谱名,责任者,姓氏,撰修时间,堂号,家谱简介,详情链接
中州白沙崔氏祠堂（河南省/郑州市/巩义市）,崔耕,崔,2011,--,明洪武四年（1371）白沙崔氏始祖思义自山西长子县兴宁里迁河南巩义白沙村，生有五子：干、举、禹臣、良臣、儒臣，遂分为五门。 谱载前言、概述、祠堂建筑、碑刻家谱、崔氏源流与迁徙、祠堂文化、历代人物、传说故事、大事要略、后记。,https://jiapu.library.sh.cn/https://jiapu.library.sh.cn/#/GenealogySummary:http://data.library.sh.cn/jp/resource/work/qwlubl1q83vtabfb
中州堂覃氏族谱（湖北省/宜昌市/长阳土家族自治县）,覃守宪,覃,2011,中州堂,始迁祖光显，元朝末年自大四川中州（今重庆忠县忠州镇）马侯府坝细沙溪挈眷来湖北长阳资丘施鸠坪小花坪定居。四世孙镇、铭、铨、矿、钊、铎派分六房 第一册（上卷序、凡例、述略、考、纪略、录、碑文、简介、人物荟萃、中卷大房世系表、下卷功德录、概述、表、花絮、艺文精选、余庆录、后记、附件、族谱付梓感怀），第二册（上、下卷与第一册上、下卷内容相同，中卷为二房世系表），第三册（上、下卷与第一册上、下卷内容相同、中卷五房世系表），第四册（上、下卷与第一册上、下卷内容相同、中卷三房、四房、六房世系表）。,https://jiapu.library.sh.cn/https://jiapu.library.sh.cn/#/GenealogySummary:http://data.library.sh.cn/jp/resource/work/79qan2zptheogzn4
中川胡氏世系表（福建省/龙岩市/永定区）,中川史志编委会,胡,1988,--,始祖垶，谱称万九郎，宋间由赣入闽汀州上杭，为入闽一世。裔孙七郎，南宋时迁永定东南下洋。始迁祖铁缘，明洪武初开基下洋中川村忠坑。后裔散居永定、同安及广东省等地。胡文虎出于是族。是为三世右一郎系下谱。 谱载得姓一世至九十四世万九郎之世系、开基九十五世、开基永定下洋一世七郎派下各房派世系、分布。详述子裔分迁闽、粤、台、浙、湖及海外资料。,https://jiapu.library.sh.cn/https://jiapu.library.sh.cn/#/GenealogySummary:http://data.library.sh.cn/jp/resource/work/l41l7eygbgnwv4ut
中嵧重修钱氏宗谱四卷首一卷（浙江省杭州市临安市）,水叔明,钱,民國37年(1948),永锡堂,始遷祖履禎，南朝梁天監元年自建康府城遷居臨安縣葛浦村（今屬藻溪鎮）。存卷首、卷一、三。書名據譜序題。版心、書簽、卷端題錢氏宗譜。,https://jiapu.library.sh.cn/https://jiapu.library.sh.cn/#/GenealogySummary:http://data.library.sh.cn/jp/resource/work/1m6n81a29te1vzzg
中嵧重修钱氏宗谱四卷首一卷（浙江省杭州市临安市）,钱士元,钱,民國7年(1918),永锡堂,始祖鏐。第九世纂，字子綱，自台州派分杭州臨安縣南鳳翥鄉錢宅橋。纂分第十八世有文聰、文瑉，文瑉於明宣德元年由錢宅橋贅居中嵧，文聰曾孫龍於嘉靖元年因被火遷居大支里。卷首譜序、譜说，卷一凡例、遺訓、家訓、鐵券圖、玉册、敕命、對策，卷二吳越世家、吳越國境圖、射潮圖、表忠觀圖、像贊、墓圖、碑記，卷三至四中嵧大支里行實、墓圖、跋。書名據譜序題。版心、書簽、目录題錢氏宗譜。,https://jiapu.library.sh.cn/https://jiapu.library.sh.cn/#/GenealogySummary:http://data.library.sh.cn/jp/resource/work/6ykwsr1jb7kvqvl8
中峰刘氏族谱不分卷（江西省赣州市南康市）,刘国钧,刘,清光緒29年(1903),敦本堂,始祖遜，唐末由江西吉州廬陵徙临江之荻斜；五世式由荻斜徙清江之清泉里；十三世椿，字宗寶，居天寶乡。始迁祖茂山，号仁軒，南宋时由瑞州府新昌县天寶乡徙居南康中峰开基。谱载谱序、敕命領谱字号、定字派说、祠堂图、村图寿序、传、墓誌銘、世系、谱跋、樂捐名目等。书名据版心、书衣题。谱初修於明万曆四年，此为三修本。,https://jiapu.library.sh.cn/https://jiapu.library.sh.cn/#/GenealogySummary:http://data.library.sh.cn/jp/resource/work/a8a1orb7b1gome21
中山高氏福房系家谱（福建省/福州市）,高学冠,高,2008,--,始迁祖玉宇（讳字莫考，行二），明末自山东迁福州南营，其地在榕城嵩山之麓，嵩山又名中山。传至第六世，分福、禄、寿、仁、义、礼、智、忠、信九房，福房祖允倬（讳国章、天章、汉章，行一）生三子，又分诗、书、易三房。诗房祖在鲁（讳超、启锽，行一），其后人多在鳌峰坊故居生活，此谱是诗、易房谱 。 卷一本源、卷二祖居、卷三世系、卷四传略、卷五研究、卷六图集等。,https://jiapu.library.sh.cn/https://jiapu.library.sh.cn/#/GenealogySummary:http://data.library.sh.cn/jp/resource/work/boadwkftlnyhg3bj
中山高氏福房系家谱（福建省/福州市）,高学冠,高,2008,--,始迁祖玉宇（讳字莫考，行二），明末自山东迁福州南营，其地在榕城嵩山之麓，嵩山又名中山。传至第六世，分福、禄、寿、仁、义、礼、智、忠、信九房，福房祖允倬（讳国章、天章、汉章，行一）生三子，又分诗、书、易三房。诗房祖在鲁（讳超、启锽，行一），其后人多在鳌峰坊故居生活，此谱是诗、易房谱 。 卷一本源、卷二祖居、卷三世系、卷四传略、卷五研究、卷六图集等。,https://jiapu.library.sh.cn/https://jiapu.library.sh.cn/#/GenealogySummary:http://data.library.sh.cn/jp/resource/work/t57ltnhce9foky53
中山高氏福房系家谱（广东省/中山市）,高学冠,高,2008,--,始祖玉宇公，生于明万历年丁酉年，卒于清康熙甲寅年，生儿子文龙、文凤。 谱载修谱说明，卷一本源，卷二祖居，卷三世系，卷四传略，卷五研究，卷六图集。,https://jiapu.library.sh.cn/https://jiapu.library.sh.cn/#/GenealogySummary:http://data.library.sh.cn/jp/resource/work/o33ebpsnhg3y5f7l
中山高氏家谱三卷（福建省福州市）,高福康,高,清光绪元年（1875）,--,始迁祖玉宇，行二。书名据版心、封面题。二修本。,https://jiapu.library.sh.cn/https://jiapu.library.sh.cn/#/GenealogySummary:http://data.library.sh.cn/jp/resource/work/7ju9no36dknnrkqy
中山颜氏宗谱六卷（江苏省南京市溧水县）,颜延,颜,清道光六年（1826）,文礼堂,始祖裕，號啟齋，行七。書名據版心、書簽題。,https://jiapu.library.sh.cn/https://jiapu.library.sh.cn/#/GenealogySummary:http://data.library.sh.cn/jp/resource/work/ip3q5kyvo75l1u3k
中山金氏宗谱（浙江省金华市义乌市）,不详,金,清嘉慶24年(1819),--,是族原姓劉，後改姓金。而中山爲劉姓郡望之一，譜名加中山二字，蓋追遠漢中山靖王劉勝。始遷祖起運，行原六，元季自蘭谿遷義烏廿八都西金，旋遭回禄之難，又遷金京村。卷三世系，卷四行傳。存卷三、四。書名據版心題。,https://jiapu.library.sh.cn/https://jiapu.library.sh.cn/#/GenealogySummary:http://data.library.sh.cn/jp/resource/work/69k3nkkjfnybul1e
中山金氏宗谱四卷（浙江省绍兴市嵊州市）,金嘉钦,金,清嘉慶十七年（1812）,百忍堂,始遷祖楠，自嵊縣茶場村（今屬東陽市巍山鎮）遷居本邑金貂嶺下（今崇仁鎮金田村）。卷一譜敘，卷二祖像，卷三行傳。存卷一至三,https://jiapu.library.sh.cn/https://jiapu.library.sh.cn/#/GenealogySummary:http://data.library.sh.cn/jp/resource/work/lqlciikfjkv62twr
中山郭致政祖谱牒十六卷（广东省中山市）,郭尚瑗,郭,民國26年(1937),治本堂,始迁祖开广，又名致政，南宋末自南雄移居香山（今中山）县。卷一序、传记、祠堂、乡记、修谱人員照片等，卷二至三宗图，卷四至十六世次。林森封面题署，孫科、居正、于右任等题字。书名据版心、目录题。,https://jiapu.library.sh.cn/https://jiapu.library.sh.cn/#/GenealogySummary:http://data.library.sh.cn/jp/resource/work/irx8r24xu47pfynp
中山郭致政祖谱牒十六卷,郭尚瑗,郭,民國26年(1937),治本堂,--,https://jiapu.library.sh.cn/https://jiapu.library.sh.cn/#/GenealogySummary:http://data.library.sh.cn/jp/resource/work/f5jkdelnye660l3v
中山郭致政祖谱牒十六卷,郭尚瑗,郭,民國26年(1937),治本堂,始遷祖致政，又名開廣，南宋末自南雄遷香山(中山舊名)。二子健、復，以兩房。後裔散居南美洲、非洲、澳洲、東南亞，而我國之上海、香港尤多。卷一修譜人員照片、序、傳記、祠堂、鄉記，卷二、三宗圖，卷四至十六世次。林森作封面題署，孫科、居正、於右任等題字。附有人物和風景照片多幅。,https://jiapu.library.sh.cn/https://jiapu.library.sh.cn/#/GenealogySummary:http://data.library.sh.cn/jp/resource/work/us1cj4kt63yu4gt1
中山郡金氏宗谱四卷（浙江省温州市平阳县）,金立文,金,1995年,--,始祖嘉澤，宋代人。始遷祖希賚，明崇禎十二年自永嘉縣上金村遷居平陽縣南港夏姑橋村垟心（今屬蕭江鎮）。卷一凡例、譜序、遺像，卷二至四世系。譜初修於清康熙五十三年，此爲七修本。,https://jiapu.library.sh.cn/https://jiapu.library.sh.cn/#/GenealogySummary:http://data.library.sh.cn/jp/resource/work/5at7fhj3k1ijuhy4
中山郡碧湖狮子头汤氏宗谱不分卷(浙江丽水),汤鉴定;汤肇发,汤,2011年,--,始祖四十四世（自秦末漢初人元濬始）思退（字進之，號湘水），南宋浙江青田人，官居處州郡城。始遷祖諶（四十六世），南宋時自處州郡城遷麗水碧湖下街。譜載湯氏老祖宗圖像、序言、名目、新譜前言、湯氏受姓源流、湯氏淵源、世系圖、行第名錄、傳記、附錄、編後記。,https://jiapu.library.sh.cn/https://jiapu.library.sh.cn/#/GenealogySummary:http://data.library.sh.cn/jp/resource/work/6itbeldlowcva50k
中山郡汤氏一脉家谱不分卷（台湾省苗栗县）,不详,汤,1915年,--,始祖同上。,https://jiapu.library.sh.cn/https://jiapu.library.sh.cn/#/GenealogySummary:http://data.library.sh.cn/jp/resource/work/dd1udbfetgsl6ea5
中山郡毛氏宗谱（浙江省/丽水市/松阳县）,毛陈祥,毛,2000,--,始迁祖文缙，宋代人。,https://jiapu.library.sh.cn/https://jiapu.library.sh.cn/#/GenealogySummary:http://data.library.sh.cn/jp/resource/work/e1g921x7tnjrh8ec
中山郡毛氏宗谱不分卷：,毛成禧,毛,清道光21年(1841),敦伦堂,始遷祖惟真（字雲），明初自里黃遷居上莊。譜載序、忌田、山圖、世系。,https://jiapu.library.sh.cn/https://jiapu.library.sh.cn/#/GenealogySummary:http://data.library.sh.cn/jp/resource/work/enzc7r7v23hifol7
中山郡望合肥日新堂汤氏宗谱（安徽省/合肥市/肥西县）,汤先峰,汤,2005,日新堂,始迁祖锦、三儒、仕保，元末明初奉朝命举族北上，由南昌府经瓦屑坝跨江迁至庐州府西乡官亭林柯岗一带定居。 卷一总谱载名贤说谱、祖训、家规、家训、祠图记、世系字派引、家礼图、宗法考证、历修谱序、历修相关人员名录、捐资修谱名录、领谱字号名录、老谱凡例、九修谱凡例、人物传记、坟图，卷二至十二世系。,https://jiapu.library.sh.cn/https://jiapu.library.sh.cn/#/GenealogySummary:http://data.library.sh.cn/jp/resource/work/tslhv7bwhw3o4xje
中山郡后池汤氏长房家乘六卷（浙江省温州市泰顺县）,陈乐,汤,1980年,--,始迁祖文魁，字掄元，號碩園，清康熙间自樂清迁居泰順平橋村（今泗溪鎮）。卷一譜序、例言、排行字，卷二世紀，卷三至四世系图，卷五祠记，卷六藝文、雜录。书名據版心题。,https://jiapu.library.sh.cn/https://jiapu.library.sh.cn/#/GenealogySummary:http://data.library.sh.cn/jp/resource/work/qe49n6vxinckb1f5
中山郡吞星堂第四次编修汤氏宗谱（浙江省/杭州市/建德市）,汤敬文,汤,2005,吞星堂,老谱损毁，本谱从二十四世汤良学开始记载，本谱系江西抚州市南丰县太和镇丹阳村（或仙源村）迁至浙江衢州市江山市坑头村定居一百多年后，二十九世汤得魁，于清乾隆辛巳年又迁寿昌县东乡汤家村（今浙江省杭州市建德市新安江街道办白沙社区汤家村）。 卷一汤姓渊源、序、世系录、现代部分人名录、家规、家训、堂郡，卷二世系表、世纪录，卷三字辈凡例，卷四家族住居图，卷五先祖墓园，卷六1942-1944年编修的原宗谱。,https://jiapu.library.sh.cn/https://jiapu.library.sh.cn/#/GenealogySummary:http://data.library.sh.cn/jp/resource/work/7vobx3v5n726e65i
中山郡刘氏宗谱（浙江省/丽水市/青田县）,刘回春,刘,2008,--,始迁祖瑞(字国祥)，原籍福建福州，唐朝时期迁浙江省青田县中山郡。本谱支祖聚族(字螽羽)，明朝人，居青田县腊口镇浮弋村。 卷一重修理事会成员合影、始祖纪念碑、宗族发祥地、聚族后裔繁衍地、遗像、谱序、碑文、生平简介、理事会名单、纪念碑助资芳名录、父母颂、略传、序、敕命、宦跡、赞传、凡例、排行字母、董理花名，卷二内纪行第、大众山场，卷三外纪系图、内纪系图。,https://jiapu.library.sh.cn/https://jiapu.library.sh.cn/#/GenealogySummary:http://data.library.sh.cn/jp/resource/work/celubudp9rbx4knv
中山郡刘氏宗谱（浙江省/温州市/永嘉县）,--,刘,2000,--,始祖元陆，字浣仲，号增胜，初居尼山，宋祥符间避夷徙迁窑川。始迁祖立信（字可行，号华岳），宋时迁永嘉上宅岸。 谱载谱序、祖训族规、凡例、派行、世系图。,https://jiapu.library.sh.cn/https://jiapu.library.sh.cn/#/GenealogySummary:http://data.library.sh.cn/jp/resource/work/xrqngtjx1iqz8jop
中山郡刘氏宗谱（浙江省/温州市/乐清市）,刘尚煜,刘,2000,--,始迁祖元陆（号增胜），初居浙江之尼山（或为平阳县尼山村），北宋宋祥符八年中秋避夷徙迁乐清窑川。子宗祥，旋迁邑之竹屿。 卷一族谱序、五伦说、奏疏、家范、诰敕、诗集、凡例规条、书田记、劝农、艺文、跋文、寿序、节传、传赞、行状、墓志，卷二缙绅录、雁行、赤岸、世系图。卷三至九世系图。,https://jiapu.library.sh.cn/https://jiapu.library.sh.cn/#/GenealogySummary:http://data.library.sh.cn/jp/resource/work/d3rf43tyc1j6z4hu
中山郡 巴邑堂重庆巴邑蔺氏文泰公支族谱（重庆市/重庆市/巴南区）,蔺学连;蔺习华,蔺,2021,巴邑堂,韩武子名厥之玄孙韩康仕赵，采食于蔺，以邑为姓，始姓蔺，是蔺氏家族鼻祖。始祖本周，生子二，长仁宽，次仁和。明末清初，入川渝始祖文泰落业于四川省重庆府巴县长生桥乡梅溪漕湖广湾。 谱载序、续修组织名单、寻根问祖、蔺文泰公后裔世系图、蔺文泰公后裔直系谱、历史研究、字派对照表、续谱通讯录。,https://jiapu.library.sh.cn/https://jiapu.library.sh.cn/#/GenealogySummary:http://data.library.sh.cn/jp/resource/work/1t4icxt7ppput1zb
中山郎氏万邑龙驹堡郎氏族谱治国公支谱（重庆市/重庆市/万州区）,郎永亭;郎正邦,郎,2014,--,始祖先润，明洪武初由湖广黄州府麻城高堦基迁居万州石马山。始迁祖尔顺，先润次子，迁居龙驹坝郎家湾。本谱为明末人治国（字定虞）一支支谱。 谱载凡例、谱序、垂丝图、世系录、功德录、附录、编撰委员会成员介绍、编后感言。,https://jiapu.library.sh.cn/https://jiapu.library.sh.cn/#/GenealogySummary:http://data.library.sh.cn/jp/resource/work/vjpz5ztwb9yf4cx6
中山郎氏宗谱二卷（浙江省金华市兰溪市）,郎寿祥,郎,清光緒二十五年（1899）,--,始祖璜如，行仁一，自嚴州府城（今建德市梅城镇）遷居蘭谿里郎村（今屬游埠鎮）。始遷祖献功，字老兄，行榮一，清光緒間自里郎村徙居本邑午塘邊村（今屬水亭畲族鄉）。卷一家规、譜引、凡例、譜序、像赞、图等，卷二行傳。 譜初修於清光緒元年，此爲二修本。,https://jiapu.library.sh.cn/https://jiapu.library.sh.cn/#/GenealogySummary:http://data.library.sh.cn/jp/resource/work/v8mkm9tzxl8fjhxq
中山郎氏宗谱九卷（浙江省金华市兰溪市）,郎静山;郎鳯桂,郎,1948年,敦伦堂,始遷祖禎，南宋淳熙間自安吉縣遷居蘭谿縣郎家村。卷一敕命、譜序、里居圖，卷二世系，卷三至九行傳。 書名據封簽題。譜初修於南宋紹定間，此爲二十修本。,https://jiapu.library.sh.cn/https://jiapu.library.sh.cn/#/GenealogySummary:http://data.library.sh.cn/jp/resource/work/92k4eqhdza4ipadg
中山谢氏家谱九卷（安徽省黄山市祁门县）,谢敬,谢,明,--,始祖纘，字承緒，西晉人。始遷祖友聞，號中山居士，行三七，宋代人。書名據卷端、譜序題。記事至明嘉靖十八年。,https://jiapu.library.sh.cn/https://jiapu.library.sh.cn/#/GenealogySummary:http://data.library.sh.cn/jp/resource/work/2kb2ighk2u7b27yk
中山谢氏家谱不分卷（安徽省黄山市祁门县）,谢二玉,谢,清,--,始祖纘，字承緒，西晉人。始遷祖友聞，號中山居士，行三七，宋代人。書名據版心題。記事至清嘉慶六年。,https://jiapu.library.sh.cn/https://jiapu.library.sh.cn/#/GenealogySummary:http://data.library.sh.cn/jp/resource/work/up516awov8uyyvl6
中山良都竹秀园郭氏家谱不分卷（广东省中山市）,郭鸾辉,郭,民國18年(1929),保顺堂,始迁祖开广，又名致政，南宋末自南雄移居香山（今中山）县。书名据书衣题。,https://jiapu.library.sh.cn/https://jiapu.library.sh.cn/#/GenealogySummary:http://data.library.sh.cn/jp/resource/work/91qtzlra6j2q37wy
中山翠微韦氏族谱十二卷附一卷（广东省珠海市）,韦祺光;韦兆栋,韦,民國26年(1937),传经堂,始祖昆，字德宗，行五十一，宋咸淳九年自南雄府保昌县东嶺鄉石門關珠璣巷移居广州府香山县長安鄉。始迁祖方壽，昆六世孫，明季入贅本邑翠微（今屬珠海市）梁氏，生觀胜、觀護、觀道三子，别为三房。附卷通册记韦氏女子事。书名据书衣题。七修本。,https://jiapu.library.sh.cn/https://jiapu.library.sh.cn/#/GenealogySummary:http://data.library.sh.cn/jp/resource/work/cktlgctxuztf34mo
中山县第贰区坎溪梁氏谱略不分卷（广东省中山市）,梁云溪,梁,複印1927年,--,始祖白石，元代人。始遷祖養晦，名玉，字德温，行三，明代人。書名據書衣題。梁富强等增補至1944年。,https://jiapu.library.sh.cn/https://jiapu.library.sh.cn/#/GenealogySummary:http://data.library.sh.cn/jp/resource/work/3iwagtefe98ybklv
中山县库充乡陈氏族谱（广东省/中山市）,陈石章,陈,1980,--,始祖谟（号世德，行一），宋代人。三子文龙，宋元之际卜居香山（今中山）后衙。始迁祖显佑，明季移居库充乡。,https://jiapu.library.sh.cn/https://jiapu.library.sh.cn/#/GenealogySummary:http://data.library.sh.cn/jp/resource/work/i9ai96kko2va4got
中山第一居刘金氏宗谱（浙江省金华市义乌市）,不详,金,清光緒二十三年（1897）,--,參見清康熙二十七年［浙江東陽］《重修一居金氏宗譜》條。一居祖泉之孫潤，行興九，南宋時由東陽巍山郭園舊宅遷義烏之殿下，是爲始遷之祖。存卷爲世系圖。 存卷二。書名據版心題。,https://jiapu.library.sh.cn/https://jiapu.library.sh.cn/#/GenealogySummary:http://data.library.sh.cn/jp/resource/work/sfv48thnpe9pu1hj
中山第一居刘金氏宗谱（浙江省金华市义乌市）,不详,金,清道光9年(1829),--,參見清康熙二十七年［浙江東陽］《重修一居金氏宗譜》條。一居祖泉之孫潤，行興九，南宋時由東陽巍山郭園舊宅遷義烏之殿下，是爲始遷之祖。卷一譜序、家規、凡例、誥敕、像贊、仕宦、世系圖，卷三行傳。存卷一、三。書名據版心題。卷端題劉金氏宗譜。,https://jiapu.library.sh.cn/https://jiapu.library.sh.cn/#/GenealogySummary:http://data.library.sh.cn/jp/resource/work/5g55835iuejmq8mm
中山汤氏祖谱（台湾省台中市）,汤贵士,汤,1981年,--,始祖同上。臺灣始迁祖輝元，號六郎，諡厚詒。,https://jiapu.library.sh.cn/https://jiapu.library.sh.cn/#/GenealogySummary:http://data.library.sh.cn/jp/resource/work/niwizuyysymfwyll
中山汤氏瓜瓞族谱（台湾省）,汤超龄,汤,1985年,--,始祖同上。臺灣始迁祖昌生、坤生等。,https://jiapu.library.sh.cn/https://jiapu.library.sh.cn/#/GenealogySummary:http://data.library.sh.cn/jp/resource/work/grippsfn3voth2nw
中山汤氏瓜瓞族谱（广东省/梅州市/蕉岭县）,不详,汤,2002,--,始祖四十七郎公，居福建汀州府宁化县石壁乡，四传至汤四十七郎，繁衍至粤，为广东镇平（今蕉岭）高思乡开基始祖。谱载一世至二十六世世系。 卷一源流，卷二世系，前言，编后记,https://jiapu.library.sh.cn/https://jiapu.library.sh.cn/#/GenealogySummary:http://data.library.sh.cn/jp/resource/work/mhszyc8udo5ls76c
中山汤氏族谱（台湾省）,汤超龄,汤,1983年,--,始祖同上。臺灣始迁祖輝元，清代人。,https://jiapu.library.sh.cn/https://jiapu.library.sh.cn/#/GenealogySummary:http://data.library.sh.cn/jp/resource/work/9d1f4uhuqwf7l9np
中山汤氏族谱（福建省龙岩市）,合族,汤,1990年,--,始祖智、簡，唐代人。始迁祖篤川，又名積洪，宋代人。书名據封面题。,https://jiapu.library.sh.cn/https://jiapu.library.sh.cn/#/GenealogySummary:http://data.library.sh.cn/jp/resource/work/2v1glc8vobq8cslt
中山汤氏族谱（福建省漳州市）,汤天聪,汤,1992年,--,始迁祖智，唐代人。譜載序、譜系、源流、播迁、昭穆、祖祠、祭祖、祖墳、人物、歷史文獻諸篇。书名據书名页题。,https://jiapu.library.sh.cn/https://jiapu.library.sh.cn/#/GenealogySummary:http://data.library.sh.cn/jp/resource/work/mvsjvhwlkfxxqgvp
中山汤氏族谱（福建省/龙岩市）,汤坤华,汤,1997,肇禋堂,始祖智，原籍河南光州固始，唐中宗垂拱二年，从陈元光入闽，择居福建龙岩柳营江东乌浔坑。始迁祖十三世笃川（又名积洪），宋代迁居福建龙岩湖营、大吉、厦老，立户汤宗瑞。 卷一序、绅衿、寿考，卷二历代史迹，卷三至十五世系图、世系行传，卷十六续谱用纸，附卷勘误表。,https://jiapu.library.sh.cn/https://jiapu.library.sh.cn/#/GenealogySummary:http://data.library.sh.cn/jp/resource/work/2p9rugxtdsuvivff
中山汤氏房谱四（浙江省丽水市松阳县）,不详,汤,1920年,孝思堂,始祖思退，字進之，南宋前期迁居麗水縣。始迁祖惟正，南宋乾道间自云五云村（今屬五云鎮）迁居松陽縣三都呈回村（今屬三都鄉）。存卷載世系。存卷四。八修本。,https://jiapu.library.sh.cn/https://jiapu.library.sh.cn/#/GenealogySummary:http://data.library.sh.cn/jp/resource/work/2odkgz3iedq7f2hu
中山汤氏房谱二卷（浙江省丽水市松阳县）,汤世管,汤,清光緒二十一年（1895）,孝思堂,始祖思退，字進之，南宋前期迁居麗水縣。始迁祖惟正，南宋乾道间自云五云村（今屬五云鎮）迁居松陽縣三都呈回村（今屬三都鄉）。上卷家寶、目录、條例、家訓、嗣績、名諱、序文、傳贊、像图、产業，下卷世系图。七修本。,https://jiapu.library.sh.cn/https://jiapu.library.sh.cn/#/GenealogySummary:http://data.library.sh.cn/jp/resource/work/vqeq913diw8e8vsr
中山汤氏宗谱（浙江省丽水市松阳县）,汤永辉,汤,清道光8年(1828),--,始祖思退，字進之，南宋前期迁居麗水縣。始迁祖惟正，南宋乾道间自云五云村（今屬五云鎮）迁居松陽縣三都呈回村（今屬三都鄉）。卷一譜序，卷二傳贊，卷三至四山图，卷五像图，卷六为行傳。存卷一至六。书名據版心题。,https://jiapu.library.sh.cn/https://jiapu.library.sh.cn/#/GenealogySummary:http://data.library.sh.cn/jp/resource/work/aqvwc1nw9gbb5h13
中山汤氏宗谱（浙江省/金华市/兰溪市）,汤建忠,汤,2018,--,始祖球（讳一贯）宋德祐元年（1275）进士出身，授湖广黄州刺史，由苏州徙居兰北之大畈、灵泉凤山之西汤，已有七百余年。 卷一家宝、题词、合影、中和堂、村貌、新序、重修宗谱理事会成员芳名录、功德录、藏谱名录、藏谱约言、旧序、讳行字母、祖训、家规、凡例并序、敕命、传赞、像赞，卷二阳基图、助产、坟图、墓记、议约、祀产，卷三远系图、世系图，卷四至六行传。,https://jiapu.library.sh.cn/https://jiapu.library.sh.cn/#/GenealogySummary:http://data.library.sh.cn/jp/resource/work/59yqly2d55aklwdb
中山汤氏宗谱（浙江省/金华市/兰溪市）,汤建忠,汤,2018,--,始祖廷玉（字尧宣，行道一），北宋宣和间进士，官授礼部尚书。五世一贯（字球，号明德，行处一），南宋初自江苏苏州迁居浙江兰溪五都大畈。 卷一家宝、题词、合影、村景村貌、村庙、谱序、芳名录、功德录、藏谱名录、藏谱约言、记、发逆寇兰记略、讳行字母、祖训、凡例、敕命、传赞、像赞，卷二阳基图、助产、坟图、墓记、议约、祀产，卷三世系图，卷四至六行传。,https://jiapu.library.sh.cn/https://jiapu.library.sh.cn/#/GenealogySummary:http://data.library.sh.cn/jp/resource/work/82l6f5cj1vn2m8lm
