谱名,责任者,姓氏,撰修时间,堂号,家谱简介,详情链接
中国合肥邹氏宗谱（安徽省/合肥市）,邹立周;等;张伟志,张,2007,忠益堂,始迁祖南美，明代由山东兖州府迁至颍州，后复迁庐州合肥南乡上派河之东，巢湖庵之西，起名曰邹家岗定居。 卷一开卷语、邹姓始祖像、图腾、总目录、圣谕十六条、新旧序、二修组织机构合影、二修邹氏溯源及其人口分布、历史名人摘录、先人光荣史实、历代诗词选载、诗词文赞、功德榜、英才榜、二修组织机构成员、二修章程、二修宗规、字派、公告、凡例、二修户主索引、二修邹氏世系总表，卷二先祖遗像、古谱赞词、历代渊源世系，卷三至五世系，卷六世系、古谱传赞序、古谱六条分注、古谱家规、古谱规训引、古谱名贤谱说、古谱创修执事名目、古谱派行引、二修公德颂、二修中华始祖概述、国家文件、二修执谱规章、二修执谱名目、二修收藏证书、古谱家礼图、古谱坟茔图、二修祭文、二修讲话、二修后记、古谱压卷图案。,https://jiapu.library.sh.cn/https://jiapu.library.sh.cn/#/GenealogySummary:http://data.library.sh.cn/jp/resource/work/lyokk6i1wkhtibg4
中国合肥罗氏宗谱（安徽省/合肥市）,罗授明,罗,2019,怀德堂,始祖罗伦（字立本），原籍江西南昌府鄱阳瓦屑壩，南宋理公朝进士，官庶常，因不得志隐于山林，终身未仕。数传后至罗益（号一峰），仍居江右，明永乐末有武功敕受昭勇将军。生三子，长子寄籍北京，次子寄籍河南，三子罗昇（日平公）明宣德间自豫章迁庐州，是为始迁祖。而后三世祖贞公命诸子析居，长子杰公留郡城，次子伟公、三子仁公携杰公长子和四子卜居南乡永乐港南北两岸。 卷一载开卷语、升公图像、原谱序、重修宗谱引、谱跋、建祠修谱序、任事名目、教民六训小引、圣谕十六条、圣谕六条律、诸名贤谱说、凡例、书法、大宗小宗图、宗说、族说、六不书、祠事款目、祠祀祝文、作谱五难、捐资功德榜、道德歌、诗歌联赞、朱子家训，卷二至卷九为世系，卷十为传赞、补遗、茔图、家规、家礼图、执谱名目、谱跋、世派引、捐资赠谱执谱名目、罗氏族人居住分布图、收藏证书。,https://jiapu.library.sh.cn/https://jiapu.library.sh.cn/#/GenealogySummary:http://data.library.sh.cn/jp/resource/work/i6enfk18a9o8b7p7
中国合肥淝南朱氏宗谱（安徽省/合肥市/包河区）,朱宝山,朱,2008,白鹿堂,始迁祖有海，偕二弟于元末明初迁庐，居合肥城南朱岗村，后世延绵至今。 卷一光绪三十三年（1907）手抄本（包括：字辈、谱序、家规引、先贤像赞、序论赞跋）、民国二十五年（1936）四修谱稿（包括：传家宝箓、谱引、谱序、圣谕、图说、谱说、凡例、规训、序论赞跋、字派引及字派词、同治及光绪二次续修执事名目、民国谱执事名目）、五修史料（包括：弘扬祖德、铸人励志、五修谱序、肥东青石碾觅踪拜谒记实、理事会成员名单、功德榜、执谱名录、家庭珍藏名录、后记、万年历、龙凤图、勘误表），卷二至十二世系图。,https://jiapu.library.sh.cn/https://jiapu.library.sh.cn/#/GenealogySummary:http://data.library.sh.cn/jp/resource/work/s9r3993yynv61eif
中国合肥淝南傅氏宗谱（安徽省/合肥市）,傅昆杨,傅,2012,举岩堂,淝南傅氏系出清河，尊傅说为鼻祖。傅姓本籍江西庐陵，元初昭文公任庐阳教谕，教学庐州，遂迁居于此，卜居德胜门。历数世，后代又分别迁至马鞍圩杨家桥以及三河、舒城、无为、庐陵等地。目前主要居于马鞍圩周边的傅油坊、楚郢、老庄及吴寨。元末明初，长房天鹏公后裔中一支从傅油坊陆续迁至舒城弯腰树、百神庙及庐江金牛等地，现已完全分立。 卷一五修家谱序言、续修说明、行为规范、族人行为规范、傅姓与付姓不同、清圣谕十六条、谱序、名贤谱说、凡例家规、祠堂图、家礼图、大宗小宗、宗法考证、新编家规、历代源流引。卷二文件、五修宗谱任事名目、功德录记、照片、功德榜、执谱守则、执谱人员名单、简历、记、序、赞、传、世系字派续修说明、新老世系字辈对照表、淝南傅氏宗亲联谊会成员名单、世系。卷三至七世系。卷八原谱传赞序等、淝南傅氏《五修宗谱工作总结》，附安徽省傅氏宗亲联谊会简介、成员名单。,https://jiapu.library.sh.cn/https://jiapu.library.sh.cn/#/GenealogySummary:http://data.library.sh.cn/jp/resource/work/ta23as6wyhtqw7u7
中国合肥席氏宗谱（安徽省/合肥市/肥东县）,席理彬,席,2005,稼书堂,始迁祖克明，明万历元年（1572）由江苏句容县迁居合肥东乡（今龙塘乡）胡连圩。生子四，长子复礼子孙移居店埠北湾因谓之湾分，次子复义子孙移居店埠西北乡竹音庵竹陂塘因谓之塘分，三子复信子孙仍居胡连圩因谓之圩分，四子复智子孙移居合肥北乡十八里河因谓之双河分。 卷首一为六修谱前言、读谱指要、谱说、先正格言、寻始祖陵寝、公告、席姓探源、序跋、乐捐引、执谱志文、执谱须知、字派引、执谱字号、家训、育子篇、编后记，卷首二历代渊源世系总图、四公支系图、合修谱序，卷一至十世系。,https://jiapu.library.sh.cn/https://jiapu.library.sh.cn/#/GenealogySummary:http://data.library.sh.cn/jp/resource/work/fvhiyfr39lc89k4y
中国合肥孙氏宗谱（安徽省/合肥市）,孙世光,孙,2018,庆馀堂,始迁祖郁公（字曙东，号霁堂），本江西南昌府丰城人，元末由南昌迁安徽庐州府合肥县南乡龙盛冈，为明永乐戊子科举人，官湖广按察司。 卷首始祖像传、同造孙家简介、序、江西丰城同造孙家世系、同造孙氏族谱内外编目录、同造孙氏大四房族谱内编卷之一、考证跋，卷一上谕、序、作谱五难、六条、凡例、家规、家礼仪节、家训、历代源流世系引，卷二字派、老系辨、历朝仕宦、世系总图、世系，卷三至十五为世系，卷十六祠事款目、总赞、传赞序、茔图、执事名目、执谱字号、跋，卷十七祠堂对联、开卷语、孙氏寻根问祖起源、序、姓氏知识、续谱工作人员、家训、序谱志、续修楹联、续修出谱号、执谱字号、中西纪年对照表、新老字派引、人口统计表、世系，卷十八至二十四为世系。,https://jiapu.library.sh.cn/https://jiapu.library.sh.cn/#/GenealogySummary:http://data.library.sh.cn/jp/resource/work/bnb6g81ca1u4swxt
中国合肥南乡陈氏宗谱（安徽省/合肥市/包河区）,陈治勋,陈,2006（2006）,庐圆堂,是族先世元末明初由江西瓦砾坝迁合肥南乡义城。此谱为义城支系、雷麻支系、北分路支系三支合修。 卷一通知、谱引及郡堂对联、源流、瓦屑坝之谜、传、谱序、前言、堂号说明、家规、五修贺词及诗联、各支派公告、支谱序、传赞引、各支派名人传、字派引及字派词、功德榜、执谱公约及名目、收藏证书、家礼图及宗法图、宗亲联谊会、阅谱明目表、后记，卷二至十二各支派世系表。,https://jiapu.library.sh.cn/https://jiapu.library.sh.cn/#/GenealogySummary:http://data.library.sh.cn/jp/resource/work/89vodmw1knum18r4
中国古代家族与国家形态（甘肃省）,王大良,王,1998,--,该族分布于甘肃省。 谱载前言、琅琊王氏由来和早期历史、魏晋时期的琅琊王氏、琅琊王氏与东晋政局、南朝宋齐时期的琅琊王氏、梁陈时期的琅琊王氏、琅琊王氏在北朝及隋的开拓与发展、唐代琅琊王氏的衰亡、琅琊王氏世系和人口、琅琊王氏政治行为与政治地位、琅琊王氏家族风貌与婚姻问题、琅琊王氏思想信仰与文化传统、琅琊王氏经济基础与经济构成、结语、后记。,https://jiapu.library.sh.cn/https://jiapu.library.sh.cn/#/GenealogySummary:http://data.library.sh.cn/jp/resource/work/c4ztozlexmtyv2sp
中国元朝皇室后裔蒙古族铁改余姓川中族谱（四川省）,余妙文,余,2013,--,"一世祖成吉思汗铁木真，六世裔孙铁氏“九子一女""，为五世祖元南平王铁木健子女，铁改余姓肇姓始祖，元亡，改姓换名，南迁隐居四川，生息繁衍在全国各地及海外。 族史传、新编铁改余姓族规祖训、家规家训、溯源：族源祖源、颂祖、祭祖、民族风情、附件及传承记序、文件、编后记。",https://jiapu.library.sh.cn/https://jiapu.library.sh.cn/#/GenealogySummary:http://data.library.sh.cn/jp/resource/work/xn1inkgf5c5f8jmp
中国余氏世系考（全国）,余英忠,余,2002,--,始迁祖不详，其后裔散居于江西省、江苏省、福建省、浙江省等地。 卷一序、前言、历史篇、附录，卷二地理篇、示意图、编后语。,https://jiapu.library.sh.cn/https://jiapu.library.sh.cn/#/GenealogySummary:http://data.library.sh.cn/jp/resource/work/6hw5yydkj6mxb6er
中国井盐世家王三畏堂＆李陶叔堂家族史（四川省/自贡市）,王群华,王,2007,--,王姓自贡始迁祖佚名，明成化年间自湖北麻城县孝感乡兴子镇迁至四川江阳县；明末清初四川战乱众族分离，族人重聚自贡自流井。王姓字派:仁义礼智信，武常大典明，诗书延世泽，孝友振家声。李姓自贡始迁祖李本齐，1660年前后，自原籍江西赣州龙南县入川，辗转诸州县，定居自流井洗脚河坎。 载王三畏堂家族史及人物表，李陶淑堂家族史及人物表。,https://jiapu.library.sh.cn/https://jiapu.library.sh.cn/#/GenealogySummary:http://data.library.sh.cn/jp/resource/work/w3s1djw7c2kojquu
中国之旅华夏黄氏谱志（全国）,黄德权,黄,2009,--,此为湘鄂黄氏通谱。内录湖南、湖北两省多支黄氏宗支世系传承及相关文史资料。 卷一导言篇，卷二文献篇，卷三考古篇，卷四史政篇，卷五家律篇，卷六人文篇，卷七寻根篇，卷八谱版篇，卷九世系篇，卷十相关篇。,https://jiapu.library.sh.cn/https://jiapu.library.sh.cn/#/GenealogySummary:http://data.library.sh.cn/jp/resource/work/9cjcfpkfk6cal1rt
中国·云南红河州睹里后裔哈尼族陈氏简史（云南省/红河哈尼族彝族自治州/建水县）,陈家明,陈,2014,--,始迁祖应鳌，清朝燕京府（南京）竹子园老埂脚人，清康熙十八年左右，随清军孟庆元入滇，后为建水州牧（州长），在临安屯军统管（今建水陈官镇，原称陈官屯）。根据族人口传，家族原居陈官镇，后定居于普古鲊，在迁徙过程中成为了哈尼族。 谱载理侯之后分支谱碟、迁徙路线图、文化生活器物照、家族历史传说和史迹照片。,https://jiapu.library.sh.cn/https://jiapu.library.sh.cn/#/GenealogySummary:http://data.library.sh.cn/jp/resource/work/ynj12q7emsnfj3ma
中国·广东·阳江（北惯）范氏族谱（广东省/阳江市/阳东区）,范伯祥,范,2011,--,始祖仲淹（字希文，谥文正，行五），世居苏州吴县。入粤始迁祖十五世范智（字明五，行二），仲淹次子纯仁（字尧夫，谥忠宣）脉裔，于明正统十年（1445）自湖南衡阳徙广东南雄，继迁新会县得行都（广东江门市，清顺治时划归开平）。清康熙八年（1669），二十三世茂贤、应相、允朋、允业、兰兴、逸仓、逸兴、逸明、逸经、卫兴、全兴、卓兴等十二人自开平县得行都群迁至阳江县平乐乡北惯都北惯一图博贯村（北惯村）范家寨（又名范屋寨）开基。 谱载六篇：论著序言特辑、寻根溯源、氏族世系、历代人才、姓氏文化、知识附录。,https://jiapu.library.sh.cn/https://jiapu.library.sh.cn/#/GenealogySummary:http://data.library.sh.cn/jp/resource/work/szhp3xi4o43e5oic
中国·安徽蔡氏家谱·续编（安徽省/合肥市）,蔡有方,蔡,2000,--,是为三支联宗蔡氏合修谱：一支始迁祖福，明洪武三年（1370）自江苏句容迁合肥，五世孙祥、禋后裔分居于县城及梁园镇北、东、西、南四乡。另一支始迁祖祯，明洪武间自皖北凤阳迁居含山。再一支始迁祖日先，移居合肥西山南。 谱载新增彩色图片、执事名单、序文、蔡氏发展史历史文献资料与人物传记、各支系世系表、各支系世系瓜藤谱。,https://jiapu.library.sh.cn/https://jiapu.library.sh.cn/#/GenealogySummary:http://data.library.sh.cn/jp/resource/work/6a1f1geckpdspo7h
中国·安徽肥东王氏家谱（安徽省/合肥市/肥东县）,王忠新,王,2006,--,始迁祖宪，自清初由江西迁至合肥，卜居肥东高王村，子孙繁衍，延及各宗支。此谱系合肥、肥东、肥西、金椒、和县、繁昌、芜湖七地王氏族人重修。 谱载封面、前言、续修谱总目、重修谱序、宗谱序、谱说、新家规家训、收藏规则及人员名目、家派小引及字派、世系称谓、续修谱执事人员、照片、捐款人员、参与并支持续谱建祠人员、王姓在党政群军企事业单位任职人员、民国六年与2006年联宗目录、民国六年老谱内容、载1-4卷目录总叙、民国谱传家宝及书字号及龙图、序、圣谕、凡例、家规、礼图、字派、首事者、执谱者、传、赞、年表、合族茔地图、2006年从“家”字派续谱世系、组织规则及人员、致词、编后记、后序及编辑人员。,https://jiapu.library.sh.cn/https://jiapu.library.sh.cn/#/GenealogySummary:http://data.library.sh.cn/jp/resource/work/oy2fohvpdh7c7d4w
中国·合肥欧阳氏宗谱（安徽省/合肥市）,欧阳承炯,欧阳,2009,陆一堂,尊越王勾践五世孙无疆二子蹄为得姓始祖。欧阳氏于汉、唐或居齐或居豫，至宋欧阳永叔，明欧阳衢居江西。合肥欧阳氏出自江西庐陵，明洪武初年由江西庐陵迁至安徽庐江县榖城（胜）河（今金牛镇郭河），至子铭公偕子纲、子鉴三兄弟，由庐江迁到肥东桥头集鸡笼山西麓大欧村（一说小霸村）及其周边地区。后有子铭公三子仕舜移迁撮镇南乡，现其支下世系居长乐涧南村；长子继德公支下和二房继全公支仍居桥头集镇大欧村，其中二房八世士成迁居肥西，现其支下世系居住在肥西将军村、四合郢及合肥等；三房现居桥头集镇朝四方。 上部载民国五年（1916）二修版老谱四卷，卷一谱序、传家规范十条、谱例说、谱图说、明贤谱说、纂修宗谱说、谱例、作谱五难、礼冠图、创修宗祠引、名字派、联修宗谱成员名单、传赞、执谱说、执谱人名单，卷二至四世系。下部四卷，卷一续修委员会组成人员、三修始末序、续修谱例说明、欧阳姓氏考略、欧阳氏宗谱续修赞、字派引、宗谱续修领导组成员、续修委员会部分人员合影、老寿星像、光荣榜、赞助人员简介、诗词赞、伟人论家谱、编好《中国家谱综合目标》、编好《中国家谱总目》、欧阳氏楹联、欧阳氏图谱序（欧阳修）、传家世次总歌、六一堂、论欧阳氏家谱、欧阳氏历史名人录、像赞、世系称谓、欧阳氏家训（新作）、五戒、家族理事会、世系瓜藤图、世系、执谱引、执谱人名单、欧阳氏宗谱续修公告、续谱筹备会议纪要、在第二次筹备组扩大会议上的讲话，卷二至四世系。,https://jiapu.library.sh.cn/https://jiapu.library.sh.cn/#/GenealogySummary:http://data.library.sh.cn/jp/resource/work/sg3289c127erqzg6
中国·合肥南乡王氏宗谱（安徽省/合肥市/肥西县）,王振泉,王,2008,保二堂（三槐堂）,始迁祖国用公、谷用公、国朝公，自明初由江西瓦砾坝同迁至庐州府合肥邑（县）内九獅桥。历年后分支，国用公居肥西班家堰东南小田阜地方，亦王家湾，世代相传“王家湾王”。谷用公居肥西二十阜柏树大郢，世代相传“柏树王”。国朝公居南乡三里岗。三公后人各建宗祠，各修宗谱。 卷一谱字号—家训十六条、续修宗谱委员会、告王氏“保二堂”书、王氏宗谱简述、保二堂渊源、排行所占世次及郡门对联、凡例、捐款人员名片、执谱人员名单、对续谱工作支持和关心的人员名单、名人跋序、名人录及贺言书法、四修王氏宗亲联谊会成员，卷二烟墩支系，卷三四十井支系，卷四王尘洼冲支系。,https://jiapu.library.sh.cn/https://jiapu.library.sh.cn/#/GenealogySummary:http://data.library.sh.cn/jp/resource/work/rs5c27ez9jpxlr4c
中国.贵州曹氏族谱.施秉.石阡曹节支谱（贵州省/黔东南苗族侗族自治州/施秉县）,曹定礼,曹,2015,谯国堂,明洪武年间，始迁祖曹节从湖南省邵阳市新宁县迁贵州省黔东南苗族侗族自治州施秉县。 谱载开卷首语、序言、曹氏族谱百世流芳、关于收集修谱的一封信、为入黔始祖曹节恢复坟墓和立碑的通知、族规篇、曹姓来源考、迁徙分布、炎黄世系简表、曹节支系世系树枝略图、曹节支谱字派流转表、谯国源流、字辈流传、传略、个人简历、曹氏宗谱的起源、序、后记。,https://jiapu.library.sh.cn/https://jiapu.library.sh.cn/#/GenealogySummary:http://data.library.sh.cn/jp/resource/work/5wmonwxd8zx63vks
中国江苏江阴文林潘氏宗谱四十二卷（江苏省无锡市江阴市）,潘镜清,潘,2005年金壇古籍印刷廠排印,积厚堂,始迁祖元，原名敬，字元朗，号菊潭，原籍松江，明弘治间宦居江陰文林西順乡。卷一至三序、凡例、祠图、家訓、名目、记、簡介、像赞，卷四至三十五世系图表，卷三十六至四十二传、寿序、跋、源流世系图表、墓图、墓考。书名据书签题。,https://jiapu.library.sh.cn/https://jiapu.library.sh.cn/#/GenealogySummary:http://data.library.sh.cn/jp/resource/work/z8ek8f5hk7jembhj
中和镇文姓氏族源流一卷（湖南省永州市新田县）,文若星,文,1948年,--,始遷祖子陞，清代人。,https://jiapu.library.sh.cn/https://jiapu.library.sh.cn/#/GenealogySummary:http://data.library.sh.cn/jp/resource/work/z3ym54i688fsesde
中和金峯黄氏宗谱六卷(湖北黄冈),黄源嵣,黄,清同治13年(1874),积庆堂,始遷祖伯琰，明初自江西饒州府遷居湖北黃岡金山之陽。孫嵩、嶽、崇（字文肅）、山分啟四房。卷一譜序、凡例、祭規、家法、家規、傳、墓圖、約據，卷二至六世系。（館藏：995818-833系民國譜）,https://jiapu.library.sh.cn/https://jiapu.library.sh.cn/#/GenealogySummary:http://data.library.sh.cn/jp/resource/work/sp4mnf1wkbrm0mk8
中和朱姓氏族源流一卷（湖南省永州市新田县）,朱朝职,朱,民國,--,始祖子明，字秀華，宋代人。始遷祖康祥，行二，元代人。書名據書衣。,https://jiapu.library.sh.cn/https://jiapu.library.sh.cn/#/GenealogySummary:http://data.library.sh.cn/jp/resource/work/3dz7w6gbpqlb9wnj
中和市百（穴+羔）许氏族谱（台湾省/新北市/中和区）,许嘉立,许,1981,--,始祖太惠，同安开基始祖。始迁祖维由同安县金门十九都盐埕尾乡迁居台湾台北市中和市日（穴+羔）里。 内录封面、例言、祖籍、考源、列传、目录、昭穆、公谱、世系、家谱等。,https://jiapu.library.sh.cn/https://jiapu.library.sh.cn/#/GenealogySummary:http://data.library.sh.cn/jp/resource/work/f1qedgim73euso4q
中和市百窑许氏世系（台湾省/新北市/中和区）,许嘉立,许,1981,--,同安开基始祖太惠。始迁祖维由同安县金门十九都盐埕尾乡迁居台湾台北市中和市日窑里。 内录中和市百（穴+羔）许氏始祖太惠公世系。,https://jiapu.library.sh.cn/https://jiapu.library.sh.cn/#/GenealogySummary:http://data.library.sh.cn/jp/resource/work/tmkqs1qb3gn1kwlo
中和市瓦窰许氏族谱（台湾省/台北市）,许嘉立,许,1981,--,始祖太惠，福建同安开基始祖。始迁祖维，元季自同安县金门十九都盐埕尾乡迁居台湾台北市中和市日窰里。 内录封面、例言、祖籍、考源、列传、目录、昭穆、公谱、世系、家谱等。,https://jiapu.library.sh.cn/https://jiapu.library.sh.cn/#/GenealogySummary:http://data.library.sh.cn/jp/resource/work/li15kal7lnhbm2ii
中和堂汪氏祀谱总录不分卷（安徽省黄山市歙县）,汪诗松,汪,清乾隆十九年（1754）,中和堂,書名據封面題。,https://jiapu.library.sh.cn/https://jiapu.library.sh.cn/#/GenealogySummary:http://data.library.sh.cn/jp/resource/work/obw83c675j3wfbuu
中古世家大族谱.清河崔氏研究（全国）,夏炎,崔,2004（2004）,--,本谱为中古清河崔氏家传文化研究，《中古世家大族清河崔氏研究》分八章：崔氏溯源、清河崔氏大族的形成、清河崔氏与十六国南北朝政治、隋唐清河崔氏地位的新变化、清河崔氏各房支与隋唐政治、清河崔氏的婚姻关系等。 谱载序文、目录、引言、姓氏溯源、姓氏发展、世系图、婚姻关系、家传文化、社会地位、附录、后记。,https://jiapu.library.sh.cn/https://jiapu.library.sh.cn/#/GenealogySummary:http://data.library.sh.cn/jp/resource/work/twhganfltltk8qgb
中原冯氏宗谱（河南省/平顶山市/宝丰县）,佚名,冯,2014,--,始迁祖冯志圣为开基始祖，明清时期人，从山西省长治市上党迁中原，其后裔迁河南省平顶山市宝丰县。 谱载像赞、题词、字辈、序、家训、凡例、明清时期冯氏世系图、宗派图、宝丰冯异一集遗风考、对联、铭记历史、编后语。,https://jiapu.library.sh.cn/https://jiapu.library.sh.cn/#/GenealogySummary:http://data.library.sh.cn/jp/resource/work/lq4kljksvdbh9yl9
中原雷氏统谱（河南省）,雷德正,雷,2016,--,始祖焕（字孔章），豫章鄱阳（今江西鄱阳）人，西晋元康八年为丰城（今江西丰城）县令。十三世天本（名源），唐初迁居陕西合阳。二十五世德骧（字善行），北宋初为殿中侍御史。再传十七世有青丝、白丝、黑丝、红丝，“四丝雷”族裔于明洪武间自陕西合阳红渠沟迁中原，散居郑州、平顶山、许昌等地；或由陕西渭南迁河南洛阳孟津、洛宁南阳等地；或由山西洪洞大槐树迁中原各地。又有焕支系千四之后裔，由江西迁河南信阳地区。并有江西其他宗支相继迁居河南开封、商丘、漯河、周口等地。 今谱内所收以四丝后裔为主，包括河南郑州市、平顶山市、周口市、洛阳市、南阳市、信阳市、开封市、许昌市、驻马店、焦作市、漯河市、濮阳市、商丘市及安徽阜阳市共14个地区58个县（市、区）的雷氏支系。 卷一开篇、雷氏族人大事记、字派、雷氏源流、中原雷氏源流、序文选粹、中原雷氏宗祠介绍、雷氏堂号迁徙与分布、碑文选录、雷氏各地家训家规，卷二雷氏名人、雷氏历代举人、进士、世系，卷三世系、附记。,https://jiapu.library.sh.cn/https://jiapu.library.sh.cn/#/GenealogySummary:http://data.library.sh.cn/jp/resource/work/esc613l6th8p49le
中原苗氏世谱（河南省/焦作市/武陟县）,苗圃,苗,2019,--,始迁祖子实，明洪武间自山西长子县南张堡（一说洪洞）迁河南武陟大封镇。生子四：长子迁温县赵堡；次子迁新乡县东张青，七世得献兄弟复迁小冀镇苗庄村；三子迁武陟乔庙；四子潭留居大封镇。本谱主要登载武陟大封和新乡苗庄两支世系情况。 谱分十四章：章一苗姓渊源，章二繁衍迁播，章三郡望堂号，章四家谱文献，章五各地苗姓字辈排行，章六历史名人，章七苗氏遗址宗祠楹联，章八苗氏家谱序集锦，章九中原苗氏族谱潭枝谱续世系，章十行政区划、自然地理，章十一地域文化、风俗习惯，章十二苗氏传承文化，章十三历史故事传说，章十四附录。,https://jiapu.library.sh.cn/https://jiapu.library.sh.cn/#/GenealogySummary:http://data.library.sh.cn/jp/resource/work/wb5ids4ynbw6jn45
中原管氏平昌堂族谱（河南省/濮阳市/清丰县）,管世杰,管,2017,平昌堂,始迁祖兴，明洪武间奉诏由山西省洪洞县迁居直隶省清丰县西南波头村。 卷一记名引、目录及同族住址、谱序、碑文、碑记、条例、宗规、祖茔地亩活步、祠堂地基活步、世系图，卷二至五世系图。,https://jiapu.library.sh.cn/https://jiapu.library.sh.cn/#/GenealogySummary:http://data.library.sh.cn/jp/resource/work/hy96qw7wdoqna314
中原大树赵赵氏家谱第四卷（河南省/南阳市/唐河县）,中原大树赵氏文化研究会,赵,2011,--,始迁祖本成，明初自洛阳迁居唐河油李屯（今大树赵）。备注：中原大树赵赵氏家谱于2008年出了二卷，2009年出了第三卷，2011年出了第四卷，2017年出了第五卷。 谱载序、中原大树赵赵氏家谱第四卷编委会、中原大树赵赵氏家谱第四卷编委会人员简介、唐河县宗人谱、正误、大树赵赵氏部分名人小传等。,https://jiapu.library.sh.cn/https://jiapu.library.sh.cn/#/GenealogySummary:http://data.library.sh.cn/jp/resource/work/sotr0u7m18n3d2pw
