谱名,责任者,姓氏,撰修时间,堂号,家谱简介,详情链接
［龚氏］重修宗谱稿略不分卷（安徽省合肥市）,龚心湛,龚,民國37年(1948),--,先祖同上。譜載碑記、皌議、譜論、行傳等。書名據書衣題。,https://jiapu.library.sh.cn/https://jiapu.library.sh.cn/#/GenealogySummary:http://data.library.sh.cn/jp/resource/work/umm7zj8wk76ieujy
［龚氏］家乘述闻不分卷（浙江省杭州市）,龚守正,龚,清道光間,--,始遷祖潮，明代人。書名據書簽題。記事至清道光二十二年。,https://jiapu.library.sh.cn/https://jiapu.library.sh.cn/#/GenealogySummary:http://data.library.sh.cn/jp/resource/work/khr6tdljoj3cqk59
［麻氏］亲亲余事上编六卷下编六卷续编六卷（江西省吉安市）,麻敬业,麻,清道光十五年（1835）,真乐堂,清嘉慶二十五年作者纂修《親親録》（即族譜），此譜为其補作。始遷祖績，明代人。書名據版心、書名頁、卷端題。,https://jiapu.library.sh.cn/https://jiapu.library.sh.cn/#/GenealogySummary:http://data.library.sh.cn/jp/resource/work/s1jw27uga2hp25ik
［魏氏］钜鹿堂上历代族簿（台湾省南投县）（台湾省/南投县）,魏禹,魏,不详,--,始祖邦达。迁台湾始迁祖仁相。后裔散居南投县水里乡顶崁村族等地。记事至1982年。,https://jiapu.library.sh.cn/https://jiapu.library.sh.cn/#/GenealogySummary:http://data.library.sh.cn/jp/resource/work/5se25y6kd9xbascy
［高氏］近亲祖上系统图（台湾省/台北市）,高铭池,高,1982,--,始祖子仲。族居台北北投区。,https://jiapu.library.sh.cn/https://jiapu.library.sh.cn/#/GenealogySummary:http://data.library.sh.cn/jp/resource/work/rn8s33rnm91le9i2
［高氏］近亲祖上系统图（台湾省/台北市）,佚名,高,1976,--,始祖寿保。始迁祖钟万，清代迁台湾。,https://jiapu.library.sh.cn/https://jiapu.library.sh.cn/#/GenealogySummary:http://data.library.sh.cn/jp/resource/work/vsmpj6l5gggyzp3k
［高氏］稽查族谱总集簿不分卷（台湾省澎湖县）,不详,高,1913年,--,始祖秋，明清之際人。族居澎湖湖西乡。,https://jiapu.library.sh.cn/https://jiapu.library.sh.cn/#/GenealogySummary:http://data.library.sh.cn/jp/resource/work/hi8lfcqgpjq8v3ar
［冯氏］始迁嘉兴本支分谱不分卷（浙江省嘉兴市）,合族,冯,民國,--,始迁祖景夏，字樹臣，一字印君，號伯陽，清代人。书名據目录、卷端题。,https://jiapu.library.sh.cn/https://jiapu.library.sh.cn/#/GenealogySummary:http://data.library.sh.cn/jp/resource/work/epu41xxwv4u9fqle
［冯氏］十世祖朝瑞公遗下族谱（台湾省新竹市）,不详,冯,1950年,--,始祖萬八郎。臺灣始迁祖朝瑞，清代人。,https://jiapu.library.sh.cn/https://jiapu.library.sh.cn/#/GenealogySummary:http://data.library.sh.cn/jp/resource/work/8b7lmz15uz3rycrb
［颜氏］陋巷志八卷（山东省济宁市曲阜市）,吕兆祥,--,明崇禎間,--,是書乃闕里颜氏家志，奉孔子學生颜回（字子淵）为一世祖。颜氏原無專志，其家族事略並載於闕里三氏志中。明正德初年回六十一代孫翰林院五經博士鋐草創初稿，屬提督學政陳鎬編輯成書，共四卷。萬曆年間第六十五代孫祚又增補为八卷。此本是曲阜市颜子研究會於1998年至2002年據明崇禎年間重修志之殘本參考清代刻本校輯而成。卷一像圖，卷二至三世家，卷四恩典，卷五至八藝文。崇禎志參訂者光魯，颜回六十七代孫，明天啟二年襲翰林院五經博士。其子紹統於崇禎十四年繼襲。書名據版心*書簽題。,https://jiapu.library.sh.cn/https://jiapu.library.sh.cn/#/GenealogySummary:http://data.library.sh.cn/jp/resource/work/knuvtswumnafsqft
［顾氏］枫洞叁房族谱四卷（广东省云浮市新兴县）,顾瑞清,顾,據1915年鉛印本,--,始遷祖仁傑，明代人。書名據書名頁題。,https://jiapu.library.sh.cn/https://jiapu.library.sh.cn/#/GenealogySummary:http://data.library.sh.cn/jp/resource/work/e2s11a1ax2dwtc1p
［颜氏］泗滨志（福建省泉州市德化县）（福建省/泉州市/德化县）,颜沽滥,颜,2000,--,始祖友别。始迁祖芳（字教先），唐代人。 卷一经济和社会发展，卷二龙浔泗滨颜氏族谱，卷三人口繁衍。,https://jiapu.library.sh.cn/https://jiapu.library.sh.cn/#/GenealogySummary:http://data.library.sh.cn/jp/resource/work/uqilk7fvth3osmir
［韦氏］来连始祖宗支不分卷（广东省清远市连山壮族瑶族自治县）,韦大钧,韦,1948年,--,始迁祖金滿，壯族，明代人。书名据书衣题。,https://jiapu.library.sh.cn/https://jiapu.library.sh.cn/#/GenealogySummary:http://data.library.sh.cn/jp/resource/work/2gl6r14u739654hh
［韦氏］姓谱宗支不分卷（广东省清远市连山壮族瑶族自治县）,韦安霖,韦,民國,--,始迁祖法應，明代人。书名据书衣题。增補至1978年。,https://jiapu.library.sh.cn/https://jiapu.library.sh.cn/#/GenealogySummary:http://data.library.sh.cn/jp/resource/work/lhmq3hlbfssnqyl3
［陶氏］松友祖家谱三卷 （广东省江门市新会区）,陶杰杨,陶,清光緒九年（1883）,--,始祖文質。始遷祖政遒，又作松友。後裔散居廣東省及香港泥圍等地。缺卷二。,https://jiapu.library.sh.cn/https://jiapu.library.sh.cn/#/GenealogySummary:http://data.library.sh.cn/jp/resource/work/ai26zgrym1xvktu8
［陈氏］颍川堂十二世历代高曾祖族谱（台湾省台中市）,不详,陈,1982年,--,始祖泰，清代移居臺灣，後裔散居臺中縣后里鄉中和村等地。,https://jiapu.library.sh.cn/https://jiapu.library.sh.cn/#/GenealogySummary:http://data.library.sh.cn/jp/resource/work/z9zml67qbnw71p3x
［陈氏］氏族系统来源（台湾省花莲县）,不详,陈,1959年,--,--,https://jiapu.library.sh.cn/https://jiapu.library.sh.cn/#/GenealogySummary:http://data.library.sh.cn/jp/resource/work/2etnsqiducq9q942
［陈氏］文堂乡约家法（安徽省黄山市祁门县）,陈德信,陈,明隆慶六年（1572）,--,始遷祖百三，唐代人。書名據序言題。,https://jiapu.library.sh.cn/https://jiapu.library.sh.cn/#/GenealogySummary:http://data.library.sh.cn/jp/resource/work/i85ha7ngdnl71rc1
［关氏］族史“元皇世系”家谱（河南省濮阳市清丰县）,关昌竹;等,关,據1986年稿本,--,始祖孛兒只斤鐵木黎，元末隱居内黄縣馬次范村。其子關傑，行四，明初自内黄縣遷居清豐。書名據封面題。,https://jiapu.library.sh.cn/https://jiapu.library.sh.cn/#/GenealogySummary:http://data.library.sh.cn/jp/resource/work/z5lt1cexl44jxldy
［关氏］元昌公家谱二卷（广东省广州市番禺区）,关颂声,关,民國26年(1937),--,始遷祖翔，號悦隆，行一，明正統九年攜子文祐、禮祐自廣州郡城鮉行街遷居番禺縣西塱鄉。譜載始遷祖翔十八世孫振容（字元昌）一派。卷一譜序、凡例、十八世振容(元昌)支世系、小傳、墓銘、服制圖、花甲表，卷二小傳、像片。書名據目录題。,https://jiapu.library.sh.cn/https://jiapu.library.sh.cn/#/GenealogySummary:http://data.library.sh.cn/jp/resource/work/yg2q15m34hi187a9
［钱］牧斋晚年家乘文一卷附一卷（江苏省苏州市常熟市）,钱谦益,钱,清宣統3年(1911),--,始遷祖元孫，宋末自台州遷海。六世祖鏞、珍，派分爲海禄園、奚浦兩支。内容較钱谦益修《海錢氏家乘》條。增王文濡跋，附牧齋年譜。書名據版心、卷端題。書名頁題錢牧齋晚年文。,https://jiapu.library.sh.cn/https://jiapu.library.sh.cn/#/GenealogySummary:http://data.library.sh.cn/jp/resource/work/htfnp4n4pspw993s
［钮祜禄氏］额宜都巴图鲁世系谱一卷（辽宁省）,不详,钮钴禄,清,--,始祖索，名索和濟，稱曰巴颜，明代人。始迁祖額宜都，清代人。记事至清嘉慶间。,https://jiapu.library.sh.cn/https://jiapu.library.sh.cn/#/GenealogySummary:http://data.library.sh.cn/jp/resource/work/qe9f9l8j6vldi9bi
［钮祜禄氏］弘毅公第十房家谱不分卷（辽宁省）,不详,钮钴禄,清,--,始祖索，名索和濟，稱曰巴颜，明代人。始迁祖額宜都，清代人。书名據书衣题。记事至清嘉慶八年。,https://jiapu.library.sh.cn/https://jiapu.library.sh.cn/#/GenealogySummary:http://data.library.sh.cn/jp/resource/work/7gejtio9opzb26ho
［邬氏］渔潭村志（江西省宜春市丰城市）,邬书金,邬,1987年,--,始祖惟祥。三修本。,https://jiapu.library.sh.cn/https://jiapu.library.sh.cn/#/GenealogySummary:http://data.library.sh.cn/jp/resource/work/11rxb5viwpp8rp88
［郭氏］旧德述闻六卷（福建省）,郭则澐,郭,1936年,--,始祖子仪，唐山西汾阳人。始迁祖嵩，字維太，代国公郭曜之子，唐咸通间从武威軍節度使王審知入閩，遂家於新宁芝山之北峙溪，为入閩始祖。书名据版心、封面题。,https://jiapu.library.sh.cn/https://jiapu.library.sh.cn/#/GenealogySummary:http://data.library.sh.cn/jp/resource/work/zyi3sm426fh5nl8y
［郭氏］家乘述闻三卷家世述闻六卷（福建省）,郭则澐,郭,1936年,--,始祖子仪，唐山西汾阳人。始迁祖嵩，字維太，代国公郭曜之子，唐咸通间从武威軍節度使王審知入閩，遂家於新宁芝山之北峙溪，为入閩始祖。是谱於本支之外，兼及四支，或輯见聞，或徵史料，兼有考證，所载皆先世嘉言懿行、祖塋、祀典、礼俗、诗文等，但無世系及列传。谱初修於明隆庆六年，此为十修本。,https://jiapu.library.sh.cn/https://jiapu.library.sh.cn/#/GenealogySummary:http://data.library.sh.cn/jp/resource/work/z8w88nhepffjp3pl
［邵氏］思源录（江苏省苏州市太仓市）,邵廷烈,邵,清道光十三年（1833）,--,始祖琳，晉代人。始遷祖光龍，明代移居太倉。,https://jiapu.library.sh.cn/https://jiapu.library.sh.cn/#/GenealogySummary:http://data.library.sh.cn/jp/resource/work/dqt3xzpafx9yzkpe
［那拉氏］叶赫国贝勒家乘一卷（辽宁省铁岭市开原市）,徐干学,那拉,清同治四年（1865）,--,葉赫國，即葉赫部，明海西女貞四部之一，俗稱“北關”，因分佈於葉赫河（今遼寧開原）得名。譜稱，葉赫國起於明宣德間，星懇達爾漢，稱貝勒，始傳席爾格噶圖以下共八世，十一貝勒，至明萬曆四十七年“國祚乃終”，即爲達州女真所并。是譜記述其八世祖傳及葉赫部發展史。清同治四年（1865）葉赫納蘭氏崇秀重訂手抄本，書名據書簽、卷端題。,https://jiapu.library.sh.cn/https://jiapu.library.sh.cn/#/GenealogySummary:http://data.library.sh.cn/jp/resource/work/czx5c45c2bqi39bh
［邢氏］呈公裔十五代世系考不分卷（上海市）,邢志馨,邢,1948年,--,始遷祖楊溪，明嘉靖間自南匯遷居上海引翔鄉楊家浜。譜載序、楊溪長子呈下派世系、歷朝邢氏仕宦録等。清王敬銘撰序。書名據書衣題。,https://jiapu.library.sh.cn/https://jiapu.library.sh.cn/#/GenealogySummary:http://data.library.sh.cn/jp/resource/work/rdwxqljpsm2yfae7
［连氏］独醒居谱稿一卷乘稿二卷（浙江省绍兴市上虞市）,连光枢,连,民國,--,始祖楹，明建文帝时殉節金陵（今南京），其少子避難至浙，潛居會稽花堪（今屬上市章镇），以葉为氏。後裔春一，由华浦迁西之葉家埭。始迁祖曉三，明末由葉家埭卜居上湖頭，復姓連氏。谱稿载敘例、弁言、凡例、復姓考、姓系考序、世系表序、歷世行第考序、徙居考序、後序。乘稿卷甲弁言、敘例、小序、後序、小宗祠记等，卷乙宗賢传、列女传、像贊等。书名据卷端题。,https://jiapu.library.sh.cn/https://jiapu.library.sh.cn/#/GenealogySummary:http://data.library.sh.cn/jp/resource/work/flyw5deh1t1d5byg
［赵氏］宋宗藩庆系录,不详,赵,宋内府,--,書名據書簽題。,https://jiapu.library.sh.cn/https://jiapu.library.sh.cn/#/GenealogySummary:http://data.library.sh.cn/jp/resource/work/11v5811j6ovfeseo
［谭氏］统纂会谱四卷（湖南省株洲市茶陵县）,谭凤翔,谭,民國6年(1917),一本堂,始遷租可奕，唐咸通十四年自江西泰和縣早禾渡烏龍山石壁下遷茶陵十五都上塘。本譜實为祭譜，卷一像贊、祭序、凡例、儀注，卷二祠主录，卷三受姓考、源流、詩、列傳、列女，卷四山契、祭器什物表、跋。書名據版心題。,https://jiapu.library.sh.cn/https://jiapu.library.sh.cn/#/GenealogySummary:http://data.library.sh.cn/jp/resource/work/rnnqwh1xhkz4mwfc
［谭氏］彦实白公族谱新编（广东省江门市新会区）,谭锐耀;等,谭,1999年,--,先祖同上。書名據封面題。,https://jiapu.library.sh.cn/https://jiapu.library.sh.cn/#/GenealogySummary:http://data.library.sh.cn/jp/resource/work/7dkz819cai2uc8yu
［谢氏］宝树堂族谱不分卷（台湾省澎湖县）,不详,谢,1946年,--,澎湖始祖道，字永昌。,https://jiapu.library.sh.cn/https://jiapu.library.sh.cn/#/GenealogySummary:http://data.library.sh.cn/jp/resource/work/6iwzmu1z9v3j1751
［谢氏］厚铭日记四卷（安徽省黄山市祁门县）,谢朝元,谢,明天啟間,--,始祖纘，字承緒，西晉人。譜載墓圖、像贊。書名據版心題。,https://jiapu.library.sh.cn/https://jiapu.library.sh.cn/#/GenealogySummary:http://data.library.sh.cn/jp/resource/work/ehdf5lttxqu297s9
［谢氏］劫余小乘不分卷（江苏省苏州市）,谢攀瀛,谢,清同治七年（1868）,--,始祖善現，字子名，行尚三，元末遷居會稽孟葑。始遷祖洪明，字德陽，自紹興孟葑遷吳。家祠在西跨塘橋。此譜謝氏居蘇州桃花塢。是書为咸豐庚申（1860）之難後所撰。卷前有許賡、繆賓、王霆震手書序，謝攀瀛自序，各房人口記略、世系表、世系述、祠屋圖、祖墓圖。書名據書衣題。,https://jiapu.library.sh.cn/https://jiapu.library.sh.cn/#/GenealogySummary:http://data.library.sh.cn/jp/resource/work/yyz17ajqaku8f8qc
［许氏］高阳郡泰岳宗支不分卷（广东省江门市开平市）,不详,许,據1916年,广希堂,始祖玖，字賢國，號古田，宋代人。書名據書衣題。,https://jiapu.library.sh.cn/https://jiapu.library.sh.cn/#/GenealogySummary:http://data.library.sh.cn/jp/resource/work/65birddr5uokfxfb
［许氏］长房家族谱（福建省漳州市诏安县）,许良浩,许,清光緒間,--,先祖同上，是为裔孫長房祖譜，房祖松崖。,https://jiapu.library.sh.cn/https://jiapu.library.sh.cn/#/GenealogySummary:http://data.library.sh.cn/jp/resource/work/mi1miac3rd6bups5
［觉尔察］宗勋世系备考二卷,恩明,--,清嘉慶間,--,是为满洲八旗姓，鑲藍旗中有此姓。覺爾察氏始祖完布禄，明代人。後有改为赵氏者。書名據書衣題。,https://jiapu.library.sh.cn/https://jiapu.library.sh.cn/#/GenealogySummary:http://data.library.sh.cn/jp/resource/work/imytbudboo3nw2e5
［苏氏］景瞻堂楍房家谱不分卷（广东省广州市番禺区）,苏玉书,苏,清道光二十四年(1844),景瞻堂,始遷祖本仁，明季迁居番禺鴉岡鄉。譜載像贊、家訓、墓銘、壽序、行略等。有彩色繪像。書名據書名頁題。,https://jiapu.library.sh.cn/https://jiapu.library.sh.cn/#/GenealogySummary:http://data.library.sh.cn/jp/resource/work/sd6irnovwu26godj
［薛氏］癸辛堂纪略不分卷（江苏省无锡市）,黄绮,薛,民國30年(1941),--,是書載薛榮滋家傳、孟太夫人家傳、癸辛堂記、贈薛秉初序、方山書館論。書名據版心*書簽*書名頁題。,https://jiapu.library.sh.cn/https://jiapu.library.sh.cn/#/GenealogySummary:http://data.library.sh.cn/jp/resource/work/duv11n38ibzdkcja
［董氏］纯德汇编七卷（浙江省宁波市）,董华钧,董,清嘉慶三十三年（1818）,--,始遷祖平一，一名華鈞，别號梅坡。書名據版心*書衣題。,https://jiapu.library.sh.cn/https://jiapu.library.sh.cn/#/GenealogySummary:http://data.library.sh.cn/jp/resource/work/45qqen3nq77tqv4q
［叶赫那拉氏］家谱不分卷（辽宁省铁岭市开原市）,额腾额,那拉,清道光三年（1823）,--,始遷祖星懇達爾漢，明代人。書名據書簽題。,https://jiapu.library.sh.cn/https://jiapu.library.sh.cn/#/GenealogySummary:http://data.library.sh.cn/jp/resource/work/tdjx9ohgfl5h12nj
［叶赫那拉氏］世系生辰谱不分卷（陕西省）,那淳,那拉,清,敦厚堂,始遷祖胡錫布。書名據版心題。佚名手補至清嘉慶間。,https://jiapu.library.sh.cn/https://jiapu.library.sh.cn/#/GenealogySummary:http://data.library.sh.cn/jp/resource/work/1u3j8viqykrzacdh
［叶氏］族谱（台湾省苗栗县）,不详,叶,--,--,始祖如蘭。臺灣始迁祖啟周，清代人。记事至1981年。,https://jiapu.library.sh.cn/https://jiapu.library.sh.cn/#/GenealogySummary:http://data.library.sh.cn/jp/resource/work/41q2qnnp8383i31k
［叶氏］族谱（台湾省屏东县）,叶清元,叶,--,--,廣東程鄉始祖大經，字伯常，號封川，宋代人。臺灣始迁祖梅春、九宣，清代人。记事至1966年。,https://jiapu.library.sh.cn/https://jiapu.library.sh.cn/#/GenealogySummary:http://data.library.sh.cn/jp/resource/work/tasbe8eve6f68y3m
［叶氏］族谱（台湾省屏东县）,不详,叶,1984年,--,廣東程鄉始祖大經，字伯常，號封川，宋代人。臺灣始迁祖梅春、九宣，清代人。,https://jiapu.library.sh.cn/https://jiapu.library.sh.cn/#/GenealogySummary:http://data.library.sh.cn/jp/resource/work/d7xehpp6dotnaz5n
［叶氏］新兴东房入主名册不分卷（广东省云浮市新兴县）,北街叶氏大宗祠理事会,叶,1947年,--,書名據書名頁題。,https://jiapu.library.sh.cn/https://jiapu.library.sh.cn/#/GenealogySummary:http://data.library.sh.cn/jp/resource/work/ai7dsmh41gahdsnt
［叶氏］家谱（台湾省花莲县）,叶云??,叶,--,--,臺灣始迁祖仁奏。,https://jiapu.library.sh.cn/https://jiapu.library.sh.cn/#/GenealogySummary:http://data.library.sh.cn/jp/resource/work/yawdgvm4i1cggtwu
［叶氏］和顺房族谱不分卷（广东省佛山市南海区）,叶健堂,叶,1947年,--,始祖一瑯，唐代人。始迁祖本，字挺立，宋代人。书名據书名页题。譜修於清同治元年。,https://jiapu.library.sh.cn/https://jiapu.library.sh.cn/#/GenealogySummary:http://data.library.sh.cn/jp/resource/work/tukan682iwgh9eyz
［叶氏］仁奏公家谱叶发炎李清妹后裔表（台湾省花莲县）,叶鸣冈,叶,1981年,--,臺灣始迁祖仁奏。,https://jiapu.library.sh.cn/https://jiapu.library.sh.cn/#/GenealogySummary:http://data.library.sh.cn/jp/resource/work/ff43hvtz7b3arp2f
［叶氏］五大房族簿流传（台湾省花莲县）,不详,叶,--,--,始迁祖奕明，諡剛毅。记事至1968年。,https://jiapu.library.sh.cn/https://jiapu.library.sh.cn/#/GenealogySummary:http://data.library.sh.cn/jp/resource/work/l4ihnvcdacf1bndz
［庄氏］家传（台湾省高雄市）,庄昆生,庄,1979年,--,始遷祖石，清代移居臺灣高雄。,https://jiapu.library.sh.cn/https://jiapu.library.sh.cn/#/GenealogySummary:http://data.library.sh.cn/jp/resource/work/l4n3eot9q8nblgpu
［庄氏］世代祖公名列明永传（台湾省花莲县）,不详,庄,1957年,--,始祖耀德，行九郎。始遷祖瑞梅，移居臺灣花蓮縣鳳林鎮。,https://jiapu.library.sh.cn/https://jiapu.library.sh.cn/#/GenealogySummary:http://data.library.sh.cn/jp/resource/work/qo7ok2hg62xlv1zh
［台北大安安泰房林氏］族谱（台湾省台北市）,林憨,林,1943年,--,始祖致政，元末明初人。始遷祖欽明，字君讓，清乾隆十九年（1755）自福建泉州安溪移居臺灣上淡水内港大加蚋保林口莊。後裔散居臺灣臺北市大安區、臺北縣板橋市等地。1943年修1973年增補稿本。,https://jiapu.library.sh.cn/https://jiapu.library.sh.cn/#/GenealogySummary:http://data.library.sh.cn/jp/resource/work/mh4v2hpydlaoegr2
［临溪吴氏］墓谱不分卷（安徽省黄山市休宁县）,吴文辉,吴,明,--,始遷祖團，宋代人。存墓譜。書名據版心題。記事至明萬曆間。,https://jiapu.library.sh.cn/https://jiapu.library.sh.cn/#/GenealogySummary:http://data.library.sh.cn/jp/resource/work/nbfp8w7jrgn4ipan
［胡氏］历代统序全家族总抄簿（台湾省/花莲县）,不详,胡,1976,--,始祖有通，谥文穆，元明之际迁广东潮州。始迁祖逢耀、逢彬，清季迁台湾省花莲县吉安乡。,https://jiapu.library.sh.cn/https://jiapu.library.sh.cn/#/GenealogySummary:http://data.library.sh.cn/jp/resource/work/1zy5m6rnbj2foni7
［翁氏］祖谱（台湾省苗栗县）,翁绍鼎,翁,1980年,--,始迁祖学忠，清季自广东陆丰迁臺灣。後裔散居苗栗县三灣乡。,https://jiapu.library.sh.cn/https://jiapu.library.sh.cn/#/GenealogySummary:http://data.library.sh.cn/jp/resource/work/27xwfwtglkwr2wbe
［翁氏］家族简谱（福建省福州市福清市）,不详,翁,--,--,始祖学吾。後裔散居福建省福清县江陰乡及臺灣省花蓮县光復乡等地。记事至1985年。,https://jiapu.library.sh.cn/https://jiapu.library.sh.cn/#/GenealogySummary:http://data.library.sh.cn/jp/resource/work/pcemko5uhredyv4c
［翁氏］六桂（广东省）,翁清泉,翁,--,--,是为潮州、汕頭六桂後裔合谱。先祖軒，唐间入閩，後裔有兄弟六人於宋开寶间同登進士，世稱六桂，後迁广东汕頭、潮州等地。本书为潮汕翁氏联誼会会刊之創刊号。据1993年潮汕翁氏联誼会铅印本複印，平装。书名据书名页题。,https://jiapu.library.sh.cn/https://jiapu.library.sh.cn/#/GenealogySummary:http://data.library.sh.cn/jp/resource/work/1xad582md5cddqkn
［罗氏］豫章堂世代祖族簿书不分卷（台湾省屏东县）,不详,罗,1943年,--,譜奉唐代人洪祖（字觀望，號翁源）为一世祖。是为其後裔散居臺灣省屏東縣南州鄉米崙村支譜。卷端題羅氏流傳世譜。,https://jiapu.library.sh.cn/https://jiapu.library.sh.cn/#/GenealogySummary:http://data.library.sh.cn/jp/resource/work/kv2spz42vbw9cj8e
［罗氏］万四公房派下世系表（台湾省屏东县）,罗彬兴,罗,--,--,房祖萬四。裔孫彬興、登興、龍興等遷居臺灣。記事至1985年。,https://jiapu.library.sh.cn/https://jiapu.library.sh.cn/#/GenealogySummary:http://data.library.sh.cn/jp/resource/work/lsufzsfbiibmrqyf
［罗氏］系统图（台湾省嘉义市）,不详,罗,--,--,--,https://jiapu.library.sh.cn/https://jiapu.library.sh.cn/#/GenealogySummary:http://data.library.sh.cn/jp/resource/work/9l9c1cmooqe7rvvt
［罗氏］祖谱（台湾省）,罗美德,罗,1985年,--,始祖翔。始遷祖國風，民國初年遷居臺灣。,https://jiapu.library.sh.cn/https://jiapu.library.sh.cn/#/GenealogySummary:http://data.library.sh.cn/jp/resource/work/wn9l13zrzg1hvvg7
［罗氏］柞昌长房家谱不分卷（广东省佛山市顺德区）,罗宗泰,罗,1934年,--,始祖同上。始遷祖昌誠，號性甫，字存齊，行一，明季遷居大良鄉南門東湧都。書名據書簽題。,https://jiapu.library.sh.cn/https://jiapu.library.sh.cn/#/GenealogySummary:http://data.library.sh.cn/jp/resource/work/f2dcwhqmsh1biift
［罗氏］松轩祠支簿不分卷（安徽省黄山市歙县）,不详,罗,據1973年羅清波抄本,--,先祖同上。是为前羅善四房支譜。書名據書名頁題。,https://jiapu.library.sh.cn/https://jiapu.library.sh.cn/#/GenealogySummary:http://data.library.sh.cn/jp/resource/work/nwu5cx9gix1yxb1e
［罗氏］族谱集不分卷（台湾省屏东县）,不详,罗,1922年,--,始祖念六，諡宏裕。始遷祖輝龍，清季遷臺灣。,https://jiapu.library.sh.cn/https://jiapu.library.sh.cn/#/GenealogySummary:http://data.library.sh.cn/jp/resource/work/avplbk6b3h5sd5b4
［罗氏］家谱（广东省梅州市丰顺县）,罗启丰,罗,1992年,--,譜奉造化为始祖。,https://jiapu.library.sh.cn/https://jiapu.library.sh.cn/#/GenealogySummary:http://data.library.sh.cn/jp/resource/work/abtbj7rfgbu4z127
［简氏］范阳冈陵祀墓志（台湾省台北市）,简文发,简,--,--,始祖德潤，號居敬，元明之際人。遷臺灣始遷祖悦使，清代人。記事至1979年。,https://jiapu.library.sh.cn/https://jiapu.library.sh.cn/#/GenealogySummary:http://data.library.sh.cn/jp/resource/work/mdm2l8s49ae1s177
［简氏］洪源族谱不分卷（台湾省桃园县）,不详,简,民國,--,一世始祖會益，諡萬五郎，宋代人。洪源村一世祖到德，諡小一郎。臺灣始遷祖德仁。記事至1914年。,https://jiapu.library.sh.cn/https://jiapu.library.sh.cn/#/GenealogySummary:http://data.library.sh.cn/jp/resource/work/b5fybnbuzhp8uw7n
［简氏］根在夏泽（江西省宜春市奉新县）,简杏农,简,2001年,--,始祖永慎。第四世英叔遷居京台，第十世立宗於明嘉靖年間遷居奉新，第十四世奇明於明末定居奉新夏澤。譜載歷代舊譜序、氏族溯源、先祖傳記輯抄、夏澤春秋（族史）、風土人情等。書名據封面、書名頁題。,https://jiapu.library.sh.cn/https://jiapu.library.sh.cn/#/GenealogySummary:http://data.library.sh.cn/jp/resource/work/asmbbjghyqb7xa8r
［简氏］家谱俯拾（台湾省屏东县）,简竹青,简,1985年,--,始祖會益，諡萬五郎，宋代人。臺灣始遷祖乾候。南靖支祖德潤，元明之際人。族居屏東縣萬丹鄉新莊村。内容以敘事詩體裁撰寫。,https://jiapu.library.sh.cn/https://jiapu.library.sh.cn/#/GenealogySummary:http://data.library.sh.cn/jp/resource/work/68lmjnxdreisbojl
