谱名,责任者,姓氏,撰修时间,堂号,家谱简介,详情链接
余姚四明黄氏牌宪支墙里家谱（浙江省/宁波市/余姚市）,黄新茂,黄,2016,光系堂,始迁祖褎（字宗远），原籍山东青州，五代后唐时任越州别驾，迁居余姚四明（今梁弄镇）。九世祖时荣（行千九）生两子，长子恭绮（行亚七）派分真门、牌宪两支，次子鉴宁派分洞门、横街两支。传至十三世，牌宪支又分为墙里、墙外两支，本谱主要记墙里一支世系。墙里支祖奫（字义和，行季四），褎十三世孙，官居宋礼部尚书。 卷首像图，卷一彝训，卷二旧序，卷三姓氏族考，卷四至十世系，卷十一诰敇，卷十二列传，卷十三列女传，卷十四祠墓纪，卷十五祀田纪，卷十六宗事纪事，卷十七艺苑名言，卷末藏谱房次、捐款芳名、跋。,https://jiapu.library.sh.cn/https://jiapu.library.sh.cn/#/GenealogySummary:http://data.library.sh.cn/jp/resource/work/kp6s88nwt544rqw4
余姚四明汪氏宗谱八卷(浙江余姚),汪济川,汪,清光緒12年(1886),达德堂,--,https://jiapu.library.sh.cn/https://jiapu.library.sh.cn/#/GenealogySummary:http://data.library.sh.cn/jp/resource/work/rl0i2rnalemsncwh
余姚四明孙氏宗谱（浙江省/宁波市/余姚市）,孙志荣;孙瑞堂,孙,2015,敦睦堂,始迁祖偓（字龙光），礼部尚书，封乐安侯，原居山东青州府乐安县（今山东广饶县），唐光化元年谪迁浙江余姚四明乡（今梁弄）定居。 卷一序、图、记、遗像、进士录、艺文、宗派考、行辈、族规祖训、旧谱条例、凡例、墓志铭、传记、芳名、合影、字号、世系图表，卷二至六世系图表。,https://jiapu.library.sh.cn/https://jiapu.library.sh.cn/#/GenealogySummary:http://data.library.sh.cn/jp/resource/work/fa3b1ralt3y1obr1
余姚四明夏氏宗谱三卷（浙江省宁波市余姚市）,鲁月粹,夏,民國23年(1934),三余堂,始祖伯孫，宋建炎南渡，自汴梁迁山阴。始迁祖梗，字汝剛，行添一，宋代迁餘姚鳳亭。卷一凡例、宗规、遺訓、祖像、谱序跋、传记、行述，卷二至三行传。书名据版心题。,https://jiapu.library.sh.cn/https://jiapu.library.sh.cn/#/GenealogySummary:http://data.library.sh.cn/jp/resource/work/xkfngpzmarfwt1rz
余姚周行景氏宗谱六卷（浙江省宁波市余姚市）,景怀燕,景,民國28年(1939),念祖堂,始祖伯南，南宋初自河南迁居會稽，居四明大洋山，後復移居餘姚康山。太祖雍一，伯南十世孫，再迁邑之周巷。一世祖可賢，雍一子，居周巷鈎月池。傳四世至见慕、普庵、諒直、蓮慕，别为南、後、西、東四房。书名據版心、书簽、书名页题。,https://jiapu.library.sh.cn/https://jiapu.library.sh.cn/#/GenealogySummary:http://data.library.sh.cn/jp/resource/work/w9vr4jpc1u44v17d
余姚周巷陈氏同春老三房（浙江省/宁波市/余姚市）,陈宜亨;陈宜珊;陈宜张,陈,2010,--,谱载同春老三房世系。 殿书，清代人，居余姚周巷樟树下（今属浙江省慈溪市），经营同春染坊。其子治裕，其孙怀成，单丁相传，故称同春老三房。 谱载编写说明、序、周巷樟树下陈氏同春老三房、谱系表、人物、其他传记及回忆、通讯、图片集。,https://jiapu.library.sh.cn/https://jiapu.library.sh.cn/#/GenealogySummary:http://data.library.sh.cn/jp/resource/work/khpyr5gjkbosk118
余姚吕氏宗谱八卷首一卷（浙江省宁波市余姚市）,吕谦,吕,清光緒二十四年（1898）,敬知堂,始遷祖元，字宗禹，又字昌禹，行小二，元代人。書名據目録、卷端題。元至正二年吕伯真初修，此爲三修本。,https://jiapu.library.sh.cn/https://jiapu.library.sh.cn/#/GenealogySummary:http://data.library.sh.cn/jp/resource/work/6bownph2cuxtcesh
余姚司前桑氏宗谱八卷（浙江省宁波市余姚市）,桑庭富,桑,1917年,一本堂,始祖堯卿，行青，北宋人。始遷祖達之，號眉山，行億，元末明初自杭州府城遷居餘姚縣孝義鄉二都眉山司城之前（今四明山鎮寺前村）。卷一敘文、例言、祖像、傳，卷二節孝、圖繪、祠規、祭文、舍石録、遺著、分房志略、總世系表，卷三至八世系、修譜題名録、修譜徵信録。書名據版心、書簽題。三修本。,https://jiapu.library.sh.cn/https://jiapu.library.sh.cn/#/GenealogySummary:http://data.library.sh.cn/jp/resource/work/q5zgewuyfgoqlrao
余姚史氏宗谱十二卷首二卷末三卷（浙江省宁波市余姚市）,史良书,史,民國3年(1914),--,始祖恭，西漢人。溧陽始祖崇，字伯勤，東漢人。始遷祖德，字克明，又字汝行，號右文，又號得齋，南宋寧宗時，其父彌賢自鄞州隱餘姚西南兩城，德往來其間，後遂占籍於兹。德三子：閏、應炎、肇，開閏一、閏二、閏三三房，是譜即三房合修。明史琳出於此族。卷首載譜序、凡例、仕宦録、科第録、京兆杜陵世系、溧陽統修世系、明州世系，卷一餘姚世系，卷二至十二世系，卷末誥敕、列傳、像贊、碑記、墓誌銘。内有楊時、張九成、程大昌、周必大、危素、蔡元定、邵廷采、徐浩、邵晉涵等人撰文。書名據版心、書簽、書名頁題。九修本。,https://jiapu.library.sh.cn/https://jiapu.library.sh.cn/#/GenealogySummary:http://data.library.sh.cn/jp/resource/work/lfwjks43uz39yapr
余姚史氏宗谱十一卷首二卷末二卷附本支百世一卷（浙江省宁波市余姚市）,史光,史,清咸豐六年（1856）,--,始祖恭，西漢人。溧陽始祖崇，字伯勤，東漢人。始遷祖德，字克明，又字汝行，號右文，又號得齋，南宋寧宗時，其父彌賢自鄞州隱餘姚西南兩城，德往來其間，後遂占籍於兹。德三子：閏、應炎、肇，開閏一、閏二、閏三三房，是譜即三房合修。明史琳出於此族。首一卷及本支百世一卷系抄配。書名據版心、書簽題。史琳初修於明成化七年，此爲八修本。,https://jiapu.library.sh.cn/https://jiapu.library.sh.cn/#/GenealogySummary:http://data.library.sh.cn/jp/resource/work/9unbru2i6n31vi24
余姚南门清风里胡氏宗谱四卷首一卷末一卷（浙江省宁波市余姚市）,杨阴寰,胡,民國9年(1920),豫萃堂,始迁祖莘齋，字霖，号商臣，行二，元代自餘姚柏山迁至城南清風里。卷首谱序、凡例、目录、世家原委、神道碑、柏山记、文定公遺跡，卷一像贊、族谱宗范、選舉录，卷二祭产、祠记、廟图、列传、家禮誌略，卷三至四瓜瓞图、行传，卷末跋。书名据书衣题。,https://jiapu.library.sh.cn/https://jiapu.library.sh.cn/#/GenealogySummary:http://data.library.sh.cn/jp/resource/work/jtwngt8lil4g2d15
余姚南徐徐氏宗谱十四卷首一卷补一卷（浙江省宁波市余姚市）,徐文錂,徐,1928年,敦睦堂,始祖處仁，南宋初居会稽，五世孫柟迁居餘姚马堰，生秉瑞、秉鈍。秉瑞曾孫福七，始迁县城，为本支一世祖。始迁祖叔庸，字傑，元代人。书名据版心、书衣题。,https://jiapu.library.sh.cn/https://jiapu.library.sh.cn/#/GenealogySummary:http://data.library.sh.cn/jp/resource/work/gi7sxdoyfi8m54re
余姚半霖卢氏宗谱十二卷首一卷（浙江省宁波市余姚市）,卢赝清,卢,民國3年(1914),绪新堂,始祖仁瞻，字世望，南宋人。始遷祖尚仁，字欽和，行端二，南宋末自餘姚縣城遷居本邑半霖村（今屬大嵐鎮）。卷首總目、修輯名次、凡例、宗規，卷一譜序、譜志辨、敕封、小敘、分派、源流，卷二像贊、行略、志銘、議單、祀産，卷三至四行第、瓜瓞圖，卷五至十一世系圖，卷十二存疑世系、支系圖。清人盧文弨等出於此族。書名據版心、書名頁、目录題。譜初修於明萬曆三十一年，此爲五修本。,https://jiapu.library.sh.cn/https://jiapu.library.sh.cn/#/GenealogySummary:http://data.library.sh.cn/jp/resource/work/a26rji18l8m76rvz
余姚半霖史氏小宗支谱八卷首一卷（浙江省宁波市余姚市）,史玫,史,清咸豐3年(1853),嘉会堂,始祖浩，字直翁，號鄮峰，行萬七四，南宋人。浩子彌堅有曾孫榘卿，榘卿子暲孫（字章甫，行百三四）與埜卿子昌孫（字明甫，行二百六九）於元初自鄞縣遷居餘姚半霖村，分爲上、下宅祖；榘卿另一子昞孫（字見甫，行四百三六）遷居高誼坊南，爲半霖中宅祖。是譜即合三宅世系編成。卷首敘、記、凡例、目録，卷一受姓祖圖、追原聯屬、世祖圖、世原，卷二封典、像贊，卷三至四碑銘、墓誌、詩詞、傳略、文詞、行述、忠孝節義録、史浩年譜，卷五至八世系、規戒、八行垂訓、誤辨、緒餘、後跋。,https://jiapu.library.sh.cn/https://jiapu.library.sh.cn/#/GenealogySummary:http://data.library.sh.cn/jp/resource/work/uuijszkmpgc6hqae
余姚半霖史氏小宗支谱九卷（浙江省宁波市余姚市）,史泉义,史,1923年,--,始祖浩，字直翁，號鄮峰，行萬七四，南宋人。浩子彌堅有曾孫榘卿，榘卿子暲孫（字章甫，行百三四）與埜卿子昌孫（字明甫，行二百六九）於元初自鄞縣遷居餘姚半霖村，分爲上、下宅祖；榘卿另一子昞孫（字見甫，行四百三六）遷居高誼坊南，爲半霖中宅祖。是譜即合三宅世系編成。卷首譜序、記、山田圖、凡例、目録，卷一世祖圖、忠孝節義録，卷二封典、像贊，卷三碑銘、墓表、年譜，卷四墓誌、傳、行狀，卷五至九世系圖、後跋。書名據版心、書名頁題。,https://jiapu.library.sh.cn/https://jiapu.library.sh.cn/#/GenealogySummary:http://data.library.sh.cn/jp/resource/work/y4ri8ay8wjh1e2iw
余姚半霖史氏小宗支谱九卷首一卷（浙江省宁波市余姚市）,史玫,史,清同治9年(1870),--,始祖浩，字直翁，號鄮峰，行萬七四，南宋人。浩子彌堅有曾孫榘卿，榘卿子暲孫（字章甫，行百三四）與埜卿子昌孫（字明甫，行二百六九）於元初自鄞縣遷居餘姚半霖村，分爲上、下宅祖；榘卿另一子昞孫（字見甫，行四百三六）遷居高誼坊南，爲半霖中宅祖。是譜即合三宅世系編成。卷首、卷一譜序、凡例、世祖圖，卷二誥命、像贊，卷三至四碑銘、傳記、墓誌、壽序、史浩年譜，卷五至八世系，卷九訓戒藏紀内有八行垂訓、宗譜規戒、族譜辨誤等。書名據版心題。,https://jiapu.library.sh.cn/https://jiapu.library.sh.cn/#/GenealogySummary:http://data.library.sh.cn/jp/resource/work/44ehqq3ypmhh8o9w
馀姚汇头杨氏谱（浙江省宁波市余姚市）,--,杨,民國,--,存卷1-3,https://jiapu.library.sh.cn/https://jiapu.library.sh.cn/#/GenealogySummary:http://data.library.sh.cn/jp/resource/work/3ysi4ctjfleu3wru
余姚北城邹氏宗谱六卷首一卷（浙江省宁波市余姚市）,邹元瀛,邹,清光緒6年(1880),敦睦堂,始祖思道，名游，唐代人。裔孫植，初名桂因，字德本，行四，宋代迁居餘姚樣山，为樣山始祖。始迁祖盛，又名堅固，字茂義，號永昌，行懋二，明代迁居邑之北城。卷首凡例、誥敕、宗祠图、像，卷一列傳，卷二宗祠记事、規約等，卷三至六世系。书名據版心、书衣、目录、卷端题。,https://jiapu.library.sh.cn/https://jiapu.library.sh.cn/#/GenealogySummary:http://data.library.sh.cn/jp/resource/work/ebmr57a6j44ip8ae
余姚剡湖陆氏世谱十二卷首一卷末一卷（浙江省宁波市余姚市）,陆富祥,陆,清光绪十三年（1887）,源本堂,始迁祖萬八，宋代人。书名据版心题。,https://jiapu.library.sh.cn/https://jiapu.library.sh.cn/#/GenealogySummary:http://data.library.sh.cn/jp/resource/work/zham7waeucqappu7
余姚剡湖陆氏世谱十二卷首一卷末一卷（浙江省宁波市余姚市）,陆凤中;等,陆,1926年,源本堂,始迁祖行辛七，宋進士，元德祐二年扈蹕东渡钱塘，居姚江。书名据版心、卷端题。,https://jiapu.library.sh.cn/https://jiapu.library.sh.cn/#/GenealogySummary:http://data.library.sh.cn/jp/resource/work/2yu6lmvsvllhagg5
余姚凰山桥明德堂鲁氏宗谱（浙江省/宁波市/余姚市）,鲁政,鲁,2020,明德堂,始祖居仁，北宋时人，居开封。传五世，后裔一支迁秀州（今浙江嘉兴），又居绍兴。十一世裔孙于南宋淳祐十年迁居余姚，繁衍于邑之景嘉桥。始迁祖二十七世忠孝，清乾隆间迁居凰山桥。 谱载序、景嘉桥鲁氏宗谱考、世系图、世系表、凰山桥鲁家往事、余姚老话乡间俚语、景嘉桥旧谱复印件、后记。,https://jiapu.library.sh.cn/https://jiapu.library.sh.cn/#/GenealogySummary:http://data.library.sh.cn/jp/resource/work/vg7uhdtbbfnrhqnp
余姚兰风胡氏续修宗谱七卷首二卷末一卷附刊一卷（浙江省宁波市余姚市）,胡庆瑺,胡,民國8年(1919),敦本堂,始祖從，字輔成，别号常樂翁，行八，後周顯德二年自常州安上鄉迁餘姚雲柯鄉柏山，裔孫再徙县东高田蘘。始迁祖十八世孫慣（字天忠，一字天宗，行泰三）、擳（字天純，行泰四），明代迁至兰風五車堰，各为东外房、西外房之祖。是谱並收柏山谱，兼收本邑竹山、曲塘湾、梅川等旁支及杭城褚家堂、嘉興檇李、冶山三層樓等分支。卷首上源流考、书簡、家规、宗规、像贊等，卷首下行述、杂俎，述及辛亥革命前後上海金融界之情形，卷一至七世系图、敘世传等，卷末迁徙录。附刊为1935年敦本堂木活字本，为改正友薌德配程夫人名義碑等。书名据卷端题。,https://jiapu.library.sh.cn/https://jiapu.library.sh.cn/#/GenealogySummary:http://data.library.sh.cn/jp/resource/work/icvdskkzrdluelnk
余姚何氏家谱第十七代至第二十二代（浙江省/宁波市/余姚市）,不详,何,2014,--,是族祖籍浙江余姚何家闼子。谱系何氏十七至二十二代汇集。世系自十七世联恩始。 谱载世系、照片、通讯录。,https://jiapu.library.sh.cn/https://jiapu.library.sh.cn/#/GenealogySummary:http://data.library.sh.cn/jp/resource/work/42xp2aduh7d8rb76
余姚何氏宗谱（浙江省/宁波市/余姚市）,何叶凉,何,2021,种德堂,始迁祖曼（字长吉，行十三），初居浙江海宁，南宋德祐间迁居浙江余姚兰风八字桥。 卷一目录、序、续谱人员名单、村简介、祠堂、人丁统计、住宅平面图、影像地图、联系人、家庭照片、捐赠人员名单、谱原、谱序、凡例、祠规、家规、祖训、宗祠记、像赞，卷二列传、诰敕、赐书、族谱志、奏表、牒、进谱表、墓志、碑文、碑记、简札、杂作、祭文、仪注、楹联、祭产、耆年表、跋，卷三至七世系图。,https://jiapu.library.sh.cn/https://jiapu.library.sh.cn/#/GenealogySummary:http://data.library.sh.cn/jp/resource/work/al1p785fv7eb3c2e
馀姚何氏元增公家谱（上海市）,何兆丰,何,1999,--,始祖曼（字长吉），南宋德祐间自浙江海宁迁馀姚兰风八字桥。二十一世元增（字福永，号耀祖），清光绪间自馀姚迁上海。 内录序、凡例、庐江世系、世系表、传略、馀姚世系、世系表、传略，元增公房世系、世系表、传略、附录一至五等。,https://jiapu.library.sh.cn/https://jiapu.library.sh.cn/#/GenealogySummary:http://data.library.sh.cn/jp/resource/work/n6og91negbvbc8qh
余姚云楼董氏宗谱五卷首一卷（浙江省宁波市余姚市）,董作臣,董,1928年,正谊堂,始迁祖邦治，字姚愚，行慶八，宋代人。书名據版心题。,https://jiapu.library.sh.cn/https://jiapu.library.sh.cn/#/GenealogySummary:http://data.library.sh.cn/jp/resource/work/9kw8gkycgqgr4p7r
余姚临山俞氏宗谱三卷（浙江省宁波市余姚市）,俞济诚,俞,民國2年(1913),敦伦堂,始迁祖公炳，字長孺，明景泰末由新昌迁餘姚，馆於临山，遂家焉。卷一凡例、家訓、传等，卷二世系，卷三世表。书名据版心、目录题。,https://jiapu.library.sh.cn/https://jiapu.library.sh.cn/#/GenealogySummary:http://data.library.sh.cn/jp/resource/work/y6xheuw83vip6nay
余姚东门翁氏家乘二十卷（浙江省宁波市余姚市）,翁砲明,翁,民國2年(1913),统宗堂,始迁祖晉，仕南宋，官浙东提督鈐轄使，遂居餘姚东门外。有程頤、杨时、胡沂、文天祥、葉澄等人所撰墓誌、行狀，保存南宋、明兩代史料特丰。卷一迁各郡始祖、先賢小像、宗规，卷二瓜瓞图，卷三至六总世系、本支总系、本支世系，卷七至二十誥命、敕书、薦章、仕籍、广族谱、传赞、诗歌、啟諸、墓誌、家訓、閨範。书名据版心、书名页、书签、卷端题。,https://jiapu.library.sh.cn/https://jiapu.library.sh.cn/#/GenealogySummary:http://data.library.sh.cn/jp/resource/work/vdto4sqddddrpwx3
余姚东门翁氏家乘二十卷（浙江省宁波市余姚市）,翁学涵,翁,清咸丰三年（1853）,统宗堂,始迁祖晉，仕南宋，官浙东提督鈐轄使，遂居餘姚东门外。书名据版心、书名页题。,https://jiapu.library.sh.cn/https://jiapu.library.sh.cn/#/GenealogySummary:http://data.library.sh.cn/jp/resource/work/n2fnn5adtr4ia1hw
余姚上林宋氏族谱二十四卷附录一卷（浙江省宁波市慈溪市）,宋子隽;宋元英,宋,清光緒十九年（1893）,统宗堂,始遷祖昂十八，宋代自奉川（今奉化市）移居餘姚縣上林湖（今屬慈谿市橋頭鎮）。卷一淵源考，卷二至十四世系，卷十五外譜，卷十六誥敕，卷十七祖訓，卷十八列傳，卷十九内紀，卷二十家傳，卷二十一典禮志，卷二十二土田志，卷二十三彙編，卷二十四車馬，附录學簿。存卷一、二、五至十四、附录。譜初修於清嘉慶元年，此爲三修本。,https://jiapu.library.sh.cn/https://jiapu.library.sh.cn/#/GenealogySummary:http://data.library.sh.cn/jp/resource/work/zqnpxskxqf8he5pi
余姚上林周氏宗谱十卷首一卷外一卷（浙江省宁波市余姚市）,周月全,周,清光緒二十七年（1901）,敦伦堂,始遷祖幾，行細二十，元初自臨安府城（今杭州市）遷居餘姚縣上林湖。卷首譜序、凡例、儀形圖、祖像、行第歌、族規、墓誌、傳、宗事記、祭文、祀産、賞給饅首目，卷一至十世系圖、失綫昭穆圖，外卷螟派圖、譜跋、輯譜紀事。 書名據書簽、目録題。初修本。,https://jiapu.library.sh.cn/https://jiapu.library.sh.cn/#/GenealogySummary:http://data.library.sh.cn/jp/resource/work/uxgnk625hli8m9tr
余姚上塘王氏宗谱十四卷首一卷末一卷（浙江省宁波市余姚市）,王钦安,王,民國23年(1934),嗣槐堂,始遷祖寰，行千二十一，南宋時自會稽縣（今屬紹興縣）徐家渡村移居上縣蘭風鄉上塘村（今屬餘姚市黄家埠鎮）。卷首序、凡例、論、祠圖，卷一列傳，卷二宗賢事略、藝文録，卷三淵源圖，卷四至十四世系，卷末總録、雜録。書名據版心、書簽、書名頁等題。,https://jiapu.library.sh.cn/https://jiapu.library.sh.cn/#/GenealogySummary:http://data.library.sh.cn/jp/resource/work/jqqy7rj6ssydpfot
余姚上塘王氏宗谱十四卷首一卷末一卷附录一卷（浙江省宁波市余姚市）,王钦安,王,民國23年(1934),嗣槐堂,是譜較木活字本多附録《纂譜散稿》，載例言、淵源圖、統宗圖、分房表、附記、傳記。存卷首、卷一至九、附録。,https://jiapu.library.sh.cn/https://jiapu.library.sh.cn/#/GenealogySummary:http://data.library.sh.cn/jp/resource/work/pp3x9wqy1rmvan5m
余姚三山王氏族谱（浙江省宁波市余姚市）,王锡璋,王,清,--,始遷祖承福，行念二，宋初自松江華亭移居餘姚三山。卷載序、家訓、世系、傳記等。存卷一、二。,https://jiapu.library.sh.cn/https://jiapu.library.sh.cn/#/GenealogySummary:http://data.library.sh.cn/jp/resource/work/b9fv49a1jqqgw3su
余姚三墙门张氏宗谱二十八卷（浙江省宁波市余姚市）,张振鹭,张,民國5年(1916),树德堂,參見清張方量修《張氏宗譜》條目。三墻門支祖壆，埴之七世孫。卷一至六祠規、聯語、墓圖、誥敕、像贊、傳、墓誌銘、科名録、文學録、詩、遺訓、祭文等，餘卷載世系。書名據書衣題。六修本。,https://jiapu.library.sh.cn/https://jiapu.library.sh.cn/#/GenealogySummary:http://data.library.sh.cn/jp/resource/work/zywkiy9baga5n3zx
余姚丈亭应氏福禄寿房亲属资料汇编（浙江省/宁波市/余姚市）,陈维群,应,2009,--,是族世居于姚江与慈江交汇的镵头渡，距姚江流域丈亭（今属浙江省余姚市）仅一里余，故称丈亭应氏。世系始记自承佐（一世），明末清初人。五世允柱。传至七世椿龄、武龄、葆龄，分启福、禄、寿三房。 谱载前记、福房亲属资料、禄寿房亲属资料、福房亲属照片、禄寿房亲属照片、应氏家宅平面图、编后说明、索引。,https://jiapu.library.sh.cn/https://jiapu.library.sh.cn/#/GenealogySummary:http://data.library.sh.cn/jp/resource/work/c84u38f3yfgvo7oa
余姚丈亭应氏福房亲属资料（浙江省宁波市余姚市）,应启新;应启炳,应,2006年4月,--,始遷祖佚名，世居浙江慈谿縣明兆鄉丈亭（今屬餘姚市河姆渡鎮）。資料載前記、世系、照片、跋語等。書名據封面題。,https://jiapu.library.sh.cn/https://jiapu.library.sh.cn/#/GenealogySummary:http://data.library.sh.cn/jp/resource/work/ojdcw9tlmgwr5rl7
余姚丈亭应氏福房亲属资料（浙江省/宁波市/余姚市）,应启炳;应启新,应,2006,--,是族世居于姚江与慈江交汇的镵头渡，距姚江流域丈亭（今属浙江省余姚市）仅一里余，故称丈亭应氏。世系始记自承佐（一世），明末清初人。五世允柱。传至七世椿龄、武龄、葆龄，分启福、禄、寿三房。谱为自茂生以下福房亲属资料。 谱载前记、福房先祖、照片、行传、跋。,https://jiapu.library.sh.cn/https://jiapu.library.sh.cn/#/GenealogySummary:http://data.library.sh.cn/jp/resource/work/ysg2qt626r4ui4gy
聂氏族谱□□卷（安徽省）,聂槐,聂,清,--,始祖志明（字北逵，號敏軒），元至正十五年自江西鄱陽遷居安徽太湖。始遷祖為其長子正隆（號近塘），明洪武元年遷居潛山。卷首譜序、名目、名賢譜說、凡例、家規、誥命、像贊，卷二家禮圖、世系。（館藏：1020181-217為此譜之續修本）書名據版心題。,https://jiapu.library.sh.cn/https://jiapu.library.sh.cn/#/GenealogySummary:http://data.library.sh.cn/jp/resource/work/2kwhh7uegbktyefc
养浩堂曾氏族谱忠部不分卷（福建省泉州市南安市）,不详,曾,據1919年,--,始祖同上。始迁祖学尚，清代人。书名據书名页题。,https://jiapu.library.sh.cn/https://jiapu.library.sh.cn/#/GenealogySummary:http://data.library.sh.cn/jp/resource/work/pvufcu9epetx318x
养浩堂曾氏族谱不分卷（福建省泉州市南安市）,曾荆璧,曾,據清光緒间,--,始祖同上。始迁祖俅，宋代人。书名據书簽题。本譜为清咸豐二年修，清光緒年间增補。,https://jiapu.library.sh.cn/https://jiapu.library.sh.cn/#/GenealogySummary:http://data.library.sh.cn/jp/resource/work/lqyouxc8onr9nj76
养浩堂曾氏族谱不分卷（福建省泉州市南安市）,曾攀桂,曾,據清光緒十二年（1886）,养浩堂,始祖延世，唐代人。始迁祖達庵，清代人。书名據书衣题。,https://jiapu.library.sh.cn/https://jiapu.library.sh.cn/#/GenealogySummary:http://data.library.sh.cn/jp/resource/work/atyoxpxinl22tl8e
飞鸾梅溪王氏世谱不分卷（福建省宁德市）,王梦熊,王,清同治八年（1869）,--,始祖審知，唐代人。始遷祖一璧，清代人。書名據卷端題。,https://jiapu.library.sh.cn/https://jiapu.library.sh.cn/#/GenealogySummary:http://data.library.sh.cn/jp/resource/work/2jh5n52uruyawtew
飞鹅石陈氏宗族谱志（重庆市/重庆市/綦江区）,陈廷杰,陈,1993,--,此族祖籍江西，元末迁居湖南湘乡县。始迁祖铁（又名茂先，行三郎），明洪武二年自湖南入川，定居綦江瓢坝河飞鹅石洞子湾，后裔分八大房。此谱系八大房合修。 谱载墓图、序、江西义门陈氏史料、八大房支族名册（世系表）等。,https://jiapu.library.sh.cn/https://jiapu.library.sh.cn/#/GenealogySummary:http://data.library.sh.cn/jp/resource/work/bc9jcelqy3vxj5mg
飞凤祠郭氏族谱（广东省/肇庆市/怀集县）,郭廷标;郭锦华,郭,2000,--,始迁祖豪亮、豪晃、豪广，从湖广丝洲巷迁广西贺县，元泰定元年直到威州（今广东怀集）冷坑，分居成村岗、井埇岗、下谷岗。 谱载前言、修编族谱委员会、昭穆表、捐款芳名表、世系、族规、古今名录、编后记。,https://jiapu.library.sh.cn/https://jiapu.library.sh.cn/#/GenealogySummary:http://data.library.sh.cn/jp/resource/work/mx2c7h4ovb7azcp2
飞钱陈氏族谱（福建省/莆田市/仙游县）,陈兆;等,陈,1999,--,始祖鄙（字纯仁），唐代居仙游榜头乡。五世孙晔（字季通），徙居钱田境琴盘。始迁祖汝器，宋季再迁飞钱。 不详,https://jiapu.library.sh.cn/https://jiapu.library.sh.cn/#/GenealogySummary:http://data.library.sh.cn/jp/resource/work/iiswm257de28w5u1
