谱名,责任者,姓氏,撰修时间,堂号,家谱简介,详情链接
曾氏族谱（台湾省/桃园市）,不详,曾,不详,--,台湾始迁祖九健，谥朴直，清代人。记事至1985年。内附户籍誊本一份。,https://jiapu.library.sh.cn/https://jiapu.library.sh.cn/#/GenealogySummary:http://data.library.sh.cn/jp/resource/work/o3utnsul7316uks4
曾氏族谱（台湾省/新竹县）,曾焕进,曾,1977,--,始祖贵耒，元明之际人。谱内另拍有朱永衫于澎湖祖家抄来的朱家族谱，始祖为朱妹公（字焕堂）部分后裔移居台湾新竹新丰乡等地世系。,https://jiapu.library.sh.cn/https://jiapu.library.sh.cn/#/GenealogySummary:http://data.library.sh.cn/jp/resource/work/jkuvj3natm5hwz2c
曾氏族谱（台湾省/新竹县）,不详,曾,不详,--,台湾始迁祖自寿，谥纯良，清代人。支祖新丁，清代人。记事至1975年。,https://jiapu.library.sh.cn/https://jiapu.library.sh.cn/#/GenealogySummary:http://data.library.sh.cn/jp/resource/work/qov5zfpzrb5u1sdr
曾氏族谱（台湾省/新竹县）,曾娘胜,曾,1969,--,广东镇平始祖裕振。台湾始迁祖日恭（谥法恩，赐儒林郎），清代人。,https://jiapu.library.sh.cn/https://jiapu.library.sh.cn/#/GenealogySummary:http://data.library.sh.cn/jp/resource/work/cjd6hvi4diiuurig
曾氏族谱（台湾省/新竹县）,不详,曾,1982,--,始祖贵涞，明代人。台湾始迁祖肇珠、肇玉、肇珍，清代人。,https://jiapu.library.sh.cn/https://jiapu.library.sh.cn/#/GenealogySummary:http://data.library.sh.cn/jp/resource/work/iwfm3vxbq8i2av8m
曾氏族谱（台湾省/新竹县）,不详,曾,不详,--,支祖新进，清代人。,https://jiapu.library.sh.cn/https://jiapu.library.sh.cn/#/GenealogySummary:http://data.library.sh.cn/jp/resource/work/u6mxmrpkw38yi2sm
曾氏族谱（台湾省/新竹县）,不详,曾,1971,--,始祖仲文，清代人。,https://jiapu.library.sh.cn/https://jiapu.library.sh.cn/#/GenealogySummary:http://data.library.sh.cn/jp/resource/work/w1ds95mkpdk7i382
曾氏族谱（台湾省/彰化县）,不详,曾,1961,--,始祖万八郎。台湾始迁祖延杰、延居。,https://jiapu.library.sh.cn/https://jiapu.library.sh.cn/#/GenealogySummary:http://data.library.sh.cn/jp/resource/work/i49qnupapu467oov
曾氏族谱（台湾省/屏东县）,曾祥富,曾,不详,--,始祖启沧。,https://jiapu.library.sh.cn/https://jiapu.library.sh.cn/#/GenealogySummary:http://data.library.sh.cn/jp/resource/work/xzzotuxs6un66omd
曾氏族谱（台湾省/屏东县）,不详,曾,1974,--,台湾始迁祖毓鼎，字鼎拔。,https://jiapu.library.sh.cn/https://jiapu.library.sh.cn/#/GenealogySummary:http://data.library.sh.cn/jp/resource/work/4dm399jgv9u8ki4t
曾氏族谱（台湾省/屏东县）,曾振寿,曾,不详,--,台湾始迁祖九俊、九伦、九健，清代人。记事至1978年。,https://jiapu.library.sh.cn/https://jiapu.library.sh.cn/#/GenealogySummary:http://data.library.sh.cn/jp/resource/work/lnpux2k9zr8zwf7s
曾氏族谱（台湾省/屏东县）,曾得昌,曾,不详,--,台湾始迁祖映灺（字玉长），清代人。,https://jiapu.library.sh.cn/https://jiapu.library.sh.cn/#/GenealogySummary:http://data.library.sh.cn/jp/resource/work/75gnww3m75uefuyl
曾氏族谱（台湾省/宜兰县）,曾朝清,曾,1964,--,始祖正等，清代人。,https://jiapu.library.sh.cn/https://jiapu.library.sh.cn/#/GenealogySummary:http://data.library.sh.cn/jp/resource/work/izc6n78yjobdlitp
曾氏族谱（台湾省/嘉义县）,曾堂坤,曾,1985,--,始迁祖铁，从福建省迁居台湾省嘉义县。 谱载迁徙源流、家族人员。,https://jiapu.library.sh.cn/https://jiapu.library.sh.cn/#/GenealogySummary:http://data.library.sh.cn/jp/resource/work/c3kgi5y2fsq6npxb
曾氏族谱（台湾省/嘉义市）,不详,曾,不详,--,始祖延世，唐代人。支祖珪随。台湾始迁祖呈脱，清代人。,https://jiapu.library.sh.cn/https://jiapu.library.sh.cn/#/GenealogySummary:http://data.library.sh.cn/jp/resource/work/8s6rzdjzk5gizvbf
曾氏族谱（台湾省/嘉义市）,不详,曾,不详,--,始祖延世，唐代人。支祖珪随。台湾始迁祖呈脱，清代人。记事至1981年。,https://jiapu.library.sh.cn/https://jiapu.library.sh.cn/#/GenealogySummary:http://data.library.sh.cn/jp/resource/work/yj1v8o8w3jpa3ovb
曾氏族谱（台湾省/嘉义市）,曾振,曾,不详,--,始祖志和。台湾始迁祖元拱。,https://jiapu.library.sh.cn/https://jiapu.library.sh.cn/#/GenealogySummary:http://data.library.sh.cn/jp/resource/work/q9omrk6ngbssaiwo
曾氏族谱（台湾省/南投县）,不详,曾,不详,--,台湾始迁祖赐（名邻玉）、吕斗、镇南等，清代人。,https://jiapu.library.sh.cn/https://jiapu.library.sh.cn/#/GenealogySummary:http://data.library.sh.cn/jp/resource/work/wgqktl9jhf26pei6
曾氏族谱（台湾省/南投县）,曾炳炉,曾,1974,--,始祖万八郎。台湾始迁祖士夏，字敏德。,https://jiapu.library.sh.cn/https://jiapu.library.sh.cn/#/GenealogySummary:http://data.library.sh.cn/jp/resource/work/3tjetj7r2n27qblz
曾氏族谱（福建省龙岩市上杭县）,不详,曾,清,忠恕堂,始祖敬，號一元，行恩一，为曾參四十四世孫，唐代舊之裔，居宁化，子二八郎、六四郎、三十郎、廿三郎分迁上杭之陳坑白沙、大古村南山下、扶陽、高寨嶺等地。卷首總源志，卷一为世系表。存卷首、卷一。书名據卷端题。记事至清道光间。,https://jiapu.library.sh.cn/https://jiapu.library.sh.cn/#/GenealogySummary:http://data.library.sh.cn/jp/resource/work/3llhk8hz3eif5srf
曾氏族谱（福建省/漳州市）,不详,曾,1990,--,书名据书名页题。,https://jiapu.library.sh.cn/https://jiapu.library.sh.cn/#/GenealogySummary:http://data.library.sh.cn/jp/resource/work/iql4ejy2pw5lyl1p
曾氏族谱（福建省/三明市）,等;曾年坤,曾,1991,--,谱以春秋时期的山东鲁国思想家曾参为始祖。三十八世洪立（字熙和，行二郎），唐代为南丰县令，遂居焉。四十三世巩，北宋文学家，江西南丰人。始迁祖五十六世兄弟二人：长十郎（字惺初，号正含），于元末明初先自南丰查溪迁洪坪，复迁福建三明宁化安远招得里四都横排（又名衡排）定居；次铁郎，自江西南丰查溪迁居福建三明建宁均口龙头曾家窠居住。另有一支始迁祖系洪立二十一世孙德九，于明中期迁居福建宁化上仕居住。 谱载序、谱规、源流、诗、赞、像图、诏、迁徙、芳名表、家献、世系图、世系表。,https://jiapu.library.sh.cn/https://jiapu.library.sh.cn/#/GenealogySummary:http://data.library.sh.cn/jp/resource/work/avzh32t9hi8ccvvv
曾氏族谱（福建省/三明市/宁化县）,曾东兴,曾,1991,--,"明洪武年间曾允康自江西南丰迁福建,其孙洪郎迁三明宁化县。 谱载序、圣谕、祖像、墓图、墓志、修谱花名、字派、世系。",https://jiapu.library.sh.cn/https://jiapu.library.sh.cn/#/GenealogySummary:http://data.library.sh.cn/jp/resource/work/lwc9zugmhoag9jc9
曾氏族谱（湖南省湘潭市湘乡市）,曾闻进,曾,清康熙四十九年（1710）,--,譜以參为一世祖，珪为三十四世祖，第五十四世鎮撫，又名太乙郎，字添錫，元季自江西太和徙居湘鄉南門，繼移樃山（一曰榔山）黄花園。存卷一至三。书名據版心题。,https://jiapu.library.sh.cn/https://jiapu.library.sh.cn/#/GenealogySummary:http://data.library.sh.cn/jp/resource/work/k7vmnd3whh2m8mlu
曾氏族谱（海南省/澄迈县）,曾维 曾德新 曾令富 曾德大 曾令仕 曾令贵,曾,2012,--,始迁祖传，福建莆田人，明朝嘉靖年间，官居武职千户，琼州镇守备。卜居澄地，落籍文大，繁衍生息，为立村始祖。 谱载目录、庶尹公世系、宏启大公世系、宏开二公世系、宏良三公世系、宏应四公世系、拨南世彦公世系。,https://jiapu.library.sh.cn/https://jiapu.library.sh.cn/#/GenealogySummary:http://data.library.sh.cn/jp/resource/work/4fipcck8anws9rhs
曾氏族谱（江西省/赣州市/信丰县）,曾传经;曾毓廷,曾,1990,--,始祖仲什，大约元朝年间自吉阳分徙虔州邑水口曾屋塆。始迁祖德潨、德湛，大约明朝年间兄弟二人卜居信邑大塘埠镇牛口村李屋坑口老屋立籍。 谱载序言、通谱字派、世系表。,https://jiapu.library.sh.cn/https://jiapu.library.sh.cn/#/GenealogySummary:http://data.library.sh.cn/jp/resource/work/3qg6hgh1ygjz8ol9
曾氏族谱（江西省/赣州市/信丰县）,不详,曾,当代（当代）,武城堂,始迁祖德潨、德湛，清代迁居江西信丰大塘埠镇牛口村李屋坑口老屋。 谱载序、字派、总源、世系图、世系表。,https://jiapu.library.sh.cn/https://jiapu.library.sh.cn/#/GenealogySummary:http://data.library.sh.cn/jp/resource/work/88952sz3k3es72ma
曾氏族谱（江西省/抚州市）,曾锡贵,曾,1990,玉春堂,始祖据公，西汉末年因避贼子南下避居江西庐陵吉阳乡，其后裔分支到广东韶关福建赣南等地。待李唐后期吉安洪立公任南丰令，后由文定公迁至抚州的后湖田。 目录、新序、文定公像、像赞、联修各支始祖像、合族合姓字派、曾氏联修族谱董事会首士表、领谱字号、联修各支历届修谱简述、原序、总源流序、各支序、乔迁录、家族家训、凡例、居徙考、衣冠表、辰翰篇、神道碑、祠志、名迹、墓铭、家祀集、列传、山场、曾氏先代源流、源流吊图,https://jiapu.library.sh.cn/https://jiapu.library.sh.cn/#/GenealogySummary:http://data.library.sh.cn/jp/resource/work/3naqcnqo9b4c74li
曾氏族谱（江西省/宜春市/丰城市）,曾泉根,曾,不详,--,始迁祖霞，自抚州官塘迁来。是为丰城茂溪村谱。,https://jiapu.library.sh.cn/https://jiapu.library.sh.cn/#/GenealogySummary:http://data.library.sh.cn/jp/resource/work/6dxe8qf2blrj6ccm
曾氏族谱（江西省/宜春市/丰城市）,曾宪权,曾,不详,--,始祖汝辉、毓祖。始迁祖东宗。是为丰城邹家村谱。,https://jiapu.library.sh.cn/https://jiapu.library.sh.cn/#/GenealogySummary:http://data.library.sh.cn/jp/resource/work/v1gxnbuvtaltoh3i
曾氏族谱（江西省/宜春市/丰城市）,曾绍先,曾,1985,--,先祖同上。辙曾孙均（字德固，行七六）分居墩溪。越四世，端（号和翁，行四）复迁澳源，端曾孙怀志（字继先，行八）再迁邑内木口。本支始迁祖怀志孙本元（字易），明代徙居柘溪，后因水患始居望郭。,https://jiapu.library.sh.cn/https://jiapu.library.sh.cn/#/GenealogySummary:http://data.library.sh.cn/jp/resource/work/26b8oquvwj46r6as
曾氏族谱（广东省/韶关市）,曾昭良,曾,2014,--,仁化县曾氏族人是先后从广东河源、嘉应州、翁源、乐昌，江西泰和、永丰，湖南汝城等地迁徙至今仁化镇龟颈、长江镇 蒙洞等地立基，再分迁各地繁衍生息。其中龟颈村始迁祖景旺（行一），明宣德二年从广东惠州府河源县迁入。始兴县东湖坪曾氏开基祖仲仁，明正统年间从嘉应州镇平县（广东梅州市蕉岭县）迁至，后又分支黄丹岭等地安居。 谱载曾氏的起源、播迁流布、郡望、堂号、堂联、名胜遗迹、历代皇封、世系派辈、世系录、人物录等。,https://jiapu.library.sh.cn/https://jiapu.library.sh.cn/#/GenealogySummary:http://data.library.sh.cn/jp/resource/work/3cxvfrovw3p8os28
曾氏族谱（广东省/汕尾市/陆丰市）,曾烱坚,曾,2003,--,始迁祖儣与其孙曾仕禄清康熙初年由长乐（今五华）县迁徙至海丰县，暂居金锡都桐埔，后又迁南海之滨芳荣乡白石头村（今属广东省汕尾市陆丰市湖东镇白石头村）定居。 谱载目录、成员合影、题词、家训、祖先像、祖墓、祖祠、前言、序文、迁徙图、分布图、世系图、诗迭、芳名榜、后记。,https://jiapu.library.sh.cn/https://jiapu.library.sh.cn/#/GenealogySummary:http://data.library.sh.cn/jp/resource/work/hor13k8vediu8rpp
曾氏族谱（广东省/中山市）,曾雷黄,曾,不详,--,始祖续仁（字东引），明朝人。 谱载山图、祖考忌日、房屋契约、房屋界址、坟墓图、私人函件。,https://jiapu.library.sh.cn/https://jiapu.library.sh.cn/#/GenealogySummary:http://data.library.sh.cn/jp/resource/work/16n7r1ngdo4nf1ln
曾氏族谱（山东省/济宁市/嘉祥县）,曾纪瑚;曾宗于,曾,1993,--,始祖参（字子舆），生于周敬王丙申年，生于东鲁移居武城。 谱载谱序、谱源、世系表。,https://jiapu.library.sh.cn/https://jiapu.library.sh.cn/#/GenealogySummary:http://data.library.sh.cn/jp/resource/work/akdx0in7psl7yebo
曾氏族谱（四川省/遂宁市/射洪市）,曾洪源,曾,2019,--,本房曾氏系1750年至1835年间，从湖广麻城县孝感乡黄州寺（今湖北省孝感市）出发入川，繁衍于四川省遂宁市射洪市仁和镇。 谱载组织篇、射洪曾氏各支分布、续谱工作组织及相关文件、名人篇、旧族奉旨敕封宗圣族谱、曾家湾老谱、世系篇、修谱工作篇、功德篇、附录、祭文集锦、编后记。,https://jiapu.library.sh.cn/https://jiapu.library.sh.cn/#/GenealogySummary:http://data.library.sh.cn/jp/resource/work/o2wcca6zz4sf0uo7
曾氏族谱重庆忠县（重庆市/重庆市/忠县）,曾繁礼,曾,2010,三省堂,曾姓为传统汉族姓氏，最初发源于今山东省临沂市兰陵县（苍山县）西北一带。夏王少康封地给小儿子曲烈作为子爵王国，称为鄫子国。后鄫国被灭，鄫国太子巫投奔邻近的鲁国，用原国名“鄫”为姓氏，但除去了邑旁（阝），表示离开故城，不忘先祖，称为“曾”。曲烈为始封远祖，曾巫为曾姓的得姓始祖，曾参为开派始祖。曾姓堂号三省堂。曾氏第一发脉地为山东武城，旺族中心江西庐陵。入川始祖德宣公，于明洪武二年（公元1369年）与兄长、二哥，从湖广黄州麻城县孝感乡高家汇起身，举家迁入下川东忠州长江北岸顺溪场天池山，后来叫曾家河。 本谱内容包括曾氏家族源流、族谱编修、字辈、家训、古今名人；忠县曾氏世系（户册），忠州堑口坝曾氏世系，拔山寺曾氏世系，曹家、磨子山曾氏世系、高洞、马灌曾氏世系，九蟒、新生白窑曾氏世系；知识集锦、文苑。,https://jiapu.library.sh.cn/https://jiapu.library.sh.cn/#/GenealogySummary:http://data.library.sh.cn/jp/resource/work/oyimfxmt7tcluyu3
曾氏族谱秀岭村世斌公裔系（广东省/河源市/龙川县）,曾锦初;曾锦棠,曾,2001,--,始祖广新(字成德，号一柯)，元末随父母自福建宁化徙广东长乐县（今梅州市五华县），后又避兵乱徙兴宁县北厢龙归洞（梅州市）立业。其第七子德甫（行七十三郎）后裔今居铁场镇（今广东省河源市龙川县谷前镇）秀岭。是为德甫曾孙世斌（行二）支系谱。 卷首载新旧谱序，甲编为得姓祖至德甫之子文通世系，乙编为文通之子世斌后裔世系。,https://jiapu.library.sh.cn/https://jiapu.library.sh.cn/#/GenealogySummary:http://data.library.sh.cn/jp/resource/work/tfovbm982l93sp1v
曾氏族谱惠东脉络派系篇（广东省/惠州市/惠东县）,曾仿修,曾,2009,--,始祖珪（字子玉），三十四派，居吉阳上黎堡（今江西省吉安市），为庐陵房祖；其六世孙崇鼎，为永丰房系东宅祖，原居江西省吉安市永丰县睦陂迁到新干县玉笋乡；五十五派传孙曾应志从永丰县迁到福建省莆田市；五十六派孙曾通固，于明洪武五年，再迁广东省汕尾市陆丰县白藤坑村，后又迁到汕尾市海丰县沙港乡，为沙港开基祖；六十五派传孙曾国全衍惠东县铁冲镇好招楼村。 谱载插页、谱序、叙、郡望、堂号、宗圣祖训、家规、曾氏远祖、曾氏先祖、房系、编后语、功德芳名篇、古今人文篇、历代先贤、附录。,https://jiapu.library.sh.cn/https://jiapu.library.sh.cn/#/GenealogySummary:http://data.library.sh.cn/jp/resource/work/js0o5cl31xlbn1vi
曾氏族谱平和部分不分卷（台湾省台北市）,曾添福,曾,1932年,雍睦堂,平和始祖大一郎，諡瑞峰，元代人。臺灣始迁祖玉，字振聲，諡純賢，清代人。,https://jiapu.library.sh.cn/https://jiapu.library.sh.cn/#/GenealogySummary:http://data.library.sh.cn/jp/resource/work/gbj1bvba2otpwu7y
曾氏族谱屏东全台宗圣公祠六大户派下（台湾省/屏东县）,曾锦财,曾,1974,--,台湾始迁祖良辉、子嵩、健华等，皆清代人。,https://jiapu.library.sh.cn/https://jiapu.library.sh.cn/#/GenealogySummary:http://data.library.sh.cn/jp/resource/work/offfjaihpo5q5pny
曾氏族谱四卷首二卷（江西省）,曾有望,曾,清道光5年（1825）,鲁国堂,是族於元末自福建汀州府寧化縣遷居廣東惠州府長樂縣，明洪武十四年復遷興寧縣龍歸洞。始祖榮甫（名七郎），曾孫五十二世孫，明初人。明末清初，榮甫後裔陸續遷居江西袁州府，以居萬載者尤多。卷首上聖諭、奏牘、敕詔、諭祭、御贊、御詩，卷首下序、傳、贊、廟墓記、遺事、古蹟、家規、各派小引、修譜人名、領譜字號，卷一至四世系。缺卷三。,https://jiapu.library.sh.cn/https://jiapu.library.sh.cn/#/GenealogySummary:http://data.library.sh.cn/jp/resource/work/1torym34313tfuc6
曾氏族谱八卷首一卷（江西省）,曾有望,曾,清道光5年(1825),鲁国堂,此是万载部分曾氏之统宗谱，共奉宋末元初人天秩（名政）、天贞（名治）为祖。天秩、天贞自福建宁化县迁广东程乡县，其后裔于清初分别自广东镇平、平远、龙川等县迁来万载。卷首谱序、传、记、遗事、赞，卷一源流，卷二至八世系。书名据版心题。,https://jiapu.library.sh.cn/https://jiapu.library.sh.cn/#/GenealogySummary:http://data.library.sh.cn/jp/resource/work/vw5dukyyy3su5d4p
曾氏族谱二十卷首一卷(福建上杭),曾毓琳,曾,清道光27年(1847),--,參見清曾琮瑤修《[福建上杭]曾氏族譜》條目（館藏：1059086-091）。始祖敬（別號一元，行恩一），南宋時居福建寧化。生五子，長二八郎、次六四郎、三三十郎、四念三郎，由寧化遷居上杭勝運里，是為始遷祖。後裔散居閩、贛、粵、楚等地。卷首一序、聖諭、五服圖、凡例、家規、像圖、修譜名目、祠圖、墳圖，卷首二總源志、族譜總源，卷一至二十世系。,https://jiapu.library.sh.cn/https://jiapu.library.sh.cn/#/GenealogySummary:http://data.library.sh.cn/jp/resource/work/lw1gx3lfz357s2go
曾氏族谱二十六卷首二卷(福建上杭),曾纪寿;曾琮瑶,曾,清嘉慶13年(1808),忠恕堂,始祖敬（別號一元，行恩一），南宋時居福建寧化。生五子，長二八郎、次六四郎、三三十郎、四念三郎，由寧化遷居上杭勝運里，是為始遷祖。後裔散居閩、贛、粵、楚等地。卷首一聖諭、序、五服圖、凡例、家規、像圖里葬志、修譜名目、祠圖、墳圖、蒸嘗、題捐，卷首二總源志、族譜總源，卷一至二十六世系。,https://jiapu.library.sh.cn/https://jiapu.library.sh.cn/#/GenealogySummary:http://data.library.sh.cn/jp/resource/work/4fdmrohvondf2e4p
曾氏族谱丹阳运河殷台村宗圣堂版（江苏省/镇江市/丹阳市）,曾茂海,曾,2006,宗圣堂,明景泰年间（公元1456-1520年）殷塘曾姓族人普定沿大运河东迁到江苏省镇江市丹阳东门外的栅口谋生。约在公元17世纪后半叶（即清康熙年间中后期），第八世族人中才有一支到丹阳殷台村生息，并开拓了殷台村，始迁祖不详。 卷一宗圣堂堂联、二十世纪五十年代殷台村简图、先祖像、十五修族谱序、十五修族谱人名录、丹阳曾氏内纪世系一世至十五世、丹阳曾氏钧公派大一公房内纪世系， 卷二至卷八钧公派大一公九世孙内纪世系表，卷九宋徽宗敕曾布知润州命、曾姓一世祖曾子、丹阳曾姓一世祖曾布简介、殷台村史考略。,https://jiapu.library.sh.cn/https://jiapu.library.sh.cn/#/GenealogySummary:http://data.library.sh.cn/jp/resource/work/hn7671651ww7by64
曾氏族谱不分卷（台湾省台东县）,不详,曾,民國,--,臺灣始迁祖亮唯，諡純厚，清代人。记事至1938年。,https://jiapu.library.sh.cn/https://jiapu.library.sh.cn/#/GenealogySummary:http://data.library.sh.cn/jp/resource/work/skakuy1h82exc8ev
曾氏族谱不分卷（台湾省台北市）,不详,曾,清咸豐十一年（1861）,--,--,https://jiapu.library.sh.cn/https://jiapu.library.sh.cn/#/GenealogySummary:http://data.library.sh.cn/jp/resource/work/rsvuh2gm98fkcjk9
曾氏族谱不分卷（台湾省台中市）,不详,曾,民國,--,始祖延世，唐代人。支祖日禮，清代人。记事至1947年。,https://jiapu.library.sh.cn/https://jiapu.library.sh.cn/#/GenealogySummary:http://data.library.sh.cn/jp/resource/work/7tq3cpxnbkp7dwrl
曾氏族谱不分卷（台湾省台中市）,曾玉音,曾,清光緒六年（1880）,--,福建永定太平寨村始祖友益，號四五郎，元明之際人。臺灣始迁祖云觀、云匡等，清代人。,https://jiapu.library.sh.cn/https://jiapu.library.sh.cn/#/GenealogySummary:http://data.library.sh.cn/jp/resource/work/gqn3f5fgemq87kua
曾氏族谱不分卷（台湾省澎湖县）,不详,曾,1948年,--,始祖誥。书名自擬。,https://jiapu.library.sh.cn/https://jiapu.library.sh.cn/#/GenealogySummary:http://data.library.sh.cn/jp/resource/work/y645xen9sd1g8cf6
曾氏族谱不分卷（台湾省桃园县）,曾六郎,曾,1935年,--,始祖月，號明哲，清代人。,https://jiapu.library.sh.cn/https://jiapu.library.sh.cn/#/GenealogySummary:http://data.library.sh.cn/jp/resource/work/pqs49jgpggwnqbyl
曾氏族谱不分卷（台湾省南投县）,不详,曾,民國,--,始祖順，清代人。记事至1928年。,https://jiapu.library.sh.cn/https://jiapu.library.sh.cn/#/GenealogySummary:http://data.library.sh.cn/jp/resource/work/jg7teupfzg95j9ar
曾氏族谱不分卷（台湾省南投县）,曾三捷,曾,民國,--,臺灣始迁祖填，清代人。书名自擬。记事至1928年。,https://jiapu.library.sh.cn/https://jiapu.library.sh.cn/#/GenealogySummary:http://data.library.sh.cn/jp/resource/work/2r7xxltjvt8y622r
曾氏族谱不分卷（福建省龙岩市上杭县）,不详,曾,據1921年,--,始迁祖六十四郎。书名據书衣题。,https://jiapu.library.sh.cn/https://jiapu.library.sh.cn/#/GenealogySummary:http://data.library.sh.cn/jp/resource/work/zuasp74oe7vssjje
曾氏族谱不分卷（浙江省衢州市常山县）,符璋,曾,清嘉慶十六年（1811）,--,--,https://jiapu.library.sh.cn/https://jiapu.library.sh.cn/#/GenealogySummary:http://data.library.sh.cn/jp/resource/work/uxu3v81bal89f6ht
曾氏族谱不分卷（江西省）,曾明彰,曾,清宣統3年(1911),--,始祖儣新（又名成德、廣德、一軻），曾参五十四世孙，元末自福建寧化遷居廣東長樂，明洪武四年再遷廣東興寧。始遷祖十七世傳煃（原名廷煃，字允日），清康熙間自廣東長樂遷江西上猶廬陽隘左溪。譜載誥敕、遺訓、譜序、修譜條例、名目、墳圖案卷、讃、圖、世系。書名據版心題。,https://jiapu.library.sh.cn/https://jiapu.library.sh.cn/#/GenealogySummary:http://data.library.sh.cn/jp/resource/work/mv4mow8qjs5r67jt
曾氏族谱不分卷（四川省资阳市简阳市）,不详,曾,清,--,始祖廣淵，元代人。始迁祖秀璋，清乾隆间自廣東長樂縣迁居四川簡陽。书名自擬。记事至清咸豐二年，佚名墨筆增補至民國间。,https://jiapu.library.sh.cn/https://jiapu.library.sh.cn/#/GenealogySummary:http://data.library.sh.cn/jp/resource/work/wb5ku8ygzwh6a7xu
曾氏族谱不分卷(全国),曾毓墫,曾,清乾隆60年(1795),--,譜載曾氏源流世系，繁衍江西廬陵、吉揚、南豐，廣東龍川、和平等派。譜存誥敕、序、首事鴻名、條例、凡例、世系等。,https://jiapu.library.sh.cn/https://jiapu.library.sh.cn/#/GenealogySummary:http://data.library.sh.cn/jp/resource/work/bvq4hvu4vztw1pnn
曾氏族谱不分卷,不详,曾,清同治四年（1865）,--,始祖榮浦，汉代人。书名據书名页题。,https://jiapu.library.sh.cn/https://jiapu.library.sh.cn/#/GenealogySummary:http://data.library.sh.cn/jp/resource/work/dbkyc8739impfm6s
曾氏族谱不分卷,不详,曾,清嘉慶间,--,始祖據，字恒仁，汉代人。江西南豐派始迁祖畧，唐代人。廣東長樂縣始迁祖廣新，宋代人。谱存宗聖志、前敘、舊序、曾氏總图、山東武城世系總图、廣淵公、畧公派、三十郎傳下室公派世系源流。书名版心题。记事至清嘉慶十九年。,https://jiapu.library.sh.cn/https://jiapu.library.sh.cn/#/GenealogySummary:http://data.library.sh.cn/jp/resource/work/ujvenafnn5mn4bf5
曾氏族谱三省堂广西钦州市康熙岭镇板坪村有华公世系（广西壮族自治区/钦州市）,曾宪壹,曾,2018,三省堂,谱称是族系出广东遂溪曾氏，后分派石城（今廉江市）欧家村。先祖有华，清代居石城欧家村。其孙学林、学成兄弟二人于嘉庆元年携家迁广西钦州康熙岭板坪南村，是为始迁祖。 谱分八篇：篇一曾氏家族的源流、迁徙分布，篇二渊源始祖、世系代辈，篇三字辈、宗祠堂联、祖训家规，篇四曾氏名胜、李氏名人，篇五板坪南村、祖祠、祖墓，篇六世系，篇七杂学园地，篇八族亲赞记。,https://jiapu.library.sh.cn/https://jiapu.library.sh.cn/#/GenealogySummary:http://data.library.sh.cn/jp/resource/work/7s2l2k14627dyif7
