谱名,责任者,姓氏,撰修时间,堂号,家谱简介,详情链接
五云夏川李氏宗谱（浙江省丽水市缙云县）,不详,李,清同治七年（1868）,--,始祖僧護，字添佑，唐代人。後裔秫，字孟偘，號悦貳，行廉十四，宋代移居浙江桐廬塢門村。始遷祖美，字邦佳，行萬九，南宋寶祐間避亂改名紹，隱居婺州城（今金華市婺城區）石塘村，後又遷雲縣夏嘉畈村（今屬新川鄉）。存卷为系圖。存卷二。書名據版心题。,https://jiapu.library.sh.cn/https://jiapu.library.sh.cn/#/GenealogySummary:http://data.library.sh.cn/jp/resource/work/l1tgh7klkx263opi
五云夏川李氏宗谱十卷（浙江省丽水市缙云县）,李灿然,李,1938年,--,始祖僧護，字添佑，唐代人。後裔秫，字孟偘，號悦貳，行廉十四，宋代移居浙江桐廬塢門村。始遷祖美，字邦佳，行萬九，南宋寶祐間避亂改名紹，隱居婺州城（今金華市婺城區）石塘村，後又遷雲縣夏嘉畈村（今屬新川鄉）。卷一傅贊，卷二下世系圖，卷七、十行第。存卷一至三、七、十。書名據版心題。,https://jiapu.library.sh.cn/https://jiapu.library.sh.cn/#/GenealogySummary:http://data.library.sh.cn/jp/resource/work/npebbzky5nyh6mbr
五云周氏宗谱（浙江省丽水市缙云县）,不详,周,清同治七年（1868）,--,始祖兵，字廷信，北宋時宦居東陽縣玉峰村。始遷祖厨，字敦度，行進七，北宋元祐間自雲縣古樓村（今屬五雲鎮）遷居本邑臚膛村（今屬東方鎮）。卷二祠記、墓誌銘、傳贊、墓圖，卷三至六行第。 存卷二、三、五、六。譜初修於南宋景定三年，此为二十修本。,https://jiapu.library.sh.cn/https://jiapu.library.sh.cn/#/GenealogySummary:http://data.library.sh.cn/jp/resource/work/yvtq31kzl59hvavt
五云周氏宗谱（浙江省丽水市缙云县）,周南顿,周,清光緒三十四年（1908）,--,始祖兵，字廷信，北宋時宦居東陽縣玉峰村。始遷祖厨，字敦度，行進七，北宋元祐間自雲縣古樓村（今屬五雲鎮）遷居本邑臚膛村（今屬東方鎮）。卷二祠記、墓誌銘、傳贊、墓圖，卷三至六行第。 存卷二至六。二十二修本。,https://jiapu.library.sh.cn/https://jiapu.library.sh.cn/#/GenealogySummary:http://data.library.sh.cn/jp/resource/work/i5ntgk4jkzgmexv8
五云周氏宗谱（浙江省/丽水市/缙云县）,周显岳,周,2005,--,先祖行暹，后周显德年间，始居古楼。始祖兵（字廷信），五云周氏始祖，北宋开宝六年（973）仕东阳儒学教谕，遂居玉峰。本谱重修，以南顿、大溪滩、下东方二派合修，南顿始迁祖起（字伯清），明洪武壬申（1392）年，自古楼始居美化乡南顿；大溪滩始迁祖大敬，明万历甲辰（1604）年，从南顿迁居；下东方始迁祖乐主，明代从马鞍山迁居下东方。 谱载文集篇宗祠照片、修谱理事会合影、村景、全家福、遗像、凡例、谱序、大事记、历届谱序、传、赞、志、行略、简介、简历、杂记、约据、笔据、族裔概述、老年协会简况、赋、传说、村史、修桥小纪、坟图，世系篇外纪世系考证、转载旧谱外纪世系、内纪世系、行第篇世系行第、跋。,https://jiapu.library.sh.cn/https://jiapu.library.sh.cn/#/GenealogySummary:http://data.library.sh.cn/jp/resource/work/tagbt1wmzxhglsye
五云周氏宗谱（浙江省/丽水市/缙云县）,周日希,周,民国37年（1948）,--,谱称敦颐孙莹，北宋真宗咸平间拜相封武陵侯，赐郡武陵。莹玄孙衡，字德量，号心齐，行建九十四，两宋之际避乱，自诸暨迁居云章塘，卷一序文、宗支图、诰勅、传典、行传、家训、宗祠记、分徙居址图、排行、墓碑等，卷二世系图、墓图，卷三至六行传。 书名据目录、卷端题。,https://jiapu.library.sh.cn/https://jiapu.library.sh.cn/#/GenealogySummary:http://data.library.sh.cn/jp/resource/work/56mmrtin9pzzxs2d
五云周氏宗谱六卷（浙江省）,周灿元,周,民國17年(1928),--,參見清周金田清宣統元年修《[浙江縉雲]五雲周氏宗譜》條目（館藏：932045-49）。（始祖敦頤（字茂叔，號濂溪），北宋理學家。敦頤孫瑩（字子榮），北宋真宗咸平間拜相封武陵侯，賜郡武陵。始遷祖衡（字德量，號心齋，行建九十四），敦頤七世孫，瑩玄孫，兩宋之際避亂自浙江諸暨遷居縉雲章塘。）。卷二世系圖，卷三至六行第。存卷二至四、六。,https://jiapu.library.sh.cn/https://jiapu.library.sh.cn/#/GenealogySummary:http://data.library.sh.cn/jp/resource/work/s1hxmdgkx9dtamjr
五云周氏宗谱六卷（浙江省）,周金田,周,清宣統元年(1909),--,參見清周志靜修《[浙江縉雲]五雲周氏宗譜》條目（館藏號：1047661-664），館藏另有清光緒十三年、民國十七年和民國三十七年多個版本。（始祖敦頤（字茂叔，號濂溪），北宋理學家。敦頤孫瑩（字子榮），北宋真宗咸平間拜相封武陵侯，賜郡武陵。始遷祖衡（字德量，號心齋，行建九十四），敦頤七世孫，瑩玄孫，兩宋之際避亂自浙江諸暨遷居縉雲章塘。）。卷一譜序、宗支圖、恩典誥敕、統宗歷世簪纓、傳典、行傳、世訓、宗祠記、分徙居止圖、排行字母、墓碑、墓圖、案，卷二世系圖，卷三至六行第。缺卷五。,https://jiapu.library.sh.cn/https://jiapu.library.sh.cn/#/GenealogySummary:http://data.library.sh.cn/jp/resource/work/23knvurrat91d32q
五云周氏宗谱六卷（浙江省）,周连庚,周,清光緒13年(1887),--,參見清周志靜修《[浙江縉雲]五雲周氏宗譜》條目（館藏號：1047661-664），館藏另有清宣統元年、民國十七年和民國三十七年多個版本。（始祖敦頤（字茂叔，號濂溪），北宋理學家。敦頤孫瑩（字子榮），北宋真宗咸平間拜相封武陵侯，賜郡武陵。始遷祖衡（字德量，號心齋，行建九十四），敦頤七世孫，瑩玄孫，兩宋之際避亂自浙江諸暨遷居縉雲章塘。）。卷一譜序、宗支圖、恩典誥敕、統宗歷世簪纓、傳典、行傳、世訓、宗祠記、分徙居止圖、排行字母、墓碑、墓圖、案，卷二世系圖，卷三至六行第。缺卷六。,https://jiapu.library.sh.cn/https://jiapu.library.sh.cn/#/GenealogySummary:http://data.library.sh.cn/jp/resource/work/o64i5zm9qp2ss993
五云周氏宗谱六卷（浙江省丽水市缙云县）,周灿元,周,1928年,--,譜稱敦頤孫瑩，北宋真宗咸平間拜相封武陵侯，賜郡武陵。瑩玄孫衡，字德量，號心齊，行建九十四，兩宋之際避亂，自諸暨遷居雲章塘，書名據卷端題。,https://jiapu.library.sh.cn/https://jiapu.library.sh.cn/#/GenealogySummary:http://data.library.sh.cn/jp/resource/work/cc5u24auoftgro2h
五云周氏宗谱六卷（浙江省丽水市缙云县）,周金田,周,清宣統元年(1909),--,譜稱敦頤孫瑩，北宋真宗咸平間拜相封武陵侯，賜郡武陵。瑩玄孫衡，字德量，號心齊，行建九十四，兩宋之際避亂，自諸暨遷居雲章塘，卷一譜序、誥敕、行傳、宗祠記、分徙圖、墓圖等，卷二世系圖，卷三至六行第。 書名據目录題。,https://jiapu.library.sh.cn/https://jiapu.library.sh.cn/#/GenealogySummary:http://data.library.sh.cn/jp/resource/work/iwd1kkewhv7q1qqx
五云周氏宗谱八卷（浙江省丽水市缙云县）,周尚仁,周,1946年,--,始祖兵，字廷信，北宋時宦居東陽縣玉峰村。始遷祖厨，字敦度，行進七，北宋元祐間自雲縣古樓村（今屬五雲鎮）遷居本邑臚膛村（今屬東方鎮）。卷一为新舊序、制誥、譜例、家規、祠記、墓誌、助筆、祭約、傳贊、墳圖，卷二为世系支圖，卷三至八为行第。 書名據版心題。,https://jiapu.library.sh.cn/https://jiapu.library.sh.cn/#/GenealogySummary:http://data.library.sh.cn/jp/resource/work/9plts68dilymj1i6
五云周氏宗谱五卷（浙江省）,周志静;周志靜,周,清同治5年,--,始祖敦頤（字茂叔，號濂溪），北宋理學家。敦頤孫瑩（字子榮），北宋真宗咸平間拜相封武陵侯，賜郡武陵。始遷祖衡（字德量，號心齋，行建九十四），敦頤七世孫，瑩玄孫，兩宋之際避亂自浙江諸暨遷居縉雲章塘。卷一譜序、宗支圖、恩典誥敕、統宗歷世簪纓、傳典、行傳、世訓、宗祠記、分徙居止圖、排行字母、墓碑、墓圖、案，卷二世系圖，卷三至五行第。（館藏：1030821-822為此譜之複本殘卷，館藏另有清光緒十三年、清宣統元年、民國十七年和民國三十七年多個版本。）書名據目錄、卷二及卷三卷端題。,https://jiapu.library.sh.cn/https://jiapu.library.sh.cn/#/GenealogySummary:http://data.library.sh.cn/jp/resource/work/afkimucfm85xm5al
五云周氏宗谱七卷（浙江省丽水市缙云县）,不详,周,1925年,--,始祖兵，字廷信，北宋時宦居東陽縣玉峰村。始遷祖厨，字敦度，行進七，北宋元祐間自雲縣古樓村（今屬五雲鎮）遷居本邑臚膛村（今屬東方鎮）。卷一譜序、源流、譜例、家規、紳録、排行字、像圖、牌坊、墓誌，卷二世系圖，卷三至六行第，卷七傳、贊略、約。 存卷一、三至五、七。二十三修本。,https://jiapu.library.sh.cn/https://jiapu.library.sh.cn/#/GenealogySummary:http://data.library.sh.cn/jp/resource/work/vcpncrucia7kcuge
五云吕氏宗谱（浙江省/丽水市/缙云县）,吕关岳;吕喜恩,吕,2014,--,始祖好问（字舜徒），宋高宗南渡自河南洛阳徙居浙江婺州。始迁六世祖似之（字以诚，行万七），南宋嘉泰癸亥年生人，以恩补宣教郎温州永嘉尉，徙居浙江缙云北门登俊坊。 卷一祖像、祠庙图片、新序、旧序、谱谕、踪迹考、宗祠记、祠图、庙记、凡例、家规、家训、恩命，卷二仕宦录、谱册、历代谱长、世美录、墓志铭、传、家传、行传、简历，卷三行赞、寿考铭、广寺兹记、居址、坟域、坟山、祀田、裕后录、谱识、判决、后跋，卷四至十世系图、世表。,https://jiapu.library.sh.cn/https://jiapu.library.sh.cn/#/GenealogySummary:http://data.library.sh.cn/jp/resource/work/oqec69wyyqz3jm1x
五云吴氏宗谱（浙江省/丽水市/缙云县）,吴有新,吴,1999,--,始祖进，唐代人。始迁祖荣（字光宗，号心田）。,https://jiapu.library.sh.cn/https://jiapu.library.sh.cn/#/GenealogySummary:http://data.library.sh.cn/jp/resource/work/ki31tmunbyz4a9ug
五云古楼周氏宗谱一卷补一卷，纂修。（浙江省丽水市缙云县）,周立新;周德飞;周立新,周,1999年,--,始祖勃，西漢人。始遷祖行暹，後周顯德間遷居雲縣古樓村（今屬五雲鎮）。載譜序、地方要記、世珍（誥敕、墓誌、榮壽、桅杆、匾額、牌坊）、世範（名人、任紳，傳贊）、世粹（祠廟記、祠廟聯、遺作）、世居、世系、行第；補卷： 地方要記、領譜紀實、農業諺語、人生諺語、補遺、後語。書名據封簽題。譜初修於南宋景定二年，此为二十修本。,https://jiapu.library.sh.cn/https://jiapu.library.sh.cn/#/GenealogySummary:http://data.library.sh.cn/jp/resource/work/hhtxa3k51lni68xf
五云丛桂坊陈氏宗谱（浙江省/丽水市/缙云县）,陈清生;陈志坤,陈,1998,--,始祖翔（字凤翔，行福），五代人。始迁祖禾（字丰年，号石斋），约北宋庆历间自江苏金陵（今南京市）移居浙江缙云县邑城（今五云镇）丛桂坊。世系载至第三十四世“圣”字辈。 谱载文献篇、支图篇、行第篇。,https://jiapu.library.sh.cn/https://jiapu.library.sh.cn/#/GenealogySummary:http://data.library.sh.cn/jp/resource/work/tvr157vz2vvdnvu9
五云刘氏宗谱□□卷(浙江缙云),佚名,刘,民國30年(1941),--,劉學元修《[浙江縉雲]五雲劉氏宗譜》條目（館藏：1058213-215）。鼻祖翔，唐末五代初自京兆（今陝西西安）遷居福建崇安（今武夷山）五夫里。十一世麟（字瑞符），遷居婺州（今東陽）竹溪。十五世宗山，遷居麗水劉山。始遷祖炎（字盛之，號竹庵，行明五），宗山孫，宋末元初遷居縉雲榧川。存卷皆行第。,https://jiapu.library.sh.cn/https://jiapu.library.sh.cn/#/GenealogySummary:http://data.library.sh.cn/jp/resource/work/lrpldfgsbme2mrkk
五云刘氏宗谱□□卷(浙江缙云),刘学元,刘,民國36年(1947),--,鼻祖翔，唐末五代初自京兆（今陝西西安）遷居福建崇安（今武夷山）五夫里。十一世麟（字瑞符），遷居婺州（今東陽）竹溪。十五世宗山，遷居麗水劉山。始遷祖炎（字盛之，號竹庵，行明五），宗山孫，宋末元初遷居縉雲榧川。卷一誥封、建造宗祠記、修譜人名、墳山圖、約據，卷二世系，卷三行第。,https://jiapu.library.sh.cn/https://jiapu.library.sh.cn/#/GenealogySummary:http://data.library.sh.cn/jp/resource/work/2ntcwnhkt1vduqxa
五云刘氏族谱二卷（江西省吉安市万安县）,刘采辰,刘,1915年,承玉堂,始迁祖懋生，始居江西万安南坑，即今白加乡廓埠村南坑組。书名据书名页题。,https://jiapu.library.sh.cn/https://jiapu.library.sh.cn/#/GenealogySummary:http://data.library.sh.cn/jp/resource/work/ikat4nbc6qu33jzw
五云仙巖溪刘氏宗谱五卷（浙江省丽水市缙云县）（浙江省/丽水市/缙云县）,--,刘,1997,--,始迁祖师贡，字起泗，号栝峰，宋朝自括苍东门迁五云仙巖溪。 谱载新序、名人录、记乐助款、旧序、旧谱例、旧谱规、排行字母、庙图记、记类、新旧村图、山图、堂祠名、祀回丘段、坟图等，卷一至二贞节传、行传、源汉序、世系源流支图等，卷三至五为行第。,https://jiapu.library.sh.cn/https://jiapu.library.sh.cn/#/GenealogySummary:http://data.library.sh.cn/jp/resource/work/3fr86qx832lv7asn
五云东川徐氏宗谱（浙江省丽水市缙云县）,不详,徐,民國26年(1937),--,一世祖楷，行十六，宋末官處州青田县監税。九世孫紅，行太六十七，明代官礼部主事，致仕後游遨邑仙都，遂徙居於东方。存卷为外内紀世系图、墓图。存卷三。书名据版心、卷端题。,https://jiapu.library.sh.cn/https://jiapu.library.sh.cn/#/GenealogySummary:http://data.library.sh.cn/jp/resource/work/4vhqq2jj7nzsvu9k
五云世家蒙城赵氏宗谱十二卷(浙江缙云),赵登连,赵,民國17年(1928),--,參見清光緒十五年木活字本《五雲趙氏宗譜》條目。卷一序、凡例、藝文等，卷二誥敕、宦跡、儒林、方技、祠宇、產業等，卷三、四祠圖、村圖、墓志銘、傳贊、墓圖等，卷五系圖，餘卷存行第。,https://jiapu.library.sh.cn/https://jiapu.library.sh.cn/#/GenealogySummary:http://data.library.sh.cn/jp/resource/work/ujvhbk0kpyojkrcp
五云上湖徐氏宗谱四卷（浙江省丽水市缙云县）,徐蔼然;徐锡林;徐陈楷,徐,清光緒29年(1903),--,始祖讳晦，南宋初隱居於东海。十三世端肅，字敬恭，行百五者，咸淳進士，拜職不仕，徙居處州（今麗水）雲五都之玉巖大園、復轉徙五雲之上湖，是为上湖徐氏始迁之祖。後世或分黄龍、烏石、松溪、潘寻等地。卷一谱序、誥敕、凡例、家规、寿序、仕宦、德赞、行传、祠记，卷二至三行第，卷四外内系图、墓图祭田、祀田山場。存卷一、二、四。书名据版心题。,https://jiapu.library.sh.cn/https://jiapu.library.sh.cn/#/GenealogySummary:http://data.library.sh.cn/jp/resource/work/iec78bg2mffwf7iw
五云上湖徐氏宗谱五卷（浙江省丽水市缙云县）,徐慕祥,徐,1947年,--,始祖讳晦，南宋初隱居於东海。十三世端肅，字敬恭，行百五者，咸淳進士，拜職不仕，徙居處州（今麗水）雲五都之玉巖大園、復轉徙五雲之上湖，是为上湖徐氏始迁之祖。後世或分黄龍、烏石、松溪、潘寻等地。书名据版心题。,https://jiapu.library.sh.cn/https://jiapu.library.sh.cn/#/GenealogySummary:http://data.library.sh.cn/jp/resource/work/v8l926lkpqaehayf
五云上湖徐氏宗谱（浙江省/丽水市/缙云县）,徐翰忠,徐,1993,--,始祖晦，南宋初隐居于东海。十三世端肃（字敬恭，行百五者），咸淳进士，拜职不仕，徙居处州（今丽水）云五都之玉岩大园、复转徙五云之上湖，是为上湖徐氏始迁之祖。后世或分黄龙、乌石、松溪、潘寻等地。 卷一序、诰敕、凡例、家规、寿序、仕宦、封赠、祠记、祠录、大宗小宗图、祝文等，卷二外内系图、墓图、祭田，卷三至七行第。,https://jiapu.library.sh.cn/https://jiapu.library.sh.cn/#/GenealogySummary:http://data.library.sh.cn/jp/resource/work/8oua22qg7ke3f245
五云上湖徐氏宗谱五卷(浙江缙云),徐慕祥;徐瑞溪,徐,民國16年(1927),--,參見清徐錫林修《[浙江縉雲]五雲上湖徐氏宗譜》條目（館藏：955252-254）。（徐氏始祖晦，南宋初隱居於東海。始遷祖十三世端肅（字敬恭，行百五），南宋咸淳間遷居處州（今麗水）縉雲五都玉巖大園，轉徙五雲上湖。存卷為譜序、誥敕、凡例、家規、仕宦錄、行傳、宗祠記、宗祠錄、大宗小宗圖。,https://jiapu.library.sh.cn/https://jiapu.library.sh.cn/#/GenealogySummary:http://data.library.sh.cn/jp/resource/work/50dbukvodyyte42w
五云三溪吴氏重修宗谱（浙江省丽水市缙云县）,不详,吴,清道光20年(1840),--,始迁祖椅，字叔竒，行百六三。南宋时自仙居厚仁迁居雲鶴林。卷三行第，卷五至六列传、祭文、学田、诗等。存卷三、五、六。,https://jiapu.library.sh.cn/https://jiapu.library.sh.cn/#/GenealogySummary:http://data.library.sh.cn/jp/resource/work/2iy963kyzfyjgg28
五云三溪吴氏重修宗谱（浙江省丽水市缙云县）,吴式真,吴,清光緒33年(1907),--,始迁祖椅，字叔竒，行百六三。南宋时自仙居厚仁迁居雲鶴林。卷一耆壽录，卷二传记、禁约，卷四至六行第。存卷一、二、四、六。书名据卷端题。,https://jiapu.library.sh.cn/https://jiapu.library.sh.cn/#/GenealogySummary:http://data.library.sh.cn/jp/resource/work/o8l53njhsdhvt153
五云三溪吴氏重修宗谱（浙江省丽水市缙云县）,不详,吴,清同治8年(1869),--,始迁祖椅，字叔竒，行百六三。南宋时自仙居厚仁迁居雲鶴林。存卷载传记。存卷五。书名据卷端题。,https://jiapu.library.sh.cn/https://jiapu.library.sh.cn/#/GenealogySummary:http://data.library.sh.cn/jp/resource/work/3j8mzwgnjcy94jqf
五云丁氏宗谱（浙江省丽水市缙云县）,不详,丁,1947年,--,始遷祖洙，世居天台温嶺，南宋初官江西轉運副使，任滿還鄉，路過雲，愛其山水民情，遂置産立業，築室邑之翠微山下而居。書名據版心題。,https://jiapu.library.sh.cn/https://jiapu.library.sh.cn/#/GenealogySummary:http://data.library.sh.cn/jp/resource/work/pkfghfaamn74f1g8
五云丁氏宗谱（浙江省丽水市缙云县）,不详,丁,清宣統元年(1909),--,始遷祖洙，世居天台温嶺，南宋初官江西轉運副使，任滿還鄉，路過雲，愛其山水民情，遂置産立業，築室邑之翠微山下而居。卷二外紀系圖、内紀系圖，卷三至八均爲行第。存卷二、三、八。書名據版心題。,https://jiapu.library.sh.cn/https://jiapu.library.sh.cn/#/GenealogySummary:http://data.library.sh.cn/jp/resource/work/mne6tm45spjob9tc
五里埔王氏史志（略）（福建省/泉州市/安溪县）,王登刚,王,1998,双鲤堂,始迁祖廷臣，清乾隆二十七年由福建泉州府迁徙至清溪县，定居于五里埔（今属福建省泉州市安溪县官桥镇恒美村）。 谱载祖像、序文、昭穆排行、地名小考、世系表。,https://jiapu.library.sh.cn/https://jiapu.library.sh.cn/#/GenealogySummary:http://data.library.sh.cn/jp/resource/work/cpmqkdcz7sz2x3uq
五里刘氏宗谱（浙江省衢州市常山县）,不详,刘,清,永思堂,始迁祖仁德，字天宇，又字威明，行四，明初自三衢郡城菱角塘徙居定阳（位於今常山东南）白馬山五里乡。存卷为世系。存卷二。书名据版心、卷端题。记事至清道光间。,https://jiapu.library.sh.cn/https://jiapu.library.sh.cn/#/GenealogySummary:http://data.library.sh.cn/jp/resource/work/silgoijwkydryxb7
五里刘氏宗谱（浙江省衢州市常山县）,不详,刘,清,敬爱堂,始迁祖仁德，字天宇，又字威明，行四，明初自三衢郡城菱角塘徙居定阳（位於今常山东南）白馬山五里乡。存卷为行传。存卷三。书名据版心题。记事至清咸豐间。,https://jiapu.library.sh.cn/https://jiapu.library.sh.cn/#/GenealogySummary:http://data.library.sh.cn/jp/resource/work/ldiolmvjeyne3jc5
五里刘氏宗谱八卷（浙江省衢州市常山县）,刘光宗,刘,1938年,--,始祖章，字季高，南宋人。始迁祖仁德，字天宇，又字威明，行仁九，明洪武十八年自西安县（今衢州市衢江區）菱角塘村迁居常山县五里村（今屬五里乡）。卷一谱序、凡例、目次、修谱任事名單、祠图、排行字、規訓、祭祀，卷二像赞、墓表、墓图，卷三至八世系图。书名据书签、书名页题。谱初修於清順治十年，此为五修本。,https://jiapu.library.sh.cn/https://jiapu.library.sh.cn/#/GenealogySummary:http://data.library.sh.cn/jp/resource/work/xk4gwed2gaai7s9s
五里刘氏世谱不分卷（浙江省衢州市常山县）,刘光宗,刘,1932年,--,始祖章，字季高，南宋人。始迁祖順臺，字長運，行文十一，清雍正八年自常山县五里村（今屬五里乡）迁居本邑古县畈村（今屬招贤镇）。谱载谱序、凡例、修谱任事名單、家規、像赞、世系图。谱初修於清乾隆八年，此为七修本。,https://jiapu.library.sh.cn/https://jiapu.library.sh.cn/#/GenealogySummary:http://data.library.sh.cn/jp/resource/work/o7nb7pd1y2sa9g91
五乡碶傅氏贞西头份头忠和安三房支谱不分卷(浙江宁波),傅庆恒,傅,2013年,--,參見傅豐炎修《[浙江寧波]傅氏支譜》條目（館藏：JP350，JP350-1）。鼻祖恩齋，北宋末遷浙江鄞東鑒橋（今寧波市中山廣場東南一帶）。始祖仲一，南宋遷居傅家堍，傳至茂二，攜子祥二遷居五鄉碶。祥二生四子，分啟元、亨、利、貞四房。貞房恩有孫二，分啟東西二房，珍即貞西房祖。是為珍後裔和房瑞棠、安房裕棠、忠房慶藩三房後裔合修。譜載前言、譜世沿革、遺像、族譜、紀念文章、紀念照片、集體照、三房發譜大會留念、編後言。,https://jiapu.library.sh.cn/https://jiapu.library.sh.cn/#/GenealogySummary:http://data.library.sh.cn/jp/resource/work/he52vj1yg8cbyxvq
五都钱氏宗谱（浙江省金华市兰溪市）,不详,钱,清,--,始祖鏐。十四世行千三者自浦江徙居蘭谿靈泉鄉大塘里，二十世道再遷上潘，道又五傳曰仲謙，行淳四，明代復由上潘移家五都。存卷爲世表、世傳。存卷三、五。書名據版心題。記事至清乾隆間。,https://jiapu.library.sh.cn/https://jiapu.library.sh.cn/#/GenealogySummary:http://data.library.sh.cn/jp/resource/work/fdyxh8gb515w91gq
五都钱氏宗谱（浙江省金华市兰溪市）,不详,钱,清,--,十三世祖柔中，字剛叔，南宋時由浦陽遷金華赤松鄉建昌里白泉溪上，爲始遷祖。存卷二至六。書名據版心題。記事至清嘉慶間。,https://jiapu.library.sh.cn/https://jiapu.library.sh.cn/#/GenealogySummary:http://data.library.sh.cn/jp/resource/work/ya94resddqwlcpgs
五都钱氏宗谱（浙江省/金华市/婺城区）,钱福牛,钱,2013,敦睦堂,始迁祖钱仲谦，明朝年间，由浙江省金华市金东区上潘村，迁到浙江省金华市婺城区五都钱村。 卷二年表、传赞、碑文、人物简介、作品选登、布告、统计档案、像赞、墓图、行传、,https://jiapu.library.sh.cn/https://jiapu.library.sh.cn/#/GenealogySummary:http://data.library.sh.cn/jp/resource/work/tzmrlap2bk8uer28
五都钱氏宗谱□□卷(浙江兰谿),佚名,钱,清,--,始祖鏐。十四世行千三者自浦江徙居蘭谿靈泉鄉大塘里，二十世道再遷上潘，道又五傳曰仲謙（行淳四），明代復由上潘移家五都。存卷為世表、行傳。,https://jiapu.library.sh.cn/https://jiapu.library.sh.cn/#/GenealogySummary:http://data.library.sh.cn/jp/resource/work/fgz4kd06pwrlevn1
五部郑氏四修房谱六卷首一卷（浙江省台州市黄岩区）,王召棠,郑,1928年,--,始祖回，唐代人。始遷祖恩榮，字載冕，號神軒，北宋治平間自仙居縣南谿村（今屬雲縣南谿鄉）遷居黄巖縣五部村鄭家嶴（今屬寧谿鎮）。卷首譜序，卷一世系圖，卷二至三世系傳，卷四行第表、遷居他處表，卷五祀産，卷六藝文。書名據卷端題。譜初修於清乾隆間。,https://jiapu.library.sh.cn/https://jiapu.library.sh.cn/#/GenealogySummary:http://data.library.sh.cn/jp/resource/work/c552d16ni9x7li76
五华（长乐）开基祖黄氏族谱（台湾省/苗栗县）,黄庆铨,黄,1972,--,太始祖宋代人僚，字良臣。始祖伯伍郎。台湾始迁祖梅怡，清代人。,https://jiapu.library.sh.cn/https://jiapu.library.sh.cn/#/GenealogySummary:http://data.library.sh.cn/jp/resource/work/jwleanj5lblw1d16
