谱名,责任者,姓氏,撰修时间,堂号,家谱简介,详情链接
马氏族谱（四川省/凉山彝族自治州/会东县）,马洪勇,马,2013,--,始迁祖仕钊，清代由贵州遵义府治东隅里二甲马家塆迁四川建南道宁远府会理洲洼乌司火山老屋（今属四川凉山会东县）。 谱载前言、序、新增字辈、族规家法做人准则、马氏家族的经济和文化状况、马氏家族的称呼、姓氏来源、祖先起源、几次的大迁徙、各代人员的基本简历、各代人员的发展情况、各代人员的妻儿名单、家族商议会议人员、尾语、后记、马氏家族通讯录。,https://jiapu.library.sh.cn/https://jiapu.library.sh.cn/#/GenealogySummary:http://data.library.sh.cn/jp/resource/work/gsfkxlpftrek875q
马氏族谱马家屯马氏支族谱（山东省/青岛市/即墨区）,马克琳;马克金,马,2012,食德堂,始迁祖道亨，明永乐二年自云南迁至即墨南乡金家岭疃（今属山东省青岛市崂山区）。八世支祖永乐，清顺治年间迁马家屯（今属青岛市即墨区）。 谱载序、分迁辈分人才情况、世系表、后序。,https://jiapu.library.sh.cn/https://jiapu.library.sh.cn/#/GenealogySummary:http://data.library.sh.cn/jp/resource/work/c87tyikcssx4oltu
马氏族谱续修志（山东省/青岛市/即墨区）,马岢先;马术先,马,2010,--,始迁祖子贤，约明代从山东即墨城北栗行村搬到楼子疃村，后迁至柘车河村。 谱载谱序、增修谱序、叙史、续修人名单、命名定式、世系表、捐资名单。,https://jiapu.library.sh.cn/https://jiapu.library.sh.cn/#/GenealogySummary:http://data.library.sh.cn/jp/resource/work/63i75en2x2sgngvk
马氏族谱禄部（河北省/沧州市/沧县）,等;马革新,马,2014,--,该族大明永乐二年自山西洪洞县双柳树迁至盐山县城东北大庄。六世长分祖梁，居盐山县大庄；二分祖柱，由盐山县大庄迁居沧州城东南虎皮马庄；三分祖栋，置买马厂庄田居住。八世支祖文成（字四海），由土台迁居穆官屯村。九世德良，迁居上河崖。十一世兆雄（字太占），迁居自来屯，是为始迁祖。此谱为仁派二支次分。 谱载序言、修续族谱说明、续修人员名单、世系、行传。,https://jiapu.library.sh.cn/https://jiapu.library.sh.cn/#/GenealogySummary:http://data.library.sh.cn/jp/resource/work/3svnwjikqzn6nafp
马氏族谱旺公支系（河北省/沧州市/东光县）,马希春;马茂才,马,2017,--,始迁祖襄，原名李骧，明永乐二年自山东即墨乌龙河村迁河北东光县城东大李家村（后改称前生村），为避原籍丁地税，遂依“骧”之故改名马襄。襄生三子，各院各续谱书，三子旺，居东院，本谱为东院旺公支谱。 谱载序、字派、待续组委、世系、家训、编后。,https://jiapu.library.sh.cn/https://jiapu.library.sh.cn/#/GenealogySummary:http://data.library.sh.cn/jp/resource/work/3p2u7v5uh4ndxdxo
马氏族谱扶风马氏龙溪一脉合修（湖南省/郴州市/安仁县）,马纯良,马,2017,扶风堂,始祖殷（字霸图）。始迁祖八世禁暹，宋代自湖南长沙迁湖南安仁龙溪塘。 总卷上前言、大事记、世系考、序、跋、凡例、文献选、跋选、谱图法录、执事人员名列、捐资芳名，总卷下行次、本源图、衣冠图、导言、婚事文书、家训家规、五服图、名人传与名人录、人物传、谱诗文选、后记，卷一第一集图、墓地、自然村落、族谱凡例、前言、序、跋、赞、编后语、后记，卷一第二集至卷一第六集世系、齿录，卷一第七集历届衣冠录图、家规家训、艺文集。,https://jiapu.library.sh.cn/https://jiapu.library.sh.cn/#/GenealogySummary:http://data.library.sh.cn/jp/resource/work/ncx9ba39usomi8fw
马氏族谱十四卷(湖南澧县江西安福),马运熙,马,清光绪28年(1902),扶风堂,始迁祖大郎、二郎，元末由江西南昌县沙泥坝柳洲保迁湖南澧县枫林树马公湖马家山。七世孙思恭，明代继徙马家垣、马家峪，终卜马家港，居圈门湾，生伯泰、伯洪二子。伯泰又生珠、玟、珷、琼、环、琦六子；伯洪又生琇。其中玟、珷二房失纪；珠之孙文昇，明末又迁江西安福县佘市桥十一都。此乃珠、琼、环、琦、琇五房合谱，修於江西安福。卷一谱例、修谱诏、祖训、古训、家规、捐款名目、公务章程、服制图、祠堂图记、祠基界、茔图，卷二长房支序、种马山记、纪、传、赞、志、庭训实录、缙绅合传、理事名目、领谱字号、世派、前八世世系图世次表，卷三至十四图纪（世系）。,https://jiapu.library.sh.cn/https://jiapu.library.sh.cn/#/GenealogySummary:http://data.library.sh.cn/jp/resource/work/jq7ueyhs3vfj8f4o
马氏族谱十卷首一卷末一卷（江西省吉安市万安县）,不详,司马,1937年,河内堂,始祖禄，晉明帝時奉敕守晉安郡，因家晉安。裔孫萬寵，仕居高平。後裔散居贛、粤兩地。清初，族裔約有數十支始來萬。書名據版心題。,https://jiapu.library.sh.cn/https://jiapu.library.sh.cn/#/GenealogySummary:http://data.library.sh.cn/jp/resource/work/9dh88vwr84s94d5h
马氏族谱六卷首二卷（湖南省）,马烈鼎,马,民國三十二年(1943),伏波堂,始迁祖登科、登瀛、登俊，原籍湖北蒲圻县吉阳乡怀义里詹家坪，于清康熙年间迁来湖南，登科居澧县西之龙家洞，其地后称马家山；登瀛居石门县水浸垭；登俊居石门李家峪。卷首谱序、传、赞、凡例、派序、祠堂图、茔图，卷一至六世系表。书名据版心、书衣、书名页题。,https://jiapu.library.sh.cn/https://jiapu.library.sh.cn/#/GenealogySummary:http://data.library.sh.cn/jp/resource/work/6gt4ehwyicw2v531
马氏族谱——资阳慈相寺马旺阳系（四川省/资阳市）,马登敏,马,1994,--,该族明代从湖北麻城孝感乡迁居四川。本谱记载旺阳后裔四川资阳慈相寺支系。 谱载编辑说明、名人语录、排行对照表、关于马旺阳之后、慈相马氏族谱男性人口统计表、侯家坪系统、世系、附录。,https://jiapu.library.sh.cn/https://jiapu.library.sh.cn/#/GenealogySummary:http://data.library.sh.cn/jp/resource/work/dkpk2n3b3mc4q3e8
马氏族谱——河北省南皮县马四拨村（河北省/沧州市/南皮县）,马德声,马,2014,--,始祖德胜，明永乐二年由山东寿光县东社马家寨（今牛头镇）从龙北迁至燕京，因功封为世袭千户，宅天津，公田名马邑升屯（今四拨），始迁祖四世永清，特授南邑（河北南皮）千户，传至十世云升，因大清定鼎，千户告终。天津谱失迷，世系无考，暂续长门谱图。八世钦，子二，分居为长分二分。 卷五修谱成员、题字、照片、序、祖茔、碑记、家训、称呼、寿星榜、人物简介、字辈谱、世系图。,https://jiapu.library.sh.cn/https://jiapu.library.sh.cn/#/GenealogySummary:http://data.library.sh.cn/jp/resource/work/teghjgqk51jx4oh4
马氏支谱（山东省/青岛市/即墨区）,马克敏,马,1992,思先堂,始迁祖道亨，明永乐二年自云南徙居即墨北邑。七世永乐，清顺治年间迁马家屯（今属山东省青岛市即墨区）。 谱载前言、支谱引和跋、命名定式、世系图、世表。,https://jiapu.library.sh.cn/https://jiapu.library.sh.cn/#/GenealogySummary:http://data.library.sh.cn/jp/resource/work/llyjdda7zxtvd34c
马氏支谱（山东省/青岛市/即墨区）,马克熠,马,2006,--,始迁祖道亨，明永乐二年自云南徙居墨邑南金家岭疃（今属山东省青岛市崂山区）。八世祖永立，清顺治年间迁马家屯（今属山东省青岛市即墨区）。 谱载谱序、命名定式、世系图、世表、跋。,https://jiapu.library.sh.cn/https://jiapu.library.sh.cn/#/GenealogySummary:http://data.library.sh.cn/jp/resource/work/zx8ifgqmocc5x9wu
马氏支谱（山东省/潍坊市/青州市）,马明鑫,马,2002,--,始祖克明，清朝居武定府商河县马家庵（现山东省济南市商河县殷巷镇马庵村）。 谱载谱序、世系、后记。,https://jiapu.library.sh.cn/https://jiapu.library.sh.cn/#/GenealogySummary:http://data.library.sh.cn/jp/resource/work/jdivxrm8idtfz3m3
马氏志（湖北省/仙桃市）,马成林,马,2000,绎帐堂,始迁祖孝暹，元朝自江西南昌府（古称豫章）南昌县洗马池迁居今湖北仙桃市剅河镇马脑村一组。 卷载凡例、索引、总叙、分房、分片迁徙志、马氏源流考、大氏考、马氏宗谱、马氏名人录、家风赞、历次谱序及历史资料选载、马氏公约、族人通讯录。,https://jiapu.library.sh.cn/https://jiapu.library.sh.cn/#/GenealogySummary:http://data.library.sh.cn/jp/resource/work/a78se7xz9b3uvlye
马氏复修族谱十三卷首一卷(湖南新化),马曜;马祖启;马中骥,马,清同治10年(1871),--,始遷祖成龍（字雲卿），元末自山東濟南歷城遷居湖南新化長鄄。長子添麒遷新化枧田，次子添麟，留居長鄄。後裔散居新化、湘鄉、邵陽、寧鄉等地。卷首序、旌表節孝錄、墓誌、家廟圖、五服圖、分別大宗小宗圖、凡例、家訓、簪纓錄、頖璧錄、首事人、墳山圖、頒譜字號、本源圖，卷一至十三世系。（館藏：1024661-666、1024667系此譜之五修本）,https://jiapu.library.sh.cn/https://jiapu.library.sh.cn/#/GenealogySummary:http://data.library.sh.cn/jp/resource/work/g12txvbx3rjb8o38
马氏廉使祖系族谱（广东省/汕头市/潮阳区）,马氏大宗祠理事会,马,--,--,始迁祖廉使，南宋人。,https://jiapu.library.sh.cn/https://jiapu.library.sh.cn/#/GenealogySummary:http://data.library.sh.cn/jp/resource/work/ox29loy1ya1npmyz
马氏家谱（陕西省/咸阳市/长武县）,等;马润身,马,1990,--,始迁祖来安，明代人。,https://jiapu.library.sh.cn/https://jiapu.library.sh.cn/#/GenealogySummary:http://data.library.sh.cn/jp/resource/work/fp4x6pwjrozs6mos
马氏家谱（贵州省/黔东南苗族侗族自治州/榕江县）,马云有;等,马,2015,--,始迁祖星槐，清康熙三十二年由江西迁贵州榕江。 谱载前言、历史简介、名人风水、诗曰、六讲、字派、字派说明、字派二十字解释、排名榜宜、世系、分房的、点形房份说明、附。,https://jiapu.library.sh.cn/https://jiapu.library.sh.cn/#/GenealogySummary:http://data.library.sh.cn/jp/resource/work/ae96vainwnwoqxmj
马氏家谱（瓦子坪支系）（重庆市/重庆市/巫山县）,马清白,马,2008,--,始迁祖相甫、相臣、相寄、相玉弟兄四人，清康熙年间举家由湖广麻城孝感洗脚河入川，落户巫山县大昌马家镇。相寄配当地陈氏为发妻，复迁至今奉节县石岗乡瓦子坪定居，其余三位娶室立业，无嗣传代。相寄一脉至今发展至第十三代“家”字辈，延至竹元镇、红土乡、永安镇、巫溪县等地，老昙花乡（改制后的石岗乡），成为马氏瓦子坪家族发源地和密集区。 谱载溯源、世系、墓碑、传•寄、记事五章节，记述自相寄兄弟入川以来瓦子坪马氏分支的传承与演变情况。,https://jiapu.library.sh.cn/https://jiapu.library.sh.cn/#/GenealogySummary:http://data.library.sh.cn/jp/resource/work/kqqnvbpi59mfmv3g
马氏家谱（河南省/郑州市）,等;马世太,马,1998,--,谱奉明代人兴（行一）、旺（行二）为一世祖。始迁祖有亮、有芳，明代人。,https://jiapu.library.sh.cn/https://jiapu.library.sh.cn/#/GenealogySummary:http://data.library.sh.cn/jp/resource/work/3vwibtmjk3yngxax
马氏家谱（河南省/郑州市/新密市）,马羊群,马,2015,扶风堂,始祖成，明洪武九年（1377年）由山西洪洞大槐树迁至河南密邑（今新密市）。 谱载马氏家谱长门、马氏家谱二门、马氏家谱三门、马氏家谱四门、马氏家谱五门。,https://jiapu.library.sh.cn/https://jiapu.library.sh.cn/#/GenealogySummary:http://data.library.sh.cn/jp/resource/work/3oaavb63c5gjohhh
马氏家谱（河南省/洛阳市/洛宁县）,马松杰;马汉杰,马,1995,--,马氏祖籍陕西扶风。始迁祖亨，明初迁居洛宁县杨坡村，派分南北两门。族人分居于杨坡、周村、梁凹等村。是为北门谱。,https://jiapu.library.sh.cn/https://jiapu.library.sh.cn/#/GenealogySummary:http://data.library.sh.cn/jp/resource/work/v8n4k9hquwpob2sm
马氏家谱（河南省/洛阳市/汝阳县）,马文生,马,2014,--,马氏家族迁入汝阳马坡村已逾千年。长先祖（腾海之大哥）迁汝阳县小店乡小店村和赵村。 谱载马坡马氏字辈谱、马坡马氏先族五门支图表、马氏家族世系表、备用增修谱、附录、后记。,https://jiapu.library.sh.cn/https://jiapu.library.sh.cn/#/GenealogySummary:http://data.library.sh.cn/jp/resource/work/wf9syo94xch3dqqj
马氏家谱（河南省/南阳市/唐河县）,马银廷,马,2015,--,唐河县马岗马氏一宗，系明洪武二年从山西省洪洞迁入。祖良公兄弟四人从洪洞迁出，老大文公迁居鹤壁百乐树，老二兴公迁居新野潦口村，老三旺公迁居鹤壁马家村，老四良公迁居唐河西南60里马岗村。 谱载槐乡洪洞、帝都南阳、风俗礼仪、马氏祖源、马氏世系、马氏家训、马氏历史名人录、各地现存马氏家谱等。,https://jiapu.library.sh.cn/https://jiapu.library.sh.cn/#/GenealogySummary:http://data.library.sh.cn/jp/resource/work/3rc6nqmhv7cex625
马氏家谱（河北省/沧州市/肃宁县）,马芳,马,2009,--,该族明永乐二年由河北省沧州市献县西城镇迁河北省沧州市肃宁县万里镇马家庄。（一至九世失考） 谱载序言、谱字辈、世系、后记。,https://jiapu.library.sh.cn/https://jiapu.library.sh.cn/#/GenealogySummary:http://data.library.sh.cn/jp/resource/work/j1divqwn2i7a3v5t
马氏家谱（河北省/沧州市/河间市）,马万尚;等,马,2015,--,始迁祖原，明永乐二年由山西马邑县临城村迁居河北省河间市。 谱载序、目录、世系。,https://jiapu.library.sh.cn/https://jiapu.library.sh.cn/#/GenealogySummary:http://data.library.sh.cn/jp/resource/work/wusxhy27aemqdb3b
马氏家谱（河北省/沧州市/东光县）,马万林;马长岩,马,2020,--,始迁祖德昭，元代迁居河北东光马祠堂。 谱载编撰者、出资人、俚言、序、七律、碑记、祠堂联、世系。,https://jiapu.library.sh.cn/https://jiapu.library.sh.cn/#/GenealogySummary:http://data.library.sh.cn/jp/resource/work/nb1tw9h1ie971o2s
马氏家谱（河北省/沧州市/南皮县）,马凤良,马,2015,--,始迁祖辉生，明朝由山东即墨县迁居河北南皮县寨子镇大马村。 谱载谱序、墓图、祭田、字辈、世系图、世表。,https://jiapu.library.sh.cn/https://jiapu.library.sh.cn/#/GenealogySummary:http://data.library.sh.cn/jp/resource/work/958q947s9l9tngo9
马氏家谱（河北省/廊坊市/大城县）,马万尚;马树范,马,2014,--,始迁祖原，原籍山西朔州大同府马邑县临城村，明永乐二年迁河北大城白马堂村。 上卷谱序、世系、行传，下卷世系、行传。,https://jiapu.library.sh.cn/https://jiapu.library.sh.cn/#/GenealogySummary:http://data.library.sh.cn/jp/resource/work/quucnacvx7zbxav1
马氏家谱（山西省/长治市/襄垣县）,马忠书;马晋平;马庆平,马,2015,--,远祖援（字文渊），扶风茂陵（今陕西兴平）人，东汉初期的著名将帅，开国元勋，振兴马九姓的第一名人。他为马姓的南迁做出了世大贡献。 始迁祖广□（广字辈），明洪武二年从陕西同州府朝邑县迁来山西襄垣祝家岭。洞上村从留存的家谱记明八世朝字辈前考证：广纬友英文，廷子朝孟毓，字辈排序，所以始迁祖是广字辈。 谱载卷一，前言、续谱启事、筹委会成员名册、主编简介、编者按语，卷二始祖赵奢像、宗祖马援将军像、祠、墓图（陕西）筹委会成员个人照、成员集体照、成员简介，卷三谱序、凡例、宗族渊源、姓氏概论、姓氏渊源、马姓远古族源、始祖赵奢、本宗马援及家族、伏波史话，卷四世系序，卷五家族文化、宗族家风、诗文、格言，后记、附祭祖文。,https://jiapu.library.sh.cn/https://jiapu.library.sh.cn/#/GenealogySummary:http://data.library.sh.cn/jp/resource/work/yy1td6hpea9mus39
马氏家谱（山西省/朔州市/应县）,--,马,1989,--,始迁祖友成，明代人。,https://jiapu.library.sh.cn/https://jiapu.library.sh.cn/#/GenealogySummary:http://data.library.sh.cn/jp/resource/work/qyzxaxugl6dua4h9
马氏家谱（山西省/忻州市/忻府区）,马先海,马,1994,--,始迁祖束海，明朝时从朔州马邑乡（今山西省朔州市朔城区东北）徙至忻州九原乡（今山西省忻州市忻府区九原街街道）乔村。 谱载目录、序言、人物传略、革命烈士、世系。,https://jiapu.library.sh.cn/https://jiapu.library.sh.cn/#/GenealogySummary:http://data.library.sh.cn/jp/resource/work/vqxumqlmj2wzs9ms
马氏家谱（山东省/菏泽市/鄄城县）,马体道,马,1981,--,始祖良甫，世居山西洪洞县西北三十五里马家屯。长子飞兴（字翔鸣），明初仕宦山东青州。生八子，次子志宝于永乐间奉母命定居鄄城马油坊，是为始迁祖。生子九：长琴（字大棋）、次瑟（字方泽）、三幸（字大仲）、四大方（字元泽）、五柱（字大弼）、六且赏（字大恭）、七尚忠（字大仁，号厚泽）、八梅（字大魁）、九臣（字大顺），分启九支，分徙四周。今族裔散居山东鄄城、菏泽、曹县、郓城、河南濮阳等地。 卷一凡例、前序、马氏族谱略序、旧修首事人名、新序、新修首事人名、支谱序、世系，卷二至十三各支谱序、世系。,https://jiapu.library.sh.cn/https://jiapu.library.sh.cn/#/GenealogySummary:http://data.library.sh.cn/jp/resource/work/fwidcvy7zs6e2d3r
马氏家谱（山东省/菏泽市/鄄城县）,马瑞本,马,1953,--,始迁祖志宝，明代自山西洪洞县迁山东甄城县。 谱载凡例、字辈、谱序、世系。,https://jiapu.library.sh.cn/https://jiapu.library.sh.cn/#/GenealogySummary:http://data.library.sh.cn/jp/resource/work/1edvif46xlah7b3k
马氏家谱（山东省/菏泽市/鄄城县）,等;马瑞本,马,1998,--,始祖飞兴，原籍山西洪洞马家屯，明代仕宦青州，居益都县矮槐村。始迁祖次子志宝，迁居濮州（今山东鄄城县）东南马油房。志宝子琴、瑟、幸、大方、柱、且赏、尚忠、梅臣派分九房。 一支卷一凡例、立身八纲、歌谣、传略、序、附注、首事人名、迁居情况表、世系表，二支卷一至九支卷一序、世系表。,https://jiapu.library.sh.cn/https://jiapu.library.sh.cn/#/GenealogySummary:http://data.library.sh.cn/jp/resource/work/a4meruo3laks9umw
马氏家谱（山东省/泰安市）,马善瀛,马,2014,--,始迁祖兴，明隆庆间与弟福自山西洪洞迁山东长清县（今济南市长清区）马家庄，福留居长清，兴继迁山东泰安南家庄（后改为大马家庄）。 卷一谱序、续谱委员会、图式、碑式、行辈、世系，卷二至十一世系、编后语。,https://jiapu.library.sh.cn/https://jiapu.library.sh.cn/#/GenealogySummary:http://data.library.sh.cn/jp/resource/work/oaij8eeqmxdh1uzb
马氏家谱（山东省/东营市）,马义峰;马立功,马,2015,--,始迁祖玉，明永乐元年由河北枣强迁居山东东营盐垛村（后改盐坨村）。 谱载修谱说明、浅析马氏宗祠楹联、谱序、世系表、五服图、行第、家规、家训、祠堂、余庆录、捐款光荣榜。,https://jiapu.library.sh.cn/https://jiapu.library.sh.cn/#/GenealogySummary:http://data.library.sh.cn/jp/resource/work/f21dn9wrc57oqcas
马氏家谱（山东省/德州市/乐陵市）,马克,马,2002,--,始迁祖种德，明初由河北枣强迁山东乐陵。 谱载谱序、续修族谱、续修族谱释、小言、小引、小序、修墓文、谱解、纪要、碑记、世系、修谱人记、续修族谱附。,https://jiapu.library.sh.cn/https://jiapu.library.sh.cn/#/GenealogySummary:http://data.library.sh.cn/jp/resource/work/s1ku4bgajxz6nlr2
马氏家谱（安徽省/阜阳市/颍上县）,马怀慈,马,2008,--,该族原籍山东，元代移居江苏苏州府常熟县。始迁祖福，明洪武十五年迁安徽颍上，定居桑元。 谱载序言、凡例、历代先祖像赞、姓氏源流、远祖世系图、淮颍马氏历代人名录、坟茔、支系分布、祠庙、各支系世系图、历代人物小传、现代人物简介、历代人物学位官职表、现代人物登记表、宗族文化、族规、本族大事记等。,https://jiapu.library.sh.cn/https://jiapu.library.sh.cn/#/GenealogySummary:http://data.library.sh.cn/jp/resource/work/6mt4njmvxzzkdzg7
马氏家谱（台湾省/台北市）,马开东,马,1987,--,始迁祖马金盈原籍本是山东金乡县人，民国战争时期被美军俘虏，荣获自由后逃至台湾，定居于台湾台北。 谱载姓氏源流、世系表。,https://jiapu.library.sh.cn/https://jiapu.library.sh.cn/#/GenealogySummary:http://data.library.sh.cn/jp/resource/work/epkiacddhjdlczzv
马氏家谱续集山西孝义柳湾村（山西省/吕梁市/孝义市）,马永宁;马林生,马,2019,--,始迁祖志学，明嘉靖年间从陕西米脂迁至山西孝义柳湾村。 谱载谱序、世辈序字、马姓溯源、马氏家谱、修谱捐资。,https://jiapu.library.sh.cn/https://jiapu.library.sh.cn/#/GenealogySummary:http://data.library.sh.cn/jp/resource/work/k12in9v7wcgms2nt
马氏家谱河南关山马家冲（河南省/信阳市/光山县）,马继伦,马,2015,--,始迁祖明，明末清初从江西省南昌市筷子巷迁到河南光山县向南店老虎山马家冲。 谱载谱首像文、序、派行序、马氏家训、续谱理事会、照片、续谱凡例、信息往来、马氏宗祠、祖茔祖坟、虔诚祭祖、孝道文化、楷模家庭、马氏精英、续谱捐款光荣榜、迁外定居宗亲登记表、编后语、谱牒汇编、勘误表。,https://jiapu.library.sh.cn/https://jiapu.library.sh.cn/#/GenealogySummary:http://data.library.sh.cn/jp/resource/work/eylnp8ygc1dnt9vr
马氏家谱文强系（河南省/郑州市/巩义市）,马立修,马,2015,--,始祖景眉（字子白），约在明前期由扶风茂陵迁居河南洛阳。六世孙文强，迁居今河南省巩义市康庄镇，是为始迁祖。 卷首像、宗祠、功德碑、照片、谱序、宗派字、凡例，正卷索引、世系，卷后族规族训、人才录、跋。,https://jiapu.library.sh.cn/https://jiapu.library.sh.cn/#/GenealogySummary:http://data.library.sh.cn/jp/resource/work/srwdlbg8l3r8nogo
马氏家谱山西省朔州市平鲁区马家湾村支谱（山西省/朔州市/平鲁区）,马杰;马玉,马,2019,--,是族先世明洪武二年由山西代州解河畔圪台街迁朔州平鲁马家湾村。谱尊清代冀、周、录、桃、俊、为世系一世。传至今十一世。 谱分六篇：篇一祖根源流篇，篇二世系传承篇，篇三族训家风篇，篇四人物风采篇，篇五基业兴隆篇，篇六婚丧习俗篇。,https://jiapu.library.sh.cn/https://jiapu.library.sh.cn/#/GenealogySummary:http://data.library.sh.cn/jp/resource/work/5kviy6azrujg652l
马氏家谱卷七之一续虹桥支分堰桥（江苏省/无锡市）,马淼根,马,2023,忠孝堂,始迁祖圣全（字大成，号时中），元末自上元县（今属江苏南京）迁居居江苏无锡虹桥。十五世启荣，清康熙间自无锡虹桥南门迁居邑之堰桥。 谱载扉页、目录、前言、祠堂记、凡例、世系表、世系图、后记、修谱纪名。,https://jiapu.library.sh.cn/https://jiapu.library.sh.cn/#/GenealogySummary:http://data.library.sh.cn/jp/resource/work/sevlpl4j6wa3jkgd
马氏家族谱（宁夏回族自治区/吴忠市）,马波,马,2017,--,始迁祖名失考，约于清末迁宁夏同心纪家乡（平岭子），后迁吴忠。生子三虎、三洪。 谱首载编委介绍、序言，卷一族规家训卷，卷二命名卷，卷三功名卷，卷四宗教卷，卷五至十脉线卷，卷十一人丁卷，卷十二族人职业卷，卷十三坟墓卷。,https://jiapu.library.sh.cn/https://jiapu.library.sh.cn/#/GenealogySummary:http://data.library.sh.cn/jp/resource/work/kwiezr8k1vr4zkb6
马氏家族谱书（辽宁省/辽阳市）,马德芳,马,2002,--,始祖运通，原籍山东登州府栖霞县马家营，清初迁至盛京（今辽宁沈阳）城北八里洼子窑。始迁祖其子国庶，迁至辽宁辽阳城东大汤沟镶红旗界。 谱载谱序、注解、随笔赠言、世系、续修后说明等。,https://jiapu.library.sh.cn/https://jiapu.library.sh.cn/#/GenealogySummary:http://data.library.sh.cn/jp/resource/work/lcykjn1qgl6y73au
马氏家族与长鄄（湖南省/邵阳市/隆回县）,马远平,马,2002,--,始迁祖成龙（字云卿），明代人。,https://jiapu.library.sh.cn/https://jiapu.library.sh.cn/#/GenealogySummary:http://data.library.sh.cn/jp/resource/work/xgdfp9baxmfvgilm
