谱名,责任者,姓氏,撰修时间,堂号,家谱简介,详情链接
曹氏家谱（陶家镇九龙支族）（重庆市/重庆市/九龙坡区）,陶家镇九龙清明会,曹,2005,谯郡堂,颛顼帝五世孙陆终第五子安，因帮助大禹治水有功，于河南灵保县曹水被封曹官，为夏朝国君，是开姓祖。商灭夏后，安后裔遭讨伐，迁山东定陶，后分支广布全国各地。明末清初战乱，一世祖珍随族人由湖北麻城逃贵州遵义避难，在该地生长婚配，后率第三子入川，传十四代，分布于陶家、巴福、双河场、津福等地，以谯郡堂为号。另有元明土庙子两支系、享堂曹家巷子、杜市、贾嗣、仁沱、先锋等分支均在清初时期陆续由黔入川。 谱载陶家镇九龙曹氏的源流、迁徙与传承等内容，并增补了相邻曹姓其他分支祖宗入川的历史概况。,https://jiapu.library.sh.cn/https://jiapu.library.sh.cn/#/GenealogySummary:http://data.library.sh.cn/jp/resource/work/r3ytv8qid6dsfln3
曹氏家谱（贵州省/黔东南苗族侗族自治州/锦屏县）,曹汉平,曹,2014,亲睦堂,始祖同，原籍江南庐州府合肥县（今安徽合肥）皂角村，明洪武六年以军功升湖南永州卫百户，后战亡。其子英袭职，洪武三十二年调守贵州锦屏铜鼓镇，遂择居城内曹家苑，是为始迁祖。 谱载诰敕、赠、匾序、旧谱序、八九年修谱资金收付清单、整理序、世系。,https://jiapu.library.sh.cn/https://jiapu.library.sh.cn/#/GenealogySummary:http://data.library.sh.cn/jp/resource/work/wib3c314wbxejx4y
曹氏家谱（河南省焦作市济源市）,合族,曹,1999年,--,此曹氏明代自山西洪洞大槐樹下棄家逃荒遷至河南濟西邵東花園定居。書名據書衣、書名頁題。,https://jiapu.library.sh.cn/https://jiapu.library.sh.cn/#/GenealogySummary:http://data.library.sh.cn/jp/resource/work/ix62cusrjyzaa5bb
曹氏家谱（河北省/沧州市）,曹德才;曹德怀,曹,2014,--,始迁祖源，明永乐年间自直隶河间府河间县尊祖庄，又移居河北沧州杜生镇曹会头村居焉。 谱载谱序、续谱人员、辈次表、世系图、行传。,https://jiapu.library.sh.cn/https://jiapu.library.sh.cn/#/GenealogySummary:http://data.library.sh.cn/jp/resource/work/6pdu71bau99x6xvd
曹氏家谱（江苏省/宿迁市）,曹绪刚;曹绪成,曹,2013,绣虎堂,始迁祖相成，明万历年间自山西洪洞县迁居邳州岔河，生三子，守仓、守全、守金。守仓留岔河祭祀，后失传。守全、守金自岔河迁居宿迁县安八图骆马湖城西（今宿迁市湖滨新区黄墩镇曹家瓦房、小曹庄、曹甸一带，据考原属淮阴市宿迁县窑湾镇，自1945年后隶属宿迁县黄墩镇），故谱称“窑湾曹氏”。 谱载中华民国戊辰谱(1928年) 卷一至四、二零一三年卷、后记篇。,https://jiapu.library.sh.cn/https://jiapu.library.sh.cn/#/GenealogySummary:http://data.library.sh.cn/jp/resource/work/2cprbwxyh6pkq3ee
曹氏家谱（江苏省/宿迁市）,曹剑影,曹,1995,--,始祖相成，明万历年间自山西洪洞县迁居邳州岔河，生三子，守仓、守全、守金。守仓留岔河祭祀，后失传。守全、守金自岔河迁居宿迁县安八图骆马湖城西。 卷一编撰委员会名单、续谱前言、字辈排行、总目录、世表、行传，卷二至六各支派世表、行传。,https://jiapu.library.sh.cn/https://jiapu.library.sh.cn/#/GenealogySummary:http://data.library.sh.cn/jp/resource/work/zmg37zsgjeopjbjn
曹氏家谱（广东省/梅州市/大埔县）,佚名,曹,2019,光裕堂,清，始迁祖曹二十由福建省三明市宁化县迁居福建省龙岩市连城县又移居福建省龙岩市上杭县，后又移居广东省梅州市大埔县。 谱载序、姓氏源流、吾族姓源、世系图、曹远生入闽始祖由来、曹氏祖训、曹氏宗词楹联、世系表。,https://jiapu.library.sh.cn/https://jiapu.library.sh.cn/#/GenealogySummary:http://data.library.sh.cn/jp/resource/work/4ze6qnb7pyuh4atn
曹氏家谱（山东省/聊城市/东阿县）,曹传龙,曹,2016,大正堂,始迁祖母携四子（均失讳，本谱以母为一世，四子为二世），原籍山东登州府文登县铁板桥沟北涯曹家大门，明洪武八年迁居山东济宁府东平州东阿县西曹李庄（今姜单李村李庄），其后又迁至邑之曹庙村。二世四兄弟派分四支：长支自九世登（字魁五），次支自八世继先（字善述），三支自十一世兴素、文功，四支自十三世存义、存立始记世系。 卷一工作人员、前言、溯源、行辈、堂号、家训、祖茔、碑文，卷二至十一碑文、祖茔、世系图。,https://jiapu.library.sh.cn/https://jiapu.library.sh.cn/#/GenealogySummary:http://data.library.sh.cn/jp/resource/work/i6s47cg2379ladzy
曹氏家谱（不详）,曹政雄,曹,1950,--,始祖曹信和，清朝人，始迁祖不详，原籍福建省漳州市平和县，迁徙源流不详。 谱载世系。,https://jiapu.library.sh.cn/https://jiapu.library.sh.cn/#/GenealogySummary:http://data.library.sh.cn/jp/resource/work/xg93pxit6f6gbwdt
曹氏家谱六编（安徽省滁州市天长市）,曹志鸿,曹,2000年,义德堂,此是天長市曹氏統宗譜。無舊譜可依據。第一編序言、題詞，第二編人物記事，第三編家教資料，第四編曹氏歷代名人录，第五編雜記資料，第六編宗支世系表。世系表所記皆現代人。書名據封面題。,https://jiapu.library.sh.cn/https://jiapu.library.sh.cn/#/GenealogySummary:http://data.library.sh.cn/jp/resource/work/xksxcrf7lrx6e8mn
曹氏家谱光山砖桥曹河支系（河南省/信阳市/光山县）,曹先福,曹,--,--,本族先世相传由江西迁居河南光邑五龙保毛家蒲，明万历中迁居砖桥麒麟河。谱以明人本珍为始祖。 谱载照片、修谱领导小组成员、工作人员、捐款一览表、说明、序言、祝文、派行、寻根记、传赞、协议、合同、规条、世序篇、后记等。,https://jiapu.library.sh.cn/https://jiapu.library.sh.cn/#/GenealogySummary:http://data.library.sh.cn/jp/resource/work/8ngag7eqobkjqmqo
曹氏家谱不分卷（河南省商丘市夏邑县）,不详,曹,清光緒九年（1883）,--,書名據書衣題。記事至清同治間。,https://jiapu.library.sh.cn/https://jiapu.library.sh.cn/#/GenealogySummary:http://data.library.sh.cn/jp/resource/work/mf9g8emwyyoi1z9y
曹氏家谱不分卷（江苏省无锡市宜兴市）,曹启骧,曹,清光緒29年(1903),留耕堂,昌祚一派出於鎮江開沙，參見清曹國寶修《開沙曹氏宗譜》條目。此譜載昌祚派下第一支元臣、元相之後及第二支元輔、元文之後。有世系圖及世傳。書名自擬。封面題始遷祖昌祚公系第一第二支譜。,https://jiapu.library.sh.cn/https://jiapu.library.sh.cn/#/GenealogySummary:http://data.library.sh.cn/jp/resource/work/wg87mzyaasxd1pyc
曹氏家谱不分卷（上海市）,曹必芳,曹,1924年,凝辉堂,始遷祖守常，孟莊公，明永樂間由范溪（即吳淞江之范家浜，或謂即滬西曹家渡）東渡，贅於護塘季氏，遂卜居焉，里人名其居里曰曹家衖。守常生五子：遺、迪、逳、延、逞，各爲中、西、南、北、東五宗支祖。,https://jiapu.library.sh.cn/https://jiapu.library.sh.cn/#/GenealogySummary:http://data.library.sh.cn/jp/resource/work/kq2v9ztiunu1amgt
曹氏家谱不分卷(河南信阳),曹溥秀,曹,2008年,--,此是信陽市溮河區、平橋區各支曹氏之合譜。較大的二支城西馮家莊柳條衝支與城東雙河鄉左店支，其始遷祖訓、文生，都是祖籍江西南昌府新建縣瓦溪垻，明洪武年間經由湖北麻城遷來。內錄序、概述、各分支世系表、人物傳記與統計表、光緒六年譜選載（譜序、家規、家傳）。,https://jiapu.library.sh.cn/https://jiapu.library.sh.cn/#/GenealogySummary:http://data.library.sh.cn/jp/resource/work/8fi3ord37esfr7i3
曹氏家谱一卷（陕西省咸阳市礼泉县）,曹乃斌,曹,1947年,--,始祖自新，明代人。譜載譜序、世系、傳記等。名據書衣題。,https://jiapu.library.sh.cn/https://jiapu.library.sh.cn/#/GenealogySummary:http://data.library.sh.cn/jp/resource/work/la1ebkb97lhpotfy
曹氏家谱.霍州市东堡村（山西省/临汾市/霍州市）,曹马锁,曹,2014,--,霍州曹姓传说南北朝时期，从山东省菏泽市曹县，迁到山西临汾市霍州市寺庄村，后播迁霍州东堡、阴底、尉底、塔底、观堆……等15个村落，本谱系东堡曹氏一支，曹姓在东堡村曹氏曾祖父（姓名不详）前有几辈无从考证，曾祖父曹宝子为曹家在东堡立门起户。 谱载曹姓起源及姓曹名人、家族成员辈份一览表、霍州市东堡曹氏繁衍示意图、九族五服图、东堡曹氏简述、家风家规家训、家庭成员登记表、庆典仪式图、敬仰先辈、碑文、后记。,https://jiapu.library.sh.cn/https://jiapu.library.sh.cn/#/GenealogySummary:http://data.library.sh.cn/jp/resource/work/vujjucdm51y0wv6j
曹氏家谱.谯国郡（福建省/龙岩市/长汀县）,曹大村,曹,2009,--,始迁祖曹远生，南宋年间，由浙江省台州市，迁到福建省龙岩市长汀县。 谱载委员会、图、像、照片、题词、修谱说明、前言、序文、概述、大事记、文化盛景、族祠、祭文、专用联、家训、人物、世系、风俗礼仪、附录、编后语。,https://jiapu.library.sh.cn/https://jiapu.library.sh.cn/#/GenealogySummary:http://data.library.sh.cn/jp/resource/work/3q4ng3x1rjocmj4i
曹氏家乘（江苏省/南通市/如皋市）,曹肇翔,曹,2020,积善堂,始祖彬（字国华，谥武惠），河北真定灵寿人，北宋开国名将，封济阳王。五世钰（字延玉）随宋室南渡，自汴京（今河南开封）迁江苏常熟釜山陆庄。十三世均佑元末避乱迁南通通州余庆场。始迁祖十九世尚勇（字存义），明景泰初复迁如皋城北鲜鱼庄。 卷一告知书、三修序、题词、像赞、封赠、旧序、历修名目、合影、谱议、谱例、家训家规、祭仪、祠堂、墓图、五服图、传，卷二文、族人简介、捐资芳名及照片、随感、附录，卷三至八世系。,https://jiapu.library.sh.cn/https://jiapu.library.sh.cn/#/GenealogySummary:http://data.library.sh.cn/jp/resource/work/dksvbc8jcq5mwv22
曹氏家乘四卷（江苏省镇江市）,曹壄昭,曹,清道光二年（1822）,--,始遷祖景莊，字耕亭，明代人。,https://jiapu.library.sh.cn/https://jiapu.library.sh.cn/#/GenealogySummary:http://data.library.sh.cn/jp/resource/work/mb6h4grukplm6v62
曹氏家乘十二卷（江苏省南京市溧水县）,曹光逵,曹,1930年,孝友堂,--,https://jiapu.library.sh.cn/https://jiapu.library.sh.cn/#/GenealogySummary:http://data.library.sh.cn/jp/resource/work/tgzaefmgu6w8t6ob
曹氏家乘不分卷（上海市崇明县）,不详,曹,清,--,存卷爲世系圖。,https://jiapu.library.sh.cn/https://jiapu.library.sh.cn/#/GenealogySummary:http://data.library.sh.cn/jp/resource/work/kn8e4asidnbwkyuj
曹氏家乘.续集（重庆市/重庆市/江津区）,曹学信,曹,2010,--,元末至正十一年，始迁祖曹文海携家眷从河南省信阳市固始县迁居重庆市江津区。 谱载长房、二房、幺房、支系考证、个人生平事略、整理续修家谱捐款人员、后记。,https://jiapu.library.sh.cn/https://jiapu.library.sh.cn/#/GenealogySummary:http://data.library.sh.cn/jp/resource/work/j8vfixy5dtvg5wld
曹氏宗谱（辽宁省/辽阳市）,曹文诚;曹津宁,曹,2009,--,始迁祖万国、万学，明朝末年与祁家一起挑担来辽阳玉皇庙村安家落户。 谱载宗谱修撰人员、自序、摄影图像、老新家谱、谱序、追考、碑石考证、族人分布与世系、族人辈分差异、墓地分布、存疑、世系表、族人年份记载、曹道祖业与红楼梦道家文化、曹氏宗谱集存。,https://jiapu.library.sh.cn/https://jiapu.library.sh.cn/#/GenealogySummary:http://data.library.sh.cn/jp/resource/work/f9tpv51yj3cnauqg
曹氏宗谱（湖北省）,曹兆麟,曹,2006,文昭堂,始祖曹振铎，始迁祖曹宗泰，元朝时期，由东山冷水，迁到西山(今湖北省) 谱载先祖墓庙简介、先祖像介、名人传、家训、敕命、附录、世系录。,https://jiapu.library.sh.cn/https://jiapu.library.sh.cn/#/GenealogySummary:http://data.library.sh.cn/jp/resource/work/buu3opoblu51jw3s
曹氏宗谱（湖北省/黄石市/大冶市）,曹衍培,曹,1989,三治堂,始迁祖曹智一于元末时期由豫章(今江西省南昌市)迁湖北省黄石市大冶市汪仁镇。 卷首序、诰敕、名人传、祖茔。,https://jiapu.library.sh.cn/https://jiapu.library.sh.cn/#/GenealogySummary:http://data.library.sh.cn/jp/resource/work/r7puitug8yaqka76
曹氏宗谱（湖北省/黄冈市）,曹直心,曹,1998,崇本堂,始祖曹佑公，由原籍江西饶州府乐平县瓦屑坝明洪武十一年迁于黄厥 卷之首上谱序、凡例、宗谱名目、家规、墓图、庙图，卷之首下家传谱、公传、孺人传、节孝传、行述、受姓流源考、宗祠序、教家格言。卷之一至十一世系图。卷之十二上分世系谱载本卷首附塘上分补遗表。卷之十三塘分世系谱载本卷首。卷之十四井分世系谱本卷附井分补遗表。(湖北省图书馆);始祖曹佑公，由原籍江西饶州府乐平县瓦屑坝明洪武十一年迁于黄厥 卷之首上谱序、凡例、宗谱名目、家规、墓图、庙图，卷之首下家传谱、公传、孺人传、节孝传、行述、受姓流源考、宗祠序、教家格言。卷之一至十一世系图。卷之十二上分世系谱载本卷首附塘上分补遗表。卷之十三塘分世系谱载本卷首。卷之十四井分世系谱本卷附井分补遗表。(美国犹他家谱学会);始迁祖佑，明洪武十一年由原籍江西饶州府乐平县瓦屑壩迁于黄冈居焉。 卷之首上谱序、凡例、宗谱名目、家规、墓图、庙图，卷之首下家传谱、公传、孺人传、节孝传、行述、受姓流源考、宗祠序、教家格言，卷之一至十一世系图，卷之十二上分世系谱载本卷首附塘上分补遗表，卷之十三塘分世系谱载本卷首，卷之十四井分世系谱本卷附井分补遗表。(山西省社会科学院图书馆),https://jiapu.library.sh.cn/https://jiapu.library.sh.cn/#/GenealogySummary:http://data.library.sh.cn/jp/resource/work/2p38f9pvo1tokbke
曹氏宗谱（湖北省/黄冈市）,曹锦章,曹,1991,平阳堂,始迁祖荣一，明洪武年间由江西饶州府浮梁县迁居黄冈鸟雀林。 卷首一续修总序、谱序、合序、归宗序、祖序、派字、圣谕、凡例、祖祠碑记、续修理事名单、重立墓碑记、祭产，卷首二墓祠图，卷首三传、名人录、仪注、宗祠祝文、五服图，卷一至三十八世系图、世系表。,https://jiapu.library.sh.cn/https://jiapu.library.sh.cn/#/GenealogySummary:http://data.library.sh.cn/jp/resource/work/a5876l6fe331w7kd
曹氏宗谱（湖北省/黄冈市/麻城市）,曹永善,曹,1993,三桂堂,明洪武年间，始迁祖曹良卿，从江西星子县（今江西省九江市庐山市）迁到麻城浮溪河（今湖北省黄冈市麻城市）。 卷首上续修职名、序、赞言、家规、家训、派行、祠堂志、节孝、跋，卷首溪像、图，卷一至卷二十四世系。,https://jiapu.library.sh.cn/https://jiapu.library.sh.cn/#/GenealogySummary:http://data.library.sh.cn/jp/resource/work/gmzxvemevg4wszf1
曹氏宗谱（湖北省/黄冈市/麻城市）,曹玉堂,曹,2008,文昭堂 平阳堂,始迁祖英顕（字荣一），明朝年间由赣迁居麻城。 卷首一序言、圣谕、派字、凡例，卷首二传记，卷首三祠墓图，卷一世系图，卷五至六世系表。,https://jiapu.library.sh.cn/https://jiapu.library.sh.cn/#/GenealogySummary:http://data.library.sh.cn/jp/resource/work/zhcfjut15ye234im
曹氏宗谱（湖北省/黄冈市/浠水县）,曹定福,曹,1994,平阳堂,始迁祖隆伍（字盛周），授以职衔从戎北征，明季自江西饶州府来黄立籍浠水居焉。 卷一宗谱序、族谱引、行述、传、序、谱例、家规、家训、源流序、行略、三修四修名目、叙，卷二续修谱序、源流序、传、行述、宗祠序、坟山记、墓志序，卷三至十四世系、行传。,https://jiapu.library.sh.cn/https://jiapu.library.sh.cn/#/GenealogySummary:http://data.library.sh.cn/jp/resource/work/3l92zfm9hpjgjmdd
曹氏宗谱（浙江省绍兴市上虞市）,曹文鉴,曹,清,世德堂,漢曹參之子曹崇爲會稽郡太守，遂居上。傳至建忠，字國良，行中三，元季徙居本縣大板橋，是爲板橋曹氏始遷祖。存卷爲世系圖。存卷四。書名據版心題。,https://jiapu.library.sh.cn/https://jiapu.library.sh.cn/#/GenealogySummary:http://data.library.sh.cn/jp/resource/work/k9ia6lpjk8ddc7vc
曹氏宗谱（河南省/平顶山市/鲁山县）,曹孟举,曹,2013,--,始祖不知何时从何初迁至鲁山城东（今河南省平顶山市鲁山县）柿园曹村。二世祖为曹鸣珂，故只能奉其为始祖。 谱载编纂委员会、题词、图腾、名单、前言、家族简介、总括篇、字派、祖训族规、宗族孝铭、家训、禁约、世系篇、简述、世系图、世表、人物篇、通讯录、续修捐款名额、后记。,https://jiapu.library.sh.cn/https://jiapu.library.sh.cn/#/GenealogySummary:http://data.library.sh.cn/jp/resource/work/4elpmq5txf6ff178
曹氏宗谱（河南省/平顶山市/鲁山县）,曹孟举;曹利亚,曹,2013,--,始迁祖佚名，明朝年间从山西洪洞县大槐树迁至鲁山城东定居柿园，命名柿园曹村。 谱载编纂委员会、题词、图腾、名单、前言、家族简介、总括篇、字派、祖训族规、宗族孝铭、家训、禁约、世系篇、简述、世系图、世表、人物篇、通讯录、续修捐款名额、后记。,https://jiapu.library.sh.cn/https://jiapu.library.sh.cn/#/GenealogySummary:http://data.library.sh.cn/jp/resource/work/mo39vfqlnog62q7i
曹氏宗谱（江西省）,不详,曹,清,--,存卷二至三。書名據版心題。記事至清道光十四年。,https://jiapu.library.sh.cn/https://jiapu.library.sh.cn/#/GenealogySummary:http://data.library.sh.cn/jp/resource/work/fq5muatxtwgifn9c
曹氏宗谱（江西省）,不详,曹,清,--,存卷三、五。記事至清同治十三年。,https://jiapu.library.sh.cn/https://jiapu.library.sh.cn/#/GenealogySummary:http://data.library.sh.cn/jp/resource/work/m4u6quwfwhzekhw4
曹氏宗谱（江西省）,不详,曹,清,--,存卷一。記事至清乾隆四十二年。,https://jiapu.library.sh.cn/https://jiapu.library.sh.cn/#/GenealogySummary:http://data.library.sh.cn/jp/resource/work/lcrh8nr7non34nnu
曹氏宗谱（江西省/九江市/修水县）,曹理斌;曹其苏,曹,2012,平阳堂,端礼公任洪都教谕，由山东徙江西进贤，为迁赣始祖。端礼公十五世孙洪显出任分宁司铎，于宋咸淳六年迁修水，尊为修水一世祖。 谱分三卷：卷首前言、凡例、序言、族源、族规、历届宗谱序言、传记、名人录、诗文、宗派等，卷二至卷三为各公世系。,https://jiapu.library.sh.cn/https://jiapu.library.sh.cn/#/GenealogySummary:http://data.library.sh.cn/jp/resource/work/63aq4tdiexehywis
曹氏宗谱（江苏省/苏州市/常熟市）,曹伟苍;曹君梅,曹,2012,育政堂,六世始祖珏（字延玉），随宋高宗南渡徙迁常熟卜釜山定居。始迁十七世祖棻，迁常熟邑之东五渠（今常熟藕渠）。二十五世支祖彦（字伯英）、奇（字仲希），迁居顾山南缪巷，为本支祖。 卷一前言、原序、凡例、家规、家训、祠堂记、特载、判决书、传、迁徙宅志、服制图、领谱字号、粮田细数、继子捐款、续修宗谱职员、赞助榜、大校军衔曹金龙简介、续修宗谱工作实事，卷二至七世系图、世表。,https://jiapu.library.sh.cn/https://jiapu.library.sh.cn/#/GenealogySummary:http://data.library.sh.cn/jp/resource/work/ruqvmu94ri6h7jmt
曹氏宗谱（江苏省/苏州市/常熟市）,曹君梅,曹,2012,育政堂,一世祖曹芸，仕后汉兵马使，宋初国华公贵赠芸公王爵；六世祖珏，字延玉，随高宗南渡，居常熟釜山，为曹氏始迁祖；后十七世祖棻，迁居五渠（今常熟藕渠），为五渠支始迁祖；二十五世祖曹彦（字伯英）、曹奇（字仲希），从五渠迁居顾山南缪巷。 卷一载续修宗谱序、凡例、族规家训、人物小传、迁徙宅志等；卷二至七录世系图、表等。,https://jiapu.library.sh.cn/https://jiapu.library.sh.cn/#/GenealogySummary:http://data.library.sh.cn/jp/resource/work/omj9vsknwwuw296g
曹氏宗谱（江苏省/无锡市）,曹建明;曹富民,曹,2012,三桂堂,始迁祖鹤轩，生于南宋绍熙年间，举进士第，为吴门始祖（今苏州）。十一世支祖景仁（号东溪），明正统年间由锡邑虹桥迁北门外三十里玉祁镇南地名黄巷；景德，迁居黄巷西首二里许礼社后巷。 卷首续修序、大宗世系图、各分支迁居年代、续修大事记、各分支分布图、族人感言、总目录、续修九次题名录、凡例、关于筹集续修宗谱资金的意见、功德榜、捐资者风采、先贤传记、人物简介、长寿乐、七彩录、编后语，卷一启后录、谱序，卷二敕命、诰命、像赞、传、序、墓志铭，卷三传、序、谱跋、凡例、历次修谱登名录、新建祠堂记、领谱名录，卷四重建祠堂记、祠廓说明、坟墓碑记、祠规、训祠、序言、重建祠堂理事会题名录、功德榜、祭祖、新祠规，卷五至十四世系图、世表。,https://jiapu.library.sh.cn/https://jiapu.library.sh.cn/#/GenealogySummary:http://data.library.sh.cn/jp/resource/work/4n4pxw547o8w2cqa
曹氏宗谱（江苏省/无锡市）,曹祖康,曹,2017,毓秀堂,始祖彬（字国华，谥武惠），北宋开国将领，封济阳王。五世钰（字延玉），北宋末从驾南渡，迁居江苏常熟釜山陆庄（今常熟海虞肖桥村）。十六世汉英（字虞山）元末携子元禄、中和自常熟陆庄迁无锡荷村，元禄居垂庆荷村，为荷村始迁祖；中和居泰伯薇村，为薇村始迁祖。 卷一续修序、题词、诰敕、像赞、旧序、旧谱凡例、仕宦、墓志、祖茔、志文考、传序诗文等，卷二家训族规、凡例、各分支简况、各分支分布示意图、宗祠毓秀堂、图片、功德榜、续谱理事会、后记等，卷三至八世系。,https://jiapu.library.sh.cn/https://jiapu.library.sh.cn/#/GenealogySummary:http://data.library.sh.cn/jp/resource/work/1c11cr8zg8t2y33v
曹氏宗谱（江苏省/无锡市/江阴市）,曹宝才,曹,2008,四正堂,始祖教夫（讳塾）世居金陵。二世祖俦南唐末为避五季之乱徙居常熟梅李，后又徙江阴东城内后底径。六世祖碤创别业于虞门，为虞门始迁祖。 卷首题词、像赞、序、本届续修组织机构、捐资名册、原序、谱例、家训、祠堂记、墓图、领谱字号，卷一家传、妇女传，卷二墓志、墓表、行状、祭诛、寿序，卷三文献录，卷四冠盖录，庆源录，贞节录、散处录，卷五统总世表分支图序、统总世表，卷六至三十六世系图、世系表。,https://jiapu.library.sh.cn/https://jiapu.library.sh.cn/#/GenealogySummary:http://data.library.sh.cn/jp/resource/work/76yo4nlzyvm42wtx
曹氏宗谱（江苏省/扬州市/高邮市）,曹玉宽,曹,2015,七步堂,本族先世于明初由江苏苏州迁居高邮。谱内世系自清末民国初之际，第六世族人始。 卷上留影、谱序、当代宗亲优秀事迹、题词、家训及家风、字派、世系表，卷下世系表、文苑、宗亲会章程、家谱会会规、跋、集资名单。,https://jiapu.library.sh.cn/https://jiapu.library.sh.cn/#/GenealogySummary:http://data.library.sh.cn/jp/resource/work/rjxv3sno8oha28cu
曹氏宗谱（江苏省/常州市）,曹国忠;曹正芳,曹,2011（2011）,裕后堂,始祖荣甫（行五十），宋南京礼部儒士居句容县百社村。始迁四世祖子实（字东隐，行良三），明万历年间迁到常州武进新塘之集英河北居住，村名曹家桥。五世支祖长子希育，为东分祖；次子希弘，为二分祖；三子希达，为三分祖；四子希和，为四分祖；五子希道，为五分祖。 卷一历次修谱、续修序、贺词、曹家桥村的地理位置及族人的居住环境、村平面图、赞颂、散叙、家谱颂、九修宗谱倡议书、筹备会、告同胞书、凡例、跋、编委会名单、赞助名录、传记简介与寿序、学历及科级干部以上名录、家规、领谱人名录、修谱告成书，卷二谱序、谱引、后庄迁居序、支派序、祠堂记、桥记、奉天敕命、诰敕、像跋、像赞，卷三谱制、谱弊、谱诫、家乘例约、家规、家训、服制图、祠堂图、墓图、输捐人名、修谱记名、给谱录，卷四传、墓碑、墓志，卷五行述、传、寿序、行略、诗、续修谱跋，卷六至十二世系图、世表。,https://jiapu.library.sh.cn/https://jiapu.library.sh.cn/#/GenealogySummary:http://data.library.sh.cn/jp/resource/work/s6scngm8oyw43x6q
