谱名,责任者,姓氏,撰修时间,堂号,家谱简介,详情链接
九郎溪俞氏宗谱（浙江省/台州市/仙居县）,俞林春,俞,2001,--,始迁祖元（字承道，号屏山），原籍金陵阴山，北宋熙宁年间，与长子柄公，卜居于乐安（今仙居）西乡九郎溪。 卷一题字、遗像、祠堂照片、戏台照片、关公殿照片、古墓照片、领导合影、村景村貌照片、全家福照片、修谱人员照片、名人录、贺信、序言、捐资名单、简历、凡例、辈行、后记等；旧谱谱序、家规、谱例、诰敕、纂修名次，卷二至三旧谱传略，卷四旧谱传略、新增大事记、村史、祠堂记、传略等，卷五至二十三世系图，卷二十四宅图、坟图、祀田。,https://jiapu.library.sh.cn/https://jiapu.library.sh.cn/#/GenealogySummary:http://data.library.sh.cn/jp/resource/work/n6nus16gtbp46mx2
九华堂黄氏族谱十卷（江苏省徐州市丰县）,黄炖,黄,清康熙四十七年（1708）,--,--,https://jiapu.library.sh.cn/https://jiapu.library.sh.cn/#/GenealogySummary:http://data.library.sh.cn/jp/resource/work/2ieadvnrl3xuvghj
九苞邵氏宗谱（江苏省无锡市宜兴市）,邵惟升,邵,清咸豐4年(1854),天远堂,始祖豐，字靈甫，北宋人。始遷祖天真，豐十四世孫，明永樂間自宜興永定里徙居富村北九苞里。卷首祠規、家範、凡例等，卷一大宗世表、古蹟、逸譜等，卷二統宗全圖，卷六至七世表，卷八傳、詩集、序文、像贊等。存卷首、卷一、二、六至八。書名據卷端題。,https://jiapu.library.sh.cn/https://jiapu.library.sh.cn/#/GenealogySummary:http://data.library.sh.cn/jp/resource/work/bpceekraaw4cb49c
九老侯氏家谱（福建省/福州市/永泰县）,侯振铿;侯广桃,侯,1992,--,始迁祖笃清，明嘉靖间由福建漳浦县十七都迁永福（即永泰县），先居七都山岛村，后与九老坡王姓对调，改迁今之九老村。 谱载照片、前言、序言、凡例、概述、大事记、称第、系考、寿考、墓志、人物传、文物、族规、后记、家谱表、勘误表。,https://jiapu.library.sh.cn/https://jiapu.library.sh.cn/#/GenealogySummary:http://data.library.sh.cn/jp/resource/work/ffneddw3bqj86jqx
九睦塅罗氏支谱十卷(湖南长沙),罗癸澄;罗橘泉,罗,民國18年(1929),继起堂,是族珠公（字懷漢），漢代自長沙宦居江西新城。裔孫瑜宗（字光奇），後唐同光二年自江西南昌府豐城縣柏林遷居長沙府瀏陽縣北鄉秧田塅樹林。始遷祖成滿（字善虛），明正德間再遷長沙九睦塅。卷一譜序、祠堂圖、傳記、墓圖，卷二至十世系。,https://jiapu.library.sh.cn/https://jiapu.library.sh.cn/#/GenealogySummary:http://data.library.sh.cn/jp/resource/work/xweq4ovrmjd6snax
九甲马氏族谱（山东省/潍坊市/昌邑市）,马禄昌;马喜千;马清平,马,2018,--,始迁祖仁贵、仁美，明代由直隶冀州枣强县迁居山东昌邑。二世有兄弟四人，分为四甲，珰为九甲始祖。 谱以元、亨、利、贞、乾分卷。元卷目录、序、凡例、世系，亨、利、贞卷世系，乾卷纂修委员会、历次修谱概览、家族大事记、老谱掠影、九甲碑文、族史溯源、九甲印迹、祭祖大典、九甲文华、九甲商风、后代族人命名定式、族人居住分布、村庄简介、昌邑历史地图、提供资料人员名单、族谱电子版珍藏特告、捐款表。,https://jiapu.library.sh.cn/https://jiapu.library.sh.cn/#/GenealogySummary:http://data.library.sh.cn/jp/resource/work/lxfis2qdwqmic1nb
九甲闵公黄氏族谱十卷（湖南省益阳市安化县）,黄力绅,黄,清光緒33年(1907),江夏堂,始遷祖揚名，名昭，字貞利，宋時自江西泰和縣圳上遷居安化龍塘。是爲揚名玄孫宗閔派支譜。卷首序、凡例、祠圖、八景詩、契據、祠規、家訓、族規，卷三至九世系。存卷一、三至十。六修本。,https://jiapu.library.sh.cn/https://jiapu.library.sh.cn/#/GenealogySummary:http://data.library.sh.cn/jp/resource/work/4csohd6rfpw5r2hw
九甲刘氏续修族谱二十卷首二卷末一卷(湖南湘乡),刘自得;刘永青,刘,民国36年（1947）,敦本堂,始迁祖翊圣，字益（赞+力），元代由江西太和县迁湖南湘乡县蓦潭。五世孙文炳，字谷斌，明代人，为九甲支祖。卷首上新序、凡例、纪名录、领谱字号、总目、旧序、源流、规训、服制、传赞、丁口统计暨住址一览表，卷首下祠堂坟屋图志、跋 、年表；卷一至二十世系；卷末世系补录。,https://jiapu.library.sh.cn/https://jiapu.library.sh.cn/#/GenealogySummary:http://data.library.sh.cn/jp/resource/work/xbjmjn3xtapl7tew
九牧龙头派柑井支系谱（台湾省）,林梧桐;林福全,林,2016,--,厦门龙头系九牧长房，传至闽三十三世侯，从厦门馆里迁居龙头即今琼头，始迁祖侯公第九世孙朝清自龙头迁居台湾东港，再移台南府城内。后来朝清公诸子再迁台南后迁彰化县和美镇柑井里。 谱载一序言、 二龙头族林姓列祖迁徙史略、 三龙头族私谱序、 四龙头族林姓相关历代宗族序 、五林氏受姓迁之公谱时序 、六林氏受姓至禄公入闽之世序、 七禄公入闽后之世序 、八君侯公肇基龙头后之派下世序、 九朝清公迁台派下各裔世序、 十林氏论谈 、十一信仰与渊源 、十二龙头族族史、传说、活动、 十三编后语。,https://jiapu.library.sh.cn/https://jiapu.library.sh.cn/#/GenealogySummary:http://data.library.sh.cn/jp/resource/work/p2yq9f72dng4daj7
九牧长乐黄石林氏世谱（福建省/福州市/闽清县）,林公雄,林,1993,--,南宋初，始祖文英从福建省福州市福清市迁高详里之银峰；六世孙得焕和得常兄弟两于宋宝庆年间又迁福州市闽清县白中镇黄石村。 谱载像赞、前言、夫子家训、黄石林氏源流引、黄石林氏宗祠记、序、黄石林氏世纪、楹联、黄石林氏继世书香、世系图、编后寄语、附。,https://jiapu.library.sh.cn/https://jiapu.library.sh.cn/#/GenealogySummary:http://data.library.sh.cn/jp/resource/work/d33l712mfa7ufpwe
九牧长房高林派敦拿督施里林苍佑家乘（福建省/泉州市/晋江市）,林树丹,林,不详,--,始祖禄，字世荫，东晋时入闽。始迁祖披，字茂彦，唐代人。,https://jiapu.library.sh.cn/https://jiapu.library.sh.cn/#/GenealogySummary:http://data.library.sh.cn/jp/resource/work/9vns2mtkgvtgnc3d
九牧邵州联桂山坪林氏族谱（福建省/泉州市/南安市）,林柄,林,2011,--,始迁祖以仍，于元末自福建省泉州市德化县迁福建省泉州市南安市。 卷一谱序、传记文献、世系纪实、人才录、编后语，卷二至卷四世系。,https://jiapu.library.sh.cn/https://jiapu.library.sh.cn/#/GenealogySummary:http://data.library.sh.cn/jp/resource/work/7xfrg382y3sfhhdl
九牧林氏（福建省/莆田市/荔城区）,林春明,林,2002,--,唐朝时期，始迁祖林披（字茂则），从福建省福州市晋安区迁到莆田北螺（今福建省莆田市荔城区西天尾镇林峰村），再迁澄渚乌石（今福建省莆田市荔城区西天尾镇龙山村）。 谱载源流篇、九牧房系概览、九牧衍派举要、九牧族裔分布概况、人物篇、名贤传记、胜迹篇、文献篇、附录、编后语。,https://jiapu.library.sh.cn/https://jiapu.library.sh.cn/#/GenealogySummary:http://data.library.sh.cn/jp/resource/work/biqgywesdot8fiub
九牧林氏续修宗谱三十二卷（湖南省）,林文凤,林,民國12年(1923),西河堂,始祖藻，字緯乾，行十二，唐福建莆田人。二十一世孫彦恭，明永樂間宦游南楚，寄居常德武陵之石公橋。始遷祖在高，彦恭七世孫，明崇禎間自常德再徙資陽（今益陽）之南十五里白竹園、二十里中洞港。自是藻、蕴（字復梦，號赤松，行十九）、邁（字大木）、蔇（字四明）後裔疊次自閩移居湖南益陽、長沙、湘陰、湘潭、善化、南縣等地。是爲上述各支合修譜。卷一序、目录、凡例，卷二像贊、九牧公圖記、天后世系考等，卷三祠堂記、家訓家規、傳述等，卷四至五墓圖，卷六至三十二世系。書名據書衣題。,https://jiapu.library.sh.cn/https://jiapu.library.sh.cn/#/GenealogySummary:http://data.library.sh.cn/jp/resource/work/l81mp9osux5iivz9
九牧林氏家乘（湖北省/武汉市/新洲区）,林汝楫,林,1992,九牧堂,始祖披，字茂彦，唐代人。始迁祖凤京，字西山，明洪武间，从江西省上饶市余干县瓦屑坝迁到湖北省黄冈县矮林铺（今湖北省武汉市新洲区双柳镇汪林乡矮林村），再迁毛家集宝盖寺（今新洲区金台镇毛集乡）。 谱载林氏总图、像、序、赞、林氏历代宗谱总图、祠堂楹联、编纂委员会、序言、凡例、墓记、续修赞助及捐献文物人、林氏宗谱总录各支远徙名目、编者歉述、世系。,https://jiapu.library.sh.cn/https://jiapu.library.sh.cn/#/GenealogySummary:http://data.library.sh.cn/jp/resource/work/wngfz94xhj6fv1a2
九牧林氏家乘（浙江省/绍兴市/柯桥区）,林光德,林,2011,九牧堂,清朝年间，始迁祖林芳龙迁居浙江省绍兴市柯桥区，迁出地不详。 谱载前言、林氏世系、追忆先人、长幼有序、孝悌之风、名绩实录、影像集锦、余庆有续。,https://jiapu.library.sh.cn/https://jiapu.library.sh.cn/#/GenealogySummary:http://data.library.sh.cn/jp/resource/work/bers74e36y2c5owh
九牧林氏大宗谱（福建省/莆田市）,林春德,林,2013,--,东晋明帝三年（325），禄公（字世荫）奉敕守晋安郡（郡治在今福州），举家迁至侯官都西里（今福州境内），林姓遂于闽地繁衍。禄公十六世孙披公（字茂则），居澄渚乌石（今莆田西天尾龙山村），唐天宝十一年（752）明经擢第，初授将乐令，后授临汀别驾知州事，卒后赠睦州（今浙江建德）刺史。披公生九子：苇、藻（名纬乾）、著（字文直）、荐、晔（字若思）、蕴（字梦复）、蒙、迈、蔇，皆官至刺史，世称“九牧林家”。 卷一九牧林氏大宗谱凡例、原谱凡例、原谱序（二十二篇）、修谱规条谱式、纪略（二篇）。卷二九牧长房进士名录、举人名录、贡生名录、太学生名录、名贤录。卷三策问二篇、谢恩一篇、奏疏七篇。卷四恩纶。卷五先祖像赞。卷六祠墓考。卷七史籍载莆田林氏牌坊祠阙宅墓庙。卷八至卷十四世系。卷十五当代企业家风采。,https://jiapu.library.sh.cn/https://jiapu.library.sh.cn/#/GenealogySummary:http://data.library.sh.cn/jp/resource/work/rr1k2sl3q134gbmq
九牧林氏六房谱（福建省/泉州市/晋江市）,--,林,不详,--,始祖禄，字世荫，东晋时入闽。始迁祖蕴，字梦复，行十九，谥忠烈，唐代人。,https://jiapu.library.sh.cn/https://jiapu.library.sh.cn/#/GenealogySummary:http://data.library.sh.cn/jp/resource/work/fzsxs21wqra2ibrv
九牧林家（福建省/莆田市/荔城区）,林春明,林,2021,--,始迁祖林披（字茂则）大约在唐大历年间，从从福建省福州市晋安区迁福建省莆田市西天尾镇北螺村，再迁至澄渚乌石头(福建省莆田市荔城区西天尾镇龙山村)。 谱载序、源流篇、人物篇、胜迹篇、文献篇、文论篇、编后语。,https://jiapu.library.sh.cn/https://jiapu.library.sh.cn/#/GenealogySummary:http://data.library.sh.cn/jp/resource/work/k1bk6k7tuwh8q3z6
九牧林三迁堂林氏族谱（四川省/达州市/开江县）,林其松,林,2019,三迁堂,始祖爵，明代自福建迁居江西豫章鹅掌大坵。爵之子前唐，再迁湖南永州府祁阳县十四都普乐乡燕子湾。始迁祖一武（字尔文），爵五世孙，清雍正五年携六子登灏（字月生）、登茂（字盛生）、登贤（字坤生）、登高（字云生）、登松（字□生）、登友（字□生），由祁阳县迁居四川新宁县（今开江县）。六子分启六房。 卷一谱序、凡例、源流、字辈，卷二像赞，卷三族范、家训，卷四祖庙、祠墓考，卷五世纪，卷六至八世系，卷九至十齿录，卷十一续录表，卷十二附录。,https://jiapu.library.sh.cn/https://jiapu.library.sh.cn/#/GenealogySummary:http://data.library.sh.cn/jp/resource/work/8r4ar6flsp22ffsd
九牧战阪林氏族谱（福建省/福州市）,林希根,林,1997,--,始祖苇，唐代人。始迁祖孩乙，字吹万，明代人。,https://jiapu.library.sh.cn/https://jiapu.library.sh.cn/#/GenealogySummary:http://data.library.sh.cn/jp/resource/work/5jtbiwagh9gtltog
九牧堂林氏宗谱（湖北省/黄冈市/红安县）,林文珠,林,2014,九牧堂,始迁祖北山（派字凤勇），明洪武十三年与兄弟东山、南山、西山自江西饶州府余干县瓦屑坝迁居湖北黄州白米河，后兄弟四人各择居处，其中北山公迁居中和乡紫潭河西岸林家大湾（今湖北红安县太平桥镇与武汉新洲区接壤处）定居，户名林兴。 卷一图片、照片、居住图简介、宗祠简介、祖墓记、碑文、序、颂、说明、大事记、名单、凡例、派行、世系总考、迁徙探微、发迹楚黄、修谱有感，卷二序、传、敇命、诰命，卷三诗、年谱、本源纪略、世系总图、世系表，卷四至二十二世系表。,https://jiapu.library.sh.cn/https://jiapu.library.sh.cn/#/GenealogySummary:http://data.library.sh.cn/jp/resource/work/oo7bwl76vgaquz3w
九牧四林长限族谱（福建省/福州市/长乐区）,合族,林,2007,--,四林始祖畴，从福州高湖光德里锦江，迁居瀛洲光俗里白石桥，传至守谦分居长乐长限。 第一章源流 宋仁宗皇帝御书、先贤题词、孔子题比干墓、铜盘铭、历代帝王与名贤题谱、朱子题字、林氏源流总序、林氏宗谱原序、林氏世系总纪、元和姓纂序、九牧林氏族谱序、魏孝文帝吊殷少师比干支、唐太宗赠比干谥诏、唐太宗皇帝祭比干文、元仁宗皇帝御立延佑碑献文,https://jiapu.library.sh.cn/https://jiapu.library.sh.cn/#/GenealogySummary:http://data.library.sh.cn/jp/resource/work/a44n1q1sjpmv39wr
九牧四林泮野族谱（福建省/福州市/长乐区）,林培俤,林,2003,--,"始祖畴(字君锡)，元代人。始迁祖四世守端(讳绎,又名缳)，于明洪武年间由长安(今陕西省西安市长安县)迁泮野(今福建省福州市长乐市 航城街道泮野村)。 谱载题词、照片、序、遗像、世系图、宗祠规条、编后语。",https://jiapu.library.sh.cn/https://jiapu.library.sh.cn/#/GenealogySummary:http://data.library.sh.cn/jp/resource/work/vrxwmsuehdwzhrg4
九牧二房锦马大宗谱（福建省/泉州市/晋江市）,合族,林,2011,--,始迁祖翘，幼年随父（惠公）居泉州，唐僖宗乾符三年明经及第，任晋江令，缘事南巡，见马平山，肇居锦马。 1溯源、 2锦马乡史,https://jiapu.library.sh.cn/https://jiapu.library.sh.cn/#/GenealogySummary:http://data.library.sh.cn/jp/resource/work/1v3dzst94ikrmlwk
九牧二房金山五口林族谱（福建省/福州市/永泰县）,--,林,1988,--,始祖禄，字世荫，东晋人。始迁祖翛，唐代人。,https://jiapu.library.sh.cn/https://jiapu.library.sh.cn/#/GenealogySummary:http://data.library.sh.cn/jp/resource/work/yeungoick48gbdsj
九江郡陶氏联谱（浙江省温州市泰顺县）,吴志达,陶,1995年,--,始始祖喬，字遷於，號松岡，唐末自蘭谿遷居瑞安白鶴溪口村（今泰順司前）。始遷祖酉，喬之孫，北宋初自瑞安白鶴溪口村遷居下洪南源村（今泰順下洪鄉）。譜載譜序、凡例、姓氏源流、九江郡考、略傳、世系、儒林録、宦業、祠廟記、藝文録、名人録、大學生名録、捐資名録、編輯名録、後記。書名據版心題。初修本。,https://jiapu.library.sh.cn/https://jiapu.library.sh.cn/#/GenealogySummary:http://data.library.sh.cn/jp/resource/work/pvzsc5r4shrpui1j
九江郡陶氏族谱六卷 （浙江省温州市泰顺县）,林鹗,陶,--,--,始祖喬，字遷於，號松岡，唐末自蘭谿遷居瑞安白鶴溪口村（今泰順司前）。始遷祖崇伯，後梁龍德元年卜居泰順筱村葛洋村。後裔分佈泰順下洪、司前、碑牌等地。卷一至四世系圖，卷五世傳、墓考、祠志、祠田、祠規，卷六贊詩、贈言、壽文、祭章。譜首部分殘缺。書名據版心題。,https://jiapu.library.sh.cn/https://jiapu.library.sh.cn/#/GenealogySummary:http://data.library.sh.cn/jp/resource/work/dyzqw3zdjtv32nwc
九江义门陈氏宗谱（江西省/九江市/九江县）,陈义炉,陈,1989,德星堂,始迁祖士泷，明朝由江西省九江市德安县迁九江县岷山乡株岭村。 卷首一谱序、前言、职员表、卷号表、住址、祠产记、遗像，卷一谱序、家规、重修序、祠记、凡例、祠图、表奏、名宦诗、家法、分庄、查访、孝义贤节、祠碑文、瓜藤，卷二谱序、遗像、世系，卷三到卷卷十三，卷十四至卷二十一世系。,https://jiapu.library.sh.cn/https://jiapu.library.sh.cn/#/GenealogySummary:http://data.library.sh.cn/jp/resource/work/pnqtrqf62s4k1ubk
九江水黎氏二房谱（广东省/东莞市）,黎荣登,黎,不详,--,始祖臣纲，宋代人。始迁祖发祥（七郎），宋代人。 谱存世系。,https://jiapu.library.sh.cn/https://jiapu.library.sh.cn/#/GenealogySummary:http://data.library.sh.cn/jp/resource/work/a7u5gt6ppmxszet8
九江张氏（华夏张氏统谱•江西九江分谱）（江西省/九江市）,张才火;张才茂,张,2016,--,始祖宁（字康叔，行方十），唐代由长沙择迁武宁紫鹿岭而家焉。 谱载族徽、支脉分布示意图、照片、序、凡例、九江张氏颂、目录、概况、源流世系、繁衍迁徙、人物传记、宗亲联谊、附录、编后记。,https://jiapu.library.sh.cn/https://jiapu.library.sh.cn/#/GenealogySummary:http://data.library.sh.cn/jp/resource/work/ukjw89rl3zq9ur6d
九族汪氏宗谱（江西省上饶市弋阳县）,等;汪文孙,汪,1916年,--,上谱之续修谱。书名据书簽题。存卷首、卷二。,https://jiapu.library.sh.cn/https://jiapu.library.sh.cn/#/GenealogySummary:http://data.library.sh.cn/jp/resource/work/lehb349wcc5a1s9w
九族汪氏宗谱（江西省上饶市弋阳县）,汪学庆;等,汪,清光绪十六年（1890）,--,始迁祖操，字守節，於後唐天成二年自婺源三十一都環珠里迁弋阳县归化乡（今曹溪镇）自西，其後裔分居於弋阳县曹溪、螺川、东溪、石墩、自西、新屋、鞍山、長生壟及德兴石穀源等九村，故稱九族，原谱三十册。存卷首及鵝塘崗分支谱。书名据书簽题。,https://jiapu.library.sh.cn/https://jiapu.library.sh.cn/#/GenealogySummary:http://data.library.sh.cn/jp/resource/work/n284s6ozpgo51s9t
九族汪氏宗谱（江西省上饶市弋阳县）,汪学庆;等,汪,1966年,--,存卷载自西九族宗源系图、碑记、廟记、墓田记等。原谱文革时被焚。1966年汪杏波据清光绪十六年木活字本抄，一册。存卷首、卷二。书名据书簽题。,https://jiapu.library.sh.cn/https://jiapu.library.sh.cn/#/GenealogySummary:http://data.library.sh.cn/jp/resource/work/yy47s2qiurk6iktb
九族汪氏宗谱（弋西操公）十一卷（江西省上饶市弋阳县）,汪克强,汪,1999年,--,上谱之续修谱。卷首、卷二载新序、新编家训、自西九族宗源系图及舊谱資料。卷三至十一为九族分支谱（序、基图、系图、系传、墓誌銘、诗等）。現有人口一万三千馀，外迁他處者，遍布贛、皖、閩、鄂、冀、辽、黔七省十馀县。书名据封面题。,https://jiapu.library.sh.cn/https://jiapu.library.sh.cn/#/GenealogySummary:http://data.library.sh.cn/jp/resource/work/slk7iv7lcecbdkwt
九斗罗氏族谱（台湾省）,罗钦妹,罗,1989,豫章郡,先祖允王公，于胜清康熙丁已年间，由粤东祖居，跋山涉水，渡海入台，落籍今之桃园县新屋乡九斗村。 一、羅氏始祖凌甫公眞像 二、羅氏始祖凌甫公事略 三、豫章始祖大農公事略 四、羅氏的源由 五、羅姓與豫章郡六羅賴傅三姓聯宗的歷史淵源 七、譜序 八、九斗羅氏族譜續編序言九、來台允玉公派下族人誦行條文 十、祖祠重修誌 十一、重修家譜編後感十二、九斗豫章堂公屋、坟墓祖塔全影及略圖十三、墨寶 十四、編輯委員及顧問十五、輩名十六、總編.原居始祖世系十七、始祖系譜 十八、允玉公家訓及家譜弁序 十九、十三世祖心興 公一脈派下列序、二十——五十三、各派下公传系。,https://jiapu.library.sh.cn/https://jiapu.library.sh.cn/#/GenealogySummary:http://data.library.sh.cn/jp/resource/work/a8by3krlpg1lci9y
九思堂闵氏家谱志略（浙江省杭州市）,不详,闵,1997年,--,始迁祖魯農，清代在杭州當差，居錢塘。譜自編撰者高祖记起，有序、人物小傳。书名據封面题。,https://jiapu.library.sh.cn/https://jiapu.library.sh.cn/#/GenealogySummary:http://data.library.sh.cn/jp/resource/work/v376vul457xmxc3w
九川李氏村志（江西省/上饶市/弋阳县）,李龙,李,1994,--,始祖音，唐宪宗幼子，封地于江西德兴。始迁祖佑（字时敬），音九世孙，南唐时官铅山县主簿，宋开宝元年徙居弋阳石头桥（今弋阳湾里乡西李村）。 谱载概述、李氏源流、行派、序言、祠堂记、祭序、传记像赞、敕命、名宦、图像、名胜古迹、民间传说、判决、坝图、世系。,https://jiapu.library.sh.cn/https://jiapu.library.sh.cn/#/GenealogySummary:http://data.library.sh.cn/jp/resource/work/w21hybbbg7ft8cfp
九川李氏宗谱九卷首一卷（江西省上饶市弋阳县）,李京魁,李,1948年,--,始祖音，唐憲宗幼子，封地於江西德興。始遷祖佑，字時敬，音九世孫，南唐時官鉛山縣主簿，宋開寶元年徙居弋陽石頭橋（今弋陽灣里鄉西李村）。卷首凡例、家訓、源流、序、祠記、墓誌銘、行狀、吊綫總世系、陰陽基圖等，卷一至九各支世系。書名據版心題。,https://jiapu.library.sh.cn/https://jiapu.library.sh.cn/#/GenealogySummary:http://data.library.sh.cn/jp/resource/work/ksj3klm4leez8sqt
九峰永思堂吴氏家谱不分卷（福建省漳州市平和县）,不详,吴,1925年,--,始迁祖正直，明代自潮州饒平徙居漳州平和九峰。书名据谱序题。三修本。,https://jiapu.library.sh.cn/https://jiapu.library.sh.cn/#/GenealogySummary:http://data.library.sh.cn/jp/resource/work/wc8bxeow6yc9519f
九峰朱氏族谱不分卷（福建省漳州市平和县）,不详,朱,清光緒間,--,書名據譜序題。,https://jiapu.library.sh.cn/https://jiapu.library.sh.cn/#/GenealogySummary:http://data.library.sh.cn/jp/resource/work/zr96kvs8f2xq4o6z
九峰曺氏宗谱（浙江省/金华市/东阳市）,加忠,--,2001,--,始祖曹磕（字介夫，号乔迁），先居温之永嘉仁唐为婺州吴宁令达乱于治南九峰山麓遂居于此，是为曹孙宅之始祖。明朝十九世祖迁至东阳五度山（今属浙江省金华市东阳市）。 卷上彩图、前言、名次、芳名录、后记、世系图、世行，卷下世行。,https://jiapu.library.sh.cn/https://jiapu.library.sh.cn/#/GenealogySummary:http://data.library.sh.cn/jp/resource/work/bnq7mtxc2g12tzog
九峰曹氏宗谱（浙江省/金华市/东阳市）,曹加忠,曹,2001,--,始迁祖磕（字介夫，号乔迁），先居温之永嘉，唐为婺州吴宁令，达乱于治南九峰山麓遂居于此。 卷一彩图、前言、历次修谱芳名录、后记，卷二世系图，卷三至四世行传,https://jiapu.library.sh.cn/https://jiapu.library.sh.cn/#/GenealogySummary:http://data.library.sh.cn/jp/resource/work/lf59xgh6xb7qqvyr
九峰徐氏世传宗谱八卷（浙江省衢州市常山县）,王逢图;等,徐,1925年,--,谱初修於清乾隆二十二年。,https://jiapu.library.sh.cn/https://jiapu.library.sh.cn/#/GenealogySummary:http://data.library.sh.cn/jp/resource/work/iuegin8h7ys6jdsa
九峰张氏宗谱（浙江省绍兴市新昌县）,不详,张,1947年,世德堂,始祖質，五代人。存卷載世系圖。存卷三、四。書名據版心題。,https://jiapu.library.sh.cn/https://jiapu.library.sh.cn/#/GenealogySummary:http://data.library.sh.cn/jp/resource/work/5vglwv2esmnukk2e
九峰吴氏永思堂族谱不分卷（福建省漳州市平和县）,吴应奎,吴,清咸丰间,--,始迁祖正直，明代自潮州饒平徙居漳州平和九峰。谱载一至九世世系生卒葬及迁徙。书名据书名页题。清乾隆间初修，此为二修本。,https://jiapu.library.sh.cn/https://jiapu.library.sh.cn/#/GenealogySummary:http://data.library.sh.cn/jp/resource/work/63e27dvxfr648txl
九峰刘氏谱稿（浙江省）,不详,刘,民國,--,存卷为房世系。是族居於浙江。存卷四、六、七。书名据书衣题。,https://jiapu.library.sh.cn/https://jiapu.library.sh.cn/#/GenealogySummary:http://data.library.sh.cn/jp/resource/work/9grxchapxmn5k28g
九峰出水莲花吴氏家谱不分卷（福建省漳州市平和县）,不详,吴,1948年,--,始迁祖正直，明代自潮州饒平徙居漳州平和九峰。书名据封面题。,https://jiapu.library.sh.cn/https://jiapu.library.sh.cn/#/GenealogySummary:http://data.library.sh.cn/jp/resource/work/r35v7pgh8d1uubvp
