谱名,责任者,姓氏,撰修时间,堂号,家谱简介,详情链接
饶氏宗谱十二卷首二卷（湖北省黄石市大冶市）,饶华銲,饶,民國30年(1941),敦睦堂,參見饒增盛修《[湖北大冶]饒氏宗譜》七修本條目（館藏：1040384-0406）。（始祖植（字彥立），避安史之亂僑居撫州臨川縣仙源鄉。十五世光祖，元代寓居湖北通山縣。光祖子景榮（行景三）、景華（行景四），元明之際遷居大冶果城，為始遷祖。）。卷首上譜序、聖諭、凡例、家箴、老派行說、老派字、新派行說、統一新派字句、家禮圖、祠圖、墳圖說、墳圖、公產、捐約、領譜說、領譜字號祖名暨保管人名目、修譜人名，卷首下傳序、詩句、跋，卷一至十二統系傳。（館藏：7239/A-E系前五次不同時期修本）書名據版心、書衣題。,https://jiapu.library.sh.cn/https://jiapu.library.sh.cn/#/GenealogySummary:http://data.library.sh.cn/jp/resource/work/aesc46bhcqmj4r35
饶氏宗谱十二卷首一卷末一卷（安徽省宣城市旌德县）,饶玉清,--,清乾隆三十九年（1774）年*2002年,--,始遷祖文濟，北宋真宗時自江西臨川縣遷居安徽旌德縣淳源村。卷一凡例、排行字、祖訓、祠規、祠圖，卷二至六通宗紀，卷七至九家傳、贊，卷十墓圖、田地山塘税畝册，卷十一至十二墓圖，卷末譜跋。書名據版心題。譜初修於南宋乾道三年，此为五修本。,https://jiapu.library.sh.cn/https://jiapu.library.sh.cn/#/GenealogySummary:http://data.library.sh.cn/jp/resource/work/5ie5t6af8x7q3xtz
饶氏宗谱十九卷首二卷末一卷（湖北省黄冈市麻城市）,饶明义,饶,民國35年(1946),--,始遷祖繼二（字敬五）、以仁，南宋末自江西饒州府餘干縣筆架山避兵亂遷居麻城，繼二居西南中館驛南首大河岸，以仁居麻城柏子區饒家灣。卷首上譜序、執事名目、傳、條約、家訓、輩派、雜錄、祠圖、墓圖，卷下祠墓圖，卷一至十九世系，卷末補遺。（館藏：1037892-897記錄繼二遷居時代為明景泰間，與此譜遷徙年代有出入）書名據版心、書衣、書名頁、卷端題。,https://jiapu.library.sh.cn/https://jiapu.library.sh.cn/#/GenealogySummary:http://data.library.sh.cn/jp/resource/work/r4mprj8ip318nxlg
饶氏宗谱十三卷（湖北省黄冈市麻城市）,饶光泰,饶,民國5年(1916),--,始遷祖以仁，宋末元初由江西遷湖北麻城柏子區。生三子，是譜僅記次子省二派下支系。卷一譜序、祠序、傳、合同約據、雜錄、墓圖，卷二至十三世系圖、世系表。書名據版心、書衣、卷端題。,https://jiapu.library.sh.cn/https://jiapu.library.sh.cn/#/GenealogySummary:http://data.library.sh.cn/jp/resource/work/p3yqkig39k5embfn
饶氏宗谱六卷（湖北省黄冈市麻城市）,饶启曾,饶,清光緒8年(1882),--,始遷祖以仁，南宋末自江西饒州府餘干縣筆架山避兵亂遷居麻城柏子區饒家灣。卷一譜序、目錄、名目、傳、條約、雜錄、置田建祠序、傳奇、世系圖、墓圖，卷二至六世系。存卷一、三至六。,https://jiapu.library.sh.cn/https://jiapu.library.sh.cn/#/GenealogySummary:http://data.library.sh.cn/jp/resource/work/b7w37ge32mhx5psq
饶氏宗谱五卷（浙江省衢州市常山县）,饶西垣,饶,1944年,--,始祖廷直，字翔夫，唐代人。始遷祖仲達，字延君，行熾六，明嘉靖三十年自江西豐城縣遷居浙江常山縣虹橋村大洋灘自然村（今屬閣底鄉）。卷一修譜志、譜序、目録、修譜任事名單、像贊，卷二承繼産志、私房、墓圖，卷三至五世系圖。譜初修於清雍正十年，此为七修本。,https://jiapu.library.sh.cn/https://jiapu.library.sh.cn/#/GenealogySummary:http://data.library.sh.cn/jp/resource/work/hxsgvdr37iw72ena
饶氏宗谱二十二卷首一卷（湖北省黄石市大冶市）,饶盛增,饶,民國3年(1914),敦睦堂,始祖植（字彥立），避安史之亂僑居撫州臨川縣仙源鄉。十五世光祖，元代寓居湖北通山縣。光祖子景榮（行景三）、景華（行景四），元明之際遷居大冶果城，為始遷祖。卷首譜序、凡例、家規、傳、山圖、源流世系，卷一至二十二世系。（館藏號：1040200-0214系八修本，另館藏：7239/A-E系前五次不同時期修本）缺卷十一。,https://jiapu.library.sh.cn/https://jiapu.library.sh.cn/#/GenealogySummary:http://data.library.sh.cn/jp/resource/work/k4bdbpx72t64d46g
饶氏宗谱不分卷（湖北省黄石市大冶市）,饶永春,饶,清咸豐10年(1860),敦睦堂,先祖同上。存卷为世系。書名據版心*書簽題。,https://jiapu.library.sh.cn/https://jiapu.library.sh.cn/#/GenealogySummary:http://data.library.sh.cn/jp/resource/work/ijwqcz5gjjq5lf3c
饶氏宗谱不分卷（湖北省黄石市大冶市）,饶仕河,饶,清乾隆26年(1761),敦睦堂,始祖植翁，字彦雲，唐代人，居撫州仙原鄉。南宋時，有裔孫名光祖者，寓居湖廣通山縣。子榮（行景三）、華（行景四）兄弟，由通山再遷大冶果城里，为始遷大冶祖。存卷为世系。書名據版心題。,https://jiapu.library.sh.cn/https://jiapu.library.sh.cn/#/GenealogySummary:http://data.library.sh.cn/jp/resource/work/o7q2gdskdbw5m4ly
饶氏宗谱□□卷（湖北省黄冈市麻城市）,饶惟坤,饶,清光緒4年(1878),--,始遷祖繼二（字敬五，行二府君），明景泰間自江西饒州府餘干縣筆架山遷居湖北麻城。卷首譜序、派行、家訓、凡例、規約、祠堂圖、陰陽二宅圖，卷一至六世系。存卷首，卷一至三、五、六。,https://jiapu.library.sh.cn/https://jiapu.library.sh.cn/#/GenealogySummary:http://data.library.sh.cn/jp/resource/work/qeotr6rjdze4a438
饶氏宗谱□□卷（湖北省黄冈市麻城市）,--,饶,民國,--,參見清饒啟曾修《[湖北麻城]饒氏宗譜》條目（館藏：1037898-902）。（始遷祖以仁，南宋末自江西饒州府餘干縣筆架山避兵亂遷居麻城柏子區饒家灣。）。存卷為世系。存卷五、六。,https://jiapu.library.sh.cn/https://jiapu.library.sh.cn/#/GenealogySummary:http://data.library.sh.cn/jp/resource/work/y5j7kpbs5m9sai5s
饶氏宗谱□□卷(江西修水),佚名,饶,清光緒24年(1898),--,參見清饒方榖修《[江西修水]平陽饒氏三沙宗譜》八修本條目（館藏：1057768-777）。始祖賓（字克禮，號謹齋），南宋時世居臨川。生子三，長鑑（字秉明，號月灣，行利十三），次錡（字秉元，行利十四），三鎮（字秉安，行利十五），宋末兄弟避元兵遷居義寧州（今修水），誓以逢沙而止，鑑居西鄉白沙；錡居泰鄉南嶺下高沙；鎮先居仁鄉大橋黃沙，後徙安鄉黃沙。是譜即為白沙、高沙、黃沙三沙合修。卷六世系圖，卷八至十六世系。,https://jiapu.library.sh.cn/https://jiapu.library.sh.cn/#/GenealogySummary:http://data.library.sh.cn/jp/resource/work/na5a0foaxqmiylpr
饶氏创修宗谱四卷（河南省）,饶官方;饶维经,饶,民國32年(1943),--,是族於宋元間自江西鄱陽瓦屑壩遷居河南光山爐潑沖及雙輪河。譜尊明代人統為始祖。又尊學章（二世）為南關支祖，先榮（四世）為雙輪河支祖，俊（五世）為林崗支祖，柱（五世）為饒家祠支祖，賢（五世）為大饒店支祖，義（六世）為曹家莊支祖，國虎（六世）為包莊支祖，信（六世）為高陌店支祖，琦（六世）為黃家樓支祖，上希（二世）為觀廟鎮支祖。卷一目次、凡例、譜序、宗支考略、塋田地序、傳、紀實、家規、譜訓、祭禮、祝文、執事名目，卷二至四世系。書名據目錄題。,https://jiapu.library.sh.cn/https://jiapu.library.sh.cn/#/GenealogySummary:http://data.library.sh.cn/jp/resource/work/zd423rxzy2bttk3o
饶氏五县联修宗谱（江西省）,饶万斌;饶佐奇,饶,2009,--,谱为湖口县、永修县、新建县、星子县、彭泽县联修宗谱。始祖祯明（号月波）生二子：福一、福二。福一生子京一至京十二，为避北宋战乱，由雍州迁徽州紫竹源，金兵继续南侵，十二京兄弟再分迁各地。京一公由徽州紫竹源迁至饶州秀水山。饶鲁（字伯舆，号双峰）之子饶高、饶淳、饶亨迁至湖口棠里等地，为湖口饶姓始祖。饶高幼子饶必逮（字武卿）任建昌县尉定居永修，为永修饶姓始祖。必逮六世孙德铭之幼子饶文奎由永修马湾河头迁新建大塘坪，为新建饶姓始祖。饶高次子饶必达，宋咸淳进士，为泗州御史，其幼孙饶闵，元泰定四年由湖口棠里迁居南康府星子县青泉乡，为星子饶姓始祖。福二公之孙饶元豪由徽州紫竹源迁临江府，其后裔由临江府迁彭泽石壁山，为彭泽饶姓始祖。 谱载现状概况、总论、序言篇、源流篇、人物篇、产业篇、文化篇、组织机构。,https://jiapu.library.sh.cn/https://jiapu.library.sh.cn/#/GenealogySummary:http://data.library.sh.cn/jp/resource/work/9pgbhxfxe9tryg54
饶氏九修族谱（江西省/抚州市/临川区）,饶松如,饶,1950,--,始祖元亮，唐德宗时为浙东安抚使，调任浙西，由鄱阳徙居南城。始迁祖竭（行七一），宋明经进士，由临川林苑迁居邑之周溪。 卷一谱序、目录、诰封、跋、式例、凡例、祠规、祠训、坟山、山图、世派、传赞、寿序、祠记、告示、山地田粮、修谱人名、领谱人名，卷二至八世纪。,https://jiapu.library.sh.cn/https://jiapu.library.sh.cn/#/GenealogySummary:http://data.library.sh.cn/jp/resource/work/a73c3y778ore1ieo
饶氏九修族谱（全国）,等;饶世伟,饶,2013,馀庆堂,始祖饶元亮，唐德宗年间，官至浙东、浙西安抚，晚年归江西饶州饶阳（今江西省上饶市鄱阳县），后定居江西省抚州市南丰县蓝田乡。本谱主要记载其后裔散居江西省抚州市广昌县坳背源、浙江省丽水市青田县、衢州市等地的饶氏宗支世系。 卷一宗亲合影照片、村景、村貌、谱序、九修族谱前言、凡例、源流纪、年表、仕宦、领谱字号、跋，卷二至十二世系。,https://jiapu.library.sh.cn/https://jiapu.library.sh.cn/#/GenealogySummary:http://data.library.sh.cn/jp/resource/work/ks3k1txiavh8e6dr
饶氏九修族谱不分卷（江西省抚州市）,饶庆福;饶全福,饶,民國35年(1946),--,始祖斌（字文徽），唐代人，先世自邵武遷居鄱陽。七世熊（又名夢祥，字伯章），北宋建隆間遷臨川（今撫州）招賢鄉述坡岡金砂堡西。始遷祖二十一世宣伯（字益遜，行巨一），南宋祥興間遷居邑之中溪。譜載譜序、遺像、敕命、傳、凡例、家規、家訓、家誡、祖訓、領譜字號、糾首人名、派行、贊、新修顏家渡樂善橋記、祠堂記、助捐、跋、世系等。書名據版心題。,https://jiapu.library.sh.cn/https://jiapu.library.sh.cn/#/GenealogySummary:http://data.library.sh.cn/jp/resource/work/8zfm5pxtshasf4ir
饶东新昌侯氏宗谱重修（江西省/上饶市）,侯梓裕,侯,1999,--,参见民国时修《[江西上饶]侯氏宗谱》条目（馆藏：1040662-0665）。始迁祖达二（字大宾），明后期自福建邵武光泽县迁居江西上饶六十五都新昌。 卷首（即卷一）新序、旧序、目录、凡例、字派、领谱字号、基址图、像图、墓图，卷二世系图，卷三至五世系。卷首（即卷一）的图像、墓图部分为复印件。,https://jiapu.library.sh.cn/https://jiapu.library.sh.cn/#/GenealogySummary:http://data.library.sh.cn/jp/resource/work/oo4bojk4p5f4zaqy
饶李族志（四川省/巴中市/通江县）,李思泰,李;饶,1996,--,本谱为饶、李合谱。饶氏始迁祖玉鉴，清代从湖南省娄底市新化县迁四川省巴中市通江县毛浴镇。李氏始迁祖继唐，清代从陕西省延安市迁四川省巴中市通江县毛浴镇。 谱载前言、饶李渊源、世系表、附录。,https://jiapu.library.sh.cn/https://jiapu.library.sh.cn/#/GenealogySummary:http://data.library.sh.cn/jp/resource/work/rkxlgfgvak5nx68b
饶族家谱（台湾省/台中市）,佚名,饶,不详,--,谱奉清末民国初年人登为始迁祖。,https://jiapu.library.sh.cn/https://jiapu.library.sh.cn/#/GenealogySummary:http://data.library.sh.cn/jp/resource/work/anb54yj4o73pysd3
饶忠山派下系统表（台湾省/台东县）,佚名,饶,1979,--,迁台湾始迁祖忠山。,https://jiapu.library.sh.cn/https://jiapu.library.sh.cn/#/GenealogySummary:http://data.library.sh.cn/jp/resource/work/uct6m5g8x1ej7ylc
饶平黄冈刘氏族谱（广东省/潮州市/饶平县）,刘宗仁,刘,2007,--,本派始祖颍，据传祖籍河东（今山西省），唐末随父宦于广东，后遂创业于潮州桃坑。谱奉其孙表为本宗一世祖。第十四世珪（字友执，行一），明代由潮州析居饶平县黄冈。 谱载引言篇、溯源篇、汉刘光辉、刘氏骄子、世系篇、宗族文化、其他篇、附录篇、是谱以明代志学公修编的旧族谱和一九九二年桃坑编写的《刘氏族谱》为依据，增加了近代世系和宗族文化。,https://jiapu.library.sh.cn/https://jiapu.library.sh.cn/#/GenealogySummary:http://data.library.sh.cn/jp/resource/work/tewggaqp4n2yu7vj
饶平隆都大巷乡陈氏族谱不分卷（广东省潮州市饶平县）,陈沅,陈,1934年,--,始遷祖古福，字東山，宋代人。書名據目録題。記事至清光緒三十二年。,https://jiapu.library.sh.cn/https://jiapu.library.sh.cn/#/GenealogySummary:http://data.library.sh.cn/jp/resource/work/h81kvn2lxuupync4
饶平陈氏族谱（台湾省桃园县）,陈盛源,陈,1935年,--,始祖新穎，號百元，明季移居廣東饒平。始遷祖龍貴，始徙臺灣，後裔散居桃園縣。,https://jiapu.library.sh.cn/https://jiapu.library.sh.cn/#/GenealogySummary:http://data.library.sh.cn/jp/resource/work/3737urhohcijc2ur
饶平郑氏族谱（广东省/潮州市/饶平县）,朱光天,郑,1997,--,始祖清之（字德源，号碧泉）、侨（宋朝人）。始迁祖八郎、治（宋朝人）、敦直（元朝人）。,https://jiapu.library.sh.cn/https://jiapu.library.sh.cn/#/GenealogySummary:http://data.library.sh.cn/jp/resource/work/s8gnhig9mohm8e2g
饶平迁台许氏族谱（台湾省）,许学大,许,1966,--,始迁祖上珍（字席占，谥文通），清季自广东饶平迁台湾。,https://jiapu.library.sh.cn/https://jiapu.library.sh.cn/#/GenealogySummary:http://data.library.sh.cn/jp/resource/work/gghjonnz5atwkkvm
饶平道韵黄氏族谱（广东省/潮州市/饶平县）,黄步升,黄,1987,--,始迁祖建饶(号七郎)，于延祐年间由福建澄州宁化石壁(今福建省三明市宁化县石壁镇)迁广东，居饶平道韵乡(今广东省潮州市饶平县三饶镇南联主村道韵楼)。 谱载族谱略序、编者献语、世系一览、附录。,https://jiapu.library.sh.cn/https://jiapu.library.sh.cn/#/GenealogySummary:http://data.library.sh.cn/jp/resource/work/ex4zxs58pqrmqzp5
饶平詹氏渊源与大坪巷族谱（广东省/潮州市/饶平县）,詹浸,詹,1998,--,始祖学传，字成宗，号正峰，宋靖康间自徽州迁居广东大埔茶阳长窖村。始迁祖上弦，字东璐，号肇熙，行三五郎，南宋时再徙饶平西瓜园。支祖孔权，上弦六世孙，明成化间析居本邑大坪巷。 谱载前言、辈序诗、辈序诗诠释、渊源、詹氏总世系、大坪巷族谱、参考资料、家庭重要记事栏等。书名据封面题。,https://jiapu.library.sh.cn/https://jiapu.library.sh.cn/#/GenealogySummary:http://data.library.sh.cn/jp/resource/work/h9gj4utkqfib7e7u
饶平詹氏族谱（广东省/潮州市/饶平县）,詹定初,詹,2018,--,始祖学传（字成宗，号正峰，行五十），原籍江西建昌府南丰州广昌县头陂头村，宋靖康年间迁居广东潮州府海阳县恋州都茶阳长窖村（广东省梅州市大埔县长治乡长兴村）。六世孙上弦（字东潞，号维明，谥肇熙，行三五），南宋时再徙居弦歌都上饶堡西瓜园（潮州市饶平县饶洋镇八瓜村）。 谱载总谱（卷首篇、世系篇、文献篇、人物篇及附录篇）、伯玉公世系、伯〓（王+善）公世系、伯珪公世系、多世系综合卷（百一郎公世系、百二郎公世系、百三郎公世系)。,https://jiapu.library.sh.cn/https://jiapu.library.sh.cn/#/GenealogySummary:http://data.library.sh.cn/jp/resource/work/xe83pl8q88m633b4
饶平詹氏族谱伯玉公世系（广东省/潮州市/饶平县）,詹定初,詹,2013,--,饶平始祖肇熙公，迁徙本谱不详。伯玉公，行大一郎，号大宗，生于明洪武戊申年，系饶平开基始祖肇熙公第四世孙，于明时创居饶平新丰丰联，妣余氏九娘、黄氏十二娘，生三子：宗义、宗宙、宗健。 开基饶平詹氏始祖、伯玉公世系、宗义公长房彦和公世系、二房彦安公世系、宗宙公长房九村锡康大壁公世系、二房国让公世系、宗健公世系、世系辈序对照表、辈序。,https://jiapu.library.sh.cn/https://jiapu.library.sh.cn/#/GenealogySummary:http://data.library.sh.cn/jp/resource/work/4k5k9gwpk7elbywu
饶平县耀辉公派下渡台林氏族谱（台湾省/台中市）,--,林,不详,--,始祖慧翼，原姓赵，宋元间改姓林。始迁祖文辉，清代自广东饶平移居台湾台中县天平乡。,https://jiapu.library.sh.cn/https://jiapu.library.sh.cn/#/GenealogySummary:http://data.library.sh.cn/jp/resource/work/dk5rvdchvzy6jd3z
饶平县溪许氏族谱（广东省/潮州市/饶平县）,许嘉立,许,1981,--,始迁祖大安，广东省潮州府饶平县原歌都五紫岒大荣社平溪乡一世祖。这支有部分后人居于台湾。 内录许氏族谱、宗祠、故居画、谱序、昭穆志、许氏世系等。,https://jiapu.library.sh.cn/https://jiapu.library.sh.cn/#/GenealogySummary:http://data.library.sh.cn/jp/resource/work/8l7gzj4seo49trbx
饶平县水口邱氏下新楼族谱（广东省/潮州市/饶平县）,邱永生;邱大坡,邱,2017,--,始祖庚孙（谥永延），元末明初自福建上杭迁居广东饶平县水口乡西山坝竹岭下（石狮厦）。始迁祖九世孙元稷（字学灵，又字绍永，谥康毅），明嘉靖间迁邑之水口下新楼。 谱载引言、说明、图片、世系图、世系传，家训、格言、家规、昭穆排辈知识、称谓、表。,https://jiapu.library.sh.cn/https://jiapu.library.sh.cn/#/GenealogySummary:http://data.library.sh.cn/jp/resource/work/a7y6fv3fq8ma3qkc
饶平县平溪许氏族谱（台湾省/台北市）,许嘉立,许,1981,--,始迁祖敦古，原籍广东省潮州府饶平县弞都五紫岭脚大荣永平溪乡（现名饶平县坪溪镇上社村），清康熙三十九年渡海居台湾。 内录谱序、世系、昭穆志等。,https://jiapu.library.sh.cn/https://jiapu.library.sh.cn/#/GenealogySummary:http://data.library.sh.cn/jp/resource/work/1w6td3rn9xcozmu8
饶平县元敬歌图陈姓族谱（台湾省桃园县）,陈耀奎,陈,1969年,--,始祖梃槙，原居廣東饒平。始遷祖文根、文平，清代移居臺灣，後裔散居桃園縣等地。,https://jiapu.library.sh.cn/https://jiapu.library.sh.cn/#/GenealogySummary:http://data.library.sh.cn/jp/resource/work/2rim3ffqyjrttbk5
饶平石井和厚公迁台族谱（台湾省/新竹县）,刘桂梃,刘,1977,--,始祖承信，宋代人。始迁祖和厚，又名可策，清季移居台湾，后裔散居新竹县新埔镇等地。又名刘氏家谱。,https://jiapu.library.sh.cn/https://jiapu.library.sh.cn/#/GenealogySummary:http://data.library.sh.cn/jp/resource/work/ipspebni7nie4mli
饶平渡台黄氏族谱（台湾省/桃园市）,黄元龙,黄,1976,--,台湾始迁祖纯宾。,https://jiapu.library.sh.cn/https://jiapu.library.sh.cn/#/GenealogySummary:http://data.library.sh.cn/jp/resource/work/4jdrtihheh1n6g9u
饶平永善始祖子清公派衍邓氏族谱（广东省/潮州市/饶平县）,邓潮达;邓开颂,邓,2012,善庆堂;南阳堂,入粤始祖志斋（字文渊，号太乙），宋庆元年间自福建省汀州府宁化县石壁禾口村迁居潮州府程乡（广东今梅州）。四世孙子清（字卜善，号一百五郎，十一郎），元延祐年间，于战乱中自古梅蕉岭蓼坡移居潮州府饶平县元歌都下善乡（又称宝善乡，今饶平县上饶镇永善村）拓基。 谱载总谱（列祖画像及传略、总谱世系）、分谱（饶平永善始祖子清公画像及传略、世系图录列表、世系文字说明、家族迁移说明、人物事迹、重要纪事、宗族文化）、家谱（通讯录）、附录等。,https://jiapu.library.sh.cn/https://jiapu.library.sh.cn/#/GenealogySummary:http://data.library.sh.cn/jp/resource/work/g4lpavel5jtuijuw
饶平朱氏族谱（广东省/潮州市/饶平县）,朱慧施,朱,2000,--,谱以南宋理学家朱熹为始祖，熹（字元晦，号晦庵、又号紫阳），原籍江西婺源。始迁祖元通、金昆、玉季兄弟，明嘉靖五年自福建省东山县渡海迁居广东饶平信宁都（今饶平海山镇），先卜居野水村，后迁黄隆乡定居。后裔散居南滇、饶平、潮州、澄海、普宁、汕头、海丰、陆丰等地。,https://jiapu.library.sh.cn/https://jiapu.library.sh.cn/#/GenealogySummary:http://data.library.sh.cn/jp/resource/work/g6b4z3ay5zz1aexn
饶平朱氏族谱（广东省/潮州市/饶平县）,朱惠南,朱,2021,--,谱以南宋著名理学家朱熹为始祖，熹（字元晦，号晦庵、又号紫阳），原籍江西婺源。始迁祖十七世金昆、玉季兄弟，明嘉靖五年自福建省东山县渡海迁居广东饶平信宁都（今饶平海山镇），先卜居野水村，后迁黄隆乡定居。 谱载地图、宗祠概况、前言、说明、编委会成员、序、寄语、贺词、祖像、家训、家规、家政、格言、读书方法、诗选、溯源问祖、源流世系、风徽典范、宗族文化传承、后记、编后语、感谢信、结语、附录。,https://jiapu.library.sh.cn/https://jiapu.library.sh.cn/#/GenealogySummary:http://data.library.sh.cn/jp/resource/work/4pfkemof4bv1euma
饶平庄氏锦绣族谱（广东省/潮州市/饶平县）,庄氏族谱委员会饶平分会修编 庄栋梁[等]校对,庄,2000,--,本谱收录了凡居住于饶平境内的宗亲、并在一九九九年十二月三十一日前出生的族亲，自愿参与修谱、入谱者。还有饶平县地图、庄氏祖先图像、各镇世系概述、历代功名和文献选辑等。 同上,https://jiapu.library.sh.cn/https://jiapu.library.sh.cn/#/GenealogySummary:http://data.library.sh.cn/jp/resource/work/s4rcitlzthpdsjt4
饶平大巷陈氏族谱二卷（广东省潮州市饶平县）,陈沅,陈,1934年,--,始遷祖古福，字東山，宋代人。書名據卷端題。,https://jiapu.library.sh.cn/https://jiapu.library.sh.cn/#/GenealogySummary:http://data.library.sh.cn/jp/resource/work/gq5ln3tc3h6epp72
饶平堂陈氏族谱（台湾省新竹市）,陈明泉,陈,--,--,始祖萬福，清末民初人，後裔散居新竹縣、新竹市等地。記事至1976年。,https://jiapu.library.sh.cn/https://jiapu.library.sh.cn/#/GenealogySummary:http://data.library.sh.cn/jp/resource/work/9y6fa31q7acdlz6y
饶平启禹迁台周氏家谱（台湾省台南市）,周金彪,周,1979年,--,始遷祖貢，清季遷臺灣。書名自擬。,https://jiapu.library.sh.cn/https://jiapu.library.sh.cn/#/GenealogySummary:http://data.library.sh.cn/jp/resource/work/a8ar8z4s32gnc4to
饶平来台杨象圣派下家谱（台湾省/桃园市）,杨寿荣,杨,1974,--,始祖宸熙，广东饶平人。始迁祖象圣，清代移居台湾。后裔散居桃园县龙潭乡、新竹县关西镇及台北市等地。,https://jiapu.library.sh.cn/https://jiapu.library.sh.cn/#/GenealogySummary:http://data.library.sh.cn/jp/resource/work/m69r9wcbqnn14hfa
饶平来台杨象圣派下家谱（台湾省/桃园市）,杨宿留,杨,1971,--,始祖宸熙，广东饶平人。始迁祖象圣，清代移居台湾。后裔散居桃园县龙潭乡、新竹县关西镇及台北市等地。,https://jiapu.library.sh.cn/https://jiapu.library.sh.cn/#/GenealogySummary:http://data.library.sh.cn/jp/resource/work/cfvsnvx8fkrngqu7
饶平余氏族谱（广东省/潮州市/饶平县）,余构养,余,2005,--,始祖靖（原名希古，字安道，一字崇嵩，号武溪，谥忠襄，行一），世居广东韶州府曲江县拔萃坊，仕宋。八世孙英（字文英，号节翁），发轫于海阳县弦歌都严寨居田里（广东潮州市饶平县新丰镇扬康），元大德九年移居太平乡宣化都黄冈堡（饶平黄冈镇），为饶平余氏凤岗派衍始祖。十二世孙驴（匏派， 号东轩，行五），约元朝迁居下饶（饶平联饶镇）之松柏树埔等处，为菁园派衍开基祖。十六世通（字道融，号勤实，谥文哲），明朝自饶平金溪创居长教乡，为金溪（长教）派衍开基祖。 谱载饶平余氏溯源、派衍、文物、人口、人物、教育、艺文、附记、世系等。,https://jiapu.library.sh.cn/https://jiapu.library.sh.cn/#/GenealogySummary:http://data.library.sh.cn/jp/resource/work/ufrm9rr9osvbfzm3
饶姓族谱饶有发公胍下（台湾省）,饶石兴,饶,1984,--,始迁祖有发，清季迁台湾。,https://jiapu.library.sh.cn/https://jiapu.library.sh.cn/#/GenealogySummary:http://data.library.sh.cn/jp/resource/work/ewf48vu2vde4bo2j
