谱名,责任者,姓氏,撰修时间,堂号,家谱简介,详情链接
会稽山章氏家乘汇集（浙江省绍兴市）,--,章,明崇禎7年(1634),--,参见明章冠修《会稽翶山章氏家乘初集》条目。存卷1-6，卷首,https://jiapu.library.sh.cn/https://jiapu.library.sh.cn/#/GenealogySummary:http://data.library.sh.cn/jp/resource/work/h8eiuj5hgihcdgsw
会稽山章氏家乘初集二卷（浙江省绍兴市）,章仕浮,章,明崇禎7年(1634),--,晋兵部尚书章砶为居南安之一世祖，至唐有康州刺史及迁居浦城，为浦城一世祖。其後裔謐由浦城迁居山阴；南宋光宗、宁宗间，彦武又自山阴兰亭街迁居会稽翶山，为翶山章氏始迁祖。是谱分正集、初集、汇集。据序云，正集独尊彦武(唯载彦武以下)；初集载会稽聚族以上，诸家谱序，章氏之受姓、肇迹；汇集则载名公赠言、家藏遗稿。此为初集，卷一北宋以来谱序，卷二南安、浦城世系表。,https://jiapu.library.sh.cn/https://jiapu.library.sh.cn/#/GenealogySummary:http://data.library.sh.cn/jp/resource/work/26fg8fxnfebq46xg
会稽龚氏宗谱（浙江省绍兴市）,不详,龚,清,慈庆堂,是族先居鎮江，後徙剡溪之畈田。始遷祖義，由畈田入贅會稽某氏。存卷为譜序、傳記、行述、誥命等。有吕頤浩、文天祥、余煌、傅伯成等人所作序，寇准撰文。書名據版心題。記事至清道光間。,https://jiapu.library.sh.cn/https://jiapu.library.sh.cn/#/GenealogySummary:http://data.library.sh.cn/jp/resource/work/jykxz84uh1ndkpnb
会稽黄壤坞李氏宗谱五卷（浙江省绍兴市）,李昌增,李,1919年,忠贤堂,始祖湛，唐代人。始遷祖澤，行千，號適庵，又號蘭轂，元代自山陰縣遷居會稽（今屬紹興縣）黄壤塢。卷一譜序、傳贊、凡例、禁約，卷二系圖、遺像，卷三至五行傳。書名據卷端題。譜初修於清乾隆十三年，此为五修本。,https://jiapu.library.sh.cn/https://jiapu.library.sh.cn/#/GenealogySummary:http://data.library.sh.cn/jp/resource/work/iz3hiqgfc8rmo8mx
会稽鲍氏五思堂宗谱四卷首一卷会稽鲍氏五思堂宗谱四卷首一卷（浙江省绍兴市）,鲍德福,鲍,民國,五思堂,始遷祖曾尚（一名恩，字尚志）、曾可（字惠遠），清乾隆三十九年自安徽歙縣東鄉新館村以業鹺遷居浙江會稽縣（今屬紹興市）高車頭村。上譜之續修譜。卷一譜例、排行字、誥敕、家傳、雜記，卷二至四尚志公、惠遠公派世系圖譜。書名據版心、書簽題。三修本,https://jiapu.library.sh.cn/https://jiapu.library.sh.cn/#/GenealogySummary:http://data.library.sh.cn/jp/resource/work/5s8tkzde5lml5zgf
会稽鲁氏宗谱三卷（浙江省绍兴市嵊州市）,鲁毓王,鲁,清光緒二十二年（1896）,--,始祖得茂，宋南渡时移居餘姚县大嵐山。始迁祖佛清，明末清初再徙嵊县蔡墅村（今嵊州市石磺镇）。卷一谱序、原谱、敕诰、敕赞、世系图紀、行第、附約、後跋，卷二祖像、世系图，卷三行传。书名据卷端、目录题。十五修本。,https://jiapu.library.sh.cn/https://jiapu.library.sh.cn/#/GenealogySummary:http://data.library.sh.cn/jp/resource/work/h7pnamf337722f9e
会稽高车头鲍氏宗谱八卷（浙江省绍兴市）,鲍德福,鲍,清光緒二十七年（1901）,五思堂,始遷祖曾尚（一名恩，字尚志）、曾可（字惠遠），清乾隆三十九年自安徽歙縣東鄉新館村以業鹺遷居浙江會稽縣（今屬紹興市）高車頭村。上譜之續修譜。卷一誥敕、史傳，卷四世系，卷六祠規、祭祀，卷七祭田，卷八義田、義塾、藏書目、清節田。存卷一、四至八。書名據卷端題。二修本。,https://jiapu.library.sh.cn/https://jiapu.library.sh.cn/#/GenealogySummary:http://data.library.sh.cn/jp/resource/work/6ff9b4fglfqon67t
会稽高车头鲍氏五思堂宗谱六卷（浙江省绍兴市）,鲍存良,鲍,清光緒元年（1875）,五思堂,始遷祖曾尚（一名恩，字尚志）、曾可（字惠遠），清乾隆三十九年自安徽歙縣東鄉新館村以業鹺遷居浙江會稽縣（今屬紹興市）高車頭村。書名據書簽題。,https://jiapu.library.sh.cn/https://jiapu.library.sh.cn/#/GenealogySummary:http://data.library.sh.cn/jp/resource/work/grybzfr6jhoqd1qo
会稽冯氏宗谱四卷（浙江省绍兴市）,冯焕,冯,清光緒十八年（1892）,永思堂,始祖元，諡文濟，宋代人。始迁祖鼎，行百十五，南宋光宗時自諸暨櫟橋村迁居會稽雷門鄉宁桑村。卷一祠记、凡例、訓規、祖像、祠墓、祭产、行述等，卷二至三世系图、行傳，卷四祭規。书名據版心、书簽、书名页、目录题。二修本。,https://jiapu.library.sh.cn/https://jiapu.library.sh.cn/#/GenealogySummary:http://data.library.sh.cn/jp/resource/work/rejn549227syg2p6
会稽雷峰郑氏宗谱四卷（浙江省绍兴市）,郑瀚,郑,清乾隆五十一年（1786）,--,--,https://jiapu.library.sh.cn/https://jiapu.library.sh.cn/#/GenealogySummary:http://data.library.sh.cn/jp/resource/work/gs36zy47zwynw2np
会稽云门李氏宗谱十二卷（浙江省绍兴市）,李树蕃,李,清光緒十八年（1892）,厚德堂,始祖湛，唐代人。始遷祖顯忠，謚忠襄，南宋初自河南遷居浙江會稽縣雲門村（今屬紹興縣平江鄉）。卷一序、贊、凡例、墓誌銘、傳、世系引，卷二至四世系圖，卷五至十行傳，卷十一行傳、補遺，卷十二世派、祀彦。書名據版心題。譜初修於明萬曆三十二年，此为八修本。,https://jiapu.library.sh.cn/https://jiapu.library.sh.cn/#/GenealogySummary:http://data.library.sh.cn/jp/resource/work/ohg3qvf5o57wdug7
会稽云门应氏宗谱三卷（浙江省绍兴市）,应沛霖,应,1912年,敦伦堂,始遷祖仲珩，又名玢，字君哲，號文質，行仲十。書名據版心題。,https://jiapu.library.sh.cn/https://jiapu.library.sh.cn/#/GenealogySummary:http://data.library.sh.cn/jp/resource/work/1fb18alh3zrgpq9x
会稽陶氏东长房分谱不分卷 （浙江省绍兴市）,陶传尧,陶,清,--,始遷祖岳，字宗楊，行幸五，元代自新昌遷居會稽（今紹興）鑑湖堰南。明人陶諧、陶承學，近人陶成章皆出此族。譜載世系表、世傳、列傳、墓地表、始遷说、誥命、祀典志、園亭。書名據卷端題。,https://jiapu.library.sh.cn/https://jiapu.library.sh.cn/#/GenealogySummary:http://data.library.sh.cn/jp/resource/work/ba6mvke4p3r3aobl
会稽陶氏族谱（浙江省绍兴市）,不详,陶,清,--,始遷祖岳，字宗楊，行幸五，元代自新昌遷居會稽（今紹興）鑑湖堰南。明人陶諧、陶承學，近人陶成章皆出此族。譜存藝文志，墓地、祭产考部分。存卷八、九、二十四至二十八。書名據版心題。,https://jiapu.library.sh.cn/https://jiapu.library.sh.cn/#/GenealogySummary:http://data.library.sh.cn/jp/resource/work/bgwnopto64muzvwp
会稽陶氏族谱不分卷(浙江台州),陶家骏,陶,2013年,--,始遷祖嶽（字宗楊，行峰五），先世居江西潯陽，宋末避亂江南，轉輾遷居台州，嶽於元末明初遷居台州堰南。子六，此為義（字子宜，行昌三）、盛（行昌二）兩房合修譜。第一冊六修族譜序、凡例、地望、始遷、目錄、榮譽志、仕宦志、宅第志、祠墓志、坊表園亭志、文物古跡、藝文志、世系志，第二冊至九冊世系，第十冊人物志、列傳、人物簡介、傳略、編後記。,https://jiapu.library.sh.cn/https://jiapu.library.sh.cn/#/GenealogySummary:http://data.library.sh.cn/jp/resource/work/azdx6mzmdb1hdzy3
会稽陶氏族谱不分卷 （浙江省绍兴市）,陶元藻,陶,清乾隆間,--,始遷祖岳，字宗楊，行幸五，元代自新昌遷居會稽（今紹興）鑑湖堰南。明人陶諧、陶承學，近人陶成章皆出此族。譜載譜序、姓系、地望、始遷、派别、譜辨说、世傳、藝文志、祠禮、坊表、園亭志、記勝詩。書名據書簽、目録題。,https://jiapu.library.sh.cn/https://jiapu.library.sh.cn/#/GenealogySummary:http://data.library.sh.cn/jp/resource/work/4cnkbbg3qqmnpcpu
会稽陶氏族谱三十卷首一卷 （浙江省绍兴市）,陶元藻,陶,清乾隆51年(1786),--,始遷祖岳，字宗楊，行幸五，元代自新昌遷居會稽（今紹興）鑑湖堰南。明人陶諧、陶承學，近人陶成章皆出此族。卷首序、凡例，卷一姓系、地望、始遷、派别、譜辨说，卷二至五誥敕，卷六至十一世系，卷十二世傳，卷十三至十五隱德傳，卷十六至十九列傳，卷二十節婦傳，卷二十一至二十三賢媛傳，卷二十四藝文志，卷二十五至二十八墓地、祭産考，卷二十九祠祀、坊表、園亭志，卷三十外編。書名據版心、書簽、目録、卷端題。,https://jiapu.library.sh.cn/https://jiapu.library.sh.cn/#/GenealogySummary:http://data.library.sh.cn/jp/resource/work/go8e8n9gl6tlz4dx
会稽陶氏族谱三十二卷(浙江绍兴),陶际尧,陶,清道光9年(1829),--,始遷祖岳（字宗楊，行幸五），元代自新昌遷居會稽（今紹興）鑑湖堰南。明人陶諧、陶承學，近人陶成章皆出此族。卷一姓系、地望、始遷、派別、昌邑譜辨說，卷二至五誥敕，卷六至十一世系，卷十二世傳，卷十三至十五隱德傳，卷十六至十九列傳，卷二十節婦傳，卷二十一至二十三賢媛傳，卷二十四藝文志，卷二十五至二十八墓地、祭產考，卷二十九祠祀、坊表、園亭志，卷三十敘傳，卷三十一碑表、誌銘考，卷三十二科甲、編年考，附文節公殉難事跡。譜載仇兆鼇序文。,https://jiapu.library.sh.cn/https://jiapu.library.sh.cn/#/GenealogySummary:http://data.library.sh.cn/jp/resource/work/wpnsvj8lhv64p51a
会稽陶氏族谱三十二卷(浙江绍兴),陶际尧,陶,清道光10年(1830),--,始遷祖岳（字宗楊，行幸五），元代自新昌遷居會稽（今紹興）鑑湖堰南。明人陶諧、陶承學，近人陶成章皆出此族。卷一姓系、地望、始遷、派別、昌邑譜辨說，卷二至五誥敕，卷六至十一世系，卷十二世傳，卷十三至十五隱德傳，卷十六至十九列傳，卷二十節婦傳，卷二十一至二十三賢媛傳，卷二十四藝文志，卷二十五至二十八墓地、祭產考，卷二十九祠祀、坊表、園亭志，卷三十敘傳，卷三十一碑表、誌銘考，卷三十二科甲、編年考，附文節公殉難事跡。譜載仇兆鼇序文。,https://jiapu.library.sh.cn/https://jiapu.library.sh.cn/#/GenealogySummary:http://data.library.sh.cn/jp/resource/work/wevjflw5wqvwuceu
会稽陶氏族谱三十二卷(浙江绍兴),陶在铭,陶,清光緒29年(1903),--,始遷祖岳（字宗楊，行幸五），元代自新昌遷居會稽（今紹興）鑑湖堰南。明人陶諧、陶承學，近人陶成章皆出此族。卷一譜序、祠圖、墓圖、凡例、姓系、地望、始遷、派別、譜辨說，卷二至五誥敕，卷六至十一世系，卷十二世傳，卷十三至十五隱德傳，卷十六至十九列傳，卷二十節婦傳，卷二十一至二十三賢媛傳，卷二十四藝文志，卷二十五至二十八墓地、祭產考，卷二十九祠祀、坊表、園亭志，卷三十敘傳、外編，卷三十一碑表誌銘考，卷三十二科甲、編年考。,https://jiapu.library.sh.cn/https://jiapu.library.sh.cn/#/GenealogySummary:http://data.library.sh.cn/jp/resource/work/cbfprdu4apx67tul
会稽陶氏族谱三十二卷 （浙江省绍兴市）,陶在铭,陶,清光緒29年(1903),--,始遷祖岳，字宗楊，行幸五，元代自新昌遷居會稽（今紹興）鑑湖堰南。明人陶諧、陶承學，近人陶成章皆出此族。卷一譜序、祠圖、墓圖、凡例、姓系、地望、始遷、派别、譜辨说，卷二至五誥敕，卷六至十一世系，卷十二世傳，卷十三至十五隱德傳，卷十六至十九列傳，卷二十節婦傳，卷二十一至二十三賢媛傳，卷二十四藝文志，卷二十五至二十八墓地、祭产考，卷二十九祠祀、坊表、園亭志，卷三十敘傳、外編，卷三十一碑表志銘考，卷三十二科甲、編年考。書名據版心、書簽、書名頁、目録、卷端題。,https://jiapu.library.sh.cn/https://jiapu.library.sh.cn/#/GenealogySummary:http://data.library.sh.cn/jp/resource/work/ttu6x5bflcjor9p1
会稽陶氏族谱三十二卷 （浙江省绍兴市）,陶际尧,陶,清道光9年(1829),--,始遷祖岳，字宗楊，行幸五，元代自新昌遷居會稽（今紹興）鑑湖堰南。明人陶諧、陶承學，近人陶成章皆出此族。卷一姓系、地望、始遷、派别、昌邑譜辨说，卷二至五誥敕，卷六至十一世系，卷十二世傳，卷十三至十五隱德傳，卷十六至十九列傳，卷二十節婦傳，卷二十一至二十三賢媛傳，卷二十四藝文志，卷二十五至二十八墓地、祭产考，卷二十九祠祀、坊表、園亭志，卷三十敘傳，卷三十一碑表、志銘考，卷三十二科甲、編年考，附文節公殉難事蹟。譜載仇兆鼇序文。書名據版心、書簽、目録、卷端題。,https://jiapu.library.sh.cn/https://jiapu.library.sh.cn/#/GenealogySummary:http://data.library.sh.cn/jp/resource/work/8iam9ssucsr821g4
会稽陶氏族谱三十二卷 （浙江省绍兴市）,陶春年,陶,清末,--,始遷祖岳，字宗楊，行幸五，元代自新昌遷居會稽（今紹興）鑑湖堰南。明人陶諧、陶承學，近人陶成章皆出此族。書名據卷端題。,https://jiapu.library.sh.cn/https://jiapu.library.sh.cn/#/GenealogySummary:http://data.library.sh.cn/jp/resource/work/6nmroepluizfdquh
会稽陶氏宗谱绍兴陶隐里宗梓公族系（浙江省/绍兴市）,陶维墀,陶,2011,--,始迁祖徽（字宗梓，行幸三），约元末至顺间迁居浙江绍兴陶隐岭。 卷上三修谱序及前言、传记、古迹简介、老谱影印，卷下行传、世系图、附表、编后记。,https://jiapu.library.sh.cn/https://jiapu.library.sh.cn/#/GenealogySummary:http://data.library.sh.cn/jp/resource/work/kaz5col6wfupe3an
会稽陶氏咸欢河支谱（浙江省绍兴市）,陶存萃,陶,1997年,--,始遷祖岳，字宗楊，行幸五，元代自新昌遷居會稽（今紹興）鑑湖堰南。始遷祖字琴士，清光緒間自會稽（今紹興）陶堰遷居西咸歡河沿。,https://jiapu.library.sh.cn/https://jiapu.library.sh.cn/#/GenealogySummary:http://data.library.sh.cn/jp/resource/work/syfsxdn3pgvo7zzy
会稽陈氏宗谱六卷首一卷（浙江省绍兴市）,陈家鉴,陈,清宣統三年（1911）,德星堂,始遷祖篤孝，字仕堂，宋代人。卷首序、總目、譜例、傳、捐款啟、祠規，卷一至六世系表。書名據版心、書簽題。,https://jiapu.library.sh.cn/https://jiapu.library.sh.cn/#/GenealogySummary:http://data.library.sh.cn/jp/resource/work/m33e3z1x5yganv2j
会稽陈村黄氏宗谱十卷（浙江省绍兴市）,黄培清,黄,清同治十一年（1872）,五桂堂,始遷祖津，明代人。書名據版心題。,https://jiapu.library.sh.cn/https://jiapu.library.sh.cn/#/GenealogySummary:http://data.library.sh.cn/jp/resource/work/2lse65vzyaozz672
会稽陈村黄氏宗谱十卷（浙江省绍兴市）,黄秀甫,黄,清光緒二十七年（1901）,五桂堂,始遷祖津，明代人。書名據版心題。,https://jiapu.library.sh.cn/https://jiapu.library.sh.cn/#/GenealogySummary:http://data.library.sh.cn/jp/resource/work/j44z4c2sf6ekhvuu
会稽陈村黄氏宗谱（浙江省/绍兴市）,黄天文,黄,2019,五桂堂,始祖香（字文强），东汉建初中征拜郎中，累任尚书令、魏郡太守。始迁祖三十七世津（行重八），为丽水主簿，由上舍官至太州知州，约宋末元初自浙江诸暨孝义泽园迁绍兴二十七都陈村。 卷一图腾、续修谱序、捐款芳名录、遗像、凡例、陈村简史、大事年表、宗祠、历代源流序、旧序、家训，卷二敕诰、诗序、训、书、记、传、略，卷三祀产、传、略、书、碑等，卷四至十九世系，卷二十世系、补遗备考、后记。,https://jiapu.library.sh.cn/https://jiapu.library.sh.cn/#/GenealogySummary:http://data.library.sh.cn/jp/resource/work/vw00efxsbn08mn12
会稽阮氏宗谱八卷（浙江省绍兴市）,阮商书,阮,清光緒七年（1881）,序思堂,始祖穀，字伯輿，唐憲宗朝爲太子右贊善大夫。始遷祖調，字商霖，宋嘉泰間隨仕會稽（今紹興）。卷一譜序、家規、敕贊、墓誌銘，卷二至三世系圖，卷四至八行傳。 書名據書簽、卷端題。四修本。,https://jiapu.library.sh.cn/https://jiapu.library.sh.cn/#/GenealogySummary:http://data.library.sh.cn/jp/resource/work/pmf9gpgpjge2947w
会稽阐下重修潘氏宗谱四卷（浙江省绍兴市上虞市）,潘之水,潘,清光緒十六年（1890）,燕诒堂,始祖標，字僉顯，行敦一，南朝宋国人，世居藩城。始迁祖仕宗，行祖一，明代迁居會稽县闡下村（今屬上市）。卷一谱文、谱敘、谱跋、敕诰、赞、凡例、家規、家政，卷二系图引、世系图，卷三、四世行传引、世行传。书名据卷端题。五修本。,https://jiapu.library.sh.cn/https://jiapu.library.sh.cn/#/GenealogySummary:http://data.library.sh.cn/jp/resource/work/m1xleepm7v3712d6
会稽阐下重修潘氏宗谱四卷（浙江省绍兴市上虞市）,潘恒新,潘,清宣統三年（1911）,燕诒堂,始祖標，字僉顯，行敦一，南朝宋国人，世居藩城。始迁祖仕宗，行祖一，明代迁居會稽县闡下村（今屬上市）。卷一谱序、宅志、山水记、祠记、传、行狀、行實、祭産、祭田、排行字，卷二系图引、系图，卷三、四世行传引、世行传。存卷一至三。书名据卷端题。六修本。,https://jiapu.library.sh.cn/https://jiapu.library.sh.cn/#/GenealogySummary:http://data.library.sh.cn/jp/resource/work/l92kv7zo722fr88w
会稽长乐施氏宗谱不分卷（浙江省绍兴市）,施聘三,施,民國6年(1917),善继堂,始迁祖福昭，行万二，宋末自姚江迁居會稽長樂里。谱载谱序、凡例、贊銘、祠産、世系图等。书名据版心题。,https://jiapu.library.sh.cn/https://jiapu.library.sh.cn/#/GenealogySummary:http://data.library.sh.cn/jp/resource/work/1o4dkrdtnc4f27uz
会稽长乐施氏宗谱不分卷,施聘三,施,民國6年(1917),善继堂,--,https://jiapu.library.sh.cn/https://jiapu.library.sh.cn/#/GenealogySummary:http://data.library.sh.cn/jp/resource/work/txoy6lrkg2hnlf8j
会稽钟氏宗谱陶堰分支（浙江省/绍兴市/越城区）,钟苞竹,钟,2012,众裕堂,始祖僎（又名世荣，行开九），于北宋庆历中自浙江会稽学前斗鸡场旁迁居邑之舜帝庙太平乡。始迁祖十九世道十二（字元忠），于明嘉靖间迁居邑之五云门陶堰南范庄南钟溇。 卷一序、凡例、渊源考、诰敇、历代像图，卷二科名录、同宗列传、本支节孝、年谱、人物志、祖训、宗约、著述、杂著、名次，卷三历代世系、世系图表、分迁考，卷四至七世系图表。,https://jiapu.library.sh.cn/https://jiapu.library.sh.cn/#/GenealogySummary:http://data.library.sh.cn/jp/resource/work/ryewn52q7gqpudn9
会稽钟氏宗谱十七卷末一卷（浙江省绍兴市）,钟志沆,钟,民國12年(1923),至德堂,始祖僎，字世榮，行開九，北宋慶曆間由會稽學前鮭矱場遷太平鄉舜帝廟下師山。始遷祖啟酆，字遐年，又字季昌，行本四，諡瑞敏，僎十七世孫，明季贅於吳融馬氏。卷一義例、淵源考、誥敕、像圖、墳圖，卷二科名录、前代名賢录、同宗列傳等，卷三忠、孝、義、烈傳與本支列傳等，卷四祖訓、宗約、著述、贈言、條例，卷五碑記、宗祠祭产、歷世修譜名次等，卷六廟下分遷考、吳分支考等，卷七至十六世系，卷十七同岑譜，卷末世系補遺、跋。世系載至第三十五世“秉”字輩。書名據版心題。,https://jiapu.library.sh.cn/https://jiapu.library.sh.cn/#/GenealogySummary:http://data.library.sh.cn/jp/resource/work/wwb6ups77okm5ez4
会稽钟氏宗谱十七卷末一卷(浙江绍兴),钟荣;钟志沆,钟,民國12年(1923),至德堂,"始祖僎（字世榮，行開九），北宋慶曆間由會稽學前鮭矱場遷太平鄉舜帝廟下師山。始遷祖啟酆（字遐年，又字季昌，行本四，諡瑞敏），僎十七世孫，明季贅於吳融馬氏。卷一義例、淵源考、誥敕、像圖、墳圖，卷二科名録、前代名賢録、同宗列傳等，卷三忠、孝、義、烈傳與本支列傳等，卷四祖訓、宗約、著述、贈言、條例，卷五碑記、宗祠祭產、歷世修譜名次等，卷六廟下分遷考、吳分支考等，卷七至十六世系，卷十七同岑譜，卷末世系補遺、跋。世系載至第三十五世""秉""字輩。",https://jiapu.library.sh.cn/https://jiapu.library.sh.cn/#/GenealogySummary:http://data.library.sh.cn/jp/resource/work/yf23vfzxgyc5mhsz
会稽钟氏宗谱十七卷末一卷(浙江绍兴),钟志沆,钟,民國12年(1923),至德堂,"始祖僎（字世榮，行開九），北宋慶曆間由會稽學前鮭矱場遷太平鄉舜帝廟下師山。始遷祖啟酆（字遐年，又字季昌，行本四，諡瑞敏），僎十七世孫，明季贅於吳融馬氏。卷一義例、淵源考、誥敕、像圖、墳圖，卷二科名録、前代名賢録、同宗列傳等，卷三忠、孝、義、烈傳與本支列傳等，卷四祖訓、宗約、著述、贈言、條例，卷五碑記、宗祠祭產、歷世修譜名次等，卷六廟下分遷考、吳分支考等，卷七至十六世系，卷十七同岑譜，卷末世系補遺、跋。世系載至第三十五世""秉""字輩。",https://jiapu.library.sh.cn/https://jiapu.library.sh.cn/#/GenealogySummary:http://data.library.sh.cn/jp/resource/work/v5uq6vnr747r3r58
会稽钱武肃王祠堂志三卷（浙江省绍兴市）,李亨特,--,清乾隆58年(1793),--,本志前有序，内爲祠圖、碑記、匾聯、詩文、祭儀。,https://jiapu.library.sh.cn/https://jiapu.library.sh.cn/#/GenealogySummary:http://data.library.sh.cn/jp/resource/work/nfj4qubd5kkgdweb
会稽金鱼墺张氏宗谱五卷（浙江省绍兴市）,张大纲,张,清光緒8年(1882),百忍堂,剡縣玨芝始祖稷，字公喬，南齊人。始遷一世祖鼎翁，字取新，行朝一，原行炳十一，元末由餘貴遷居金魚墺。卷一凡例、家訓、傳等，卷二至五世系圖、行傳。書名據卷端題。,https://jiapu.library.sh.cn/https://jiapu.library.sh.cn/#/GenealogySummary:http://data.library.sh.cn/jp/resource/work/9hulsmg43borzxta
会稽郦氏宗谱二卷（浙江省绍兴市）,郦秉仁,郦,清光緒二十九年（1903）,--,先祖同上。先祖同上。,https://jiapu.library.sh.cn/https://jiapu.library.sh.cn/#/GenealogySummary:http://data.library.sh.cn/jp/resource/work/7qzboprrq96xxa23
会稽郦氏宗谱三卷（浙江省绍兴市）,郦文定;郦正梧,郦,清光緒23年(1897),长揖堂,始祖食其，漢代人，世居陳留。第二十世孫昶，字文盛，唐永徽二年官揚州刺史，为維揚始祖。昶第十七世孫文紹，宋南渡時扈駕居山陰。其子嵩，字惟喬，居會稽，为會稽峨嵋山始遷祖。譜即記其下派系。卷一凡例、譜序、傳記等，卷二世系，卷三行傳。書名據版心題。,https://jiapu.library.sh.cn/https://jiapu.library.sh.cn/#/GenealogySummary:http://data.library.sh.cn/jp/resource/work/ky43vgkuuq1hrdhw
会稽郑氏宗谱（浙江省绍兴市）,不详,郑,清,怀德堂,一世祖登高，字見遠，行賢一，明景泰、弘治間人。父泰一公，遷徙之跡不詳。存卷載行傳，自一世賢字行至十四世德字行。存卷三。書名據版心題。記事至清嘉慶間。墨筆增補至清道光間。,https://jiapu.library.sh.cn/https://jiapu.library.sh.cn/#/GenealogySummary:http://data.library.sh.cn/jp/resource/work/w579j1lcp69rx2fj
会稽郑氏宗谱八卷（浙江省绍兴市嵊州市）,郑尧文,郑,1925年,敦伦堂,始遷祖明十，南宋時自京師臨安府城（今杭州市）遷居會稽縣（今屬紹興縣）雷鋒五股山下八鄭村（今屬嵊州市三界鎮）。卷一譜序，卷二像贊，卷三至八系圖、行傳。九修本。,https://jiapu.library.sh.cn/https://jiapu.library.sh.cn/#/GenealogySummary:http://data.library.sh.cn/jp/resource/work/vtb7qa3axze7jt42
会稽郡（双桥）虞氏宗谱（浙江省温州市）,鸿年,虞,1987年,--,始祖權，字以中，南朝梁朝時宦居永嘉府城（今温州市鹿城區）。始遷祖仲琳，字潤玉，號石甫，南宋紹興末年自餘姚遷居瑞安縣崇泰鄉誠明里雙橋村（今屬温州市甌海區仙嚴鎮）。明人原璩岀於此族。書名據版心題。,https://jiapu.library.sh.cn/https://jiapu.library.sh.cn/#/GenealogySummary:http://data.library.sh.cn/jp/resource/work/b8v1w4v1w1xa3tnk
会稽郡虞氏十修宗谱二卷（浙江省温州市）,永兴,虞,1997年,--,卷一地圖、遺像、遺像小引，卷二敕誥、譜序、傳贊、行狀、墓誌、祭文、詩文、雜記、凡例、宗規、修譜任事名單、行第、世系。書名據卷端題。十修本。,https://jiapu.library.sh.cn/https://jiapu.library.sh.cn/#/GenealogySummary:http://data.library.sh.cn/jp/resource/work/jx4zksz973s7no5t
