谱名,责任者,姓氏,撰修时间,堂号,家谱简介,详情链接
屯阳汪氏宗谱（安徽省/铜陵市/枞阳县）,汪石刚;汪 松,汪,2013,--,始迁祖隆乙（号逸，行一），明朝初年随父从江西婺源北徙至桐城枞阳县城上码头，复迁居古屯田（今枞阳官埠桥继光村汪家老屋），此地处白鹿山之阳（南面）乃卜筑而家焉。 谱载照片、题词、修祠续谱工作委员会人员名单、七修宗谱编辑部人员名单、七修宗谱工作实施方案、宗谱序、修祠续谱综述、凡例、源流世系、世系图、行传、人物、族文化、附录。,https://jiapu.library.sh.cn/https://jiapu.library.sh.cn/#/GenealogySummary:http://data.library.sh.cn/jp/resource/work/z5qqdwir6618tq6d
屯阳汪氏宗谱（安徽省/铜陵市/枞阳县）,汪松,汪,2013,--,始迁祖隆乙（号逸，行一），约于明洪武元年，随父大五公自江西婺源大畈迁安徽桐城枞阳城上码头，后约于洪武三年复迁至邑之古屯田白鹿山之阳（今枞阳官埠桥继光村汪家老屋）定居。 谱载编委会人员名单、序、综述、凡例、世系图、世传、人物传、宗族文化、附录。,https://jiapu.library.sh.cn/https://jiapu.library.sh.cn/#/GenealogySummary:http://data.library.sh.cn/jp/resource/work/4z5ns28i5lar6lis
屯阳汪氏宗谱(安徽枞阳),汪松,汪,2013年,--,始迁祖隆乙（行一），约于明洪武元年自江西婺源大畈迁安徽桐城枞阳上码头，约于洪武三年复迁古屯田白鹿山之阳（今枞阳县官埠桥镇继光村汪家老屋）。民国十五年（1926）六修族谱时，族裔将屯田汪氏改名为屯阳汪氏。 册上题词、编委会名单、序、凡例、世系、世传，册中世系、世传，册下世系世传、人物传录、族文化、附录。,https://jiapu.library.sh.cn/https://jiapu.library.sh.cn/#/GenealogySummary:http://data.library.sh.cn/jp/resource/work/bgaeswegisolqs48
屯门陶氏撮要家谱（广东省深圳市宝安区）,陶福添,陶,--,--,始祖侃。始遷祖文質，一作士行，为入粤始祖。後裔散居寶安及香港等地。,https://jiapu.library.sh.cn/https://jiapu.library.sh.cn/#/GenealogySummary:http://data.library.sh.cn/jp/resource/work/hd33uqhnx1yy9ztq
屯门陶氏撮要家谱（广东省/深圳市/宝安区）,陶福添,陶,1976,--,元明之际，始迁祖陶文质从刚从江西省迁居广东省深圳市宝安区。 谱载陶渊明世系图、陶氏源流简记、世系表。,https://jiapu.library.sh.cn/https://jiapu.library.sh.cn/#/GenealogySummary:http://data.library.sh.cn/jp/resource/work/7gsvpnm7nsk5hjpv
屯粮黄氏族谱（四川省/宜宾市/珙县）,屯粮黄氏修谱组,黄,2005,不详,始祖海义，子清江同兄弟汉江及族人，于明初，由湖广麻城县孝感乡大坟坝入川，至富顺县青山坝（今隆昌县黄家场）造饭倒米，遂安住，是为屯粮黄氏入川始祖。清江四世孙英携子通由富顺迁珙县育贤乡四甲入住，为入珙始祖。通孙可孝、可弟、可忠、可信同胞四人迁育贤乡屯粮落业，为屯粮始祖。 前言，先祖像片，古代源流，黄姓史记，峭山脉派概述，黄姓文化，黄姓名人，应海公家谱。,https://jiapu.library.sh.cn/https://jiapu.library.sh.cn/#/GenealogySummary:http://data.library.sh.cn/jp/resource/work/d5rmjr8bicwhfi3t
屯白氏家谱（台湾省南投县）,白清逊,白,--,--,始遷祖鼎夢，清代人。據1971年稿本影印,https://jiapu.library.sh.cn/https://jiapu.library.sh.cn/#/GenealogySummary:http://data.library.sh.cn/jp/resource/work/nm6izizc6b7szpnx
屯山史氏宗谱（江苏省/常州市/溧阳市）,史和成;史国芳,史,2013,务本堂,始祖崇，东汉光武中兴功封封溧阳侯。始迁祖二十四世融，任临川令，唐天宝年间归隐金坛县西之屯山（今江苏省常州市金坛区朱林镇屯山村）。二十九世乔，五代后周末避乱迁居江西婺源。四十一世利、秈等，宋元间复归屯山。 卷一文献照、新序、旧谱序、编委名氏录、捐款名氏录、诰命、祖像、荣誉证书、族贤照、重修宗谱旧序、叙庆传录、传、碑颂、文献志、诗、艺文志、居址赋、新增行字，卷二远祖表、世系表、凡例、家训、行实志、分徙志、分支录、本支分徙录、修谱纪名录、领谱名氏录、后记，卷三至八世系图、世表。,https://jiapu.library.sh.cn/https://jiapu.library.sh.cn/#/GenealogySummary:http://data.library.sh.cn/jp/resource/work/6qt3ez5xyrdz7dre
履珠常乐郑氏宗谱不分卷(浙江衢州),郑广协,郑,清光緒8年(1882),--,始祖康（行第七），宋代自浙江開化芳山贅居常山浮河。始遷祖文信（字寧熙，又字西輝，行義十三，又行文一）、隆茂（字廷熙，又字宅煇，行義廿五，又行隆二），康十七世孫，明中葉分遷三衢信安履珠、常樂。譜存序、譜說、凡例、家規、陽基圖、傳贊、遺像、世系總圖、本支系圖、世紀、墓圖、祀產等。,https://jiapu.library.sh.cn/https://jiapu.library.sh.cn/#/GenealogySummary:http://data.library.sh.cn/jp/resource/work/on4i5c7kgbs31hna
履湖庄氏宗谱二十卷艺文二卷（浙江省金华市）,不详,庄,1926年,--,始祖宏九，宋浙江嚴陵烏龍山人。始迁祖光汶，行聖一，宏九十五世孫，宋代自金华县九都洞口村移居本邑履湖（今金华市鞋塘镇鞋塘村）。存卷为行传、艺文。存卷四、八、二十，艺文卷上。书名据版心、书签题。,https://jiapu.library.sh.cn/https://jiapu.library.sh.cn/#/GenealogySummary:http://data.library.sh.cn/jp/resource/work/xivrnowx7tpi9d5x
履坦徐氏宗谱（浙江省金华市武义县）,不详,徐,清乾隆16年(1751),--,宋末衢州西安县主簿貴安，字濟民，行位六，卜居武义履坦，爱其地山川明秀而占籍。卷一为系图。存卷一。书名据版心题。,https://jiapu.library.sh.cn/https://jiapu.library.sh.cn/#/GenealogySummary:http://data.library.sh.cn/jp/resource/work/ev3n4s2w3fpjpmek
履坦徐氏宗谱不分卷（浙江省金华市义乌市）,不详,徐,清道光23年(1843),--,始迁祖貴安，字濟民，行位六，官衢州西安县主簿，宋末迁居武义履坦。存册为世系图、行传。书名据版心题。,https://jiapu.library.sh.cn/https://jiapu.library.sh.cn/#/GenealogySummary:http://data.library.sh.cn/jp/resource/work/91ysty3gwg718f5b
履坦徐氏宗谱不分卷（浙江省金华市武义县）,不详,徐,清道光11年(1831),--,宋末衢州西安县主簿貴安，字濟民，行位六，卜居武义履坦，爱其地山川明秀而占籍。存册为行传。书名据版心题。,https://jiapu.library.sh.cn/https://jiapu.library.sh.cn/#/GenealogySummary:http://data.library.sh.cn/jp/resource/work/qrom2mp1t7hhv74u
履坦徐氏宗谱（浙江省/金华市/武义县）,徐瑞龙,徐,2012,--,始迁祖贵安(字济民)，于南宋绍兴五年从浙江省金华市婺城区徐家故里迁浙江省金华市武义县经商，而留居履坦镇。 宗图一卷历代诰勅、历朝分派、祠墓碑记、行第、家谱条例、宗训规约、宗谱源流、世系，宗图二卷至宗图三卷字行世系，宗图四卷芦珑、朱黄、厅头、崆坑，行第一卷子行，行第二卷祖德富，行第三卷贵继宗功，人物一卷仕宦、孝节、耆硕、善行、儒林、附营理祠务。,https://jiapu.library.sh.cn/https://jiapu.library.sh.cn/#/GenealogySummary:http://data.library.sh.cn/jp/resource/work/sbxlrjtxo9l2t8tk
屠氏兰陵葛桥支谱六卷首一卷（江苏省常州市）,屠亮,屠,清光緒30年(1904),保纶堂;世德堂,始祖元亮，字太乙，宋室南渡時自汴移居江蘇吳縣洞庭金鐸里。四世孫汝榮，行和二，元代自泗州天長縣（今屬安徽）移居常州葛橋，爲葛橋始遷祖。十世孫雲鶴，號碧巖，明隆慶間偕從弟源（字清來，號少溪）自洞庭移居常州蘭陵，爲蘭陵始遷祖。是爲蘭陵、葛橋二支合修譜。卷首譜序等，卷一屠姓考略、像贊，卷二墓圖、墓誌，卷三傳記，卷四蘭陵支世系、世表，卷五至六葛橋支世系、世表。書名據版心、書名頁、書簽題。,https://jiapu.library.sh.cn/https://jiapu.library.sh.cn/#/GenealogySummary:http://data.library.sh.cn/jp/resource/work/ejutcqrjo7w92pq6
屠氏毘陵支谱（江苏省/常州市）,赵德明,屠,2020,敬齐堂,参见清屠维聪纂修《[江苏常州]屠氏毘陵支谱》条目。始迁祖明（号本泉），元至正末携二子仲亨、仲实由鄞（浙江宁波鄞州）迁常（江苏常州），卜居子城厢金斗坊北郡治之州桥。 卷一上题词、序、告宗亲书、修谱记事、修谱委员会、宗亲联谊会、功德榜、照片、概述，卷一下传、简历，卷二序、凡例、诰敕、服制图、姓考、像赞、祖训、女范、家塾记、家塾规条，卷三祠祭，卷四茔墓，卷五至至六传志，卷七世系图，卷八至二十二世表。,https://jiapu.library.sh.cn/https://jiapu.library.sh.cn/#/GenealogySummary:http://data.library.sh.cn/jp/resource/work/ymreeg77dl85tx7v
屠氏毘陵支谱十六卷首一卷末一卷（江苏省常州市）,屠维聪,屠,清咸豐六年（1856）,敬斋堂,始遷祖明，號本泉，元至正末偕子仲亨、仲實自浙江鄞縣移居常州城廂金斗坊北郡治之州橋。書名據書簽題。,https://jiapu.library.sh.cn/https://jiapu.library.sh.cn/#/GenealogySummary:http://data.library.sh.cn/jp/resource/work/pw7njcfdrrgdiz64
屠氏毘陵支谱二十卷首一卷末一卷（江苏省常州市）,屠景甫,屠,民國20年(1931),敬斋堂,始遷祖明，號本泉，元至正末偕子仲亨、仲實自浙江鄞縣移居常州城廂金斗坊北郡治之州橋。卷首譜序等，卷一誥敕，卷二宗祠，卷三墓圖，卷四至五傳志，卷六世系圖，卷七至二十世表，卷末雜録。書名據卷端、版心、書名頁、書衣題。,https://jiapu.library.sh.cn/https://jiapu.library.sh.cn/#/GenealogySummary:http://data.library.sh.cn/jp/resource/work/qip29btrcmshgw7q
屠氏毘陵支谱二十卷首一卷末一卷（江苏省常州市）,屠寄,屠,清光緒三十年（1904）,敬斋堂,始遷祖明，號本泉，元至正末偕子仲亨、仲實自浙江鄞縣移居常州城廂金斗坊北郡治之州橋。卷首譜序、凡例、卷一誥敕、孝子冠帶照、服制圖、姓考、像贊、祖訓、女範、恤孤家塾記、恤孤家塾規條，卷二祠祭、宗祠經久章程、捐田記、祭田記，卷三塋墓，卷四至五傳志，卷六世系圖，卷七至二十世系，卷末雜録、給譜録。書名據版心、書衣、書名頁題。,https://jiapu.library.sh.cn/https://jiapu.library.sh.cn/#/GenealogySummary:http://data.library.sh.cn/jp/resource/work/1fz94axvt8elftvj
屠氏毘陵支谱二十卷首一卷(江苏常州),屠兆伦,屠,清光緒三十年(1904),敬斋堂,始遷祖明，號本泉，元至正末偕二子自鄞遷常，卜居子城廂金鬥坊北郡治之州橋。卷首譜序、凡例、卷一誥勅、孝子冠帶照、服制圖、姓考、像贊、祖訓、女範、恤孤家塾記、恤孤家塾規條，卷二祠祭、宗祠經久章程、捐田記、祭田記，卷三塋墓，卷四、卷五傳志，卷六世系圖，卷七至卷二十世系，卷末雜錄、給譜錄,https://jiapu.library.sh.cn/https://jiapu.library.sh.cn/#/GenealogySummary:http://data.library.sh.cn/jp/resource/work/skfdmpbpgvexbcyr
屠氏武林支谱不分卷（浙江省杭州市）,屠绍理,屠,清嘉慶八年（1803）,修龄堂,始祖廷高，字子忠，唐代人。始遷祖射，明代自江蘇無錫移居浙江武林（今杭州市）。譜載序、傳贊、考略、凡例、避諱说、同宗公約、後说、派说、後録、世系圖、譜跋。書名據書簽、目録題。版心題御賜修齡堂。譜初修於清乾隆十二年，是爲二修本。,https://jiapu.library.sh.cn/https://jiapu.library.sh.cn/#/GenealogySummary:http://data.library.sh.cn/jp/resource/work/kd79opuzspnvq8hk
屠氏族谱二卷(江苏常州),屠全方,屠,2014年,--,参见屠景甫修《[江苏常州]屠氏毗陵支谱》条目（馆藏：926850-69）。始祖元亮（字太乙），北宋靖康间自汴梁（今河南开封）迁居苏州洞庭金铎里。始迁祖四世明（字本泉，行仁一），南宋宝祐间迁居常州子城厢金斗坊北郡治之州桥。支祖八世永康（又名子问），明景泰间自常州郡城移居城南淹城大路桥。卷一谱序、目录、旧序、屠氏记闻略、像赞、诰敕、凡例、家规公约、传、考略、跋，卷二世系图、世表。,https://jiapu.library.sh.cn/https://jiapu.library.sh.cn/#/GenealogySummary:http://data.library.sh.cn/jp/resource/work/lilpxyegjzulj8oj
屠氏族谱二十二卷，续编三卷,屠之申,屠,清道光7年至8年(1827-1828),--,--,https://jiapu.library.sh.cn/https://jiapu.library.sh.cn/#/GenealogySummary:http://data.library.sh.cn/jp/resource/work/ltg6ycyymseqpg7d
屠氏族谱二十二卷，续编三卷,屠之申,屠,清道光8年(1828),--,存卷1-5、7-22，续编卷1、2,https://jiapu.library.sh.cn/https://jiapu.library.sh.cn/#/GenealogySummary:http://data.library.sh.cn/jp/resource/work/vc1jg1m1kdcx8eor
屠氏族谱二十二卷续编三卷,屠之申,屠,清道光7年至8年(1827-1828),--,此爲洞庭、浙江兩大支派彙修譜。洞庭派始祖元亮，字太乙，宋室南渡時自汴移居洞庭金鐸里，後衍爲毘陵、葛橋、秀水、贛邑、塢里、蘭陵、澄江、暨陽諸支。浙江派始祖雷發，字聲伯，後衍爲仁和、鄞邑、會稽、平湖、甪里、宜興、武林、肇塘、皋埠諸支。卷一總序、總議、凡例、總論、名人序文、宗賢序文、科第仕宦録，卷二洞庭支世系總圖、浙江支世系總圖，卷三至七孝感支譜序文、世系，卷八至九毘陵支譜序、世系，卷十葛橋支、蘭陵支、塢里支譜序及世系，卷十一秀水支、澄江支、贛邑支譜序、世系，卷十二甪里支、宜興支、肇塘支譜序及世系，卷十三至十五平湖支譜序及世系，卷十六會稽支、臯埠支譜序及世系，卷十七鄞邑支譜序及世系，卷十八仁和支、武林支譜序及世系，卷十九至二十二暨陽支譜序及世系。續編卷一金鐸支、疁溪支、安康支譜序及世系，卷二蟶浦支、下方橋支譜序及世系，卷三蕭山支譜序及世系。書名據版心、書衣、書名頁題。,https://jiapu.library.sh.cn/https://jiapu.library.sh.cn/#/GenealogySummary:http://data.library.sh.cn/jp/resource/work/d9db44alvi2irhsh
屠氏族谱三卷（江苏省苏州市）,屠震宗,屠,清道光二十九年（1849）,--,始遷祖元明，字子登，號少室，行壽乙，宋代移居江蘇吳縣陰山（今屬蘇州市）。譜載“志七房支”與“向九房支”。書名據版心題。二修本。,https://jiapu.library.sh.cn/https://jiapu.library.sh.cn/#/GenealogySummary:http://data.library.sh.cn/jp/resource/work/jar4nropcetzsbbe
屠氏宗谱（浙江省温州市乐清市）,屠宝权,屠,1995年,--,始遷祖填，字安陸，號東溟，五代初自浙江温州移居樂清金溪。書名據版心題。,https://jiapu.library.sh.cn/https://jiapu.library.sh.cn/#/GenealogySummary:http://data.library.sh.cn/jp/resource/work/di8k6pr3usq695o7
屠氏宗谱四卷（浙江省绍兴市上虞市）,屠载清,屠,1921年,茂延堂,始遷祖肅，字允恭，五代後唐時隱居上縣小越村。卷一凡例、弁言、圖序、譜序、立繼條約、譜跋、助山文契、藏譜約言、議、列傳，卷二世系圖，卷三至四行傳。書名據版心、書簽、卷端題。譜初修於清康熙間，是爲五修本。,https://jiapu.library.sh.cn/https://jiapu.library.sh.cn/#/GenealogySummary:http://data.library.sh.cn/jp/resource/work/e6j5n24eqtq334mg
屠氏宗谱不分卷（安徽省宣城市宁国市）,不详,屠,清雍正間,--,始祖辰一，系出宋宗室，南宋時列封安徽宣城，後避匿寧陽（今寧國）屠村，遂諱其本姓稱屠氏。存卷載傳略、行狀、誥敕、譜跋等。書名據版心題。,https://jiapu.library.sh.cn/https://jiapu.library.sh.cn/#/GenealogySummary:http://data.library.sh.cn/jp/resource/work/x79hxpshs18zysjj
屠氏孝感支续谱八卷(湖北孝感),屠道镛,屠,1990年增補影印清光緒二十五年(1899)木活字本,六合祠,鼻祖廷高（字子忠），唐代自山西晉陽遷居河南尉氏縣敦仁里。始祖太乙（又名元亮），廷高二十六世孫，南宋時遷居江蘇蘇州西洞庭金鐸里。太乙六世孫惠二，明代遷居湖北孝感；太乙十二世孫炳（字少泉），約於明末繼遷湖北孝感；又有太乙七世孫珙三（行三），明天順間遷居湖北孝感；太乙十世孫鏊（號雙橋），明代遷居孝感；太乙十二世孫潛升（字伏生），清代遷居孝感。卷一譜序、凡例、人物序、傳、太乙公墓碑引，卷二傳，卷三至七世系，卷八譜序、譜敘、世系。,https://jiapu.library.sh.cn/https://jiapu.library.sh.cn/#/GenealogySummary:http://data.library.sh.cn/jp/resource/work/e8s5r8zh8bmcu612
屠氏孝感支续谱不分卷(湖北孝感),屠忠楚,屠,據1993年排印本影印,--,參見清屠道鏞修《[湖北孝感]屠氏孝感支續譜》條目（館藏：XP36077-084）。鼻祖廷高（字子忠），唐代自山西晉陽遷居河南尉氏縣敦仁里。始祖太乙（又名元亮），廷高二十六世孫，南宋時遷居江蘇蘇州西洞庭金鐸里。太乙六世孫惠二，明代遷居湖北孝感；太乙十二世孫炳（字少泉），約於明末繼遷湖北孝感；又有太乙七世孫珙三（行三），明天順間遷居湖北孝感；太乙十世孫鏊（號雙橋），明代遷居孝感；太乙十二世孫潛升（字伏生，號栗岑），清代遷居孝感。冊一派字表、族譜序、世系圖、世系，冊二至七世系。,https://jiapu.library.sh.cn/https://jiapu.library.sh.cn/#/GenealogySummary:http://data.library.sh.cn/jp/resource/work/bwojc6hz2dgn48kh
屠氏先世见闻录二卷（浙江省宁波市）,屠宗伊,屠,清咸豐9年(1859),--,鄞縣屠氏始遷一世祖爲邦彦，七世祖即明弘治間吏部尚書屠滽。此書輯录古籍中屠氏先世事蹟。卷二有九世祖明兵部右侍郎、總督湖川貴改應天巡撫屠大山傳略，有明末抗清志士屠獻宸傳略等。書名據卷端*版心*書名頁題。,https://jiapu.library.sh.cn/https://jiapu.library.sh.cn/#/GenealogySummary:http://data.library.sh.cn/jp/resource/work/a8xg3z6sfj1kec6q
展茅路下徐徐氏宗谱（浙江省/舟山市）,徐方岸;徐显伏;袁国民,徐,2013,--,始迁祖子云（字东泉），明崇祯十六年自浙江宁波鄞县茅山镇花园村迁居浙江舟山展茅路下。 卷首续修谱例、前谱例、续修谱序、前谱序，卷一姓考、祖源，卷二宅基、宗祠，卷三族规、族风，卷四文德武威，卷五近现代人物谱，卷六徐氏排行，卷七徐氏排行传，卷八徐氏世系图，卷九历史文物，卷十近代族长名录，卷十一公益事业，卷十二现代族人学历简谱，卷十三后裔迁居录、附录，卷末续修始末、修谱始末。,https://jiapu.library.sh.cn/https://jiapu.library.sh.cn/#/GenealogySummary:http://data.library.sh.cn/jp/resource/work/f8t6irewh8wvtn11
展氏族谱八卷展（山东省济南市平阴县）,庆选;等,展,1916年,--,始迁祖友才，明代人。书名据书签题。,https://jiapu.library.sh.cn/https://jiapu.library.sh.cn/#/GenealogySummary:http://data.library.sh.cn/jp/resource/work/lb5eg4rxt2scoqb6
展氏族谱（山东省/济南市/平阴县）,展广华,展,2010,--,明洪武年间展有才自山东省潍坊市青州市迁济南市平阴县孝直镇展洼村。 □□卷总序、墓志、庙志、谱序、圣谕、碑记。,https://jiapu.library.sh.cn/https://jiapu.library.sh.cn/#/GenealogySummary:http://data.library.sh.cn/jp/resource/work/qlukcc1f1dfkt3ce
展氏族谱（山东省/泰安市/新泰市）,展光圣;展昭金,展,2010,--,始迁祖友才（字首举），明洪武二十五年自青州益都县卜里于平肥三界间遂家于是号展家洼焉。 卷一总序、卷二凡例、年谱、和聖祠墓神像图、庙图、衍代诗修改意见、辈字、家训、世系，卷三世系图，卷四至十二世系图、世表。,https://jiapu.library.sh.cn/https://jiapu.library.sh.cn/#/GenealogySummary:http://data.library.sh.cn/jp/resource/work/taazwwthaaxlp65g
展氏族谱十二卷(山东),展广植,展,2010年,--,譜奉春秋時魯大夫展禽為一世祖，六十八世友德、友才、友定三兄弟，明洪武年間同自青州益都縣東遷，友德遷魚臺縣，友才遷平陰、肥城間之展家窪，友定遷德州。此譜是友才後裔聯合友德、友定後之某些分支同修。卷一總序錄、新老譜序、展禽祠記，卷二、三（頭冊、次冊）錄一至六十七世世系表，卷四至十二為友才等後嗣世系表。,https://jiapu.library.sh.cn/https://jiapu.library.sh.cn/#/GenealogySummary:http://data.library.sh.cn/jp/resource/work/erb4pfpepu1afibz
展氏族谱十二卷(山东),展广植,展,2010年,--,为馆藏：XP12675-686之复本。谱奉春秋时鲁大夫展禽为一世祖，六十八世友德、友才、友定三兄弟，明洪武年间同自青州益都县东迁，友德迁鱼台县，友才迁平阴、肥城间之展家洼，友定迁德州。此谱是友才后裔联合友德、友定后之某些分支同修。 卷一总序录、新老谱序、展禽祠记，卷二、三（头册、次册）录一至六十七世世系表，卷四至十二为友才等后嗣世系表。,https://jiapu.library.sh.cn/https://jiapu.library.sh.cn/#/GenealogySummary:http://data.library.sh.cn/jp/resource/work/x4fnhbxqizumj2yq
展氏族谱.即墨市温泉镇南黄埠（山东省/青岛市/即墨区）,展新可,展,2016,--,始迁祖展国朝，山东省青岛市即墨区温泉镇南行村迁到山东青岛即墨区温泉镇南黄埠村。 谱载渊源、序、谱例、命名定式、世系、功德名录、二十四孝图、后记。,https://jiapu.library.sh.cn/https://jiapu.library.sh.cn/#/GenealogySummary:http://data.library.sh.cn/jp/resource/work/cyjlvcr5n1e7uaev
展氏家谱（甘肃省/张掖市/民乐县）,展宏仁,展,2020,和圣堂,始迁祖展崇兴，于明朝洪武年初，自山西洪洞县大槐树村迁居甘肃山丹北湾，后又迁居名乐县三堡镇官寨（今隶属于甘肃省张掖市民乐县三堡镇任官寨村）。 谱载目录、印刷件、卷序、编写说明、家训、字辈、世系图、拾遗、家谱赋、编后语。,https://jiapu.library.sh.cn/https://jiapu.library.sh.cn/#/GenealogySummary:http://data.library.sh.cn/jp/resource/work/nwv3cbrwggcs6p9f
展氏家谱郸城鹿邑分支（河南省）,展明贤,展,2005年,--,始遷祖永錫，明洪武初自山東遷河南鹿邑西南生鐵冢展橋村，後又遷寧平鎮（現屬鄲城）東南六里展樓。本譜收錄鄲城、鹿邑兩地展氏支系。卷一圖、展姓淵源敘說、總序、世系、墓誌銘、凡例、世系，卷二名目、譜序、凡例、世系，卷末名人名家簡介、中華民族的起源與象徵、歷史朝代年號民族、我國家庭婚姻姓氏的演變、天文景象生肖四靈、中華物產等、後記、附表。書名據封面。,https://jiapu.library.sh.cn/https://jiapu.library.sh.cn/#/GenealogySummary:http://data.library.sh.cn/jp/resource/work/vyp5smamq8hf3z6h
屏麓杨氏宗谱十卷首一卷（浙江省衢州市常山县）,不详,杨,清光緒二十二年（1896）,--,存卷首、一至三、七至九。,https://jiapu.library.sh.cn/https://jiapu.library.sh.cn/#/GenealogySummary:http://data.library.sh.cn/jp/resource/work/wwtzl9krc5ma7k8j
屏东县竹田乡竹田村吴氏家谱亮桂公分支来台世系图（台湾省/屏东县）,吴添富,吴,1984,--,始迁祖亮桂。,https://jiapu.library.sh.cn/https://jiapu.library.sh.cn/#/GenealogySummary:http://data.library.sh.cn/jp/resource/work/ablf8ge6ogfwjgxr
屏东县祭祀公业张万三子孙系统表（台湾省屏东县）,不详,张,1981年,--,始祖萬三。,https://jiapu.library.sh.cn/https://jiapu.library.sh.cn/#/GenealogySummary:http://data.library.sh.cn/jp/resource/work/65augde1375srkr5
屏东县南州乡三千庄陈氏族谱（台湾省屏东县）,陈郢,陈,1982年,--,始遷祖福仁，清代移居臺灣，後裔散居屏東縣南州鄉等地。,https://jiapu.library.sh.cn/https://jiapu.library.sh.cn/#/GenealogySummary:http://data.library.sh.cn/jp/resource/work/ipkt4c52wh8hry16
屏东市崇兰里萧氏历代系统表（台湾省/屏东县）,萧阿念,萧,1975,--,台湾始迁祖维天，一名珍记。后裔散居屏东县屏东市崇兰里等地。,https://jiapu.library.sh.cn/https://jiapu.library.sh.cn/#/GenealogySummary:http://data.library.sh.cn/jp/resource/work/vd1zw3ysvsm7uz1c
屏东市崇兰里萧氏历代家族系统表（台湾省/屏东县）,--,萧,1962,--,台湾始迁祖维天，一名珍记。后裔散居屏东县屏东市崇兰里、富风里等地。,https://jiapu.library.sh.cn/https://jiapu.library.sh.cn/#/GenealogySummary:http://data.library.sh.cn/jp/resource/work/1digkb8kawoh7ooq
