谱名,责任者,姓氏,撰修时间,堂号,家谱简介,详情链接
尚氏宗谱（辽宁省/鞍山市/海城市）,尚玉德,尚,当代（当代）,--,参见尚玉德主修《[辽宁海城]尚氏宗谱》条目（馆藏：XP61597-602）。始祖生（字衍斯），原籍太原府洪洞县城西十二里老鸹窝，明正德二年迁居真定府衡水县城西尚家庄，其子继官（字采宗，号仰予）于万历年间始迁辽东海城。第四世可喜（字元吉，号震阳）为清开国功臣，封平南王。可喜生子之忠、之信、之孝、之廉、之节等人派分三十二房，本谱载各支世系。 卷一谱序、总图、定训、条例、实绩、世系、恩纶录，卷二至四世系、恩纶录。,https://jiapu.library.sh.cn/https://jiapu.library.sh.cn/#/GenealogySummary:http://data.library.sh.cn/jp/resource/work/6i2h1kap4pamg1n4
尚氏宗谱（辽宁省/鞍山市/海城市）,尚玉德,尚,--,--,始祖生（字衍斯），原籍太原府洪洞县城西十二里老鸹窝，明正德二年迁居真定府衡水县城西尚家庄，其子继官（字采宗，号仰予）于万历年间始迁辽东海城。第四世可喜（字元吉，号震阳）为清开国功臣，封平南王。（馆藏：XP1071为该谱1994年续修本） 卷一谱序、总图、遗训、条例、实绩、世系，卷二至六世系。,https://jiapu.library.sh.cn/https://jiapu.library.sh.cn/#/GenealogySummary:http://data.library.sh.cn/jp/resource/work/cjclf7x9sqvvlaid
尚氏宗谱（辽宁省/鞍山市/海城市）,尚玉德;尚维慎,尚,乾隆56年（1791）,--,谱载尚氏世为洪洞人，迁于衡水，后乃徙辽左，奠厥宁居……子孙……居京师侍卫御前与宦游四方及在奉天海城守先王茔墓者皆有……。 卷之一序、总图、遗训、条例、实迹、始祖、太王、大房世系、恩纶录，卷之二至卷之四各房世系图、恩纶录、传。,https://jiapu.library.sh.cn/https://jiapu.library.sh.cn/#/GenealogySummary:http://data.library.sh.cn/jp/resource/work/i7fmkfffjh4bxq8k
尚氏宗谱（辽宁省/鞍山市/海城市）,尚玉德;尚玉成,尚,乾隆十七年（1752）,--,谱载尚氏世为洪洞人，迁于衡水，后乃徙辽左，奠厥宁居……子孙……居京师侍卫御前与宦游四方及在奉天海城守先王茔墓者皆有……。 卷一序、总图、遗训、条例、实迹、始祖、太王、大房世系、恩纶录。卷之三至卷之六各房世系、恩纶录、传。,https://jiapu.library.sh.cn/https://jiapu.library.sh.cn/#/GenealogySummary:http://data.library.sh.cn/jp/resource/work/nv6sov18nogxx2zo
尚氏宗谱（辽宁省/鞍山市/海城市）,尚久蕴;尚世海,尚,1994,--,一世始祖生（字衍斯），原籍太原府洪洞县城西十二里老鸹窝，明正德二年迁居真定府衡水县城西尚家庄，其子继官（字采宗，号仰予）于万历年间始迁辽东海城。第四世可喜（字符吉，号震阳）为清开国功臣，封平南王。族谱初创于康熙十四年。 是谱载历代谱序、先祖及祠墓图像、尚可喜传及墓志、清代以来族中名人录、尚可喜之后三十二房之宗支图与世传。,https://jiapu.library.sh.cn/https://jiapu.library.sh.cn/#/GenealogySummary:http://data.library.sh.cn/jp/resource/work/qhstbvlt3z31u9pk
尚氏宗谱（辽宁省/鞍山市/海城市）,尚世海;尚久蕴,尚,2005,--,先祖尚生，原籍太原府洪洞县，明正德二年迁居河北真定府衡水县城西八里之尚家庄，传至三世继宫于明万历三年迁居辽东海城。第四世可喜，为清开国功臣，封平南王。 第一章元功垂范，第二章宗谱、宗祠、祖训，第三章先王实绩，第四章始祖及世系图，第五章五世、大房，第六章五世、二房，第七章五世、三至五房，第八章五世六房，第九章五世、七房、之隆，第十章五世、八、九、十房，第十一章五世、十一、二房,https://jiapu.library.sh.cn/https://jiapu.library.sh.cn/#/GenealogySummary:http://data.library.sh.cn/jp/resource/work/gr76b8q424p7ywc6
尚氏宗谱（辽宁省/鞍山市/海城市）,尚其宪,尚,民国28年（1939）,--,始祖生，原籍山西洪洞，明代迁居真定府衡水县（今河北省衡水市）。其次子继官生二子：学书仍居衡水；学礼随父迁居辽东海州（今辽宁省海城市）。本谱主要记学礼支世系。学礼第四子可喜（字元吉，号震阳），清康熙年间册封平南亲王，其子之信、之孝等派分三十二房，各房后裔分居辽宁、北京等地。 卷一目录、序、例言、表、匾额联语、像、世系图、先王定训、列传、名录、碑记、遗训、实迹，卷二至十一世系图、世系传，附卷元功垂范。,https://jiapu.library.sh.cn/https://jiapu.library.sh.cn/#/GenealogySummary:http://data.library.sh.cn/jp/resource/work/rtcf970uhzjqqsc9
尚氏宗谱（浙江省/温州市/乐清市）,尚知余,尚,1999,--,始祖克昌，宋末人。始迁祖道英，明代人。,https://jiapu.library.sh.cn/https://jiapu.library.sh.cn/#/GenealogySummary:http://data.library.sh.cn/jp/resource/work/m3juuubgnpzsmkbd
尚氏宗谱（安徽省/安庆市/望江县）,尚结海,尚,2016,飞熊堂,明洪武年间，始迁祖尚均树，从徽之祁门（今安徽省黄山市祁门县）迁到望（今安庆市望江县）。 卷首序、四修名目、诰封、山图、仕宦，卷一至卷五世系，卷六世系、传、跋。,https://jiapu.library.sh.cn/https://jiapu.library.sh.cn/#/GenealogySummary:http://data.library.sh.cn/jp/resource/work/yhxogr18r2sw9ogm
尚氏宗谱（安徽省/安庆市/望江县）,尚松阳;尚结海,尚,2016,飞熊堂,始迁祖均望（字云千），明洪武年间由徽之祁门迁望小北门外筑室北台山麓。 卷首图腾、续修新序、旧序、凡例、家规、四修名目、诰封、寿袖、山图、迁坟纪要、历代仕宦、宗派，卷一至六世系图、世表、修谱名目、领谱字号、传、跋。,https://jiapu.library.sh.cn/https://jiapu.library.sh.cn/#/GenealogySummary:http://data.library.sh.cn/jp/resource/work/3rjzxzo4cyi54eky
尚氏宗谱（安徽省/合肥市）,尚昌文,尚,2010,修业堂,始迁祖肇基公，字达源，官至校尉，明中叶由江苏省句容县大椒街南鄙徙居安徽合肥东二十埠河东首吉地，子承孙继，聚族成村，得名“尚大郢”。 卷首上浅谈民国版《尚氏宗谱》、上谕十六条、圣谕六条、家礼图、大宗小宗图、祠堂图、旧序、原目录、原修谱名目、原执谱名目、字派、欧阳文忠公谱图说、名贤谱说、凡例、祠规、重建宗祠记、传赞、孤坟记，卷首下尚的名义和图腾、尚氏得姓始祖公姜子牙像、三修序、伟人名家论谱谈族、尚氏修业堂楹联、尚氏修业堂始祖像、世系总图、三修委员会名录（附合影）、后裔国内徙居示意图、省内徙居示意图、三修功德榜（附全家福）、精英榜、新家规、凡例、字派、执谱字号、传赞、三修纪事、三修祝文、三修图录、始祖墓志、重建墓园功德榜、始祖墓园图、辛卯祭祖记（附图）、尚姓历史来源考、上党郡考、尚氏后裔重修家谱、七里塘尚氏后裔老少同心共襄善举、不要被你的子孙遗忘、尚大郢影像、尚氏宗亲联谊会第一届委员会名录、尚氏宗亲联谊会章程，卷二至十八为世系，卷十九为坟图，另附清稿一册。,https://jiapu.library.sh.cn/https://jiapu.library.sh.cn/#/GenealogySummary:http://data.library.sh.cn/jp/resource/work/e9kvvw5gtii2q6op
尚氏宗谱四卷（辽宁省鞍山市海城市）,尚玉成,尚,清乾隆十七年（1752）,--,始祖生，字衍斯，原籍太原府洪洞縣城西十二里老鴰窩，明正德二年遷居真定府衡水縣城西尚家莊。子繼官，字寀宗，號仰予，明萬曆間遷居遼東海城。繼官第四子可喜，字元吉，號震陽，为清開國功臣，封平南王。可喜之三十二房違達，为新賓支始遷祖。書名據版心、書簽題。三修本。,https://jiapu.library.sh.cn/https://jiapu.library.sh.cn/#/GenealogySummary:http://data.library.sh.cn/jp/resource/work/1r7h4xpsescfg9ac
尚氏宗谱四卷首一卷（安徽省安庆市望江县）,尚汝贤,尚,1918年,飞龙堂,始遷祖均樹，字雲干，明代人。書名據版心題。,https://jiapu.library.sh.cn/https://jiapu.library.sh.cn/#/GenealogySummary:http://data.library.sh.cn/jp/resource/work/rs7qceo6u1c19rfc
尚氏宗谱四卷首一卷末一卷（安徽省安庆市望江县）,尚署发,尚,清同治十一年（1872）,敦睦堂,始遷祖均樹，字雲干，明代人。書名據版心題。,https://jiapu.library.sh.cn/https://jiapu.library.sh.cn/#/GenealogySummary:http://data.library.sh.cn/jp/resource/work/x8mkzlxi4zgshsox
尚氏宗谱十一卷附元垂功范二卷（辽宁省鞍山市海城市）,尚其宪,尚,1940年,--,始祖生，字衍斯，原籍太原府洪洞縣城西十二里老鴰窩，明正德二年遷居真定府衡水縣城西尚家莊。子繼官，字寀宗，號仰予，明萬曆間遷居遼東海城。繼官第四子可喜，字元吉，號震陽，为清開國功臣，封平南王。可喜之三十二房違達，为新賓支始遷祖。書名據版心、書簽題。五修本。,https://jiapu.library.sh.cn/https://jiapu.library.sh.cn/#/GenealogySummary:http://data.library.sh.cn/jp/resource/work/p9rp157oecdiy188
尚氏宗谱六卷（辽宁省鞍山市海城市）,尚玉德,尚,清乾隆五十六年（1791）,--,始祖生，字衍斯，原籍太原府洪洞縣城西十二里老鴰窩，明正德二年遷居真定府衡水縣城西尚家莊。子繼官，字寀宗，號仰予，明萬曆間遷居遼東海城。繼官第四子可喜，字元吉，號震陽，为清開國功臣，封平南王。可喜之三十二房違達，为新賓支始遷祖。書名據版心、書簽題。四修本。,https://jiapu.library.sh.cn/https://jiapu.library.sh.cn/#/GenealogySummary:http://data.library.sh.cn/jp/resource/work/cfwupw9vwo2af6qm
尚氏宗谱六修补遗（辽宁省/鞍山市/海城市）,尚久蕴,尚,1997,--,始祖生，字衍斯，原籍太原府洪洞县城西十二里老鸹窝，明正德二年迁居真定府衡水县城西尚家庄。子继官，字采宗，号仰予，明万历间迁居辽东海城。继官第四子可喜，字元吉，号震阳，为清开国功臣，封平南王。可喜之三十二房违达，为新宾支始迁祖。本谱收入六修谱未收之吉林省九台市、辽宁省辽阳市、鞍山市，以及散居黑龙江、甘肃、宁夏、河南等省之各支。 谱载各支世系表、历次修撰《尚氏宗谱》版本介绍、尚氏远祖渊源考等。,https://jiapu.library.sh.cn/https://jiapu.library.sh.cn/#/GenealogySummary:http://data.library.sh.cn/jp/resource/work/no2cbuy74pjzv2n1
尚氏宗谱不分卷（辽宁省鞍山市海城市）,尚之隆,尚,清康熙五十三年（1714）,--,始祖生，字衍斯，原籍太原府洪洞縣城西十二里老鴰窩，明正德二年遷居真定府衡水縣城西尚家莊。子繼官，字寀宗，號仰予，明萬曆間遷居遼東海城。繼官第四子可喜，字元吉，號震陽，为清開國功臣，封平南王。可喜之三十二房違達，为新賓支始遷祖。書名據版心題。二修本。,https://jiapu.library.sh.cn/https://jiapu.library.sh.cn/#/GenealogySummary:http://data.library.sh.cn/jp/resource/work/ypey6mjqj6iduf78
尚氏宗嗣环形世系一览图（陕西省/咸阳市/永寿县）,尚丕儒,尚,2000,--,迁徙源流不详。 内录世系图。,https://jiapu.library.sh.cn/https://jiapu.library.sh.cn/#/GenealogySummary:http://data.library.sh.cn/jp/resource/work/e5mnqyyzzae6p3er
尚氏分支家谱（河南省/洛阳市/偃师市）,尚文涛,尚,2009,--,此谱为偃师市李村镇新民村尚氏家谱，始祖不详，因明朝“移民就宽乡”政策，自洪桐县北大槐树下迁自洛阳水磨头村，民国时因水患一世克勤随迁至村南一公里重建家园，取名新民村。 序言、说明、家族成员一览表、辈份字、同父排行、同堂排行、分世个人基本情况、家谱分布、尚氏源流闻、后记。,https://jiapu.library.sh.cn/https://jiapu.library.sh.cn/#/GenealogySummary:http://data.library.sh.cn/jp/resource/work/heiw4bfvz9e1f1tc
尚氏八续族谱四卷（河南省新乡市）,尚全溶,尚,1932年,--,始遷祖肆老，明初自山西洪洞縣遷居新鄉。書名據譜序題。,https://jiapu.library.sh.cn/https://jiapu.library.sh.cn/#/GenealogySummary:http://data.library.sh.cn/jp/resource/work/ujrci7al43qjp7tw
尚桥黄氏宗谱（浙江省/金华市/永康市）,黄金土,黄,2003,--,始迁祖肇，字启元，宋代自金华迁永康尚桥。 载序、村景、墓图、传记、世系图、行传。,https://jiapu.library.sh.cn/https://jiapu.library.sh.cn/#/GenealogySummary:http://data.library.sh.cn/jp/resource/work/ub58d3tynlhrf9v3
尚桥黄氏宗谱（浙江省/金华市/永康市）,黄荣鹤,黄,2003,--,始迁祖荧（字普亮，仁十二），唐武德间左谏议大夫，江夏监利广信弋阳南昌丰城绍郡新昌黄岩柔同婺郡诸族五大族之始祖，尚黄桥黄氏始迁祖。 第一册赞助芳名录、修谱人员名单、新序、重修宗谱序、续修宗谱序、谱序特稿、后前塘重修宗谱序、总目录、黄姓起源、圣旨、像赞、像图、旧谱序、旧凡例、旧家规、旧谱传记、祠堂记、墓图、陈感塘村简介、世系，第二册至三世行传。,https://jiapu.library.sh.cn/https://jiapu.library.sh.cn/#/GenealogySummary:http://data.library.sh.cn/jp/resource/work/ebz8f9w3t2ydd3qa
尚桥李氏宗祠谱（浙江省/宁波市/奉化区）,李尧仁;李惠法,李,2018,--,始祖承词，自宁海梅林迁居道陈岭。始迁祖古淡，承词十八世孙，明时自道陈岭迁居奉化尚桥。 卷一图腾、祖训、家训、名单及照片、凡例、源流、议书、历届修谱一览表、新旧谱序、排行，卷二世系图，卷三至七世传，卷八志、航拍图、户口及学历表、公产、学校、爵秩、选举、儒林、人物、节孝、分徙、艺文、补遗、功德碑、记实。,https://jiapu.library.sh.cn/https://jiapu.library.sh.cn/#/GenealogySummary:http://data.library.sh.cn/jp/resource/work/jxw57cnfkuc6ncn5
尚书方氏宗谱（江西省上饶市婺源县）,黄衣,方,清嘉慶十七（1812）,--,始祖嚴端，唐時居江西弋陽鵝湖山。始遷祖起，字仙暹，諡文貞，唐季宰婺源，始居清華鎮。後裔散居江西婺源、上饒、德興、浮梁、波陽、安徽祁門、休寧等地。存卷四至七。書名據版心題。,https://jiapu.library.sh.cn/https://jiapu.library.sh.cn/#/GenealogySummary:http://data.library.sh.cn/jp/resource/work/ixrhlifmh5e5yjn7
尚书方氏宗谱（江西省上饶市婺源县）,胡廷玉,方,清道光二十二年（1842）,--,始祖嚴端，唐時居江西弋陽鵝湖山。始遷祖起，字仙暹，諡文貞，唐季宰婺源，始居清華鎮。後裔散居江西婺源、上饒、德興、浮梁、波陽、安徽祁門、休寧等地。存卷一至五、七、八。書名據版心題。,https://jiapu.library.sh.cn/https://jiapu.library.sh.cn/#/GenealogySummary:http://data.library.sh.cn/jp/resource/work/ys9snp9qua3buhqe
尚书方氏宗谱（江西省上饶市婺源县）,不详,方,清同治間,--,始祖嚴端，唐時居江西弋陽鵝湖山。始遷祖起，字仙暹，諡文貞，唐季宰婺源，始居清華鎮。後裔散居江西婺源、上饒、德興、浮梁、波陽、安徽祁門、休寧等地。存卷八至十、十三至二十三。書名據版心題。記事至同治十年。,https://jiapu.library.sh.cn/https://jiapu.library.sh.cn/#/GenealogySummary:http://data.library.sh.cn/jp/resource/work/lnc5nrjf3ht5qtl8
尚书方氏宗谱十五卷末一卷（江西省上饶市婺源县）,胡荣,方,清光緒三十二年（1906）,--,始祖嚴端，唐時居江西弋陽鵝湖山。始遷祖起，字仙暹，諡文貞，唐季宰婺源，始居清華鎮。後裔散居江西婺源、上饒、德興、浮梁、波陽、安徽祁門、休寧等地。缺卷二、十四、十五。書名據版心題。,https://jiapu.library.sh.cn/https://jiapu.library.sh.cn/#/GenealogySummary:http://data.library.sh.cn/jp/resource/work/4km35xp6bvmx99ek
尚德族刊(刘荣锡公支系）第1期—第5期合订本不分卷(江苏常州),刘寿祥,刘,2004-2008年,尚德堂,參見劉壽祥修《[江蘇常州]榮錫公支系劉氏家譜》條目（館藏：XP35498）。支祖榮錫（行一），清末民國人，家江蘇常州戚墅堰。譜載書法、攝影、刊頭語、人生百味、回憶錄、簡訊四則、通訊、教育與培養人才、健康園地、征稿啟事、征集家譜資料。,https://jiapu.library.sh.cn/https://jiapu.library.sh.cn/#/GenealogySummary:http://data.library.sh.cn/jp/resource/work/sk7fobgmifumu3wu
尚干林氏文房四支族谱（福建省/福州市/闽侯县）,林荣光;等,林,2009,--,始祖穆（字然祐，行三），官左朝奉大夫，世居河洛，光州固始，裔出鲁济，唐僖宗随王审知（官节度使）入闽，唐乾宁是时五代分争，社稷垂危，遂卜居闽县归义裹枕峰。始迁十四祖稼翁（字维本），官广东监运司事，元至元年间移居淘江对岸永庆里尚干。 谱载雁塔、义姑传、林森公传、序言、论族谱、世次表字、祠堂、庙阁、支族聚落分布简录、修谱理事会成员、捐资合家玉照、捐资芳名、墓图、济南长林宗谱、历朝缙绅进士题名记、先祖世表、世系图、世表。,https://jiapu.library.sh.cn/https://jiapu.library.sh.cn/#/GenealogySummary:http://data.library.sh.cn/jp/resource/work/tzsvpkto9b5p56mq
尚干林氏文房四支族谱（福建省/福州市/闽侯县）,林荣光,林,2009,--,始祖林穆(字然祐)，于公元八八五年由河南省信阳市固始县迁福建省福州市闽侯县祥谦镇枕峰村，其十九世孙为始迁祖林汝华，明永乐十八年由福建省福州市长乐市文武砂镇壶井村迁闽侯螺浦（即福建省福州市闽侯县上街镇浦口村）。 谱载序言、修谱论、世系。,https://jiapu.library.sh.cn/https://jiapu.library.sh.cn/#/GenealogySummary:http://data.library.sh.cn/jp/resource/work/k2hqrolqkbl4w8kj
尚寨吴氏族谱（福建省/漳州市/南靖县）,吴五县,吴,1995（1995）,--,始祖薪（字宗蓬，又字子芳），宋代人。始迁祖各荣，明洪武二十年自双溪口迁居尚寨。 谱载序、尚寨概况、大事记、世系图、渊源、名录、宗祠祭祀、寺庙、风俗、名胜、传说、文教、经济、交通、古碑文录等篇目。,https://jiapu.library.sh.cn/https://jiapu.library.sh.cn/#/GenealogySummary:http://data.library.sh.cn/jp/resource/work/uizvnjs9moc47de6
尚家垟尚氏宗谱（浙江省/温州市/乐清市）,尚锡鉴,尚,1997,--,始迁祖克昌（字朝盛，号载熙），宋代由闽之赤岸徙仕于温，官至通判，休任于永邑城南居焉。 谱载祖像、赞、诰敕、凡例、事记、宗谱序、传、历次干事名单、宗祠记、行第、世系图。,https://jiapu.library.sh.cn/https://jiapu.library.sh.cn/#/GenealogySummary:http://data.library.sh.cn/jp/resource/work/njb9okmraxj6znej
尚周村志（浙江省/金华市/东阳市）,刘浪,刘,2002,--,始迁祖元瑜（行绍二），元末明初自浙江东阳玉溪（现虎鹿镇溪口村）迁居尚周开宗立派。 谱载凡例、概述、上篇大事记略、田地山场（附尚周地图）、墓葬、物产、水利、教育（附知识分子名录）、灾异（附《七一三事变》、1995年火灾后赈灾名录）、商业、交通（附《尚周、出山的路》1993年修路捐款名录），中篇刘金氏合宗谱序、婺州东阳刘氏家谱序、刘金二姓辨、刘金考、刘氏源流序、刘金氏宗谱世系纪源、玉溪刘氏宗谱序、玉溪刘氏重修宗谱序、中山郡刘氏世系总图、巍山世系本支衍图、十三居派总世系图、巍山--玉溪世系图、尚周刘氏世系图、九如堂世系图、理堂屋世系图、乐善世系图、宝善世系图、蔡氏、陈氏、沈氏（附《我读宗谱》），下篇十三居总括歌、排行名讳字目、奖语集锦、人物传略（上）、人物传略（下）、上周八景、又上周四景、游东屏二十四韵、上周金峰赋、上周祠堂记、上周重建祠堂记、金峰宝善堂记、重修宝善堂记、金峰乐善堂记、上周永和堂记、子在川上、民间故事与传说、谚语、歇后语、土话、童谣民歌、社交称谓表座次图、贞教录、家规、附《尚周村志》文件、《尚周村志》捐款芳名、《尚周村志》输力芳名、后记。,https://jiapu.library.sh.cn/https://jiapu.library.sh.cn/#/GenealogySummary:http://data.library.sh.cn/jp/resource/work/1ake6u5u44r94eet
尚儒王氏宗谱（浙江省/湖州市/长兴县）,王德福,王,2012,三槐堂,始祖臯（字子高，行四四），南宋建炎三年护高宗随行自汴京开封县新里乡大边村迁居江苏苏州府长州县荻扁乡。始迁祖十二世奇瑞（字宝祥），元末避兵乱自苏州荻溪迁居湖州长兴西门外平定乡一都东川尚儒里（今浙江长兴县尚儒村）。 谱载六修序、名目、谱序、诰敕、像赞、始祖源流记略、凡例、家规十二条、原流图、世系考辨、世系图表、尚儒王氏世系、旧序、传略、行略、人物序、跋。,https://jiapu.library.sh.cn/https://jiapu.library.sh.cn/#/GenealogySummary:http://data.library.sh.cn/jp/resource/work/0kiqmxaaq1zt0kbt
尚儒王氏宗谱八卷（浙江省湖州市长兴县）,王廷干,王,1939年,三槐堂,始祖臯，字子高，南宋紹興間宦居江蘇蘇州府城荻扁鄉。始遷祖奇瑞，字寶祥，元末避兵亂再徙浙江長興縣西門外平定鄉一都東川尚儒里（今屬煤山鎮）。卷一序、題跋、受姓圖説，卷二凡例、家規、誥敕題辭、像贊、述祖詩、散居各地方紀，卷三源流記略、原姓、源流圖、世系考辨、世系總圖，卷四至六世表，卷七墓誌、祠志、傳、啟後録、翰墨雜志、藝文，卷八壽文、贈序、行略、續修名録、譜跋。世系載至第三十四世。譜初修於明洪武間，此爲六修本。,https://jiapu.library.sh.cn/https://jiapu.library.sh.cn/#/GenealogySummary:http://data.library.sh.cn/jp/resource/work/wrsq2h6zn1kwuis9
尚仪公谱.周敬轩公族孟一支系（广西壮族自治区）,周运廷,周,2017,--,"原籍江西省吉安市吉水县,明初周元善迁广西省玉林市为始祖,明中八世周尚仪迁广西省玉林市福绵区樟木镇。 族谱祠貌、墓碑志文、谱序、名士、家训、世系。",https://jiapu.library.sh.cn/https://jiapu.library.sh.cn/#/GenealogySummary:http://data.library.sh.cn/jp/resource/work/yggsbrfq2bqt3rch
尚仁系李氏族谱（山东省/烟台市/栖霞市）,李广学;李廷盛,李,2015,--,始迁祖尚仁，明末清初由丰粟迁来北洛汤建村。 谱载封面谱名说明、编纂委员会成员、序、修谱赞、墓碑、关于族人起名的范字、世系表、人物传记与简介、文选与论述、后记。,https://jiapu.library.sh.cn/https://jiapu.library.sh.cn/#/GenealogySummary:http://data.library.sh.cn/jp/resource/work/h6deacelthw7sis6
尖峰杨氏宗谱四卷（浙江省金华市兰溪市）,杨根和,杨,1920年,清白堂,始祖船山，南宋時自福建浦城縣移居浙江蘭谿縣邑西白露山。始遷祖元近，行禮四，明初再徙本邑尖山村。卷一序跋、傳記、像贊、凡例、家規、里居圖、基圖、祀産，卷二至四世系圖。書名據版心題。譜初修於明嘉靖三十四年，此爲七修本。,https://jiapu.library.sh.cn/https://jiapu.library.sh.cn/#/GenealogySummary:http://data.library.sh.cn/jp/resource/work/rmmx7zijiny1fh12
尖山龚氏四修族谱十八卷（湖南省长沙市）,龚运龙,龚,民國15年(1926),武陵堂,一世祖肇熾，字世昌，明正德間避姚源之難由南昌攜眷徙湘潭，子慶惠再遷善化七都桃花段。迄五世而派分七房。舊譜或为名成南，字肇熾者，元明之際由江右遷楚南，子進卜居善化尖山，是为始遷祖。此譜年月諱字與舊譜皆異，獨譜名“尖山”仍從舊说。卷一譜序、例言、凡例、家訓、勸戒詞、條規、祠規、碑記，卷二儀盰、祭文，卷三至四系圖，卷五至十四行傳，卷十五傳序，卷十六契據、文約，卷十七祠圖、墓圖，卷十八墓誌、跋語。書名據書衣*卷端題。,https://jiapu.library.sh.cn/https://jiapu.library.sh.cn/#/GenealogySummary:http://data.library.sh.cn/jp/resource/work/2anvzmvs8rdnwb7o
尖山洪姓族谱（台湾省/澎湖县）,洪清静,洪,不详,--,始祖公楷（字宣曦，号仕同，行十七郎），宋代福建同安人。始迁祖公亮（字廷采，号有邦），清代移居澎湖县西乡尖山村。,https://jiapu.library.sh.cn/https://jiapu.library.sh.cn/#/GenealogySummary:http://data.library.sh.cn/jp/resource/work/9wrwbvfmsffxuut7
