谱名,责任者,姓氏,撰修时间,堂号,家谱简介,详情链接
歙县龙溪汪氏统宗谱二十四卷首一卷（安徽省黄山市歙县）,汪宏布,汪,清乾隆二十年（1755）,惇本祠,始迁祖宋代人元会，一名忠，字公直；逢春，一名閣，字南軒。书名据版心题。,https://jiapu.library.sh.cn/https://jiapu.library.sh.cn/#/GenealogySummary:http://data.library.sh.cn/jp/resource/work/bxzwkof7qvzki3we
歙县迁苏潘氏家谱七卷（江苏省苏州市）,潘廷燮,潘,1914年,--,始祖美，字仲詢，宋代人。始迁祖其烈，字廷烈，号蕴武，二十四世祖，清康熙间由歙县移居蘇州長洲县山塘街星桥灣。书名据书名页题。,https://jiapu.library.sh.cn/https://jiapu.library.sh.cn/#/GenealogySummary:http://data.library.sh.cn/jp/resource/work/g5kylcyxtsqvi43m
歙县敬兴刘氏世谱十二卷首一卷（安徽省黄山市歙县）,刘存坊,刘,清乾隆47年(1782),惇典堂,始祖巨容，字德量，唐末大將，官至節度使。始迁祖與，字克進，巨容六世孫，北宋时由婺源清塘迁來歙县，初構廬於西山刘家塢，後定居敬兴。卷首谱序、谱論、凡例、詔敕，卷一传记、祠图、墓图、祀産，卷二至十一世系图，卷十二修谱列名、捐資列名、附记。存卷首、卷一至五、七至十二。书名据版心、卷端、目录题。谱初修於元至元五年。,https://jiapu.library.sh.cn/https://jiapu.library.sh.cn/#/GenealogySummary:http://data.library.sh.cn/jp/resource/work/346yxeo4urqeoe1g
歙县城东上路街汪追远族思成堂支谱不分卷（上海市浦东新区）,汪金慰,汪,--,--,始迁祖清代因来滬習賈，遂贅於浦东高家行万安樓之西首吳氏。据民国本複印。,https://jiapu.library.sh.cn/https://jiapu.library.sh.cn/#/GenealogySummary:http://data.library.sh.cn/jp/resource/work/jflwpypzottu9a97
歙县南源口汪氏宗谱不分卷（安徽省黄山市歙县）,汪效骧,汪,1941年,惇叙堂,始迁祖廷忠，约於元明之際由歙县五都坦頭迁南源口。谱载谱序、世系。书名据书衣题。,https://jiapu.library.sh.cn/https://jiapu.library.sh.cn/#/GenealogySummary:http://data.library.sh.cn/jp/resource/work/rfkuwimw1paujerm
歙南洪川洪氏续修家谱不分卷（安徽省黄山市歙县）,洪元鲁,洪,清順治十七年（1660）,--,始祖輝，字万光，唐代人。始迁祖誠，字伯實，行二，唐代人。书名据卷端、谱序题。三修本。,https://jiapu.library.sh.cn/https://jiapu.library.sh.cn/#/GenealogySummary:http://data.library.sh.cn/jp/resource/work/dabh9hayhhmh4983
歙南武担姚氏重修族谱二卷（安徽省黄山市歙县）,姚世珪,姚,明万曆六年（1578）,--,始迁祖支仲，字彦持，宋代移居歙县。始迁祖茂實，字秀甫，号筠隱，行万三，元代再徙武擔。是为下門支谱。书名据卷端题。,https://jiapu.library.sh.cn/https://jiapu.library.sh.cn/#/GenealogySummary:http://data.library.sh.cn/jp/resource/work/b8zvmc65nm1v3s2b
歙南武担姚氏支谱二卷（安徽省黄山市歙县）,姚礼俭,姚,1935年,--,始迁祖支仲，字彦持，宋代移居歙县。始迁祖茂實，字秀甫，号筠隱，行万三，元代再徙武擔。是为下門支谱。书名据版心题。三修本。,https://jiapu.library.sh.cn/https://jiapu.library.sh.cn/#/GenealogySummary:http://data.library.sh.cn/jp/resource/work/ol9ot5phkoilzddq
歙南武担姚氏支谱三卷首一卷末一卷（安徽省黄山市歙县）,姚邦燮,姚,1931年,永泽堂,始迁祖支仲，字彦持，宋代移居歙县。始迁祖茂實，字秀甫，号筠隱，行万三，元代再徙武擔。是为下門支谱。是为上門支谱。书名据版心题。,https://jiapu.library.sh.cn/https://jiapu.library.sh.cn/#/GenealogySummary:http://data.library.sh.cn/jp/resource/work/5rtd8v6tq96l1wge
歙南梅口［汪氏］续修统宗正脉谱不分卷（安徽省黄山市歙县）,不详,汪,清,--,始迁祖德载、德昇。书名据谱序题。记事至清乾隆三十二年。,https://jiapu.library.sh.cn/https://jiapu.library.sh.cn/#/GenealogySummary:http://data.library.sh.cn/jp/resource/work/b8iiqsi2ahy8ykhl
歙南吴氏族谱六卷（安徽省黄山市歙县）,吴尚德,吴,明崇禎元年（1628）,--,始祖少微，字仲材，号邃谷，唐贞觀间自江西鄱阳迁居安徽休宁，为一世迁新安祖。始迁祖淙，行三三，北宋宣和间迁居歙县南乡溪南村臨溪。本谱主载明人仕维（小名奴）下一派。书名据版心、卷端、谱序题。本书以“集”序卷。,https://jiapu.library.sh.cn/https://jiapu.library.sh.cn/#/GenealogySummary:http://data.library.sh.cn/jp/resource/work/pfg2decip5g9ntkd
歙南吴氏族谱不分卷（安徽省黄山市歙县）,不详,吴,清,--,始祖少微，字仲材，号邃谷，唐贞觀间自江西鄱阳迁居安徽休宁，为一世迁新安祖。始迁祖淙，行三三，北宋宣和间迁居歙县南乡溪南村臨溪。本谱主载明人仕维（小名奴）下一派。谱载明初人仕善（小名庆奴，字榮庆）下一派。谱载世表。书名据卷端题。记事至清康熙间。,https://jiapu.library.sh.cn/https://jiapu.library.sh.cn/#/GenealogySummary:http://data.library.sh.cn/jp/resource/work/x4qhe9o1kzbzm9la
歙南吴氏族谱不分卷（安徽省黄山市歙县）,不详,吴,明,--,始祖少微，字仲材，号邃谷，唐贞觀间自江西鄱阳迁居安徽休宁，为一世迁新安祖。始迁祖淙，行三三，北宋宣和间迁居歙县南乡溪南村臨溪。本谱主载明人仕维（小名奴）下一派。谱载歙南吳氏世系图。书名据卷端题。,https://jiapu.library.sh.cn/https://jiapu.library.sh.cn/#/GenealogySummary:http://data.library.sh.cn/jp/resource/work/b8dobbmi7swuww6r
歙南吴氏族谱不分卷（安徽省黄山市歙县）,不详,吴,清,--,始祖少微，字仲材，号邃谷，唐贞觀间自江西鄱阳迁居安徽休宁，为一世迁新安祖。始迁祖淙，行三三，北宋宣和间迁居歙县南乡溪南村臨溪。本谱主载明人仕维（小名奴）下一派。谱载明初人仕善（小名庆奴，字榮庆）下一派。谱载谱序、世系、行传、墳山、合同。书名据谱序题。记事至清咸丰间。,https://jiapu.library.sh.cn/https://jiapu.library.sh.cn/#/GenealogySummary:http://data.library.sh.cn/jp/resource/work/14hppxrmcfpnyy9v
歙北高阳许氏统宗世谱不分卷（安徽省黄山市歙县）,不详,许,清,--,十五世孫理，字行全；璙，字行先，分别爲高陽古里東、西二支世祖。載歙北高陽古里總派圖、東西二支總派圖、支派世系。書名據卷端題。,https://jiapu.library.sh.cn/https://jiapu.library.sh.cn/#/GenealogySummary:http://data.library.sh.cn/jp/resource/work/ri6gptai7h1qd1ys
歙北皇呈徐氏族谱十二卷（安徽省黄山市歙县）,徐景京,徐,清乾隆10年(1745),--,新安徐氏，託名緄为始祖。緄十五传曰昶者，字秉彞，仕南唐为歙州刺史，遂家於郡治北七里之皇呈，为新安徐氏始迁祖。卷首一序文，二引义，三凡例，四考證，五分徙序文，六名族志录，七誥敕，八碑记，九列传，十紀述，十一遗像，十二墓图碑题，十三宗谱前紀，十四统系，十五支图，十六分迁備考，十七異派别紀，十八後跋。卷一序、凡例、彙紀等，卷二至十一世系，卷十二外传、内传等。书名据书签、目录、卷端题。三修本。,https://jiapu.library.sh.cn/https://jiapu.library.sh.cn/#/GenealogySummary:http://data.library.sh.cn/jp/resource/work/u6sjecja5a7vuenz
歙北江村济阳江氏续修合谱不分卷（安徽省黄山市歙县）,江瑞霓,江,清乾隆32年(1767),--,譜尊東漢江革爲一世。始遷祖爲其三十七世孫汝剛，小名細四，字君毅，行十三，北宋時官於歙，後卜居城北之橙子培，以姓名地曰江村。是譜著録第四十五世祖桂一、桂二、桂三、桂四、士盛、士旦、士昌、士勤共八支之世系。明江天一、江東之出於此族。書名據譜序題。,https://jiapu.library.sh.cn/https://jiapu.library.sh.cn/#/GenealogySummary:http://data.library.sh.cn/jp/resource/work/irv2nnoe75ka4usa
歙北江村济阳江氏族谱十卷首一卷末一卷（安徽省黄山市歙县）,江维椿,江,清乾隆四十三年（1778）,--,譜尊東漢江革爲一世。始遷祖爲其三十七世孫汝剛，小名細四，字君毅，行十三，北宋時官於歙，後卜居城北之橙子培，以姓名地曰江村。是譜著録第四十五世祖桂一、桂二、桂三、桂四、士盛、士旦、士昌、士勤共八支之世系。明江天一、江東之出於此族。譜載、序、世系、墓塋圖、人物傳、碑記、墓誌銘、壽序、跋。 存卷首、卷一至三、五、七至十。書名據版心題。六修本。,https://jiapu.library.sh.cn/https://jiapu.library.sh.cn/#/GenealogySummary:http://data.library.sh.cn/jp/resource/work/n9t1dbr7xpamjcme
欧馀山蹄亭侯 欧阳、欧、区、阳首届四姓合修统宗通谱中国广西桂林版（广西壮族自治区/桂林市）,阳世华,阳,2018,--,桂林水陂一世祖欧阳奭，智派基祖，生子宽、实、宁。欧阳宽、欧阳宁同迁桂林水陂定居，是为始迁祖，桂林水陂二世祖。 谱载序文篇，本源篇，祖像篇，人文篇，文艺篇，迁徙篇，综述篇。,https://jiapu.library.sh.cn/https://jiapu.library.sh.cn/#/GenealogySummary:http://data.library.sh.cn/jp/resource/work/mrs95u3b2gxx3kom
欧阳谱志——广东（槎江系）秀甫公续谱（广东省/河源市/连平县）,--,欧阳,1993,--,始迁祖泳夫（号日新），元末自江西安远濂江迁居槎江（广东省河源市）。子秀甫（元秀，行八），明洪武年间自河源船塘开基沐河（广东省河源市连平县隆街镇）。 谱载绪言、论谱、祖像、像叙、前章（源流考叙、目录、资料）、后章（广东槎江系续谱、目录、彪公系部分史料、彤公系大部分史料、万公系部分史料）、编后语。,https://jiapu.library.sh.cn/https://jiapu.library.sh.cn/#/GenealogySummary:http://data.library.sh.cn/jp/resource/work/w2bdjio5kwcw5dpa
欧阳续修宗谱不分卷(湖南),欧阳代赓,欧阳,清同治8年(1689),--,始遷祖景淵，元末遷來南清水鋪。一冊錄地界記、呈詞、祠堂印契、田坦印契、壽序、其餘皆世系表。,https://jiapu.library.sh.cn/https://jiapu.library.sh.cn/#/GenealogySummary:http://data.library.sh.cn/jp/resource/work/cgec70w341rurjkg
欧阳瑞四公支谱二十二卷(江西鄱阳),欧阳翔,欧阳,民國16年(1927),--,始遷祖華（字得春），北宋徽宗崇寧間任饒州太守，致仕後居於鄱陽之龍溪。支祖九世瑞四，約元代人。卷一序，卷二凡例，卷三先儒譜說，卷四遷居鄉井，卷五居宅基圖，卷六墓圖，卷七墓志銘，卷八字派，卷九誥敕，卷十忠孝節義，卷十一理學儒林，卷十二仕宦選舉，卷十三學校儲英，卷十四會譜，卷十五約文，卷十六傳贊，卷十七詩文雜錄，卷十八事業，卷十九歷代纂修，卷二十存疑辨說，卷二十一、二十二世系。,https://jiapu.library.sh.cn/https://jiapu.library.sh.cn/#/GenealogySummary:http://data.library.sh.cn/jp/resource/work/ia0g22x3lp12qtqz
欧阳瑞四公支谱□□卷(江西鄱阳),欧阳凤,欧阳,清宣統元年(1909),--,參見歐陽翔修《[江西鄱陽]歐陽瑞四公支譜》條目（館藏：1060708-0709）。始遷祖華（字得春），北宋徽宗崇寧間任饒州太守，致仕後居於鄱陽之龍溪。支祖九世瑞四，約元代人。存卷為世系。,https://jiapu.library.sh.cn/https://jiapu.library.sh.cn/#/GenealogySummary:http://data.library.sh.cn/jp/resource/work/ih3hqfjko01bvaxu
欧阳派下俊芳房谱（湖南省湘潭市湘乡市）,欧阳清友,欧阳,民國十二年(1923),--,始迁祖泰臻，南宋景定年间自江西庐陵县儒林乡迁来湖南湘乡东凤一都东岸坪。房祖俊芳，第八世，明成化、弘治年间人。内录谱序、世系。书名据版心题。,https://jiapu.library.sh.cn/https://jiapu.library.sh.cn/#/GenealogySummary:http://data.library.sh.cn/jp/resource/work/assdpixwjr5bef2b
欧阳沙湖家谱（湖北省/仙桃市）,欧阳世海,欧阳,2011,渤海堂,始祖万，唐代吉州安福令（今江西省安福县）。始迁祖八世奇肇，因当时朝代变更，社会动荡，避乱由江西迁徙至湖广，后定居于沔阳（今湖北省仙桃市）。 谱载目录、图腾、图序、谱跋、谱序、公传、寿序、宗约说、族规说、契约、碑墓记、墓地志、宗派表、衍歌、迁居表、凡例、后记、警言、附录。,https://jiapu.library.sh.cn/https://jiapu.library.sh.cn/#/GenealogySummary:http://data.library.sh.cn/jp/resource/work/htu8l8dtes8qf9ij
欧阳氏谱（江西省/新余市）,--,欧阳,1997,忠义堂,始祖琮，字崇文，唐天宝时官吉州。,https://jiapu.library.sh.cn/https://jiapu.library.sh.cn/#/GenealogySummary:http://data.library.sh.cn/jp/resource/work/3gpp6tidanrfgi82
欧阳氏谱图序一卷,王清穆,欧阳,清光緒20年(1894),--,是書為抄錄宋歐陽修《歐陽氏譜圖序》、蘇洵《譜例》、方希直《重譜》等文匯編成書。,https://jiapu.library.sh.cn/https://jiapu.library.sh.cn/#/GenealogySummary:http://data.library.sh.cn/jp/resource/work/tre0tcddaxh5opw5
欧阳氏西壁公合修宗谱（江西省/抚州市/宜黄县）,欧阳印生,欧阳,2002,--,"始迁祖欧阳西璧（名价,字定谋,行景六），由崇仁华盖（今江西省抚州市乐安县华盖山）徙居滁山之阴（今江西省抚州市宜黄县一带），生卒不详。 卷一新序、凡例、谱序、源流说、本源图、新跋，卷二至十三世次。",https://jiapu.library.sh.cn/https://jiapu.library.sh.cn/#/GenealogySummary:http://data.library.sh.cn/jp/resource/work/43kqthhc8by1mpk7
欧阳氏续修族谱（湖南省衡阳市常宁市）,欧阳积汶;欧阳厚鑫;欧阳厚糈,阳,民國19年(1930),--,始祖萬，唐僖宗乾符間仕江西安福令。二十世來鳳，明洪武二年自湖南益陽遷居衡州，轉遷衡山銅鈴坪。生子興旺、興法、興輔，興輔生子世裕、世祜、世禧，三者及後裔陸續遷居常寧。存譜存有世祜、世禧二派世系。世祜（字福壽，行二），明洪武二十二年戍守常寧攜弟世禧（字福昌，行三），自衡山大源塘遷居常寧南路板橋，世祜居橋之左，世禧居橋之右。存卷載譜序、壽言、任事人名、世系。存卷一。,https://jiapu.library.sh.cn/https://jiapu.library.sh.cn/#/GenealogySummary:http://data.library.sh.cn/jp/resource/work/afo3qxw6nzep3m4i
欧阳氏续修族谱十二卷，首二卷（湖南省邵阳市）,欧阳又叔;欧阳尔昌,欧阳,民國32年(1943),六一堂,始迁祖志昌，明永乐四年同弟五人自江西吉安庐陵县迁湖南宝庆府邵阳县万安一都五泉塘。首二卷新旧序、凡例、宗范像赞、服制图。新寿序、旧赞、公产、新旧传、会产、坟山图等。卷一至卷十二世系表。书名据版心、书名页题。书衣题欧阳续修族谱。,https://jiapu.library.sh.cn/https://jiapu.library.sh.cn/#/GenealogySummary:http://data.library.sh.cn/jp/resource/work/uy66tz1rcae37jz4
欧阳氏续修族谱一卷（湖南省衡阳市常宁市）,欧阳厚鑫;欧阳厚糈;欧阳积汶,阳,民國18年(1929),--,是族先世於唐乾符間居江西安福，明洪武二年自湖南益陽遷居衡山銅鈴坪。始遷祖世祜（字福壽，行二）、世禧（字福昌，行三），明洪武二十二年世祜調戍常寧，遂攜弟世禧自衡山大源塘雙橋村遷居常寧南路板橋。譜載譜序、壽序、壽言、任事人名、世系。書名據版心題。,https://jiapu.library.sh.cn/https://jiapu.library.sh.cn/#/GenealogySummary:http://data.library.sh.cn/jp/resource/work/4a22hy1hxzbcwft6
欧阳氏族谱（马来西亚）,欧阳海明,欧阳,1985,渤海堂,始迁祖安，从广东省深圳市宝安区迁到马来西亚，迁徙时间不详。 谱载姓源、迁徙、堂号、世系。,https://jiapu.library.sh.cn/https://jiapu.library.sh.cn/#/GenealogySummary:http://data.library.sh.cn/jp/resource/work/6pvio3zxjy18x3zw
欧阳氏族谱（台湾省/澎湖县）,合族,欧阳,1981,--,始祖昌，唐代人。始迁祖三，明清之间人。,https://jiapu.library.sh.cn/https://jiapu.library.sh.cn/#/GenealogySummary:http://data.library.sh.cn/jp/resource/work/psj74rj8n1n5irfn
欧阳氏族谱（湖南省/邵阳市/武冈市）,欧阳世祺,欧阳,2016,--,始迁祖源斌携其子金、木、水、火、土，明洪武末年自江苏迁徙湖南武攸。 谱载前言、凡例、谱序续载十六首、班行词、欧阳氏五世总图、各公派支系、世系图、后记。,https://jiapu.library.sh.cn/https://jiapu.library.sh.cn/#/GenealogySummary:http://data.library.sh.cn/jp/resource/work/psy8vhzyq31vy6vj
欧阳氏族谱（湖南省/永州市/江永县）,欧阳义询,欧阳,2016,--,始。祖籍湖南省株洲市醴陵市白兔潭镇黄甲村。始迁祖三世严，迁徙时间不详，由春陵(今年湖南省永州市宁远县柏家坪镇柏家村和柏家井村)立宅永明寒柏岭(今湖南省永州市江永县层铺镇)。 谱载序言、抄撰、直系表、用字排行辈、祖训、制度、列传、艺文。,https://jiapu.library.sh.cn/https://jiapu.library.sh.cn/#/GenealogySummary:http://data.library.sh.cn/jp/resource/work/7v2u2r3dg4ve7wpp
欧阳氏族谱（广西壮族自治区/桂林市/灵川县）,欧阳肇华,欧阳,2000,--,始迁祖成，明代人，祖籍江西吉安府庐陵县钓源村，迁居于广西灵川县一都六图塘边（今坛下镇塘边村），生五子，第三子子富迁于灵川县公平梅子村。 此谱即子富后裔之谱。载子富一支世系图。,https://jiapu.library.sh.cn/https://jiapu.library.sh.cn/#/GenealogySummary:http://data.library.sh.cn/jp/resource/work/y11odt1bzon3e8gp
欧阳氏族谱（广东省/河源市）,欧阳可明,欧阳,1993,--,始祖琮，唐代居江西吉州，琮曾孙彪、彤徙广州，十五传至馆，宋时复迁江西安远濂江，再传八世泳夫，元时始迁河源槎江。是为彪、彤后裔居河源者修。 篇一谱序、世系、谱牒，篇二分宗载谱，篇三纪文、名人简介、荣芳录，篇四附录载分布图、人丁统计表、捐资表、编后语、图片等。,https://jiapu.library.sh.cn/https://jiapu.library.sh.cn/#/GenealogySummary:http://data.library.sh.cn/jp/resource/work/x21ncyulqtktm5n2
欧阳氏族谱官田支谱（湖南省/邵阳市/洞口县）,欧阳泉源,欧阳,2001,--,始迁祖元亨、元通、元美，宋代人。,https://jiapu.library.sh.cn/https://jiapu.library.sh.cn/#/GenealogySummary:http://data.library.sh.cn/jp/resource/work/v87eeestbxypffn6
欧阳氏族谱九卷(全国),欧阳金丹,欧阳,清同治11年(1872),渤海堂,始祖琮，世居江西吉州。始遷祖正華，明代遷萍鄉；上華、正祥、正財、京承遷瀏陽；任慶遷武寧；上利遷萬載。卷一序、誥敕、服製圖、祠堂圖、屋圖、像圖、墳圖、修譜人名、總歌等，卷二家規、凡例、序、像贊、忠節紀、理學記、祠堂記等，卷三至九世系。,https://jiapu.library.sh.cn/https://jiapu.library.sh.cn/#/GenealogySummary:http://data.library.sh.cn/jp/resource/work/d0g5kubqponis5c8
欧阳氏族宗谱（湖北省）,等;欧阳德银,欧阳,2012,六一堂,一世祖欧阳万，唐代仕为安福令，遂家焉。续谱安丁亥年谱为蓝本，续录天门、沔阳、汉川、潜江、嘉鱼等四十九个支头。 不分卷。正文前有出版说明、文件，欧阳姓氏图腾先祖像等，第116页七远祖追源图、世系图。,https://jiapu.library.sh.cn/https://jiapu.library.sh.cn/#/GenealogySummary:http://data.library.sh.cn/jp/resource/work/xm21v6gvdp51k9sq
欧阳氏族宗谱（江西省/吉安市/安福县）,欧阳矩轮,欧阳,2012,稽古堂,始迁祖不详，后裔散布在江西省吉安市安福县。 谱载出版说明、像图、修谱序、族规、世系歌、远祖追源图、世系总图。,https://jiapu.library.sh.cn/https://jiapu.library.sh.cn/#/GenealogySummary:http://data.library.sh.cn/jp/resource/work/ss27xs52fbnn2cml
欧阳氏族十修谱（湖南省/郴州市/安仁县）,欧阳邦本,欧阳,1998,渤海堂,始迁祖抟(字鹏翔)，原籍河南省南阳市方城县会村里，宋初时率子赞(字顺达，行一)奉旨镇守长、潭、桂平南左吾大将军，由长、潭、衡平息南乱于湖南省郴州市安仁县，遂在城北落籍。 谱载历代修谱年序、十修理事会名单例后、十修赞助费用名单例后、十修家教训铭、凡例、老谱旧例、祭祀榜文、祠堂图、历代人名历履、碑文、先祖赞、墓志、序、寿文、世系世表。,https://jiapu.library.sh.cn/https://jiapu.library.sh.cn/#/GenealogySummary:http://data.library.sh.cn/jp/resource/work/hmc84ltosi5w4f94
欧阳氏少峰公五修支谱十卷首一卷末一卷(湖南醴陵),欧阳魁镜;欧阳名暹,欧阳,清光緒33年(1907),伦叙堂,參見清歐陽振熾修《[湖南醴陵]續修歐陽氏少峰公支譜》三修本條目（館藏：909421）。始祖萬，唐乾符間宦居江西安福。五世詃（改名遠，字可聞），北宋時派分安福永嘉鄉黃石里。始遷祖二十一世紹中（字存良），明建文間自安福韓水遷居醴陵南十八都梘灣。支祖二十九世東長（一名東志，字少峰），明末清初時人。其子茂初（字淳慎）、茂祝（字聞礎），分居醴陵圍塘、萍鄉昇平里二處。卷首譜序、凡例、領譜字號、譜局執事，卷一祠祀誌，卷二至三系次誌，卷四至五藝文誌，卷六彝訓誌，卷七人物誌，卷八墳墓誌，卷九墳山備考，卷十生生譜，卷末序跋。,https://jiapu.library.sh.cn/https://jiapu.library.sh.cn/#/GenealogySummary:http://data.library.sh.cn/jp/resource/work/8g2zxwxx3p0arljj
欧阳氏少峰公五修支谱十卷首一卷末一卷(湖南醴陵),欧阳名辉,欧阳,清光緒33年(1907),伦叙堂,始遷祖紹中，明建文間由江西豫章遷居醴南十八都梘上。房祖東長（一名東志，字少峰），明末清初人。卷首譜序、領譜字號、譜局執事，卷一祠祝誌，卷二至三世次，卷四至五藝文誌，卷六彝訓誌，卷七人物誌，卷八墳墓誌，卷九墳山備考，卷十生生譜，卷末序跋。,https://jiapu.library.sh.cn/https://jiapu.library.sh.cn/#/GenealogySummary:http://data.library.sh.cn/jp/resource/work/xixahn5lt8zrqvox
欧阳氏家谱（山东省/烟台市/栖霞市）,欧阳为,欧阳,1982,--,先世从山东招远县欧阳家疃迁到栖霞县。始迁祖彩福、彩玉分迁到范家庄、桃村镇。,https://jiapu.library.sh.cn/https://jiapu.library.sh.cn/#/GenealogySummary:http://data.library.sh.cn/jp/resource/work/8sxjrstorrc5e9xe
欧阳氏宗谱（湖南省/怀化市/鹤城区）,欧阳祜,欧阳,1998,文忠堂,始迁祖高叟，元代由白牛塘(今属上海市)，迁到罗家溪(今湖南省怀化市鹤城区)。 卷一前言、本届序、在事人、名人录、乐捐人、凡例、排行表、谱序、碑序、世系，卷二至卷十世系。,https://jiapu.library.sh.cn/https://jiapu.library.sh.cn/#/GenealogySummary:http://data.library.sh.cn/jp/resource/work/mnwkqux9jmpilemw
欧阳氏宗谱（湖北省）,欧阳道安,欧阳,2014,渤海堂,始祖万，唐僖宗时任安福令，因家焉。五世讬、 詃、弘 、戉，此为四人后裔卜居汉水下游武汉、汉川、云梦、应城、仙桃等地合修之谱。 卷首续修宗谱理事会、各地首事名目、宗谱序、凡例、历代续谱文献汇编，卷一至六世系图、世表，卷末捐资功德榜、后记。,https://jiapu.library.sh.cn/https://jiapu.library.sh.cn/#/GenealogySummary:http://data.library.sh.cn/jp/resource/work/y7bj6toz8kgln5wm
欧阳氏宗谱（湖北省）,欧阳文清;等,欧阳,1988,六一堂,始祖万，唐僖宗时任安福县令，吉州刺史，遂居焉。五世孙谟、托、弦、堂、弘、戊派分六房。各房后裔分迁湖北监利、洪湖、沔阳、潜江四县，其中如二十八世孙笈，明代迁居监利县潭家场。 卷一记、祭文、像赞、序跋、谱例、歌、人物志、世派世序、图、世系表，卷二至十一世系表。,https://jiapu.library.sh.cn/https://jiapu.library.sh.cn/#/GenealogySummary:http://data.library.sh.cn/jp/resource/work/8psssmiu3pc6ul76
欧阳氏宗谱（湖北省/黄冈市）,欧阳际享;欧阳世喜,欧阳,1991,六一堂,始迁祖世文，明洪武初年奉令自江右饶州府乐平县瓦屑坝徙饶居楚黄冈之还和乡居焉。 卷首上新旧执事人员名目、原序、古序，卷首中（上）源流宗派、遗像、墓图、凡例、家规，卷首中（下）圣谕、服制、家训、摘抄语录，卷首下列传、行状、记说、合约、杂据、交仕录、捐款名目、人口分布一览表，卷一至十二世系、行传。,https://jiapu.library.sh.cn/https://jiapu.library.sh.cn/#/GenealogySummary:http://data.library.sh.cn/jp/resource/work/5j2pzxs9xnz8zckf
欧阳氏宗谱（湖北省/襄阳市/南漳县）,欧阳为福,欧阳,2019,渤海堂,始迁祖广，北宋时随父亲宦官，途中路过湖北襄阳时，觉得此地环境优美，后定居南垭（今隶属于湖北省襄阳市南漳县）。 卷首圣谕、家训、图腾族徽族旗、目录、凡例、谱序、传赞、概况、本源图、簪缨录、像赞、诰封、各村简介、合约、字派、辈分一览表、芳名录、编后语、修谱机构，卷二至卷二十四世系表。,https://jiapu.library.sh.cn/https://jiapu.library.sh.cn/#/GenealogySummary:http://data.library.sh.cn/jp/resource/work/meeppwb9izdqjoj5
