谱名,责任者,姓氏,撰修时间,堂号,家谱简介,详情链接
潜川张氏宗谱（安徽省/合肥市/庐江县）,张劲松;张敦献,张,2014,万选堂,始迁祖华五，元末携昆季四（华一、华二、华三、华四）自江西鄱阳瓦西迁居安徽桐城资福寺何家圩，明初又携华三及族孙仲晓（字大立）自桐城迁居庐江西南平顶山，乡邑称“潜川义门张氏”。 卷一引、旧序、新序、诰封、历次主修名单、纪原图序、世系图、跋，卷二至十三世系，卷十四始祖叙、记，卷十五传赞诗序、跋，卷十六序赞传、跋、传赞序、重修祠宇记、重修观音寺记，卷十七凡例、谱说、家礼图、家规、家法、说、田契、山契、捐资榜，卷十八茔图、跋。,https://jiapu.library.sh.cn/https://jiapu.library.sh.cn/#/GenealogySummary:http://data.library.sh.cn/jp/resource/work/i48toxie7fiqth2m
潜川张氏宗谱（安徽省/合肥市/庐江县）,张曙生,张,2019,南槐堂,始迁祖祖益，明初由徽州迁居庐江东乡五神泊，后居东门外作坊河，又入城南门内槐树下。 卷一谱序、合影、理事会名目、执事名目、功德榜、族秀收录标准、族秀榜、寿星榜、凡例，卷二传赞，卷三像、公议款条、格言、凡例、字派、墓田记、契约、坟图、执谱字号等，卷四至十六世系。,https://jiapu.library.sh.cn/https://jiapu.library.sh.cn/#/GenealogySummary:http://data.library.sh.cn/jp/resource/work/j68he9g34smrgeyc
潜川张氏宗谱（安徽省/合肥市/庐江县）,张后生,张,2009,--,始祖师载(讳讯，字德林)，明代有婺源迁居肥西石香炉岗。始迁祖三世孙选(字万青，号青钱)，明崇祯间庐江县龙潭桥。 卷一题词、谱序、凡例、新编家规、派行字辈、一至九世世系表、祭文、闻人录、艺文篇、芳名录、附录、六修宗谱组织机构、收执谱人名录、上谕十六条、跋、、张氏修祠引、合族坟茔图、契、世系传承、世系列图，卷二至三世系表。,https://jiapu.library.sh.cn/https://jiapu.library.sh.cn/#/GenealogySummary:http://data.library.sh.cn/jp/resource/work/1sb7fdjd7qt1joah
潜川张氏宗谱（安徽省/合肥市/庐江县）,张宗山,张,2017,百忍堂,始祖亨一（字养浩，号希孟，谥文忠），山东济南人，元代自江西婺源迁安徽合肥南乡邢家河。传五世有乔、良二人，良后裔于清乾隆二十五年由合肥南乡邢家河（今属肥西县）迁居庐江北乡永兴圩（今庐江县同大镇石大圩）。 卷一画像、族规、伟人名人论家谱、凡例、谱序、辈序、宗亲代表大会照片、家风、理事会名录照片、编纂委员会名录、各片片长、登记员名录、照片，家族风采录，卷二家风、谱序、正堂示禁、圣谕、家规、家训，卷三至十一世系，卷十二家族历史名人、致宗亲一封公开信、规章制度、讲话、入户登记的几点说明、族秀登记表的填写、入谱初稿的书写方法、工作报告、后记。,https://jiapu.library.sh.cn/https://jiapu.library.sh.cn/#/GenealogySummary:http://data.library.sh.cn/jp/resource/work/312ejjtbwdbjlnyt
潜川宋氏宗谱（安徽省/合肥市/庐江县）,宋建山,宋,2012,文献堂,始迁祖武（字绳庵），明初自江西婺源迁居安徽庐江（别名潜川）西乡冷水关象山之阳。子士明、士昕、士昭派分三房，分别为邑之西乡象形地、西乡查子山、东乡青山之支祖。 卷一图、引、图腾、通知、像赞、序、执事名目，卷二诰封、凡例、谱说、宗法考证、家训、图、服制、宗祠、祭祀、领谱字号、契约、章程、墓志、发言稿、照片，卷三记、行述、寿序、实录、墓志、行略、传，卷四传、诗词、照片，卷五至三十六世系图、世系表。,https://jiapu.library.sh.cn/https://jiapu.library.sh.cn/#/GenealogySummary:http://data.library.sh.cn/jp/resource/work/5dkmv1mawew5v672
潜川孙氏宗谱（安徽省/合肥市/庐江县）,孙永泉;等,孙,2019,公正堂,始迁祖太成（字先启），孙权后裔，世居安徽黄山太平塘沟村，后迁婺源（今江西婺源）。明洪武己酉年迁庐邑东乡上圣殿。二世善二定居黄陂湖之北（今庐江县白湖镇裴岗社区孙家院），清三定居黄陂湖之南（今庐江县龙桥镇竹林孙嘴），清一迁无为县杨柳圩（今无为县黄姑与庐江县杨柳陶湾交界处），清二迁桐城县堵壁山（今枞阳县白梅乡孙畈、孙家大庄等地）。其中清一一支分堂号为“天得堂”，已八修宗谱。 卷一载新序、老序、上谕十六条、张九成谱引、凡例、家规、跋、九仪九戒、作谱五难、六不书、冠婚丧祭引、宗法考证、大宗小宗、家礼仪节、时祭式，卷二老传赞、历代渊源世系引，卷三至卷卷九世系年表，卷十公请新示、祠堂引、祠堂图、祠堂四届、新立字派、执事名目、议字、契据、山图、墓志、领谱规例、领谱名目、鱼龙字号、跋、后记。,https://jiapu.library.sh.cn/https://jiapu.library.sh.cn/#/GenealogySummary:http://data.library.sh.cn/jp/resource/work/iic6zwlx2rg35nvw
潜川孙氏宗谱（安徽省/合肥市/庐江县）,孙尘,孙,2012,宝翰堂,始迁祖忠伯，明代自江西婺源牌柚迁居安徽舒城鹿起山，复迁庐江（旧称潜川）之西大城坂山。忠伯本姓王，从舅氏改姓孙。 卷一遗训、序、凡例、家礼图式、祠事款目、新编家规、像图赞、行状、墓志、墓图、卷二杂文、序、传、字派，卷三世系图，卷四至九世系表，卷十诸茔坐落、祖茔碑记、祖茔图记、四修执事名目、续修理事会名录。,https://jiapu.library.sh.cn/https://jiapu.library.sh.cn/#/GenealogySummary:http://data.library.sh.cn/jp/resource/work/17y3xgdar1mh4kyu
潜川姚氏宗谱（安徽省/合肥市/庐江县）,姚启鹏,姚,2019,崇耕堂,始迁祖伏二，元末明初由江苏金陵迁居安徽潜川罗家埠。 卷一目录、公开信、倡议书、宗亲理事会名目、编修会名目、凡例、序、赞、源流、字辈、族秀榜、功德榜、上谕、家训，卷二序、家礼图、宗法考证、大宗小宗图、祠堂图、坟禁议、祖茔图、田契、跋、领谱字号，卷三传、诗、赞、序，卷四至二十四世系。,https://jiapu.library.sh.cn/https://jiapu.library.sh.cn/#/GenealogySummary:http://data.library.sh.cn/jp/resource/work/ge5hmre7u6mjqzus
潜川夏氏（从五）宗谱（安徽省/合肥市/庐江县）,夏功能,夏,2016,三升堂,始迁祖从五，明洪武初由徽州婺源北迁淮南凤阳清水源疃，又南徙过金斗，渡巢湖，终奠居庐江北乡齐头嘴（今白山镇同春村）。 卷一宗谱理事会名目、宗亲合影照、历修谱序、凡例、字辈派行、家规家训、功德榜、族秀榜，卷二世系、历修传赞序叙，卷三至十五世系，卷十六家训、圣训、上谕、九仪九戒、凡例、谱例、家礼图、大宗小宗图、祠事款目、人丁情况统计表、祭祖文、谱叙、历修名目、谱跋、执谱字号。,https://jiapu.library.sh.cn/https://jiapu.library.sh.cn/#/GenealogySummary:http://data.library.sh.cn/jp/resource/work/tupl494evofo9665
潜川夏氏宗谱（安徽省巢湖市庐江县）,合族,夏,1914年,睦本堂,始迁祖繡，字彩章。,https://jiapu.library.sh.cn/https://jiapu.library.sh.cn/#/GenealogySummary:http://data.library.sh.cn/jp/resource/work/u7ncs3fxcypp7v2b
潜川周氏宗谱（安徽省/合肥市/庐江县）,周道信,周,2013,爱莲堂,始祖进一（字太生），约于南宋自安徽太平县龙门迁安徽泾川（今泾川县）。八世三荣（字惟耀），于明代自泾川迁安庆八卦门。十一世仲茶（字贞荣），明末迁桐城东乡周家团（今属枞阳县）。始迁祖十三世一山（字皇辅，号寿山），清代迁居安徽庐江西乡三十里铺大转弯（今庐江县万山镇）。 册一至四为影印同治四年木活字本创修老谱（卷一引、宗谱略、序、字派、世系图、世系表，卷二世系表，卷三世系表、凡例、家训、家礼宗法，卷四六条分注、家规、序、九戒）；册五至十为影印民国六年木活字本二修老谱（卷一引、序、世纪，卷二至四世系，卷五序、传、六条分注，卷六宗法、家规、家礼、坟图、凡例、九戒）；册十一至十六为三修新谱（卷一宗源，历代名人简介、序、字派、会议、公开信、组织机构、诗词、书画、功德榜、寿星，卷二至六世系）(江苏时光信息科技有限公司);始祖进一（字太生），约于南宋自安徽太平县龙门迁安徽泾川（今泾川县）。八世三荣（字惟耀），于明代自泾川迁安庆八卦门。十一世仲茶（字贞荣），明末迁桐城东乡周家团（今属枞阳县）。始迁祖十三世一山（字皇辅，号寿山），清代迁居安徽庐江西乡三十里铺大转弯（今庐江县万山镇）。 册一至四为影印同治四年木活字本创修老谱（卷一引、宗谱略、序、字派、世系图、世系表，卷二世系表，卷三世系表、凡例、家训、家礼宗法，卷四六条分注、家规、序、九戒）；册五至十为影印民国六年木活字本二修老谱（卷一引、序、世纪，卷二至四世系，卷五序、传、六条分注，卷六宗法、家规、家礼、坟图、凡例、九戒）；册十一至十六为三修新谱（卷一宗源，历代名人简介、序、字派、会议、公开信、组织机构、诗词、书画、功德榜、寿星，卷二至六世系）(沧州市图书馆);始祖进一（字太生），约于南宋自安徽太平县龙门迁安徽泾川（今泾川县）。八世三荣（字惟耀），于明代自泾川迁安庆八卦门。十一世仲茶（字贞荣），明末迁桐城东乡周家团（今属枞阳县）。始迁祖十三世一山（字皇辅，号寿山），清代迁居安徽庐江西乡三十里铺大转弯（今庐江县万山镇）。 册一至四为影印同治四年木活字本创修老谱（卷一引、宗谱略、序、字派、世系图、世系表，卷二世系表，卷三世系表、凡例、家训、家礼宗法，卷四六条分注、家规、序、九戒）；册五至十为影印民国六年木活字本二修老谱（卷一引、序、世纪，卷二至四世系，卷五序、传、六条分注，卷六宗法、家规、家礼、坟图、凡例、九戒）；册十一至十六为三修新谱（卷一宗源，历代名人简介、序、字派、会议、公开信、组织机构、诗词、书画、功德榜、寿星，卷二至六世系） (上海图书馆),https://jiapu.library.sh.cn/https://jiapu.library.sh.cn/#/GenealogySummary:http://data.library.sh.cn/jp/resource/work/ncjydjgkz4m1ilun
潜川周氏宗谱（安徽省/合肥市/庐江县）,周传来,周,2017,爱莲堂,始迁祖孔华（原名德敷），元末从江西南昌府进贤县迁居潜川西乡（今安徽省合肥市庐江县金牛镇健康村周家老圩）。 卷一公开信、理事会名录、合影、序、凡例、字辈、家训、功德榜、族秀榜，卷二上论、圣谕、敕命、墓志铭、恳词、家规、家训、治家格言、家礼，卷三家风、像赞、世系图，卷四至卷七世系，卷八世系、像赞、名目、跋。,https://jiapu.library.sh.cn/https://jiapu.library.sh.cn/#/GenealogySummary:http://data.library.sh.cn/jp/resource/work/36fk82if2w9g7ihc
潜川吴氏宗谱（安徽省/合肥市/庐江县）,吴悠,吴,2008,--,始迁祖显吾，明正德年间自江西南昌府南昌县迁安徽庐江。 卷一老谱序、凡例、诰敕，卷二家传、行状，卷三新老世系图，卷四至十一世系传，卷十二卷目录、潜川吴氏宗谱简介、潜川书院、本族人口分布、吴氏家族与近代工业、分支简介、李鸿章书信摘录等。,https://jiapu.library.sh.cn/https://jiapu.library.sh.cn/#/GenealogySummary:http://data.library.sh.cn/jp/resource/work/j1k0k1yh7zzv8pzf
潜川卞桥鲍氏宗谱（安徽省/合肥市/庐江县）,鲍和平,鲍,2016,怀义堂,"元末明初鲍春元自安徽黄山市歙县迁合肥庐江县店桥(即潜川卞桥)。 卷一谱序、先祖像赞,卷二至卷二十世系,卷二十一圣谕、家训、凡例、首事名目,卷二十二行实、跋。",https://jiapu.library.sh.cn/https://jiapu.library.sh.cn/#/GenealogySummary:http://data.library.sh.cn/jp/resource/work/9h1ippjgt8fwe19i
潜川包氏支谱（安徽省/合肥市/庐江县）,包荫桃,包,2011,清河堂,始祖包东一（讳昂，字如凤，号光白），北宋人，明朝时期，其后裔包孝庆，从震山（今安徽省宣城市泾县宝峰村）迁六安州（今安徽省六安市），再迁潜川包家岗（今安徽省合肥市庐江县）。 卷一序、历代名人序、像赞、家训、圣谕，卷二诰敕、名贤谱说、凡例、家规、九戒、派行，卷三至卷七世系，卷八传、领谱字号、茔图、跋、功德榜。,https://jiapu.library.sh.cn/https://jiapu.library.sh.cn/#/GenealogySummary:http://data.library.sh.cn/jp/resource/work/7i5qt9whcd3trquk
潜川刘氏宗谱（安徽省/合肥市/庐江县）,刘能鸣;刘耕乐,刘,2006,--,始祖宣义，四川成都靡州灌县人，宋景定年间任南阳主薄，咸淳七年改授吉水州尉。始迁八世祖广陵，明末清初自江西永丰县陶塘乡刘芳村迁安徽庐江黄龙定居。 卷一谱序、五修首事参修名目并引、圣谕、家规、家礼、山图、宗派并引、捐资名目、执谱名目，卷二至十世系图、世表、文传、新跋。,https://jiapu.library.sh.cn/https://jiapu.library.sh.cn/#/GenealogySummary:http://data.library.sh.cn/jp/resource/work/o2bxirwt5hdytg62
潜川凌氏宗谱十卷（安徽省安庆市潜山县）,凌后佑,凌,清光绪十二年（1886）,--,始祖统，字公積。始迁祖文望，元代人。书名据版心、书签题。,https://jiapu.library.sh.cn/https://jiapu.library.sh.cn/#/GenealogySummary:http://data.library.sh.cn/jp/resource/work/11ir1ej9o48ho7fh
潜川凌氏宗谱六卷（安徽省安庆市潜山县）,凌山,凌,清道光十六年（1836）,--,始祖统，字公積。始迁祖文望，元代人。书名据书签题。,https://jiapu.library.sh.cn/https://jiapu.library.sh.cn/#/GenealogySummary:http://data.library.sh.cn/jp/resource/work/9nnz3cztaldghxk3
潜川凌氏宗谱十卷(安徽潜山),凌后祐;凌湘,凌,清光緒12年(1886),--,參見清凌嶟修《[安徽潛山]凌氏宗譜》三修本條目（館藏：1061326-1331）。始遷祖文望，元末兵亂自新安避居潛山西鄉。卷一序、首事名目、六條分注、凡例、家訓、家規、九戒、宗法圖、家禮圖，卷二至七世系，卷八傳，卷九地圖、傳、贊，卷十誥封、傳、贊、祠堂圖、收執譜記。,https://jiapu.library.sh.cn/https://jiapu.library.sh.cn/#/GenealogySummary:http://data.library.sh.cn/jp/resource/work/8g5vbayouiig86im
潜川傅氏宗谱（安徽省/合肥市/庐江县）,等;傅朝阳,傅,2021,余庆堂;仁义堂,始祖傅俊，通二长子，庐陵人，元末进士，任浙江副使，以骨鲠坐贬安置无为军，明洪武初编入民籍，有六子：温、良、恭、俭、让、谦。俊与良、让、谦定居濡湏，让之族裔后迁舒城。温返庐陵，恭迁南京；俭移居潜川西乡大城坂，建祠柯坦镇，为潜川傅氏始迁祖。 谱载卷首篇、俭公支系篇、让公支系篇、仁义堂支系篇、卷后篇、附录、编后记。卷首包括祖先像赞、宗亲题词、祖地山西平陆祭祀剪影、潜川傅氏祖地柯坦镇风光、《潜川傅氏宗谱》第八次续修剪影、八修宗谱总目录、八修凡例、潜川傅氏历代世系图、八修谱序、历次编修谱序、安徽潜川傅氏宗亲联谊会暨第八次续修宗谱理事会章程、八修理事会组成人员名单、八修理事会分片联系人名单、八修宗谱致宗亲一封信。卷后篇包括《潜川傅氏宗谱》第七次续修家规、八修新编族训、八修大事记摘要、八修收款情况、八修捐款人名录、八修留芳谱、八修人物赞、八修字辈派语、八修执谱人名单、八修执谱人责任义务、潜川傅氏宗祠图、潜川傅氏一世祖陵园图。,https://jiapu.library.sh.cn/https://jiapu.library.sh.cn/#/GenealogySummary:http://data.library.sh.cn/jp/resource/work/yiun21t8l3ytsso8
潜川交二夏氏宗谱（安徽省/合肥市/庐江县）,夏登权,夏,2013,--,始迁祖交二公，明洪武初由寿春清水源潭迁潜水之北，地名齐山。 卷首上对联、谱引、新旧序及简译、谱说、凡例、作谱五难、六不书、九仪九戒、家训、恭引、祠堂志、祠堂图、伟人论谱、国家文件、八荣八耻、姓氏文化、文化遗迹、远祖世系、列祖传记、夏禹神功至德、夏姓起源、会稽夏氏历代渊源世系图、潜川夏氏宗谱九修理事会章程、历次续修宗谱首事名目、九修续谱建祠首事照片、凡例、九修工作制度、字辈、夏氏建祠选址会议记录、新建夏氏宗祠有关资料、新祠图、潜川夏氏（交二）九修宗谱人丁登记汇编、九修宗谱艺文集、像赞，卷首下功德榜、全家福照片、寿星榜、人才榜、九修执谱名录、谱跋，卷一至十八为世系，附卷一至二为世系。,https://jiapu.library.sh.cn/https://jiapu.library.sh.cn/#/GenealogySummary:http://data.library.sh.cn/jp/resource/work/zvpr114hlwm8nk89
潜川五果堂丁氏宗谱（安徽省/合肥市/庐江县）,丁昌玉,丁,2017,五果堂,始迁祖盛（号世兴），元末避乱自安徽凤阳迁庐江，入卫籍。四世有仁（字性成）、有义（字性正）、有礼（字性真）、有智（字性敏）、有信（字性厚）派分五房。 卷一六修名目、六修序、功德榜、族秀榜、历修宗谱序、历修首事名目、历代名宦、字派，卷二宗谱引、圣谕、敕命、家礼图、像赞、卫田款目、祭田、祖茔图、凡例、家规、家训、祠堂、祠事款目，卷三历修传赞叙序祝文，卷四至十六世系。,https://jiapu.library.sh.cn/https://jiapu.library.sh.cn/#/GenealogySummary:http://data.library.sh.cn/jp/resource/work/961pox3uyxoi2i7x
潜川中市汪氏祖先像赞一卷（安徽省黄山市歙县）,汪道让,汪,清光绪二十五年（1899）,--,书名据卷端题。,https://jiapu.library.sh.cn/https://jiapu.library.sh.cn/#/GenealogySummary:http://data.library.sh.cn/jp/resource/work/ig3p2lucja3d36ot
潜川世礼堂施氏宗谱（安徽省/合肥市/庐江县）,施小平,施,2019,世礼堂,始迁祖信，明初自江西 婺源迁居安徽庐江庐南乡福泉山下雨坛岗，置业施家圩村名施老院，又名先峰村（今属安徽庐江县庐城镇马厂村）。 卷首引、像图、字派、序、合影、执事名目、纪要、功德榜、倡议书、说明、施氏溯源、分支源流、图、家训、执谱字号、后记、条约，卷一圣谕、序、传赞、家礼、图、宗法、论宅、首事名目，卷二引、水源木本、圣谕、家规、凡例、谱说、引，卷三至七世系。,https://jiapu.library.sh.cn/https://jiapu.library.sh.cn/#/GenealogySummary:http://data.library.sh.cn/jp/resource/work/s8n5k55o81rh1k2b
潜川丁氏宗谱（安徽省/合肥市/庐江县）,丁家元;丁守东;等,丁,2017,万卷堂,始迁祖施九，元至正五年自安徽凤阳迁安徽庐江清冶河。 卷首谱序、圣谕、诰命，卷一官职题名、国学题名、乡学题名、恩荣题名、修谱名目、世系，卷二至二十四世系，卷末传、墓表、墓志铭、记、赞、传略、祭文、家训、丧服制度、墓图、建祠记、收执谱字号等。,https://jiapu.library.sh.cn/https://jiapu.library.sh.cn/#/GenealogySummary:http://data.library.sh.cn/jp/resource/work/iucougkloj69ecyz
潜岳程氏宗谱（安徽省/安庆市/岳西县）,程绍宏;程克勤,程,1988,世忠堂,参见程慕濂修《[安徽潜山]珌公潜岳程氏宗谱》条目（馆藏：1019100-126）。始祖元谭，东晋永昌新安太守。支祖四十一世珌（字怀古），南宋时居安徽休宁。珌次子若曾，迁居江西鄱阳。始迁祖洛（字玉泉），若曾曾孙，元末迁居安徽潜山。后裔散居潜山、岳西两地。 卷首上谱引、旧序、谱辩、诰、祖像、墓图、庙图、庙记、序、凡例、正训、谆诫十则，卷首中至下会同总图，卷一目录、新序、谱例、享堂记、墓图传赞、老派、新派、名目、谱后记、受姓一脉相承及鄱阳湖迁岳世系，卷二至二十九世系，附卷保祖全书。,https://jiapu.library.sh.cn/https://jiapu.library.sh.cn/#/GenealogySummary:http://data.library.sh.cn/jp/resource/work/eleo184komu6pjmd
潜岳吴氏族谱四卷首一卷末四卷（安徽省）,吴卿五,吴,民國34年(1945),至德堂,始遷祖雲一（字宗賜），元至正間官統制，先後宦居江蘇姑蘇與安徽徽州，元季遷居潛山。子四，祖一、祖二、祖三、祖四分啟四房。是譜兼載雲一弟雲二（字本高），元季遷居安徽懷寧縣欽化鄉源流及傳記。卷首譜序、淵源序、淵源紀、廟碑記、歷代名宦志、凡例、譜說、家訓、家規、題派等，卷一至四世系，卷末一至末四老傳、新傳、地紀、契議、修譜名目、領譜字號名目、跋。書名據書衣題。,https://jiapu.library.sh.cn/https://jiapu.library.sh.cn/#/GenealogySummary:http://data.library.sh.cn/jp/resource/work/myf839hic9h1soyu
潜山胡氏宗谱五十六卷首一卷末一卷（安徽省安庆市岳西县）,胡正埙,胡,清光绪三十年（1904）,敦睦堂,始祖淑英，字瑞人，号瓊山，南宋时由揚州如皋县迁皖北潛山。始迁祖为七世孫胜二，字百吉，元末復迁至潛邑響腸上板（今屬岳西）。,https://jiapu.library.sh.cn/https://jiapu.library.sh.cn/#/GenealogySummary:http://data.library.sh.cn/jp/resource/work/vjygw7z4eae8dzuu
潜山胡氏宗谱七十四卷首一卷末三卷（安徽省安庆市岳西县）,合族,胡,1932年,敦睦堂,始祖淑英，字瑞人，号瓊山，南宋时由揚州如皋县迁皖北潛山。始迁祖为七世孫胜二，字百吉，元末復迁至潛邑響腸上板（今屬岳西）。八修本。,https://jiapu.library.sh.cn/https://jiapu.library.sh.cn/#/GenealogySummary:http://data.library.sh.cn/jp/resource/work/ks6xkxhmxrtzev3i
潜山县蒋氏八修宗谱三十二卷首一卷（安徽省安庆市潜山县）,蒋应嵩,蒋,清光緒二十九（1903）,三径堂,始遷祖發願，字禮二，宋代人。書名據卷端題。,https://jiapu.library.sh.cn/https://jiapu.library.sh.cn/#/GenealogySummary:http://data.library.sh.cn/jp/resource/work/vzb71c4jalv6i7h9
潜山王氏宗谱（安徽省/合肥市/庐江县）,王自宇,王,2000,崇德堂,始迁祖受四，明洪武年间由徽州祁门潭口迁至庐江北乡白山镇齐头嘴（下吴村）。有八子：亨十三、彝、昱十七、亨十八、晨真十九、真二十、时、敬。亨十三居大山口坝镇；彝、真二十的子裔居铁脚山；昱十七后裔移居王嘴；晨真十九、真二十移居牌楼；时裔世居齐头嘴；敬裔长山以下五世孙子疆迁浙江。 卷一至二扫描民国三十七年旧谱之卷一、卷二，载历修谱序、家规、凡例、字派、艺文（家传、寿序等），卷三新序、新凡例、王氏今昔、新艺文，卷四至五十九世系表。,https://jiapu.library.sh.cn/https://jiapu.library.sh.cn/#/GenealogySummary:http://data.library.sh.cn/jp/resource/work/aa1m3wybo8bqk9hw
潜山朱氏源流志（安徽省/安庆市/潜山市）,朱邦振,朱,2023,--,安徽潜山朱氏在元末有三支族众分别由江西南康、河南夏邑、徽州婺源迁入。明清两代有八支脉众先后迁入。 谱载目录、序、凡例、概述、图片、大事记、渊源、流布、人物、文化、后记、附件。,https://jiapu.library.sh.cn/https://jiapu.library.sh.cn/#/GenealogySummary:http://data.library.sh.cn/jp/resource/work/900scocupeniyw5z
潜口西山汪氏流芳世谱十卷（安徽省黄山市歙县）,汪文斌,汪,明,西麓堂,始迁祖时俊，字逸甫，号逸齋，北宋由唐模迁潛川，为潛川始祖。书名据卷端、目录、谱序题。记事至明嘉靖间。,https://jiapu.library.sh.cn/https://jiapu.library.sh.cn/#/GenealogySummary:http://data.library.sh.cn/jp/resource/work/yzjntcxubfdby1jx
潚溪车路刘氏宗谱（浙江省/金华市/义乌市）,刘红成,刘,2009,--,是族其先源流不详，其后裔居住在浙江义乌市。 卷一名人题词、图腾、先祖遗像、照片、捐资芳名录、当代人才、车路刘氏宗谱序、村落概括、凡例、序、风俗文化、公墓图，卷二名人录、祠记、序赞、世系总图。,https://jiapu.library.sh.cn/https://jiapu.library.sh.cn/#/GenealogySummary:http://data.library.sh.cn/jp/resource/work/2ipgheeizjlfz9hd
潚溪刘氏宗谱（浙江省金华市义乌市）,刘尧祚,刘,清雍正13年(1735),--,始祖禄，行安三，唐代人，东汉義阳王刘輝之後裔。始迁祖獻，行忠七；嶼，行忠十二，北宋时自義烏金山迁居青潚。獻子晏再迁武義茶塘嶺腳。存卷为行传。存卷三。书名据版心题。记事至清雍正十三年。谱初修於宋咸淳间。,https://jiapu.library.sh.cn/https://jiapu.library.sh.cn/#/GenealogySummary:http://data.library.sh.cn/jp/resource/work/w7zm94852hfzlsjk
