谱名,责任者,姓氏,撰修时间,堂号,家谱简介,详情链接
刘氏宗谱（湖北省/武汉市/新洲区）,刘宏志;刘宏畅,刘,1991,传经堂,始迁祖谷音，明洪武二年由江西豫章鄱阳县筷子巷瓦屑坝，迁居湖北省黄州府黄冈县中和乡李家集北堤东老屋塆（今新洲县李集镇刘宣塆）。 卷首一目录、凡例、领谱词、采访规例简章、续修宗谱序、派行、理事会成员，卷首二家训、服制图、宗祠记、修祠捐目、祠规、塆基图、阴阳二宅图、墓图，卷首三家传、行述、传，卷首四传、行述、行略，卷一至十八世系、行传，卷末存名录、领谱字号、谱费账目、理谱琐言。,https://jiapu.library.sh.cn/https://jiapu.library.sh.cn/#/GenealogySummary:http://data.library.sh.cn/jp/resource/work/jmwzfpu5s2l5v2ta
刘氏宗谱（湖北省/武汉市/新洲区）,刘宽锋;刘维新,刘,2012,藜照堂、天禄堂,始迁祖均保，明洪武十四年从江西饶州府瓦屑坝迁湖北新洲举水以西居住；伏二，洪武二年自江西饶州府乐平县倪儿湾瓦屑坝筷子巷迁入湖北，几经迁徙，至新洲倒水河畔居住。 卷首一图腾、圣谕、彩照、宗谱选编、五修总序、伟人论谱、合族宣言、支序、五届合修宗谱立派字样、凡例、修谱理事会名单、捐款名单、序、后记，卷首二至四原谱首一、首二，卷一至五十五世系、行传。,https://jiapu.library.sh.cn/https://jiapu.library.sh.cn/#/GenealogySummary:http://data.library.sh.cn/jp/resource/work/x1sgkkxg2krig34e
刘氏宗谱（湖北省/武汉市/新洲区）,刘思胜;刘成旭,刘,1992,青藜堂,始迁祖仁寿，明洪武初年由江西始迁湖北麻城东界岭，寄居鼓山梅家塆，后徙新洲老钟山。 卷首一四修宗谱序、源流序、诰封、圣谕、遗像图、谱堂记、观音堂记、集体成员序、四修宗谱名目、传派、序、捐资名目、文风录、祭祖文、凡例、家规、家训、跋、祀文，卷首二服制图、创刊图绘、祠堂图、墓图、阳宅图、刘家觜图，卷一至二十一世系图、世表。,https://jiapu.library.sh.cn/https://jiapu.library.sh.cn/#/GenealogySummary:http://data.library.sh.cn/jp/resource/work/985tptx9bv3oq5a3
刘氏宗谱（湖北省/武汉市/新洲区）,佚名,刘,2014,三贤堂,始迁祖万子，元进士，随父由江右入楚创业新洲之阳逻。 卷一至五世系图、世表。,https://jiapu.library.sh.cn/https://jiapu.library.sh.cn/#/GenealogySummary:http://data.library.sh.cn/jp/resource/work/k7lhjgmin4f0o5ih
刘氏宗谱（湖北省/武汉市/新洲区）,刘锦锋;刘德喜,刘,2012,--,始祖福一，明初由江右梓溪迁湖北黄冈卜居上伍乡道观河瓦屑湾（今属新洲区）。 卷首载历届谱序、始祖福一公叙略、九甲说、三支合族序、历届重建祠堂序、历届修谱名目、凡例、族规、宗派、五服图、个人传记、祀产、功德榜，卷二至八载世系。,https://jiapu.library.sh.cn/https://jiapu.library.sh.cn/#/GenealogySummary:http://data.library.sh.cn/jp/resource/work/vuhbrpk2vo9k963c
刘氏宗谱（湖北省/武汉市/新洲区）,刘先淼;等,刘,1990,天福堂,始迁祖九良，明初自江西广信府迁居湖北黄冈新洲白塔河鲁肃城刘家院（今属武汉市新洲区）。 卷首一圣谕、广训、序、像赞、字派、名目，卷首二传，卷首三序、跋、名目、图、记、世系例、碑铭、规条，卷首四规条、义例、礼单、祝文、家训、律例，卷一至六世系表，附卷建祠专刊。(湖北省图书馆);始迁祖九良，明初自江西广信府迁居湖北黄冈新洲白塔河鲁肃城刘家院。,https://jiapu.library.sh.cn/https://jiapu.library.sh.cn/#/GenealogySummary:http://data.library.sh.cn/jp/resource/work/6d93twkjj47w3u6u
刘氏宗谱（湖北省/武汉市/新洲区）,刘忠良;刘忠显,刘,1990,天禄堂,始迁祖兴九，明洪武初年自江右迁居湖北黄州府黄冈县慕义乡城南村新洲河西芦蒿社下（今属武汉市新洲区）。 卷首续修宗谱目录、续修宗谱序、圣谕、谱论、创修宗谱经管合序、创修理稿序、凡例、原派行、创修议派行、续修宗谱名目、传、源流总序、祖训、家诫、家规、五服图、祭礼、阴阳二宅图、墓图，卷一至五世系、行传。,https://jiapu.library.sh.cn/https://jiapu.library.sh.cn/#/GenealogySummary:http://data.library.sh.cn/jp/resource/work/o5n9n5x9e7uabp2j
刘氏宗谱（湖北省/武汉市/新洲区）,刘泽轩;刘家发,刘,1991,三贤堂,始祖伯正，宋理宗相国理签书枢密院事，原籍陕西长安兰州卫。始迁祖四世闵（号骞甫），为元翰林，迁居湖北新洲阳逻。 卷首一祖像、宗谱序、八景诗、族源图、源流序、后裔居处图、传、纪略、凡例、弁言、致闵公后裔书，卷首二续修序、宗谱序、家乘序、纪略、序、谱跋、祭祀论、谱谕摭言、世系源流派言、历次修谱执事人名目、捐款名目、丁田捐输总序、祠堂源流考、丧服图、五服图、祠堂图、墓图，卷首三传、序、合同，卷一至二十二世系、行传。,https://jiapu.library.sh.cn/https://jiapu.library.sh.cn/#/GenealogySummary:http://data.library.sh.cn/jp/resource/work/gtruxrs44odwqqzo
刘氏宗谱（湖北省/武汉市/新洲区）,刘光明;刘锡武,刘,2011,敦本堂,参见刘则奎修《[湖北黄冈]黄冈刘氏宗谱》条目（馆藏：971734-755）。始迁祖隆三，明洪武间自江西南昌鹤仙岗马鞍溪迁居湖北黄冈上伍乡（今属武汉市新洲区）。长子受甫，再迁邑之叶顾岗；次子爱甫（字道元），居邑之横坡坳；三子受建（字道极），迁居河南后失考。 卷首一谱序、目录、续谱名录、传记、派言、凡例、家规、谱规，卷首二行略、传记、跋语、服制图、合同、家庙图、祠堂图、墓图、祭仪、仪注、祝文、家训、一样二宅图，卷一至十四世系。,https://jiapu.library.sh.cn/https://jiapu.library.sh.cn/#/GenealogySummary:http://data.library.sh.cn/jp/resource/work/gl4anmzwo4m4i3ll
刘氏宗谱（湖北省/武汉市/新洲区）,刘希才,刘,1995,藜照堂,始祖式，与姑婿夏公均迁湖北黄冈，家庶安里之白湄村，称刘家畈溪，亦曰刘家沟又曰白湄河（今属武汉市新洲区）。 卷首载谱序，名目，刘氏源流总序，谱引，行实，卷二载谱论，派行，凡例，墓图，卷三载总图，卷四起世系。,https://jiapu.library.sh.cn/https://jiapu.library.sh.cn/#/GenealogySummary:http://data.library.sh.cn/jp/resource/work/06w2os2zfxvr1orm
刘氏宗谱（湖北省/孝感市）,刘乘蒙,刘,2020,校书堂,始迁祖汪，原籍江西，明洪武初迁湖北孝感。 卷首新旧谱序、修谱世名表、鸣谢、编后语、家规、像赞、宗词言记、人物传、阴阳二宅图，祭田表、续谱后叙，特别说明、诗词，卷一起世系,https://jiapu.library.sh.cn/https://jiapu.library.sh.cn/#/GenealogySummary:http://data.library.sh.cn/jp/resource/work/s0pbkcdm9pq93w3b
刘氏宗谱（湖北省/孝感市）,刘持光,刘,2017,忠义堂,始迁祖道玘，江西丰城县龙潭湾紫竹园三图十甲人，明成化间迁湖北孝感，后定居邑之澴水。另一始迁祖道玘族弟瑞林，明成化间自江西丰城迁居湖北孝感刘家冲。 卷首（即卷一）圣谕、伟人语录、分布图、凡例、谱序、祠堂图、遗像、宗派、彩照、溯源、族规、人物录、功德榜、名目、后记、世系图，卷二至三世系图、世系表。,https://jiapu.library.sh.cn/https://jiapu.library.sh.cn/#/GenealogySummary:http://data.library.sh.cn/jp/resource/work/qsgufu3gwfv4pblp
刘氏宗谱（湖北省/孝感市/汉川市）,刘国汉;等;刘忠福;刘金汉,刘,2011,天禄堂,始祖英（字万杰，号震海），明代落籍庐陵（今江西吉安）。正德二年，子志端（字廷拱，号云衢）携诸弟游于楚，至川邑之刘家隔，后重返故里，弟志恭（字惟寅，号廷笏）、志清（字宏浩）、志林（改名文林，字翰辅）、志中（庠名仲暹，字廷忠，号云追）、行坤分别仍居汉川函水南北。 卷一像、谱像、谱序、原序、序言、传略，卷二至六世系图。,https://jiapu.library.sh.cn/https://jiapu.library.sh.cn/#/GenealogySummary:http://data.library.sh.cn/jp/resource/work/waohmiffba2822kt
刘氏宗谱（湖北省/孝感市/汉川市）,刘德亨,刘,1993,天禄堂,始迁祖轲，明宣德间由江西吉安府安福县北门清化乡兼济祠迁湖北汉川南街美化坊。 卷首原祠堂图、契约、新纪念堂设想图、旧谱家规、续修宗谱编纂委员会组成人员、谱说、序言、刘氏源流小考、天禄堂概说、本宗字派、宗族新公约、传记、精英录、功德录、文苑、里居表、续修宗谱跋，卷一至十四世系表。,https://jiapu.library.sh.cn/https://jiapu.library.sh.cn/#/GenealogySummary:http://data.library.sh.cn/jp/resource/work/nup485zjgidz7h8d
刘氏宗谱（湖北省/孝感市/汉川市）,刘德先,刘,1991,天禄堂,始祖元疆，元朝人，祖籍江西。始迁祖其长子仲孝(字德安)，元末避战乱由江西吉安府庐陵县青草乡大塘角迁湖北汉川市北街刘家坡。 宗史表载入楚始祖至六世表、序、人员简介、宗派志、祖表、二房表、大房表、后记，卷一谱序、刘氏之源考、天禄堂解、宗派志、烈士传、慈母传、编纂委员会名单、居仕表、迁徙表、在外工作人员简介、宗谱告成跋、传一之二，卷二至卷四历代统宗世系。,https://jiapu.library.sh.cn/https://jiapu.library.sh.cn/#/GenealogySummary:http://data.library.sh.cn/jp/resource/work/xukimcji3828ctgi
刘氏宗谱（湖北省/孝感市/汉川市）,刘忠祥,刘,1990,藜阁堂,始迁祖志端，明朝从庐陵（今江西省吉安市）迁湖北汉川。 卷首序、传、后记，卷一至十世系。,https://jiapu.library.sh.cn/https://jiapu.library.sh.cn/#/GenealogySummary:http://data.library.sh.cn/jp/resource/work/xbr42osbzqmw8tmx
刘氏宗谱（湖北省/孝感市/汉川市）,刘官平,刘,2005,天禄堂,始迁祖奇信，由江西吉安县迁湖北汉川市，时约明代。 卷首一序言、凡例、祠规、名传，卷首二祠堂图、家规、像赞、赞言、功德录，卷一至卷七世系。,https://jiapu.library.sh.cn/https://jiapu.library.sh.cn/#/GenealogySummary:http://data.library.sh.cn/jp/resource/work/9y887myjqwh3p8e9
刘氏宗谱（湖北省/孝感市/汉川市）,刘声辉,刘,2012,天禄堂,始祖世白（号素贞），祖居江西豫章安福五十四都，元末因教馆迁家湖北沔阳（今仙桃），后复迁汉川，定居刘家塘口。 载堂记，始祖像，修谱人员，刘姓祖源，世系图，谱序，历代墓志记，宗祠志，谱志，字派，外迁记载，世系。,https://jiapu.library.sh.cn/https://jiapu.library.sh.cn/#/GenealogySummary:http://data.library.sh.cn/jp/resource/work/xr0hs56y535gzxog
刘氏宗谱（湖北省/孝感市/汉川市）,刘传静,刘,1995,--,始祖志（字仲敏），原籍江西吉安府泰和县仁善乡南坑第四都，明洪武二年任山西平阳府万泉县知县，后擢蒲州刺史。二世彦（字灿英），任湖南善化知县，解组后迁居湖北汉阳九真山湘阴之东乡。始迁祖四世崇鼎、崇显、崇仪、崇扬，永乐二年复迁汉川，鼎居横堤湖，显居邱子脑，仪居旧口堡老虎冲，扬居丁家岭后迁刘家窑。 卷首甲谱序、卷首乙图像、卷首丙世系图，卷首丁法、志，卷首戊公传、卷首己祭祖纪实，卷一至十五世系图、世系表。,https://jiapu.library.sh.cn/https://jiapu.library.sh.cn/#/GenealogySummary:http://data.library.sh.cn/jp/resource/work/gpb3ylzfaayxa3t6
刘氏宗谱（湖北省/孝感市/汉川市）,刘世灯;刘世洛;刘之豪,刘,1989,藜照堂,始祖歆（字子骏），徙居江右。始迁祖福一、福二，明永乐间由江西南昌县梓溪迁湖北汉川。 卷一谱序，卷二源流考、瓜藤图、源谱、先祖瓜藤、卷三起世系,https://jiapu.library.sh.cn/https://jiapu.library.sh.cn/#/GenealogySummary:http://data.library.sh.cn/jp/resource/work/69g3v3h13h7hnpmw
刘氏宗谱（湖北省/孝感市/孝南区）,刘锦明,刘,1998,--,始迁祖松村，世居江西安成（今安福），明洪武初应诏迁湖北孝感六家村（今属孝南区杨店镇）。 谱载目录、发脉世系、统宗世系、会源世系、祖像、公赞、谱牒考、谱论、谱序、谱贺序、谱老序、祭祖文、族规、立派字、修篆人员、跋、凡例、编后语、功德榜、世系表。,https://jiapu.library.sh.cn/https://jiapu.library.sh.cn/#/GenealogySummary:http://data.library.sh.cn/jp/resource/work/gwaqg3lfp68u21mw
刘氏宗谱（湖北省/孝感市/孝南区）,刘家秋,刘,1996,--,"始迁祖福一，明初从江西南昌县塘南镇迁湖北麻城，后迁孝感市孝南区洪乐乡。 卷首世系考、序、谱例、家传、宗派、瓜藤图、祭祖文、续谱职员、传记、照片,卷一至卷十世系。",https://jiapu.library.sh.cn/https://jiapu.library.sh.cn/#/GenealogySummary:http://data.library.sh.cn/jp/resource/work/4fnsvvq4amtq7lom
刘氏宗谱（湖北省/天门市）,刘昌隆,刘,1990,亲睦堂,始迁祖纯庵，明洪武二年由江右而宦籍楚省卜居竟陵（今天门）。 卷首历代谱序、诗文选，卷一续修谱序、续谱参加人员名单、目录、谱号、续修小引、凡例、字派小序、增补图像序、渊源世系图、历代祖先简介、各房分支世系图、中和刘氏分布示意图，卷二至二十一世系图、世表。,https://jiapu.library.sh.cn/https://jiapu.library.sh.cn/#/GenealogySummary:http://data.library.sh.cn/jp/resource/work/9it5kzjkil7a2p8r
刘氏宗谱（湖北省/天门市）,刘昌邦;刘克仁,刘,1993,校书堂,始祖师宪，生于元至正十七年，居江右吉安府吉水县梓溪村。长子全务，为老大房；次子镐，为老二房；三子孟凤，为老三房；四子庚生（字绍政，号纯安），为老四房。庚生明初由江右宦籍竟陵（今湖北天门），是为本谱始迁祖。而镐则与全务、孟凤同徙竟陵金家沟。 卷首旧序、谱序、家传、行实、传、寿序、第四次续谱纪要，卷一凡例、世系表、总图、渊源世系，卷二至十三世系表，卷末家训、绅士表、里居表、合派表、宗派表、创祖堂名目考、修祠修谱名目说、乐捐修祠说、领谱善守论、捐资名目、领谱名目。,https://jiapu.library.sh.cn/https://jiapu.library.sh.cn/#/GenealogySummary:http://data.library.sh.cn/jp/resource/work/9ar6fndt7utypxrj
刘氏宗谱（湖北省/天门市）,刘汉章,刘,1992,藜阁堂,始迁祖诚则，明洪武二十六年自江西吉安迁徙至竟陵（今湖北天门），卜居大剅垸。 卷首目录、引言、谱序、前言、祭祖文、序言、分序、传记、宗祠记、历代名人录、理事会名单、乐捐名单、世系表、诗词歌赋集锦、规条、编后语，卷一至卷四世系表。,https://jiapu.library.sh.cn/https://jiapu.library.sh.cn/#/GenealogySummary:http://data.library.sh.cn/jp/resource/work/fnojve2shwwoi8lv
刘氏宗谱（湖北省/咸宁市/通城县）,刘厚生;刘洪甫,刘,1988,彭城堂,始迁祖天郎（字公明），宋朝由浙江金华八角楼徙居湖北通城县黄龙山小坳，又迁居梓里，今塘湖等处。 卷一族谱合纂、历代世系源流、序、世系表，卷五至三十九各房小序、世系表。,https://jiapu.library.sh.cn/https://jiapu.library.sh.cn/#/GenealogySummary:http://data.library.sh.cn/jp/resource/work/96ayur6jv11x1ppc
刘氏宗谱（湖北省/咸宁市/崇阳县）,刘郢垣,刘,1988,彭城堂,本谱主要记载散居于湖北咸宁市崇阳县刘氏宗支世系。 存卷一序、世系，卷四至卷三十九序、世系。,https://jiapu.library.sh.cn/https://jiapu.library.sh.cn/#/GenealogySummary:http://data.library.sh.cn/jp/resource/work/jpr8ocseviyyq6f6
刘氏宗谱（湖北省/咸宁市/嘉鱼县）,刘熙泉,刘,1994,务本堂,始迁祖备广，原籍江西吉安府庐陵县人，世居邑之车头岭中洲，明正德间迁居湖北沔阳孙家埠，复迁嘉鱼田屯濑子洲。 卷首一诰敇、旌典、家规、序、契约，卷首二列卷、传、述略、序引、铭赞、祭章，卷首三世系表，卷一至十二世系表。,https://jiapu.library.sh.cn/https://jiapu.library.sh.cn/#/GenealogySummary:http://data.library.sh.cn/jp/resource/work/p3fl95iyc5se8hea
刘氏宗谱（湖北省/十堰市/郧西县）,王心田,刘,1962,--,始迁祖祚永，清乾隆间从湖北孝感白云乡永安集西观村迁郧阳府郧西县。 卷一序、谱序、凡例、家规、家训、字派、五服引、簪缨图，卷二世表、,https://jiapu.library.sh.cn/https://jiapu.library.sh.cn/#/GenealogySummary:http://data.library.sh.cn/jp/resource/work/ypu6ngvfppysx2iu
刘氏宗谱（湖北省/仙桃市）,刘涤华,刘,2010,大风堂,始祖绍贤，因避宋乱而遁迹江西吉安隐姓埋名，号曰竹溪，后更名为竹江。始迁祖琳（字杰玉，行贞四，号西湖），明正统间从南昌柏叶汊迁到湖北沔阳（今仙桃）莲台。 谱载序言、图照、派文、凡例、名人论谱、源远流长、选集、万家朝宗、大风长歌、汉魂礼赞、汉风流韵、古训宝典、风流人物、附录。,https://jiapu.library.sh.cn/https://jiapu.library.sh.cn/#/GenealogySummary:http://data.library.sh.cn/jp/resource/work/hjhzhg3wdmhxmtbi
刘氏宗谱（湖北省/仙桃市）,刘义斌等,刘,1997,藜阁堂,鼻祖庄，起家江西临川宜黄，唐季官。始迁祖铢，明弘治间自赣迁居湖北沔阳（今仙桃）张家池。 存首卷，载卷首目录及篇目，篇目有三约堂第七次续谱理事会成员名单、前言、三约堂祖祠记等。,https://jiapu.library.sh.cn/https://jiapu.library.sh.cn/#/GenealogySummary:http://data.library.sh.cn/jp/resource/work/1ucls8jm8o4yv02a
刘氏宗谱（湖北省/仙桃市）,佚名,刘,2008,大风堂,始迁祖琳（字杰玉，行贞四，号西湖），明正统丁巳年由南昌梓溪柏叶汊迁湖北沔阳（今仙桃）莲台。此谱为第八部梓溪世系仙桃胡场四号房谱。 卷一源流，卷二至六世系、行传。,https://jiapu.library.sh.cn/https://jiapu.library.sh.cn/#/GenealogySummary:http://data.library.sh.cn/jp/resource/work/xafajxl8tuagirkp
刘氏宗谱（湖北省/仙桃市）,刘烈林,刘,1989,黎阁堂,参见清刘远滨修《[湖北仙桃]刘氏宗谱》条目（馆藏：XP47017）。始迁祖益明、益朗，明景泰二年自江西吉安庐陵县德政里安化村迁湖北沔阳（今仙桃）五业沄马家台。 存卷为续修宗谱小引、源流序、发源宗祖简史、谱序、谱叙、赞、传、行述、自书、续谱后记等。,https://jiapu.library.sh.cn/https://jiapu.library.sh.cn/#/GenealogySummary:http://data.library.sh.cn/jp/resource/work/yjevefcqpjgpcnk6
刘氏宗谱（湖北省/仙桃市）,刘远滨,刘,不详,藜阁堂,始迁祖益明、益朗，明景泰二年自江西吉安庐陵县德政里安化村迁湖北沔阳（今仙桃）五业沄马家台。 谱存纂修族谱小引、续谱序、续派序、传、事略。,https://jiapu.library.sh.cn/https://jiapu.library.sh.cn/#/GenealogySummary:http://data.library.sh.cn/jp/resource/work/75x653wthcjur1ew
刘氏宗谱（湖北省/仙桃市）,刘芝群,刘,2020,--,始祖五十一世端吉，明代由赣吉村迁楚竟陵（今天门），为迁楚始祖。始迁祖六十世琫鉴，清乾隆间由竟陵迁沔阳（今仙桃）。 谱载图腾、像赞、世系分布图、凡例、历代序引祖训、源流考、人物传、世祖演派、功德榜、捐款者全家福,https://jiapu.library.sh.cn/https://jiapu.library.sh.cn/#/GenealogySummary:http://data.library.sh.cn/jp/resource/work/xnsjjt5i631s4azh
刘氏宗谱（湖北省/仙桃市）,--,刘,1995,--,始迁祖文，明朝始入湖北沔阳（今仙桃）。,https://jiapu.library.sh.cn/https://jiapu.library.sh.cn/#/GenealogySummary:http://data.library.sh.cn/jp/resource/work/je7zkltvihmxcxnv
刘氏宗谱（湖北省/仙桃市）,刘烈珊;刘烈葵,刘,1999,天禄堂,始迁祖益秀、益廷、益明、益朗四公，原籍江西省吉安府庐陵县德政里安化村楠杆坡七十八都冈头下社，约明初迁湖北沔阳（今仙桃）排湖北麻港五业潭浪网洲。 卷首历代谱序集，卷一名人、刘氏来源、赞词、诗词、家训十则、支谱序、历代续修家谱人，卷二至卷五、卷七、卷九至卷十一、卷十三至卷十四、卷十六世系。,https://jiapu.library.sh.cn/https://jiapu.library.sh.cn/#/GenealogySummary:http://data.library.sh.cn/jp/resource/work/p6fylep1k3ujr38k
刘氏宗谱（湖北省/仙桃市）,不详,刘,1990,三约堂,参考馆藏清光绪二十一年《刘氏宗谱》。始祖庄，约为宋代人，世居江西临川宜黄，后随子埊居安成（今安福）前溪。始迁祖槩，礼公之后，明弘治十二年迁湖北沔阳（今仙桃）陈家河，铢迁沔阳柳西湖刘家台，庆升迁沔阳下新场。 存卷五至九、十一至十六，载淳良岭陈家河东晓公世系、陈家河东汉公世系、陈家河三百亩上刘家台东晖公世系、三角垸张家池裴家垸马鞍子殷湖垸刘家台柳西湖小河里纹宪公世系、夏新场模公世系。,https://jiapu.library.sh.cn/https://jiapu.library.sh.cn/#/GenealogySummary:http://data.library.sh.cn/jp/resource/work/ndk1legnapjsub8u
刘氏宗谱（湖北省/仙桃市）,刘可培,刘,1989,藜阁堂,始迁祖文，明洪武二年自江苏苏州吴县小口刘河迁湖北仙桃刘家河，生三子仲贵、仲华、仲亮，分为三房。 卷首祠堂图、墓图、续修刘氏家史发起引、谱序、赞修、传记、凡例、刘氏宗约绪言、名目、目录、旧序，卷一至七世系。;卷首墓图、前言、续修序、传记、凡例、宗约绪言、续修谱人员、目录、关于进谱和谱牒管理的有关规定、谱引、弁言、谱序、传，卷一至十九世系图、世表。,https://jiapu.library.sh.cn/https://jiapu.library.sh.cn/#/GenealogySummary:http://data.library.sh.cn/jp/resource/work/miecs96vxn8htxjm
刘氏宗谱（浙江省）,刘倬;刘鹤宗;刘德中,刘,光绪20年（1894）,怀贤堂,存卷为十四世高、祥房总系图、十五世高房支系图。存卷八。书名据版心题。,https://jiapu.library.sh.cn/https://jiapu.library.sh.cn/#/GenealogySummary:http://data.library.sh.cn/jp/resource/work/tn324ba2nraenhx6
刘氏宗谱（浙江省）,--,刘,1994,--,始祖延庆，宋代人。始迁祖基，字伯温，明代人。书名据封面题。,https://jiapu.library.sh.cn/https://jiapu.library.sh.cn/#/GenealogySummary:http://data.library.sh.cn/jp/resource/work/fpd8h8favrio6mp4
刘氏宗谱（浙江省/丽水市/龙泉市）,刘世荣;刘周发,刘,1950,--,始祖一、二，明朝由浙江龙泉东乡安仁迁居松阳内十三都盘坑。始迁八世祖元稀（行东一），生于明万历癸酉年，复由松阳盘坑迁居龙泉北宝源创居立业。 谱载源流、旧序、新序、传赞、源流诗、勅命、遗像、坟图、名宦传、诸公派迁列邑居、符源祖置山场产业、源流支图、统纪图、世系图、世表、排行引、行第引、藏谱合同。,https://jiapu.library.sh.cn/https://jiapu.library.sh.cn/#/GenealogySummary:http://data.library.sh.cn/jp/resource/work/qkpqsuaos7lucnph
刘氏宗谱（浙江省/丽水市/龙泉市）,刘光选,刘,1995,--,"始祖原，原籍京兆万年(今陕西西安)，,唐开元间避乱迁浙江松阳县。始迁祖四世端，由松阳县迁剑川(今龙泉市安仁镇)。 谱载序、跋、条例、世系。",https://jiapu.library.sh.cn/https://jiapu.library.sh.cn/#/GenealogySummary:http://data.library.sh.cn/jp/resource/work/ecllk8zd8pslkhqa
刘氏宗谱（浙江省/丽水市/青田县）,刘国有,刘,2016,--,始祖向荣(字乔木)，于明中叶由江西省崇义县上堡乡竹溪村迁丽东刘店(今浙江省金华市浦江县白马镇刘店村)。后裔再迁青田县季宅乡黄放口村。 谱载祖宗彩像、谱序、排行字辈字母、历代祖宗名讳、传赞等、序、世系图。,https://jiapu.library.sh.cn/https://jiapu.library.sh.cn/#/GenealogySummary:http://data.library.sh.cn/jp/resource/work/jhpgrzk87w711vuv
刘氏宗谱（浙江省/丽水市/青田县）,刘定仙,刘,2014,--,始迁祖马记(字如龙)，明代携弟马新(字如虎)由蒙川(现址不详)迁浙江省青田县季宅乡仙人坦村。 谱载功德碑文、谱序、外纪支图、内纪支图、外纪行第、内纪行第。,https://jiapu.library.sh.cn/https://jiapu.library.sh.cn/#/GenealogySummary:http://data.library.sh.cn/jp/resource/work/pdhn153tovvvsjwq
刘氏宗谱（浙江省/丽水市/云和县）,林彦遐,刘,1994,--,始祖朝禾，清前期人。始迁祖日亮、日星，清代分别迁居浙江云和县谢坳头村、山下壪村（今均属崇头镇）。 谱载添谱引言、赞、排行字、世系图。,https://jiapu.library.sh.cn/https://jiapu.library.sh.cn/#/GenealogySummary:http://data.library.sh.cn/jp/resource/work/yrddhv4uxdeq3lsb
