谱名,责任者,姓氏,撰修时间,堂号,家谱简介,详情链接
宝庆任氏族谱四卷首一卷（湖南省邵阳市）,任志锐;任志逵,任,民國11年(1922),五知堂,始遷祖義，明代自江西瑞州府上高縣何必田團山山路口對門黃家村遷居寶慶邵陽東鄉瓦子坪。是譜同時并載另外兩支居邵陽者：金祥居縣城南鄉洪仁七都五甲田老山；法雲居南鄉黃瓜嶺上島山沖。卷首譜序、淵源錄、先儒譜諭、聖諭、朱子格言、家規、家訓、家法、四禮、庵院圖、墳山圖、屋場圖、公產會積、任事人名、傳贊、紳衿錄、班次、慎毋自欺、八反歌、歷代年表，卷一至四世系。書名據版心題。,https://jiapu.library.sh.cn/https://jiapu.library.sh.cn/#/GenealogySummary:http://data.library.sh.cn/jp/resource/work/6gjufg7qx2elbyaf
宝峰毛氏宗谱四卷（浙江省宁波市鄞州区）,毛节裕,毛,1933年,明德堂,始祖閏亨，字可友，明洪武間自鄞縣通遠鄉它山堰（古堰名，在今鄞江鎮南）遷居本邑寶峰。卷一凡例、訓約、五宗説、譜序、條目、壽言、事略、排行字，卷二世系圖，卷三世傳，卷四闕文、世澤。書名據版心、目録、卷端題。,https://jiapu.library.sh.cn/https://jiapu.library.sh.cn/#/GenealogySummary:http://data.library.sh.cn/jp/resource/work/djmuhmtdjws98e83
宝峰毛氏宗谱四卷（浙江省宁波市鄞州区）,王谦和,毛,清光緒二十五年（1899）,明德堂,始祖閏亨，字可友，明洪武間自鄞縣通遠鄉它山堰（古堰名，在今鄞江鎮南）遷居本邑寶峰。卷一凡例、排行字，卷二世系圖，卷三世傳，卷四闕文、世澤。書名據版心、目録、卷端題。,https://jiapu.library.sh.cn/https://jiapu.library.sh.cn/#/GenealogySummary:http://data.library.sh.cn/jp/resource/work/j5z2u68wr5y7h3yd
宝山钟氏族谱八卷（上海市浦东新区）,钟人杰;钟愈,钟,1930年,--,始遷祖瓊，字報菴，原籍山東，宋室南渡時移居浙江，繼遷蘇州，又徙寶山，元至正間再避居江東（原寶山八都，今屬上海浦東新區）。至四世悦为舍頭祖，廷玉为北街祖，張伏为唐家橋祖。後又分出東橋、高橋、小宅、江灣、黄渡及蘇州市下街等支系。卷一事略、宗規、家訓等，卷二支圖，卷三至四文籍，卷五至八世系。書名據卷端題。,https://jiapu.library.sh.cn/https://jiapu.library.sh.cn/#/GenealogySummary:http://data.library.sh.cn/jp/resource/work/v1cjtzhuygp1w24g
宝山钱氏数典录一卷（上海市宝山区）,钱衡璋,--,清光緒24年(1898),--,始遷祖碩，明萬曆間自浙江龍游遷寶山羅溪。書名據版心、書簽、書名頁題。,https://jiapu.library.sh.cn/https://jiapu.library.sh.cn/#/GenealogySummary:http://data.library.sh.cn/jp/resource/work/3xqejrrgg2fa9x68
宝山钱氏数典录一卷（上海市宝山区）,钱衡璋,--,清光緒24年(1898),--,始迁祖硕，明万历间自浙江龙游迁宝山罗溪。本谱依次为源流考、志行、忠跡寿考、节烈。内有俞樾序。,https://jiapu.library.sh.cn/https://jiapu.library.sh.cn/#/GenealogySummary:http://data.library.sh.cn/jp/resource/work/uq6k8rwjyc23gdx7
宝山乡始祖钟公族谱（台湾省/新竹县）,钟金亮,钟,1970,--,始祖文进，元明之际人。始迁祖景章，清季移居台湾，后裔散居台湾省新竹县宝山乡等地。,https://jiapu.library.sh.cn/https://jiapu.library.sh.cn/#/GenealogySummary:http://data.library.sh.cn/jp/resource/work/z183j74dmuupunj9
宝安黄氏族谱二卷（广东省深圳市宝安区）,黄世麟,黄,清同治十一年（1872）,--,始遷祖剛，字存善，號直夫，宋代人。書名據書簽題。五修本。,https://jiapu.library.sh.cn/https://jiapu.library.sh.cn/#/GenealogySummary:http://data.library.sh.cn/jp/resource/work/6661t4w3b9nvuk34
宝安锦田邓氏族谱（香港特别行政区/新界）,邓廷桢,邓,1965,--,始迁祖汉黻，北宋雍熙年间由江西吉安府吉水县白沙乡迁广东东莞岑田（今香港新界锦田）。 谱载谱序、家训、凡例、宗祠重修碑记、世系。,https://jiapu.library.sh.cn/https://jiapu.library.sh.cn/#/GenealogySummary:http://data.library.sh.cn/jp/resource/work/6xiltqt7qxmm7brh
宝安观澜松元厦村陈氏族谱（广东省/深圳市/宝安区）,陈霭香;陈茂新,陈,1996,--,始祖宽，后世迁居全国各地。传至八世祖景旺，元代由福建上杭县迁至长乐（今五华县）大都洞大亨洞围居住。始迁祖振能，于清乾隆十六年携妻曾氏、子俊儒、俊仕、俊科，以及同胞五弟振琮。并邀集堂弟振芹、振玖、振威等一行十三人由长了移居松原厦。 谱载祠堂图、谱序、陈氏一世祖至绣华嫡系图表等,https://jiapu.library.sh.cn/https://jiapu.library.sh.cn/#/GenealogySummary:http://data.library.sh.cn/jp/resource/work/ndf3647zhswphn12
宝安袁氏族谱二卷（广东省深圳市宝安区）,袁藻铨,袁,1919年,--,始祖仍，字悦塘，宋时为朝奉大夫，迁居东莞温塘。始迁祖觀德，字克熙，始祖十一世孫，迁寶安羅湖。书名据书签题。是为寶安羅湖谱。,https://jiapu.library.sh.cn/https://jiapu.library.sh.cn/#/GenealogySummary:http://data.library.sh.cn/jp/resource/work/h22hzjqnhlde1m2w
宝安县霸刚乡洞梓村黄江夏堂族谱（广东省/深圳市/宝安区）,不详,黄,1971,--,--,https://jiapu.library.sh.cn/https://jiapu.library.sh.cn/#/GenealogySummary:http://data.library.sh.cn/jp/resource/work/cdfhmt2682p8fahg
宝安县沙井镇新桥村曾氏族谱（广东省/深圳市/宝安区）,不详,曾,1987,--,始迁祖仕贵（字明蔡，号逢龙），南宋初迁居南雄保昌珠玑巷，继迁羊城，弟仕行居番禺小龙，兄仕贵则迁居东莞归德场（今宝安沙井镇新桥村）。 谱内记事至清初，仅录世系图。,https://jiapu.library.sh.cn/https://jiapu.library.sh.cn/#/GenealogySummary:http://data.library.sh.cn/jp/resource/work/ct1vvno3ukoahzhs
宝安县横台山邓氏族谱（广东省）,佚名,邓,不详,--,始祖志斋（字太乙），宋代迁广东。始迁祖廷桂，清代人。,https://jiapu.library.sh.cn/https://jiapu.library.sh.cn/#/GenealogySummary:http://data.library.sh.cn/jp/resource/work/nep9lf2pyuen5dgy
宝安县松元厦陈氏族谱（广东省深圳市宝安区）,陈高发,陈,1925年,--,始祖景，號九經。始遷祖振能，清代徙居寶安。書名據書衣題。,https://jiapu.library.sh.cn/https://jiapu.library.sh.cn/#/GenealogySummary:http://data.library.sh.cn/jp/resource/work/9dx274jhyzpdizyp
宝安县木古李氏族谱不分卷（广东省深圳市宝安区）,不详,李,1937年,--,始祖敏，字必捷，號先達，法名百八郎，行三，南宋時自福建移居廣東長樂縣（今五華縣）。始遷祖聯達等，清代再徙廣東新安木古村（今属深圳龍岡區平湖鎮）。,https://jiapu.library.sh.cn/https://jiapu.library.sh.cn/#/GenealogySummary:http://data.library.sh.cn/jp/resource/work/59nncfnbdzkxjtkg
宝安县新界八乡上輋村张氏族谱（广东省深圳市宝安区）,张伟良,张,1955年,--,--,https://jiapu.library.sh.cn/https://jiapu.library.sh.cn/#/GenealogySummary:http://data.library.sh.cn/jp/resource/work/gn4hvoamc83o42sz
宝安县文族族谱不分卷（广东省深圳市宝安区）,文日新,文,民國,--,譜籍爲新安孫潭頭鄉村（新安今寶安）。外紀始祖時，字春元，行四，五代後唐莊宗間自蜀遷永新縣固塘。入粤始祖天瑞，名輝，號東山，宋季遷廣東惠州。始遷祖璧，宋代人。書名據書衣題。,https://jiapu.library.sh.cn/https://jiapu.library.sh.cn/#/GenealogySummary:http://data.library.sh.cn/jp/resource/work/k75twtsj18og92ue
宝安县小滘李氏族谱（广东省/深圳市/宝安区）,李廷锦,李,--,--,始祖敏（字必捷，号先达，法名百八郎，行三），南宋时自福建移居广东长乐县（今五华县）。始迁祖子茂，清代再徙广东新安（今宝安）小滘。,https://jiapu.library.sh.cn/https://jiapu.library.sh.cn/#/GenealogySummary:http://data.library.sh.cn/jp/resource/work/g9jq85hqab2isvie
宝安县厦村邓氏族谱不分卷（广东省深圳市宝安区）,邓瀛,邓,清光緒十六年（1890）,--,始祖漢黻，宋代人。,https://jiapu.library.sh.cn/https://jiapu.library.sh.cn/#/GenealogySummary:http://data.library.sh.cn/jp/resource/work/r8bof3wkp7jr8oz1
宝安琥珀坑彭氏族谱五卷（广东省深圳市宝安区）,彭应时,彭,清乾隆三十六年（1771）,--,始祖應春，宋代人。始迁祖成發，明代人。譜初修於明萬曆六年。,https://jiapu.library.sh.cn/https://jiapu.library.sh.cn/#/GenealogySummary:http://data.library.sh.cn/jp/resource/work/5d7nx1nq8rjpcc57
宝安怀南祖冯氏家谱（广东省深圳市宝安区）,冯启昌,冯,1959年,--,始迁祖懿源，元代人。支祖怀南。,https://jiapu.library.sh.cn/https://jiapu.library.sh.cn/#/GenealogySummary:http://data.library.sh.cn/jp/resource/work/um28hw9xnx8wad4j
宝城吴氏世谱,吴柠世,吴,1956,--,始迁祖贤弼，高丽朝宰和顺宝城君（今属韩国全罗道南部）。 卷一序、凡例、图、记、索引表、对照表、世系表，卷二至十二世系表。,https://jiapu.library.sh.cn/https://jiapu.library.sh.cn/#/GenealogySummary:http://data.library.sh.cn/jp/resource/work/za2pewnp7xjry2yo
宝坻单氏家乘不分卷（天津市宝坻区）,单焜,单,清光緒二十九年（1903）,--,始迁祖良高，明代人。书名據书簽题。,https://jiapu.library.sh.cn/https://jiapu.library.sh.cn/#/GenealogySummary:http://data.library.sh.cn/jp/resource/work/hs6ov9zkny92damz
宝坑黄氏万五郎公族谱（广东省梅州市梅县）,黄政田,黄,1998年,--,始遷祖萬五郎。書名據封面、書名頁題。,https://jiapu.library.sh.cn/https://jiapu.library.sh.cn/#/GenealogySummary:http://data.library.sh.cn/jp/resource/work/wfktjd8bto7eafk6
宝勋公辉勋公派下吴氏族谱（台湾省/桃园市）,不详,吴,--,--,始迁祖启浓（字乃华，号超永）。支祖宝勋、辉勋，清代人。族裔聚居桃园县龙潭乡、平镇乡、杨梅镇等地。,https://jiapu.library.sh.cn/https://jiapu.library.sh.cn/#/GenealogySummary:http://data.library.sh.cn/jp/resource/work/zvrvvfyd44xz7xsf
寮步镇西溪村尹氏族谱（广东省/东莞市）,尹傅,尹,2018,--,始祖崇珂，祖籍甘肃天水，北宋迁山西太原，后迁河南。始迁祖八世武仲，北宋迁广东省东莞市寮步镇西溪村。 谱载世系、像、墓图。,https://jiapu.library.sh.cn/https://jiapu.library.sh.cn/#/GenealogySummary:http://data.library.sh.cn/jp/resource/work/i8wyig8ydxjd1i6t
寮前村志骆氏（浙江省/金华市/永康市）,骆金超,骆,1996,--,元末明初，始迁祖进、辅、和三兄弟从浙江省金华市义乌市石臼迁居浙江省金华市永康市寮前。 谱载题词、照片、敕令、地图、概述、政治、经济、文化、教育、卫生、民情习俗、人物、诗文辑存、丛录、宗谱。,https://jiapu.library.sh.cn/https://jiapu.library.sh.cn/#/GenealogySummary:http://data.library.sh.cn/jp/resource/work/5tdwnq14yn9nsfry
宽甸柏氏家谱（辽宁省/丹东市/宽甸满族自治县）,柏庆林,柏,1997,--,始迁祖云富。,https://jiapu.library.sh.cn/https://jiapu.library.sh.cn/#/GenealogySummary:http://data.library.sh.cn/jp/resource/work/r8yddee7tzhgga84
宽桥周氏族谱（广西壮族自治区/河池市/环江毛南族自治县）,周炳仕,周,2016,汝南堂,"明时周洪列始迁广西壮族自治区河池市环江毛南族自治县思恩镇宽桥,迁出地不详。 卷一世系,卷二迁徙往来、人物传记,卷三至卷十二世系,卷十三碑文,卷十四字辈、祖源,卷十五故事,卷十六渊源。",https://jiapu.library.sh.cn/https://jiapu.library.sh.cn/#/GenealogySummary:http://data.library.sh.cn/jp/resource/work/gr6dvlvuop8sj2lx
宽桥周氏族谱（广西壮族自治区/河池市/环江毛南族自治县）,周纯管;周炳仕,周,2016,汝南堂,始迁祖洪列、洪表，明朝洪武年间自江西吉安迁至环江县宽桥居焉。 谱前载开卷献诗、序、编者按，卷一至十二世系图、世表，卷十三史料篇，卷十四考证篇，卷十五今古摘零，卷十六渊源。,https://jiapu.library.sh.cn/https://jiapu.library.sh.cn/#/GenealogySummary:http://data.library.sh.cn/jp/resource/work/63mn23wjssb1qm5k
宽公派下大河塘芳公宗支谱（湖南省/永州市/零陵区）,佚名,陶,2017,--,明洪武年间始迁祖陶彬携弟陶荣、陶富、陶须从江苏省南京市移居湖南永州零陵县（今湖南省永州市零陵区七里店街道大河塘）。 谱载世系图。,https://jiapu.library.sh.cn/https://jiapu.library.sh.cn/#/GenealogySummary:http://data.library.sh.cn/jp/resource/work/2um1h6iyugvsde2l
宽仁公云房查奕玑公家谱（江西省/上饶市/婺源县）,查传宦,查,2000,--,--,https://jiapu.library.sh.cn/https://jiapu.library.sh.cn/#/GenealogySummary:http://data.library.sh.cn/jp/resource/work/86qt5522f9qglvls
宽二二公派下房谱不分卷 （浙江省温州市永嘉县）,陈联楷,陈,清同治間,--,始祖鎮，字岳籓，號静山，行四七，宋寶慶元年由浙江瑞安移居永嘉南溪，嘉熙四年卜居包山。是为寬二公派下二宅六分房譜。譜載序、支圖、雁行。書名據書簽題。,https://jiapu.library.sh.cn/https://jiapu.library.sh.cn/#/GenealogySummary:http://data.library.sh.cn/jp/resource/work/28xdea1e63ln7nlh
审知公后裔五管支系研究资料集（福建省/泉州市/安溪县）,王学智,王,2014,--,始祖审知，唐代人。始迁祖八世管斌，后周显德元年从南安瑛内（今福建省泉州市南安市英都镇）迁到福建省泉州市安溪县长卿镇。 谱载开场自序、开闽世谱纪实、前言、世系表。,https://jiapu.library.sh.cn/https://jiapu.library.sh.cn/#/GenealogySummary:http://data.library.sh.cn/jp/resource/work/oiz7xl3zu666cfad
寨里翟氏族谱（山西省/临汾市/翼城县）,翟义,翟,2003,--,始祖，二世祖失讳，三世祖景德，明朝中期迁居翼城寨里。 谱载前言、家族史、地理位置、自然环境、居民院落、庙宇舞台、村政建设、文化教育、溯源、寻根问祖、历代名人、名联集萃、茔域碑记、人物传记、世族总谱与支谱、世系图、辈次昭穆、后世辈次名讳用字、集资名单。,https://jiapu.library.sh.cn/https://jiapu.library.sh.cn/#/GenealogySummary:http://data.library.sh.cn/jp/resource/work/urj83chhwyrtyd6i
寨里翟氏族谱不分卷(山西翼城),翟义,翟,2003年,--,始遷祖名不詳，明中葉自翼城翟家橋遷居邑之寨里古堡。譜載序、前言、翟氏家族史、翟氏溯源、塋域碑記、人物傳記、世族總譜與支譜、翟氏家族輩次昭穆、後世輩次名諱用字、集資名單。,https://jiapu.library.sh.cn/https://jiapu.library.sh.cn/#/GenealogySummary:http://data.library.sh.cn/jp/resource/work/4dg724fcqrhtlx0a
寨里文氏七修族谱五卷首一卷（湖南省株洲市攸县）,文惠元,文,民國32年(1943),蔚起堂,先祖文翁，廬州人，仕西漢。裔孫時，字春元，行四，後唐同光三年自蜀宦居江西吉安府永新縣固塘。始遷祖震，字向離，北宋後期授教於攸縣寨里。卷首序、凡例、祠規、訓戒、家箴、家訓，卷一垂絲，卷二至四齒録，卷五傳、祠堂記、壽序。書名據版心、書衣題。,https://jiapu.library.sh.cn/https://jiapu.library.sh.cn/#/GenealogySummary:http://data.library.sh.cn/jp/resource/work/6rqyoz5rkx9z65wz
寨里棠溪简氏宗谱（江西省/新余市/渝水区）,简建华,简,2022,叙伦堂,明宣德年间，始迁祖简益安从湖北省荆门市京山县迁江西省新余市渝水区棠溪镇 卷一图腾、序、源流、修志启、基址景物录、分迁时录、先祖像、陈设图、基址图、十景诗、八景诗、寿序、祭文、诗文、班行录、祖训文、坟山、跋、世系总图、荣昌公派下世系图，卷二至卷四世系表。,https://jiapu.library.sh.cn/https://jiapu.library.sh.cn/#/GenealogySummary:http://data.library.sh.cn/jp/resource/work/gkhv3ux22vcxe21o
寨溪钟氏九修族谱（江西省/赣州市/信丰县）,钟生初,钟,1995,--,始迁祖莹（行四），宋代人，后裔散居地赣州章贡区及南康、信丰、大余、上犹等县。,https://jiapu.library.sh.cn/https://jiapu.library.sh.cn/#/GenealogySummary:http://data.library.sh.cn/jp/resource/work/cexxzhb188nu42e4
寨江秦氏族谱(广西灵川),秦明朗,秦,1985年,--,始迁祖福印，明万历间由江西庐陵县百花村迁居灵川县庙头圩寨江村。 谱载序言、世系、人丁统计。,https://jiapu.library.sh.cn/https://jiapu.library.sh.cn/#/GenealogySummary:http://data.library.sh.cn/jp/resource/work/hbjd4hm2qksetuuc
寨桥刘氏宗谱（江苏省常州市武进区）,不详,刘,清,藜阁堂,始祖子翬，字彦中，号屏山，汉楚元王交之裔，南宋兴化軍通判，世居福建建州崇安。始迁祖潔祥，字本源，号龍川，屏山九世孫，仕明新淦令，洪武中始徙晉陵（今武進）新安之寨桥。卷六屏山祠记、莘材公墓表、龍川公墓誌銘，卷七刘氏文忠记、五忠堂记。存卷六、七。书名据卷端题。记事至清道光间。,https://jiapu.library.sh.cn/https://jiapu.library.sh.cn/#/GenealogySummary:http://data.library.sh.cn/jp/resource/work/fsjpa93pjezq4vc8
寨山杨氏宗谱（江西省）,杨接旺,杨,清光緒4年(1878),--,始遷祖志洪，約於明代自浙江處州府青田縣遷居江西廣信府鉛山三十都二甲寨頭山。裔孫後分仁、義、禮、敬、信五房。卷一老序、家訓、新序、凡例、祠堂記、芳名、贊、山圖、橫圖、直圖、像圖、歷代源流世系，卷二至四世系圖。存卷一、二、四。,https://jiapu.library.sh.cn/https://jiapu.library.sh.cn/#/GenealogySummary:http://data.library.sh.cn/jp/resource/work/l3ajsl3xkzuclcrk
寨山堂潜川王氏四修家谱（安徽省/合肥市/庐江县）,等;王方雄;王彦博,王,2018,寨山堂,始迁祖师仲（讳困，字学尼），唐咸通元年进士，约于唐昭宗时避朱温专权迁安徽祁门苦竹港，复自祁门避祸迁庐江齐头嘴寨山。 卷一图腾、圣谕、旧序、建祠堂记、祠事款目、家礼仪节、凡例、谱例、家规、论宅，卷二成立宗谱续修理事会的通知、公告、四修谱序、四修凡例、捐款名单、照片及个人简介，卷三至十二世系，卷十三先祖传赞序、莹图志、禁碑、文契、派行、执谱字号等。,https://jiapu.library.sh.cn/https://jiapu.library.sh.cn/#/GenealogySummary:http://data.library.sh.cn/jp/resource/work/8h29cxsmecl23hbb
寨上李氏宗谱（云南省/普洱市/镇沅彝族哈尼族拉祜族自治县）,李文彩,李,2013,--,始祖魁春，清代携芝昌、芝馨从景东文井移居今镇沅县。后芝昌迁居寨上，是为始迁祖。 谱载李氏家族由来、部分先祖墓志、三百多年的繁衍发展概况、谱系、后记。,https://jiapu.library.sh.cn/https://jiapu.library.sh.cn/#/GenealogySummary:http://data.library.sh.cn/jp/resource/work/9vxqbeinzvkmscah
寨上拉弯韦氏族谱（广西壮族自治区）,韦晓萍,韦,1998,--,始迁祖郎云，原居庆远府东兰州，明万历年间离开东兰，卜居永宁凤凰墟喇敢村（今广西永福拉弯村），后迁安和乡板坡村（今广西鹿寨县寨上村）定居，裔孙在拉弯、寨上生息繁衍。 谱载谱序、续修族谱前记、新修族谱综述、世系图、行传、附录。,https://jiapu.library.sh.cn/https://jiapu.library.sh.cn/#/GenealogySummary:http://data.library.sh.cn/jp/resource/work/o4q97y928ffiqvwx
宁麻山钟氏续修支谱八卷（湖南省长沙市宁乡县）,钟泳南;钟明星,钟,1928年,苏湖祠,始祖元海，字朝宗，號湘城，北宋人。始遷祖千駟，字萬鍾，行二，南宋時随父景仁由豫章徙潭州，後析居寧鄉麻山。卷一新舊譜序，凡例祠圖，墳山圖等，卷二至七垂絲圖、世系表，卷八傳、跋、四禮輯略等。書名據版心題。,https://jiapu.library.sh.cn/https://jiapu.library.sh.cn/#/GenealogySummary:http://data.library.sh.cn/jp/resource/work/nrvjiwaz6stdsfd8
宁阳云山李氏国位祖续修族谱（广东省/肇庆市/广宁县）,合族,李,1996,--,始祖国宾，宋代人。始迁祖国位，明代人。,https://jiapu.library.sh.cn/https://jiapu.library.sh.cn/#/GenealogySummary:http://data.library.sh.cn/jp/resource/work/cjlwxurv94xaetp3
宁阳阮氏族谱（福建省/三明市/宁化县）,阮莆能,阮,1991,--,始祖阮安所（字宁之，号远贻），南宋时期，从福建省莆田市迁至干樵绥濉阳镇（今何处未知），其十二世孙阮文富，从绥安静安堡双溪（今福建省漳州市漳浦县绥安镇）迁至三明市宁化进贤坊官圳上，是为始迁祖。 谱载谱序、领谱字号、旧序、历代源流序、凡例、重修家谱抄录、字派、祭祀图、行传、世系。,https://jiapu.library.sh.cn/https://jiapu.library.sh.cn/#/GenealogySummary:http://data.library.sh.cn/jp/resource/work/fo5rvtm9d7jczhrf
宁阳虎溪温氏十修大宗谱（江西省/赣州市/宁都县）,温运权;温泰梯,温,1994,--,始祖誗（号衡斋），唐开元癸丑为虔化令即宁都州因家万岁里万田，今之宁都万斛里背村是也。始迁祖为次子如珪（讳睦），自唐迁居宁阳之虎溪。 卷一文、传、新老寿序，卷二文、墓志铭，卷三至十八世系、行传。,https://jiapu.library.sh.cn/https://jiapu.library.sh.cn/#/GenealogySummary:http://data.library.sh.cn/jp/resource/work/6cdv2udb4ssc9ksr
宁阳县鹿氏族谱（山东省泰安市宁阳县）,鹿庆恒,鹿,1996年,--,始祖同上。其長子留居山東寧陽鹿家崖。譜載鹿姓起源、關於祖先的傳说、鹿氏家族在寧陽縣的分佈情况、世系、歷代知名人士等。書名據封面題。,https://jiapu.library.sh.cn/https://jiapu.library.sh.cn/#/GenealogySummary:http://data.library.sh.cn/jp/resource/work/gpjd1nwpuv55kfqq
宁阳县张氏族谱不分卷(山东宁阳),张友节,张,清嘉慶11年(1806),--,始遷祖偉玉，明永樂間遷居寧陽喜鵲窩。譜載序、條規、凡例、修譜人名、世系。,https://jiapu.library.sh.cn/https://jiapu.library.sh.cn/#/GenealogySummary:http://data.library.sh.cn/jp/resource/work/l34f0qgykkyzwmtu
宁阳古溪艾氏六修族谱（江西省/赣州市/宁都县）,艾道源;艾德烜,艾,1995,--,始迁祖泰，唐末由抚州东乡县迁来宁都县之赖村八坵横壩等处，后定居青塘艾屋坝遂家焉。 谱载族谱新序、祠记、祠序、执事人名、家规条约、谱例、服制图、家礼、祭业、叙、堂叙、传、文约、墓志、村图、屋图、坟图、字派、世系、世传、跋。,https://jiapu.library.sh.cn/https://jiapu.library.sh.cn/#/GenealogySummary:http://data.library.sh.cn/jp/resource/work/665zeetd9zoaqiuu
宁阳北隅张氏房谱十卷(福建宁化),张庆增,张,清光緒24年(1898),--,始祖睦，唐末自河南固始縣祥符里浮光村遷居福建福州候官縣孝悌鄉孝順里。始遷祖五世藏興，北宋時遷居寧化龍上下里桂下。本譜房祖九世日益，南宋時遷居城北隅馬上之麓。卷一序、三老慶壽圖序、凡例、宗法、宗派、祠圖、祠規、樂助題名、禮儀誌、傳，卷二通誌、系圖，卷三屋圖、祭產誌、土租誌、合同、首事題名、領譜字號，卷四至九系傳，卷十墳圖。,https://jiapu.library.sh.cn/https://jiapu.library.sh.cn/#/GenealogySummary:http://data.library.sh.cn/jp/resource/work/olh2qqtd8j1h6v67
宁阳北隅张氏房谱十一卷(福建宁化),张家松,张,民國34年(1945),--,參見張慶增修《[福建寧化]寧陽北隅張氏房譜》五修本條目（館藏：1057188-198）。始祖睦，唐末自河南固始縣祥符里浮光村遷居福建福州候官縣孝悌鄉孝順里。始遷祖五世藏興，北宋時遷居寧化龍上下里桂下。本譜房祖九世日益，南宋時遷居城北隅馬上之麓。卷一序、宗法條議、傳，卷二世系圖，卷三祠圖、墓圖、嘗產、祭產、首事題名、領譜字號，卷四至十世系，卷十一墳圖。,https://jiapu.library.sh.cn/https://jiapu.library.sh.cn/#/GenealogySummary:http://data.library.sh.cn/jp/resource/work/lor02umbjt5y3g7b
宁阳刘氏族谱（山东省/泰安市/宁阳县）,刘乐芒,刘,2004,--,始迁祖彦杰，明洪武二年从山西洪洞迁山东省宁阳县伏山镇刘庄村。 卷一族谱序、咏刘氏祠堂、刘氏族训条规、寻根联宗、祖茔记、修编说明、世系总表，卷二至卷四世系表,https://jiapu.library.sh.cn/https://jiapu.library.sh.cn/#/GenealogySummary:http://data.library.sh.cn/jp/resource/work/kdw6rxcm1phns04v
宁陵张氏族谱不分卷（河南省商丘市宁陵县）,张雅诗,张,1933年,--,始遷祖汴來，明代人。,https://jiapu.library.sh.cn/https://jiapu.library.sh.cn/#/GenealogySummary:http://data.library.sh.cn/jp/resource/work/2c82sipb9v8fd6ww
宁陵吕氏家志（河南省/商丘市/宁陵县）,吕思周,吕,2000,--,始迁祖成，号洛来。宁陵吕氏肇自洛来公，来自洛阳，衍兹八脉，本茂流长。 卷一吕氏家志叙、例义、吕李姓源、孝睦田记，卷二前王厨十七世起、太康马厂十二世起、平岗十八世起，卷三五宗支派、六宗支派、七宗支派，卷四八宗支派、家志跋。,https://jiapu.library.sh.cn/https://jiapu.library.sh.cn/#/GenealogySummary:http://data.library.sh.cn/jp/resource/work/jkq184moc4dr7avg
