谱名,责任者,姓氏,撰修时间,堂号,家谱简介,详情链接
潘氏重修族谱十一卷首一卷末一卷（江西省宜春市）,潘明斗,潘,清光緒30年(1904),--,始祖揭，字均瑞，唐代自江西临川徙宜黄大富岡。十三世祖基，復徙江西南城西山。二十四世祖尚松，字挺庵，宋季官广东潮阳县尹，寓居福建長汀。始迁祖任，字肩宏，行五郎，三十世祖，宋末隱居江西贛州長宁項山（今屬尋烏县），後裔散居江西袁州府万载、宜春、分宜、萍乡及湖南瀏阳等地。是为袁郡（今宜春）合修谱。卷首序、凡例、家訓、家規、儀節、紀传、人物、建置，卷一至十一世系，卷末跋。书名据版心题。四修本。,https://jiapu.library.sh.cn/https://jiapu.library.sh.cn/#/GenealogySummary:http://data.library.sh.cn/jp/resource/work/cet243ycn542xf7w
潘氏重修族谱不分卷（湖南省长沙市宁乡县）,潘荣升,潘,清乾隆50年(1785),--,始祖杲，字啟昭，汉孝廉。始迁祖士安，字勉旃，五代後唐庄宗时自吉州泰和移居宁乡。谱载序、家传、家規、祠祀、墓图、世系图、行传。书名据版心、目录题。,https://jiapu.library.sh.cn/https://jiapu.library.sh.cn/#/GenealogySummary:http://data.library.sh.cn/jp/resource/work/537p1zakvilolvrf
潘氏重修族谱不分卷（江西省）,潘兴松;潘兴森,潘,清道光21年(1841),--,廣東興寧龍歸洞。始祖琴（又名萬十郎），宋末元初避兵亂自福建寧化石壁村遷居廣東惠州府長樂縣。傳十餘世至清康熙間，後裔有多支陸續遷居江西興國德清鄉、太平鄉、崇賢鄉等處。是譜即為居興國各支者合修。譜存譜序、像贊、傳、墳圖、屋圖、吊線圖、世系。書名據版心題。,https://jiapu.library.sh.cn/https://jiapu.library.sh.cn/#/GenealogySummary:http://data.library.sh.cn/jp/resource/work/828uhcu2fmbqwluo
潘氏重修宗谱十卷首二卷(湖北罗田),潘振衣,潘,清光緒19年(1893),务本堂,始祖紹賢，敕授信武將軍，元代自江西遷居羅田新昌河東。五世代武（字興周），遷居木樨河東潘家灣。七世榮登、榮揚，揚生六子：明道啟長房，明遠啟二房，明通啟三房，明遇、明逵合啟四房，明述啟五房。卷首一序、建祠買約、建祠賬目及捐項、祠廟祖墓圖形、祖產記、廟產、管照祠廟定例，卷首二目錄、凡例、祀產記、花紅欵例、序、傳、修譜名目、捐欵名目、義丁名目、跋，卷一至十世傳。,https://jiapu.library.sh.cn/https://jiapu.library.sh.cn/#/GenealogySummary:http://data.library.sh.cn/jp/resource/work/bxnhf7epsysjrs34
潘氏通谱（河南省/洛阳市/老城区）,潘振明,潘,2012,--,始迁祖思清，于明初时期由山西省迁河南省洛阳市老城区白马寺镇大潘村。 谱载序、影印件、渊源考略、名人录、家风和传统教育篇、通谱正文、宗系、附录、生活常识数则、后记。,https://jiapu.library.sh.cn/https://jiapu.library.sh.cn/#/GenealogySummary:http://data.library.sh.cn/jp/resource/work/f6kxkp4qdu7b8d9z
潘氏谱书不分卷（山东省烟台市栖霞市）,潘殿臣,潘,1937年,--,始祖連堯，清順治年间自青阳移居棲霞县艾山西後泊子村。始迁祖英，連堯四世孫，再徙小潘家村。清同治十年潘文選初修，是为二修本。,https://jiapu.library.sh.cn/https://jiapu.library.sh.cn/#/GenealogySummary:http://data.library.sh.cn/jp/resource/work/nk77k77n1ipab11e
潘氏谱书（辽宁省/大连市）,潘义富,潘,不详,--,始迁祖守绪，祖籍宁远（今鞍山），明末避难于广鹿岛，清代移居金州西南乡占涝洼屯（今属大连市）。,https://jiapu.library.sh.cn/https://jiapu.library.sh.cn/#/GenealogySummary:http://data.library.sh.cn/jp/resource/work/3truwndl3bk5sl2w
潘氏西十六公宗谱（浙江省丽水市景宁畲族自治县）,潘焕祥,潘,1926年,--,始迁祖堙，字子山，元代人。卷十内含西十公系孟房、西十公系仲房、西十公系季房。存卷十。书名据版心题。,https://jiapu.library.sh.cn/https://jiapu.library.sh.cn/#/GenealogySummary:http://data.library.sh.cn/jp/resource/work/23wy9fcgyweaomub
潘氏联修族谱十二卷首一卷末二卷（江西省）（江西省）,潘其芬,潘,1994,荥阳堂,始迁祖鼎隆（字联登，号玉铉，行万十），宋崇宁间再徙萍乡腊市麻田。后裔散居江西万载、宜春，湖南浏阳等地。是为上述诸地后裔联修谱。,https://jiapu.library.sh.cn/https://jiapu.library.sh.cn/#/GenealogySummary:http://data.library.sh.cn/jp/resource/work/zgrvq8uwyfyrz9kv
潘氏续修族谱四卷首一卷（湖南省益阳市安化县）,潘春亭,潘,清光緒十年（1884）,紫岩堂,始祖添君，宋宁宗朝自江西泰和圳上徙居湖南新化县太阳乡石子嶺。始迁祖汝和，行二，添君之孫，再徙安化。卷首序、诰封、谱規、谱約、家訓、祠图、墳图、墓産、派行等，卷一至四世系。书名据版心题。,https://jiapu.library.sh.cn/https://jiapu.library.sh.cn/#/GenealogySummary:http://data.library.sh.cn/jp/resource/work/kpoz43mdmgprec9x
潘氏续修族谱六卷首一卷（湖南省益阳市安化县）,潘士斌,潘,民國12年(1923),紫岩堂,始祖添君，宋宁宗朝自江西泰和圳上徙居湖南新化县太阳乡石子嶺。始迁祖汝和，行二，添君之孫，再徙安化。卷首序、传赞、家訓、祭礼、诰封、谱規、墳图、墓産、契約等，卷一至六世系。书名据版心、书衣题。,https://jiapu.library.sh.cn/https://jiapu.library.sh.cn/#/GenealogySummary:http://data.library.sh.cn/jp/resource/work/cdfbd9l4c9m28a7r
潘氏续修族谱四卷首一卷（湖南省）,潘春亭;潘忠亮,潘,清光绪十年,--,始祖添君，宋宁宗朝自江西吉安府泰和县圳上徙居湖南宝庆府新化县太阳乡石子岭。始迁祖汝和，添君之孙，复迁安化。传至元代，汝和孙循振（字聪）、循礼（字明，号信斋）分启二房。卷首新旧谱序、目录、圣谕、诰封、谱规、谱约、禁谱十条、家训、五服图、祠堂图、坟山图、墓产誌、坟山地名附合约契约禁碑、首士名目、派行、源流世系，卷一至二循振房世系，卷三至四循礼房世系。（馆藏：943121-25为此谱之复本，另馆藏：942279-86系民国十二年（1923）四修本）。书名据版心、书签题。,https://jiapu.library.sh.cn/https://jiapu.library.sh.cn/#/GenealogySummary:http://data.library.sh.cn/jp/resource/work/22m5dbfmwuzrvwl6
潘氏续修宗谱（江苏省常州市金坛市）,潘士来,潘,清咸豐10年(1860),--,始迁祖佚名，行礼八，明永樂初由延陵（今常州市武進區）移居金壇後趙巷。内有富弼、文天祥等撰序。存卷为谱序、家規、诰敕、人物等。存卷首。书名据目录题。,https://jiapu.library.sh.cn/https://jiapu.library.sh.cn/#/GenealogySummary:http://data.library.sh.cn/jp/resource/work/mrp43zfpludxj5k1
潘氏续修宗谱二十卷首三卷(湖北黄梅),潘吐甫;潘晓堂,潘,民國36年(1947),世德堂,始遷祖大臨（字邠老，號遺良）、大觀（字仲修，號德成），北宋元豐間自黃岡遷居婺源桃溪，轉遷黃梅古磉。卷首上譜序、墳記、祀田記、修譜名目、領譜名目、宗派、譜說、凡例、家規、家訓、傳贊，卷首下傳贊、公產目錄、遷莊圖，卷一至二十世系。,https://jiapu.library.sh.cn/https://jiapu.library.sh.cn/#/GenealogySummary:http://data.library.sh.cn/jp/resource/work/0b7t7okawlhz8d4k
潘氏现代家谱（江苏省/盐城市/建湖县）,潘广喜,潘,2010,荥阳堂,始迁祖潘文江，明洪武初年，自江苏省苏州市，迁到江苏省盐城市建湖县。 谱载祭祖诗、序言、前言、小组名单、辈分、民规、文明祭祖事宜、祭文、祭祖年份安排、集资建谱名单、世系图、编后话。,https://jiapu.library.sh.cn/https://jiapu.library.sh.cn/#/GenealogySummary:http://data.library.sh.cn/jp/resource/work/2oqf4iv5rqxatisj
潘氏荥阳郡历代族谱（广东省广州市）,不详,潘,1921年,--,始祖達德，字鶴林，原籍福建閩县瓜山村第六廂，宋代人。後裔移居广州等地。,https://jiapu.library.sh.cn/https://jiapu.library.sh.cn/#/GenealogySummary:http://data.library.sh.cn/jp/resource/work/ekpdn5f4rfhkrz9z
潘氏源流宗族谱武鸣英圩丰宁日蕃公世系南宁安吉大塘喜政公世系）（广西壮族自治区/南宁市）,潘润龙,潘,2006,--,宋皇祐年间，侬智高叛乱平息后，为稳定南方局势，日蕃公由山东青州府白马苑随军征西入粤，后落籍于武鸣英圩丰宁村，是武鸣英圩丰宁潘氏始迁祖。潮珠公于明嘉靖十一年（1532年），由武鸣英圩丰宁村迁居宣邑安吉大圹村东岸，是安吉大塘潘氏始迁祖。 谱载部首要文，历史资料，潘氏世系族谱，潘氏源流宗谱（庚谱），大塘潘氏要事录。,https://jiapu.library.sh.cn/https://jiapu.library.sh.cn/#/GenealogySummary:http://data.library.sh.cn/jp/resource/work/zugwurrdgpgls7px
潘氏源流史（全国）,潘望生,潘,2021,--,不详 谱载潘氏溯源、论族谱、理顺世系、历史资料、历代名人、后记。,https://jiapu.library.sh.cn/https://jiapu.library.sh.cn/#/GenealogySummary:http://data.library.sh.cn/jp/resource/work/ml1wqdwx7ye6f9ba
潘氏族谱（湖南省岳阳市平江县）,不详,潘,清光緒三十一年（1905）,荥阳堂,始祖維文，行三，宋代人。始迁祖大成（字又孔，行一）、大章（字景雲，行二），元代人。存卷首下、卷十九、二十三、三十一。书名据版心题。,https://jiapu.library.sh.cn/https://jiapu.library.sh.cn/#/GenealogySummary:http://data.library.sh.cn/jp/resource/work/61kubzhg2l1ybttp
潘氏族谱（湖南省岳阳市平江县）,潘峻德,潘,清嘉慶十四年（1809）,荥阳堂,始祖維文，行三，宋代人。始迁祖大成（字又孔，行一）、大章（字景雲，行二），元代人。存卷首。书名据版心题。,https://jiapu.library.sh.cn/https://jiapu.library.sh.cn/#/GenealogySummary:http://data.library.sh.cn/jp/resource/work/mu6h4bswhc3itx9c
潘氏族谱（浙江省杭州市临安市）,不详,潘,清,精英堂,存卷十九。书名据版心、书签题。记事至清同治间。,https://jiapu.library.sh.cn/https://jiapu.library.sh.cn/#/GenealogySummary:http://data.library.sh.cn/jp/resource/work/spp27vxslr8ofm5j
潘氏族谱四卷首一卷（湖北省武汉市）,冯斌,潘,1928年,公兴堂,始迁祖必達，字兼善，明洪武间由黄岡移居武汉。书名据版心、卷端题。谱初修於清光緒四年，此为二修本。,https://jiapu.library.sh.cn/https://jiapu.library.sh.cn/#/GenealogySummary:http://data.library.sh.cn/jp/resource/work/v7z2kma89eatkfvm
潘氏族谱十八卷首一卷末一卷（江西省宜春市）,潘舜卿,潘,民國34年(1945),荥阳堂,始祖揭，字均瑞，唐代自江西临川徙宜黄大富岡。十三世祖基，復徙江西南城西山。二十四世祖尚松，字挺庵，宋季官广东潮阳县尹，寓居福建長汀。始迁祖任，字肩宏，行五郎，三十世祖，宋末隱居江西贛州長宁項山（今屬尋烏县），後裔散居江西袁州府万载、宜春、分宜、萍乡及湖南瀏阳等地。是为袁郡（今宜春）合修谱。卷首序、凡例、家訓、家規、儀節、紀传、人物等，卷一系图，卷二至十七世系，卷十八像赞、传、寿序、墳图、墓誌等，卷末跋。书名据版心、书衣、书名页题。四修本。,https://jiapu.library.sh.cn/https://jiapu.library.sh.cn/#/GenealogySummary:http://data.library.sh.cn/jp/resource/work/nhhsy2facxbad78c
潘氏族谱五卷首三卷（湖南省常德市临澧县）,潘孝品,潘,1945年,荥阳堂,始迁祖運乾，字百武，原籍江西南昌府鐵樹宫，明永樂二年官澧州九溪衛指揮使，卜居安福县（今临澧县）新安後月堤寺。卷首谱序、传、跋、墓誌銘、凡例、家訓、家規、祠堂图、记、墓域、图说、塋图、宗派等，卷一至四世系，卷五紅藍谱。缺卷五。书名据版心题。,https://jiapu.library.sh.cn/https://jiapu.library.sh.cn/#/GenealogySummary:http://data.library.sh.cn/jp/resource/work/uozokfrc23qtwg4o
潘氏族谱五卷首一卷（湖南省长沙市浏阳市）,潘奕前,潘,1936年,荥阳堂,始迁祖元直，字冠玉，清代人。存卷首。书名据版心、书名页题。,https://jiapu.library.sh.cn/https://jiapu.library.sh.cn/#/GenealogySummary:http://data.library.sh.cn/jp/resource/work/j664kfzpxgiqufjf
潘氏族谱五卷首一卷（江西省）,潘子浚,潘,清光緒二十六年（1900）,--,始祖揭，字均瑞，唐代移居福建建宁府城安吉乡西園村（今屬建甌市）。卷首谱序、凡例、廟諱、家派、家訓、祠志、祠序、祠记、祭會序、迁居住址记、迁居图志、像图、墳图、屋基图、紀传、紀地理、紀人物仕籍、紀寿考、紀孝友、紀貞烈、紀建置、紀財賦、修谱首事、領谱字号、目录，卷一始祖源流，卷二至五世系图、醮田、山場、排年會、山園置賣醮産、合約衆産、合議。书名据版心、卷端题。,https://jiapu.library.sh.cn/https://jiapu.library.sh.cn/#/GenealogySummary:http://data.library.sh.cn/jp/resource/work/xjiak4ogmgpno4mw
潘氏族谱二卷（重庆市长寿区）,潘洪烈,潘,1938年,--,--,https://jiapu.library.sh.cn/https://jiapu.library.sh.cn/#/GenealogySummary:http://data.library.sh.cn/jp/resource/work/dik1kzl5zi4subx3
潘氏族谱二卷（浙江省绍兴市上虞市）,潘履孙,潘,明,--,始迁祖畤，字德鄜，行六二，号月林叟，宋代人。书名据书签题。记事至明嘉靖间。,https://jiapu.library.sh.cn/https://jiapu.library.sh.cn/#/GenealogySummary:http://data.library.sh.cn/jp/resource/work/bb3vohjlkg4glo4g
潘氏族谱不分卷（湖南省株洲市醴陵市）,潘宗江,潘,清光緒24年(1898),--,始迁祖贤，明洪武间自湖南王字洞移居常宁大冲口。六世孫礼敬，明万曆时再迁福建長汀县。九世孫長城、金城兄弟，清康熙间復迁湖南醴东，子孫析居醴邑城乡。存册载谱序、服制、凡例、家訓。书名据版心题。,https://jiapu.library.sh.cn/https://jiapu.library.sh.cn/#/GenealogySummary:http://data.library.sh.cn/jp/resource/work/qdt9jnr6ivktbtit
潘氏族谱不分卷（湖南省常德市安乡县）,潘祚镳,潘,清光緒二十一年（1895）,显佑堂,始祖運元，字千五，号松嶺，元代人。始迁祖直学，字聖功，号南山，元代人。书名据版心题。,https://jiapu.library.sh.cn/https://jiapu.library.sh.cn/#/GenealogySummary:http://data.library.sh.cn/jp/resource/work/4y4w5duionja9fne
潘氏族谱不分卷（广东省云浮市新兴县）,潘柄桓,潘,1920年,--,始祖伯泰，明代人。,https://jiapu.library.sh.cn/https://jiapu.library.sh.cn/#/GenealogySummary:http://data.library.sh.cn/jp/resource/work/ygj4fmjf1i6ov96t
潘氏族谱不分卷（上海市浦东新区）,不详,潘,民國,--,始迁祖心田，明万曆时自上海龍華镇移居浦东潘家舍。子思聖、思贤、思德、仰东四人，衍分養心、奉心、敬心、仰东四支。谱载世系图、世传。书名据书衣题。,https://jiapu.library.sh.cn/https://jiapu.library.sh.cn/#/GenealogySummary:http://data.library.sh.cn/jp/resource/work/e9b8ojzn4q1zj9g9
潘氏族谱一卷潘族合谱一卷附潘氏家话一卷（山西省阳泉市平定县）,潘祖耀;潘应珍,潘,清咸豐八年（1858）,--,始祖子華，宋代人。族谱载序、墓图、世系图，合谱载世系表、跋。书名据版心、卷端题。二修本。,https://jiapu.library.sh.cn/https://jiapu.library.sh.cn/#/GenealogySummary:http://data.library.sh.cn/jp/resource/work/7mfuyoxmbkft8lni
潘氏族谱（重庆市）,吴祖炎;潘永国;龚兆芳;潘元亮,潘;吴,2012,--,本谱是渝东南酉阳、秀山、黔江区潘氏的合修谱，分为多个分支：酉阳桃花源镇城北社区潘家湾支系、酉阳麻旺镇平桥潘家院子支系（始迁祖国运，自江西临江刘家寨滑石板高阶阳迁居酉阳）、酉阳毛垻乡龙胜村龙胜坎支系（始迁祖宗、章、龙、虎，清初自湖南沅州府黔阳县顺一里迁居酉阳）、酉阳毛垻乡茶园村岩青云支系（始迁祖宗，迁徙情况见前支）、酉阳腴地乡下腴村小马家沟支系（先世自黔江两河泥渊滩迁酉阳腴地乡水盘岩，始迁祖五世尚斌，迁居下腴村小马家沟）、酉阳兴隆镇潘家梁支系（始迁祖登成）、秀山塘坳乡凉水村岩脚支系（始迁祖太祖，元延祐元年自江西临江府清水县高阶阳大河坎大龙门迁居重庆秀山平茶）、秀山塘坳乡凉水村姚家坡支系（始迁祖承栋等五人）、秀山塘坳乡凉水村小塘支系（始迁祖世学等六人）、秀山塘坳乡凉水村塘坳支系（始迁祖文开）、秀山塘坳乡凉水村大面山支系、黔江区阿蓬江镇分水村潘家寨（冷水滩）支系（始祖廷环，清初自江西临江府高坎子石板桥迁居黔江区）、黔江区两河镇两河村晒衣垻支系、黔江区阿逢江镇水井村岩山桥支系（始迁祖兴照、兴计）、黔江区濯水镇蒲花沙沟支系（始迁祖大贵等三人）。 谱载前言谱序、凡例、潘氏发源地之我见、潘氏迁徙与分布、潘氏族训、世系历代源流、世系分支源流、名贤、附录、后记、支系繁衍情况续录表。,https://jiapu.library.sh.cn/https://jiapu.library.sh.cn/#/GenealogySummary:http://data.library.sh.cn/jp/resource/work/hv4ffmd70ot2ig13
潘氏族谱（台湾省）,潘氏族谱编辑委员会,潘,1967,--,始祖琴。始迁祖庶贤、挨、官佐等，清代移居台湾。,https://jiapu.library.sh.cn/https://jiapu.library.sh.cn/#/GenealogySummary:http://data.library.sh.cn/jp/resource/work/pt5bgoycpkeninix
潘氏族谱（台湾省/宜兰县）,不详,潘,1978,--,始祖祯祥。后裔移居台湾宜兰县宜兰市。,https://jiapu.library.sh.cn/https://jiapu.library.sh.cn/#/GenealogySummary:http://data.library.sh.cn/jp/resource/work/fokx6fex8ww46euj
潘氏族谱（福建省/龙岩市/永定区）,潘桃华;潘凤藻,潘,不详,--,始迁祖千二五郎，宋代人。,https://jiapu.library.sh.cn/https://jiapu.library.sh.cn/#/GenealogySummary:http://data.library.sh.cn/jp/resource/work/lghs6eltakfjpxsa
潘氏族谱（福建省/三明市/建宁县）,潘固榜,潘,1993,立本堂,始祖潘均瑞（又名揭），从江西省抚州市临川区迁到宜黄大富冈（今江西省抚州市宜黄县），南宋年间，始迁祖其后裔潘仲明，从新城下田渡（今江西省抚州市黎川县中田乡）迁到邵武建宁（今福建省三明市建宁县）。 卷首序、凡例、堂记、图、传、芳名、源流、世系，卷一至卷九世系，卷十二世系，卷十六至卷十九世系。,https://jiapu.library.sh.cn/https://jiapu.library.sh.cn/#/GenealogySummary:http://data.library.sh.cn/jp/resource/work/xf91hhsus7yp93ng
潘氏族谱（湖南省/怀化市/洪江市）,潘忠清,潘,1994,荥阳堂,始迁祖贞周，原世居山东青州府临朐县，宋时由浙江入楚，落业湖南沅州府黔阳县（今隶属于湖南省怀化市洪江市黔城镇）。 卷首历代修谱时间表、圣谕广训、谱序、家乘叙言、新序、赞词、宦官录、谱系、凡例、世系图、坟山图，卷一至卷十四世系图。,https://jiapu.library.sh.cn/https://jiapu.library.sh.cn/#/GenealogySummary:http://data.library.sh.cn/jp/resource/work/5aozf3wqu6ei8d6d
潘氏族谱（湖南省/常德市）,潘道圣,潘,1998,蘤县堂,明朝，始迁祖安，迁湖南省常德市，迁出地不详。 卷首前言、诗词录、成员名单、总序、四修采访录、说明、潘氏后裔典型、潘氏四修捐资名单，卷一至卷四世系表，卷五尾序。,https://jiapu.library.sh.cn/https://jiapu.library.sh.cn/#/GenealogySummary:http://data.library.sh.cn/jp/resource/work/xeq7jcpbhsnelk45
潘氏族谱（湖北省/荆州市/监利县）,潘之南,潘,1987,毕采堂,明洪武年间，始迁祖安（字子安，号微君），从江南常州府江阴县（今江苏省无锡市江阴市）迁到湖北省荆州市监利县。 卷首族谱主修人、督修人、序、源流、世系，卷二至卷三世系、世表。,https://jiapu.library.sh.cn/https://jiapu.library.sh.cn/#/GenealogySummary:http://data.library.sh.cn/jp/resource/work/lmcmo3a2bdz2npar
潘氏族谱（河南省/南阳市）,潘乐天,潘,1998,--,始迁祖九功。,https://jiapu.library.sh.cn/https://jiapu.library.sh.cn/#/GenealogySummary:http://data.library.sh.cn/jp/resource/work/s5v7nej1d83dnopj
潘氏族谱（河北省/沧州市/东光县）,潘彦发,潘,2012,--,原籍山东青岛即墨区，明永乐二年潘文迁河北沧州东光县。 谱载序、族规、由来、世系。,https://jiapu.library.sh.cn/https://jiapu.library.sh.cn/#/GenealogySummary:http://data.library.sh.cn/jp/resource/work/n1rhq6xdgqxe1hrj
潘氏族谱（江西省/赣州市/寻乌县）,潘棠赞,潘,1995,--,始祖揭，字均瑞，唐代自江西临川徙宜黄大富冈。十三世祖基，复徙江西南城西山。二十四世祖尚松，字挺庵，宋季官广东潮阳县尹，寓居福建长汀。始迁祖任，字肩宏，行五郎，三十世祖，宋末隐居江西赣州长宁项山（今属寻乌县）。 卷一载远祖脉络、发展（人口统计表、分布示意图、项山潘氏远徙表）、祖坟及碑文、历代谱序、族中人镜（大专毕业生表等），卷二至四为各支世系图表。,https://jiapu.library.sh.cn/https://jiapu.library.sh.cn/#/GenealogySummary:http://data.library.sh.cn/jp/resource/work/d9t5jksja1lzrvbj
潘氏族谱（江西省/赣州市/寻乌县）,潘诗文,潘,1997,荥阳堂,始祖揭，字均瑞，唐代自江西临川徙宜黄大富冈。十三世祖基，复徙江西南城西山。二十四世祖尚松，字挺庵，宋季官广东潮阳县尹，寓居福建长汀。始迁祖任，字肩宏，行五郎，三十世祖，宋末隐居江西赣州长宁项山（今属寻乌县）。后裔散居江西南康市、赣县、崇义、龙南、上犹、遂川、万安、泰和、大余等县市。是为上述诸地后裔合修谱。,https://jiapu.library.sh.cn/https://jiapu.library.sh.cn/#/GenealogySummary:http://data.library.sh.cn/jp/resource/work/5bwdc62rt6catv1v
潘氏族谱（江西省/新余市）,潘光华,潘,1997,敦睦堂,始祖谋（字肇），汉代河南中牟人。始迁祖久晨，清代人。,https://jiapu.library.sh.cn/https://jiapu.library.sh.cn/#/GenealogySummary:http://data.library.sh.cn/jp/resource/work/ynosx2q15pyqxdg1
潘氏族谱（江西省/抚州市/宜黄县）,潘式万,潘,1994,--,始迁祖均瑞（名揭），宋季因避世乱迁宜黄仙八都大富冈居焉。 卷一始祖源流，卷二至十一世系、行传。,https://jiapu.library.sh.cn/https://jiapu.library.sh.cn/#/GenealogySummary:http://data.library.sh.cn/jp/resource/work/qztv8lt92a53ws66
潘氏族谱（江苏省/扬州市）,潘文武;洪凤山;潘文亮,潘,2017,荥阳堂,始祖维兴，约元末明初避乱隐居云阳（今江苏丹阳）汉王庙后营村。始迁祖其长子伦，明代由云阳迁扬州邗江之东。 卷一圣谕、服图、谱序、功德篇、祠堂记、凡例、家训、历修名目，卷二像、赞、传、世系图，卷三至六世系表。,https://jiapu.library.sh.cn/https://jiapu.library.sh.cn/#/GenealogySummary:http://data.library.sh.cn/jp/resource/work/dkbzn53eqyqrhzn2
潘氏族谱（江苏省/常州市）,潘兴法;潘兆兴,潘,2013,德厚堂,始迁祖润（字昭阳），原籍广陵（今江苏扬州），北宋迁居晋陵（今江苏常州）东塘横林镇第二村殷坂。 卷首图腾、题词、序、讲话、跋、村貌、图、续修理事会、功德榜、风采录、简介、人才录、长寿录、书法、领谱录、表，卷一序、记、凡例、祖范、诰敕、像赞、传、墓志铭，卷二至四纪略、序、传、寿序、行略，卷五至九世系图、世系表。;卷首潘氏图腾、题词、毗陵厚德堂潘氏续修宗谱序、潘氏宗祠重建序、跋、卫星地图村貌、住宅图、续修理事会、续修理事会合影、功德榜、风采录、人物简介、人才录、长寿录、书法、领谱录、纪年对照表，卷一原序、重修宗谱序、宗祠记、凡例、祖范、诰敕、像赞、传、墓志铭，卷二至卷四宅前始祖英公纪略、运村迁支序、传、序、寿序、行略，卷五至卷十二世系图、世表、领谱字号、历届修谱纪名录、旧谱跋、续修宗谱跋。,https://jiapu.library.sh.cn/https://jiapu.library.sh.cn/#/GenealogySummary:http://data.library.sh.cn/jp/resource/work/skxi9onezx3dyb54
潘氏族谱（广东省）,潘岐横,潘,1985,--,始祖伯润，什五郎，宋代人。后裔散居广东清远、番禺、兴宁、新会、开平、长宁、增城、嘉应、义州等地。书名据书衣题。,https://jiapu.library.sh.cn/https://jiapu.library.sh.cn/#/GenealogySummary:http://data.library.sh.cn/jp/resource/work/en2a3981do2oejk2
潘氏族谱（广东省/深圳市/宝安区）,潘志山,潘,不详,--,始迁祖英甲，字仲鉴，号昌南，行二，明代移居宝安福永镇。复印1948年抄本。,https://jiapu.library.sh.cn/https://jiapu.library.sh.cn/#/GenealogySummary:http://data.library.sh.cn/jp/resource/work/3xok2sflst7ggscz
