谱名,责任者,姓氏,撰修时间,堂号,家谱简介,详情链接
刘氏族谱.广东阳江（广东省/阳江市）,刘振灜,刘,1998,--,始迁祖少集，明初从福建建宁府建阳县贤开乡迁广东省阳江市江城区埠场镇雷山村委会谐村。 谱载阳江宗兴堂刘氏宗谱、刘氏家乘纂辑原序、阳江刘氏家乘序、修谱亿例、述古家训、修谱人员、世系表。,https://jiapu.library.sh.cn/https://jiapu.library.sh.cn/#/GenealogySummary:http://data.library.sh.cn/jp/resource/work/mo9j9jvzo7kj3be8
刘氏族谱.广岭村元初祖.广传公第五房（广东省/广州市/花都区）,刘金培;刘通海,刘,2010,--,始祖广传（官名弁，号清叔），南宋官授瑞金县令。其曾孙肇舆（名继会）南宋淳熙年间进士，其子鹿园（名玉，字玉球）迁东莞，为东莞祖。始迁祖灿章，大初（号元初）之子，清康熙间从东莞石涌乡迁到广州市花都区新华镇广岭村。 谱载世界刘氏宗亲联谊会会徽会歌、刘氏先祖像、序言、中国历代纪元表、刘氏帝王序、刘氏封臣科甲序、刘氏源流、刘氏历代集注流传族谱、广传公十四子概况、世系、后记。,https://jiapu.library.sh.cn/https://jiapu.library.sh.cn/#/GenealogySummary:http://data.library.sh.cn/jp/resource/work/9gyiuerbckntg5z8
刘氏族谱.山东省费县上冶北村（山东省/临沂市/费县）,刘修德,刘,2020,--,始迁祖先，南宋从山东费县城东许由城子迁入邑之上冶北村。 谱载照片、功德榜、记、志略、序、碑文、家训、字辈、世系。,https://jiapu.library.sh.cn/https://jiapu.library.sh.cn/#/GenealogySummary:http://data.library.sh.cn/jp/resource/work/qkzm8fbtwbj4pby1
刘氏族谱.刘田寨支系.六修（江苏省/徐州市/沛县）,刘鸿福,刘,2019,藜照堂,晋朝，始迁祖乾玄为避司马残害，迁居洛阳。后永嘉南渡，携眷归故里，开荒种田，打寨筑圩建起村落，号曰刘庄铺即今江苏沛县刘田寨是也。 卷首凡例、任事名录、各村参修人员、第六次续修族谱序、皇室诸公赞传、历史名人赞高祖、上古源流、迁移史、族规祖训、刘氏家规、祠堂记、两汉以来历史名人录、汉前后世系、四大房支村庄分布一览表、历次续修族谱资料知识库、汉前后世系实行传，卷一至卷卷十世系图，卷十一世系图、各房支参与修谱主要工作人员名录、后记。,https://jiapu.library.sh.cn/https://jiapu.library.sh.cn/#/GenealogySummary:http://data.library.sh.cn/jp/resource/work/7ndvvogzd6pfwbqp
刘氏族谱 :广传公派下家族（台湾省/新竹县）,刘清水,刘,1985,彭城堂,始祖巨深(讳光)。始迁祖十七世初昌，于明朝时期迁台湾省新竹县。 谱载世系、序。,https://jiapu.library.sh.cn/https://jiapu.library.sh.cn/#/GenealogySummary:http://data.library.sh.cn/jp/resource/work/8cwxvpbhl1hc34r4
刘氏族谱 敦本堂 湖南永州衫木桥 重庆奉节金厂坝 重庆云阳百丈溪（重庆市/重庆市/奉节县）,刘大平,刘,2015,敦本堂,始祖天朝，明洪武间由江西安庆府太和县平地徙湖南永州府零陵县崇文乡东团里石灰塘杉木桥。始迁祖益季，于康熙五十三年率孟兄益秀、仲兄益香和弟益禾及长子正联、三子正科、四子正洪从湖南朔江西上，先落于重庆奉节县金厂坝，五年之后又置业于云阳县百丈溪。本族自益季公康熙甲午年入川置业金厂坝开始，历经三百年，繁衍十五代，自“益”字辈至“开”字辈，人口达7300余人，散居重庆、湖南、湖北、四川等省市。 谱载源流篇、世系篇、人物篇、训诫篇、宗祠篇、大事篇、文献篇、祖墓篇、经费篇及后记。,https://jiapu.library.sh.cn/https://jiapu.library.sh.cn/#/GenealogySummary:http://data.library.sh.cn/jp/resource/work/b3iltfhaso1xjwyj
刘氏族谱,刘锦俊,刘,1981,--,始祖祯善，原籍广东省潮州市饶平县，始迁祖不详，迁徙源流不详。 谱载字辈、世系。,https://jiapu.library.sh.cn/https://jiapu.library.sh.cn/#/GenealogySummary:http://data.library.sh.cn/jp/resource/work/hfog2hrbgunqmh97
刘氏族谱,不详,刘,1961,--,--,https://jiapu.library.sh.cn/https://jiapu.library.sh.cn/#/GenealogySummary:http://data.library.sh.cn/jp/resource/work/gxrsuuidjldnki1v
刘氏族籍（台湾省/屏东县）,不详,刘,不详,--,始祖积敬。族人散居屏东县麟洛乡田中村等地。,https://jiapu.library.sh.cn/https://jiapu.library.sh.cn/#/GenealogySummary:http://data.library.sh.cn/jp/resource/work/ya1117ihr5wcox3y
刘氏族簿大埔始安字辈（台湾省/台中市）,不详,刘,1983,--,始祖龙，字璠孟，清代人。族人散居台中县新社乡庆西村等地。,https://jiapu.library.sh.cn/https://jiapu.library.sh.cn/#/GenealogySummary:http://data.library.sh.cn/jp/resource/work/trpaknhukkvbdor2
刘氏族志（广东省/河源市/紫金县）,--,刘,1998,--,始祖开七（字必高，行七，又字星郎，号三郎）。始迁祖习义（号必宇），明代人。,https://jiapu.library.sh.cn/https://jiapu.library.sh.cn/#/GenealogySummary:http://data.library.sh.cn/jp/resource/work/r9xliixcrwljzw2n
刘氏新族谱（广东省/潮州市）,--,刘,不详,--,谱奉南宋开七（字必高）为一世祖。,https://jiapu.library.sh.cn/https://jiapu.library.sh.cn/#/GenealogySummary:http://data.library.sh.cn/jp/resource/work/zi5bkscio4reys5b
刘氏新族谱（广东省/揭阳市/揭西县）,刘少卿,刘,1991,彭城堂,始祖开七，南宋人。始迁祖九世千一郎，明代由长乐下坝(今广东省梅州市五华县)迁揭阳青溪南门坑(今广东省揭阳市揭西县青溪南门坑乡)。支祖国诠（字能臣），清代人。 谱载像、源流、世系、墓记、家训、史略、简介、编后语。,https://jiapu.library.sh.cn/https://jiapu.library.sh.cn/#/GenealogySummary:http://data.library.sh.cn/jp/resource/work/ob62h1au7jjirc9y
刘氏文华公谱（广东省/揭阳市/榕城区）,刘百训,刘,2007,--,始祖开淑，明代因祖传田产多数在广东省揭阳县福岗洋，为便于管理，遂携带三、四子至福岗创寨(后世因故散寨而迁回揭阳桂林乡棉林村)。又打发长子到新亨埠旁创业。留下次子士禄守业新厝房。士禄传下文华。文华清朝初期从广东省揭阳县桂林新厝房（今桂东十村）来揭阳城内新庵头定居，是为始迁祖。 谱载题词及有关图照、编纂理事会、赞助本谱出版芳名、序、世系等。,https://jiapu.library.sh.cn/https://jiapu.library.sh.cn/#/GenealogySummary:http://data.library.sh.cn/jp/resource/work/p3o273p91v6klymv
刘氏文灿公房谱（安徽省/安庆市/岳西县）,刘肇朋,刘,2018,乙星堂,始祖寿二（号南山），元至正十三年自江西彭泽水西庄迁居安徽潜山上清石门山。八世暹（字焕昇），明代自邑之杨徐山迁居硖石岭。十三世文灿，再迁邑之刘瑞岭（又名楢树岭，今属岳西县），是为本谱始迁祖。 卷一题字、遗训、诰命、祖像、祖茔、祖籍、序文、凡例，谱派、家礼、家规、家训、纪实、跋文、纪实、名目，卷二至五世系。,https://jiapu.library.sh.cn/https://jiapu.library.sh.cn/#/GenealogySummary:http://data.library.sh.cn/jp/resource/work/58xme5uqrppmo6qn
刘氏文史（湖南省）,刘业孝,刘,1999,--,是谱为居新化、溆浦、安化统谱。始祖先进（字连拨，号古村），后周显德三年自江西泰和宦居四川成都。始迁祖玉盛（字緖昌，号福裔），宦居湖南邵陵云路街，旋居新化上梅茅坪。玉盛子三：长政迁四川成都守祖坟；次远，居旧宅；三滔徙居溆浦浦源。政长子俊自成都转徙新化藿草关沙佃。后裔有居湖南益阳、湖北江陵、四川等地。是谱乃居新化、溆浦、安化裔孙所修。 章一总述、历代世系寻源，章二古今刘氏名人传，章三世系、里居、风情录、源流关系考，章四文物古迹，章五宗族文化，章六诗词、楹联、传说，章七族贤名士，章八建馆、编史记事。,https://jiapu.library.sh.cn/https://jiapu.library.sh.cn/#/GenealogySummary:http://data.library.sh.cn/jp/resource/work/p28xx526thtzts6q
刘氏叙伦堂六修族谱（江西省/赣州市/信丰县）,刘承洪;刘承须,刘,1998,叙伦堂,始迁祖荣（字茂荣），宋末元初由赣来居信丰安息中里堡，以两更国运，后人或由信去赣，或由赣返信，最终在明代文信、文斌均居信。 卷一凡例、序、戒约、族约、墓志、办事人员、授谱字号、赞助鸿名录、线图、实录，卷二线图、实录。,https://jiapu.library.sh.cn/https://jiapu.library.sh.cn/#/GenealogySummary:http://data.library.sh.cn/jp/resource/work/7uv01ydo47c2sjue
刘氏支谱（湖北省/黄冈市）,刘性泰,刘,1994,校书堂,始迁祖重三，明洪武二年自江西迁湖北黄冈刘家屋。 首卷载谱序、二修编委、宗派、凡例、家规、列传、服制、祖墓图、契约、遗漏、世代列传、赞助名单，其余卷载世系,https://jiapu.library.sh.cn/https://jiapu.library.sh.cn/#/GenealogySummary:http://data.library.sh.cn/jp/resource/work/mldju25564vr28pg
刘氏支谱（江西省/宜春市）,--,刘,1985,彭城堂,始迁祖广传（字观汉，号毓正），明代人。,https://jiapu.library.sh.cn/https://jiapu.library.sh.cn/#/GenealogySummary:http://data.library.sh.cn/jp/resource/work/iienbx2x671peczs
刘氏支谱（江苏省/盐城市）,刘怀友,刘,1996,彭城堂,始迁祖立基，明洪武年间自江苏苏州迁盐城，定居于今亭湖伍佑街道一带。 谱载序、修谱人、世系。,https://jiapu.library.sh.cn/https://jiapu.library.sh.cn/#/GenealogySummary:http://data.library.sh.cn/jp/resource/work/9rhx7j9v8re88tyj
刘氏支谱（山东省/青岛市/崂山区）,佚名,刘,不详,--,谱载山东青岛崂山港东社区刘氏支系。 谱载世系图、世表。,https://jiapu.library.sh.cn/https://jiapu.library.sh.cn/#/GenealogySummary:http://data.library.sh.cn/jp/resource/work/miygk684uvyce88b
刘氏支谱（山东省/淄博市/淄川区）,刘清安,刘,2000,--,始祖甫广，明初由山西洪洞迁河北枣强，再迁山东济南之章丘。始迁祖八世文举，迁淄川罗村镇王村。 谱载叙、编委会成员名目、世系。,https://jiapu.library.sh.cn/https://jiapu.library.sh.cn/#/GenealogySummary:http://data.library.sh.cn/jp/resource/work/cbdvw8jzdje1yevi
刘氏支谱（山东省/淄博市/淄川区）,刘廷雷;刘伯修,刘,2000,--,始祖甫广，原籍山西平阳府洪洞县，明洪武年间迁于冀州枣强（即河北枣强）刘家庄，永乐年间又迁山东章丘城里新街。子江、海、贵、让，兄弟四人同时移居洄村河北名刘家。始迁七世春芳，由章丘洄村迁居王村，后又移居淄川东北路大刘庄，又名道口庄。 谱载谱序、支谱序、历续世次十八字、传家言、续谱委员会成员、会议纪要、捐资名单、世系表，续谱经费收支。,https://jiapu.library.sh.cn/https://jiapu.library.sh.cn/#/GenealogySummary:http://data.library.sh.cn/jp/resource/work/xqqeh2ejaytcolvs
刘氏支谱（安徽省/安庆市/潜山市）,刘盛苗;刘会荣,刘,1996,燃藜堂,始迁祖寿二（字南山），元至正十三年癸巳，徐寿辉冠鄱湖，公由江西彭泽县水西荘迁皖之太湖白沙村太平庄，复迁潜山皇马北乡沙村，终迁上清石门山。 卷首一续修支谱新序一、二、三、吴馨序、圣谕十六条、诰勅、宗图、家礼图、家训、家规、新派字、唐虞至宋元纪世系，卷一至卷十六下系，传、赞、传、赞、新跋。,https://jiapu.library.sh.cn/https://jiapu.library.sh.cn/#/GenealogySummary:http://data.library.sh.cn/jp/resource/work/q6d5yaz3h7v5dn4v
刘氏支谱（安徽省/安庆市/潜山市）,刘皖生;刘赞清,刘,1996,乙星堂,始迁祖寿二（号南山），原籍江西彭泽水西庄，元至正年间迁皖潜山县石门山麓。生七子。此是寿二次子福二之孙彦庆支谱。彦庆之后，一支居于怀宁硖石岭南，一支居潜山南望前路管冲及董家窰。谱主要记硖石岭一支。 卷首新老谱序、家规、家训、文契，卷一新凡例、诰敕、祖像、墓图、外纪世系，卷二至四十六世系表，卷末新旧传赞。,https://jiapu.library.sh.cn/https://jiapu.library.sh.cn/#/GenealogySummary:http://data.library.sh.cn/jp/resource/work/u6558g210y6ogpt2
刘氏支谱（安徽省/安庆市/潜山市）,刘皖生;刘赞清,刘,1996,乙星堂,参见刘开五修《[安徽潜山]刘氏支谱》条目（馆藏：1052726-763）。始祖寿二（字南山），元至正十三年自江西彭泽迁安徽太湖县北乡司空山白沙刘隆湾九口塘，至正十六年复迁潜山县北乡上青石门山丁家园，生七子。次子福二，由石门迁居潜山县东门外。本谱支祖四世彦庆（字道庆），福二孙，明初人。 卷首新序、目录、老旧序、谱论、家规小引、家训、书规、文契，卷一新增凡例、服制图、大成宗派图引、修谱名目，卷二至四十六世系，卷末老传赞引、老传赞、旧传赞引、旧传赞、旧赞、新传赞引、献款小引、新跋。,https://jiapu.library.sh.cn/https://jiapu.library.sh.cn/#/GenealogySummary:http://data.library.sh.cn/jp/resource/work/j5t3zjr2trc7gjvh
刘氏支谱（安徽省/安庆市/潜山市）,刘肇我,刘,1996,乙星堂,始迁祖寿二，元至正时江寇扰乱，由江西彭泽水西壮挈眷避乱始迁皖潜山。 卷首续修新序、旧序、谱论、家规小引、家训、文契，卷一新增凡例、服制图、大成宗派图引、修谱名目、领谱名目、虞唐至元明纪，卷二至四十六世系图、行传，卷末老传赞引、传赞、旧跋、献款小引、新跋。,https://jiapu.library.sh.cn/https://jiapu.library.sh.cn/#/GenealogySummary:http://data.library.sh.cn/jp/resource/work/9arr69qlg9ducljt
刘氏支谱（安徽省/安庆市/怀宁县）,刘方裕,刘,2000,燃藜堂,始祖寿二（字南山），元末为避战乱自江西彭泽水西庄转辗迁安徽潜山县上清石门山（今属岳西县），生七子，分七支。第五子福五迁怀宁盘石涧。福五子云伍（户名荣武，字道雯），自盘石涧受泉再迁受泉乡五十三都陡岭（近名家宕），是为本谱始迁祖。 卷首新旧谱序、诰敕、家训、凡例、源流世系，卷一至二十世系表，卷末家传、分迁、原跋。,https://jiapu.library.sh.cn/https://jiapu.library.sh.cn/#/GenealogySummary:http://data.library.sh.cn/jp/resource/work/ol28fpbbvzt0b8ge
刘氏支谱（安徽省/六安市/舒城县）,等;刘尔[正]堂,刘,2021,天禄堂,始迁祖名失考，于明代自江西瓦屑坝迁至合肥南乡，传至二十二世，族裔在以肥西县严店乡刘河村、庐江县矾山镇刘墩村、同大镇为中心聚居，分支在舒城县城关镇古城村，经济开发区金墩村、裕安区苏埠镇黄莲寸方塘组、卢氏祠存田畈组、戚家桥等。本支谱包括舒城关镇十一户、六安苏家埠七户。 谱载领谱人名单、字辈、家规家训、刘氏宗谱概述、精神文化提倡、名贤谱论、先贤格言、续修宗谱序、续修宗谱的意义、刘氏大成宗谱序、刘姓起源、续谱功德榜、世系、后记。,https://jiapu.library.sh.cn/https://jiapu.library.sh.cn/#/GenealogySummary:http://data.library.sh.cn/jp/resource/work/5671bi9okhx7d4fk
刘氏支谱彭城郡——客家支系（云南省）,刘克政,刘,2013,中山堂,是谱录南宋广传位下十四房中杨氏所生的入滇裔孙，隆裕为入滇开基祖，原籍江西，清初迁居云南。 谱载谱例、目录、刘姓图腾、三祖遗训、刘氏春秋漫步、本支历史源流、重修祖墓记、世系图、跋。,https://jiapu.library.sh.cn/https://jiapu.library.sh.cn/#/GenealogySummary:http://data.library.sh.cn/jp/resource/work/b62byw1fgn85jxm6
刘氏支谱十六卷首一卷末一卷（安徽省）,刘寅,刘,民國10年(1921),燃藜堂,始祖壽二（字南山），元至正十三年避徐壽輝亂自江西彭澤縣水西莊遷居安徽太湖白沙村太平莊，復遷潛山縣北鄉沙村，終遷上清石門山。始遷祖福五（又名信五），壽二第五子，自太湖白沙遷居懷寧縣石牌，復遷盤石澗。支祖雲伍（又名永雯，字道文，戶名榮武），福五第六子，元末明初遷居邑之受泉鄉五十三都陡嶺。卷首譜序、墓誌銘、聖諭、誥敕、宗圖、家禮圖、家訓、家規、凡例、派字、世系，卷一至十六世系，卷末傳、贊、契議、捐約、任事名目、領譜字號、各房遷居地名、跋。書名據版心、書衣題。,https://jiapu.library.sh.cn/https://jiapu.library.sh.cn/#/GenealogySummary:http://data.library.sh.cn/jp/resource/work/robdxsatzr52waaf
刘氏支谱八卷(湖南长沙),刘光迪,刘,民國15年(1926),彭城堂,始遷祖德華（字如玉），原籍江西高安，明萬曆初年遷居長沙霧陽鄉（後又名尊陽都）。卷一源流序、譜序、跋、傳、國號年歲一覽表、目錄、朱子格言、家訓、家約、宗規、凡例、服制圖，卷二領譜房份名號住址一覽表、各房住址現丁統計表、派語說、派語圖、祠堂序、祠堂圖、祠屋契據、儀注、祝文、垂絲圖，卷三墓盧說、墓盧圖、墓盧契據、墓圖、墓山契據，卷四至八世系。,https://jiapu.library.sh.cn/https://jiapu.library.sh.cn/#/GenealogySummary:http://data.library.sh.cn/jp/resource/work/08qkgo7s65yk4eb0
刘氏支谱三卷首四卷(湖南益阳),刘嘉桐,刘,民國35年(1946),彭城堂,始遷祖文達（字理和），明景泰五年由江西吉安府吉水縣遷居湖南益陽。卷首譜序、凡例、家規、家訓、壽贊、墓誌銘、祠堂記、祭田契據、新跋、墓圖說、墓圖、舊跋、章房垂絲系圖、祥房垂絲系圖，卷一至三世系。,https://jiapu.library.sh.cn/https://jiapu.library.sh.cn/#/GenealogySummary:http://data.library.sh.cn/jp/resource/work/uoq6ckhcg8c2ewiz
刘氏支谱三十八卷首一卷末一卷(安徽潜山),刘开五,刘,民國37年(1948),乙星堂,始祖壽二（字南山），元至正十三年自江西彭澤遷居安徽太湖縣北鄉司空山白沙劉隆灣九口塘，至正十六年復遷潛山縣北鄉上青石門山丁家園，生七子。次子福二，由石門遷居潛山縣東門外。本譜支祖四世彥慶（字道慶），福二孫，明初人。卷首譜序、目錄、譜論、家訓、家規、規訓、文契，卷一凡例、服制圖、修譜名目、領譜字號、世系，卷二至三十八世系，卷末傳贊、跋。,https://jiapu.library.sh.cn/https://jiapu.library.sh.cn/#/GenealogySummary:http://data.library.sh.cn/jp/resource/work/g57j8k8sw73kypm5
刘氏支谱□□卷（安徽省）,刘古盛;刘行余,刘,清光緒7年(1881),亲睦堂,鼻祖德隆（名端，字善長，號隆德），唐代人。始祖壽二，德隆十八世孫，元代自江西彭澤水西莊遷居安慶府太湖縣（今屬岳西縣）司空山太平莊，生七子。始遷祖福四，壽二四子，元末遷居潛山縣（今屬岳西縣）北鄉沙村，生四子。福四長子勝忠（字元臣）生志江（字紀南，號舒川）、志海（字名玉）。志江生集昱（字道成，號問山）、集昊（字仰止，號柱瞻）；志海生集昇（字公旦，號沙泉）。是譜系集昊、集昇兩支所修。卷二至五譜序、祭文、行實、派行、世系，卷末祀產記。（館藏：985788-806、985807-809（殘）系“集昱”支譜）存卷二至五，卷末。,https://jiapu.library.sh.cn/https://jiapu.library.sh.cn/#/GenealogySummary:http://data.library.sh.cn/jp/resource/work/r2al7sjye9ja69e5
刘氏捷贞公关其世代系统谱（台湾省/高雄市）,不详,刘,1980,--,始迁祖文科，清代人。支祖坤仁，清末民初人，移居台湾，后裔散居南雄县湖内乡及台南市等地。,https://jiapu.library.sh.cn/https://jiapu.library.sh.cn/#/GenealogySummary:http://data.library.sh.cn/jp/resource/work/fraeca6lke7qim91
刘氏手抄谱（台湾省/台中市）,不详,刘,1959,--,始祖贵兴，明代人。后裔散居台中县丰源市等地。,https://jiapu.library.sh.cn/https://jiapu.library.sh.cn/#/GenealogySummary:http://data.library.sh.cn/jp/resource/work/zgwkzquoewrghvuf
刘氏手抄谱（台湾省/新竹县）,不详,刘,1983,--,始祖开七，字三郎，号仁创，宋代人。始迁祖澄清，谥崇厚，清季移居台湾，后裔散居新竹县湖口乡等地。,https://jiapu.library.sh.cn/https://jiapu.library.sh.cn/#/GenealogySummary:http://data.library.sh.cn/jp/resource/work/mt1woiwtev44p2dd
刘氏手抄谱（台湾省/新竹县）,不详,刘,不详,--,始迁祖万毅恪，移居台湾，后裔散居新竹县竹东镇等地。,https://jiapu.library.sh.cn/https://jiapu.library.sh.cn/#/GenealogySummary:http://data.library.sh.cn/jp/resource/work/pb9unkpbbskmbkxh
刘氏手抄谱（台湾省/彰化县）,刘安车,刘,1976,--,始祖朴直，清代人。后裔散居彰化县彰化市等地。,https://jiapu.library.sh.cn/https://jiapu.library.sh.cn/#/GenealogySummary:http://data.library.sh.cn/jp/resource/work/ix7myn2oqrh7jmzv
刘氏手抄族谱（台湾省/彰化县）,等;刘作明,刘,1983,--,始迁祖光义，谥刚毅，移居台湾，后裔散居彰化县永靖乡及花莲县新城乡等地。,https://jiapu.library.sh.cn/https://jiapu.library.sh.cn/#/GenealogySummary:http://data.library.sh.cn/jp/resource/work/qh1irpukfxw3uqgi
刘氏手抄家谱表（台湾省/彰化县）,不详,刘,1983,--,始祖禹锡。支祖世知。族人散居彰化县花坛乡中口村等地。,https://jiapu.library.sh.cn/https://jiapu.library.sh.cn/#/GenealogySummary:http://data.library.sh.cn/jp/resource/work/fbglwdak7wgbwg7q
刘氏房谱（台湾省/云林县）,不详,刘,1968,--,始迁祖宏度，清季移居台湾，族人散居云林县大埤乡吉田村等地。,https://jiapu.library.sh.cn/https://jiapu.library.sh.cn/#/GenealogySummary:http://data.library.sh.cn/jp/resource/work/mqcyu9ata6ljkty7
刘氏房谱（台湾省/嘉义市）,不详,刘,1953,--,始祖谷祥，谥祯善，元末人。始迁祖达和，清季移居台湾，后裔散居嘉义县竹崎乡等地。,https://jiapu.library.sh.cn/https://jiapu.library.sh.cn/#/GenealogySummary:http://data.library.sh.cn/jp/resource/work/5b1oqbz4cm7ba6z2
刘氏房谱渡台祖宏度公二房世系（台湾省/云林县）,刘满沟,刘,不详,--,始祖开七。支祖千十郎居福建宁化石壁乡。始迁祖文科，谥敦厚，清季移居台湾，后裔散居南投县鱼池乡头社村等地。,https://jiapu.library.sh.cn/https://jiapu.library.sh.cn/#/GenealogySummary:http://data.library.sh.cn/jp/resource/work/hjsmy39fnwxjpwa8
刘氏房族族簿（台湾省/桃园市）,刘兴基,刘,不详,--,始祖千二，明代人。始迁祖现，字璞珍，谥刚明，清季移居台湾，后裔散居桃园县中坜市芝芭里等地。,https://jiapu.library.sh.cn/https://jiapu.library.sh.cn/#/GenealogySummary:http://data.library.sh.cn/jp/resource/work/3zect6s17tvd6qyc
刘氏应成堂家谱（重庆市/重庆市/渝北区）,刘成文,刘,2011,应成堂,始祖应昌，宋代人。其十三世孙珉一，明洪武四年奉母徐秀六西行上至重庆，于巴县城南柳市里梁厢塝落业，卜卦为生，纳王氏生玄明，是为始迁祖。 谱载序言、应成堂各字辈合影、追宗寻根、入川发祥史、居住地变迁、世系字派、应成堂、世系总表、房系表、族亲表、追思录文、墓地墓志、名贤录、古谱文献、附录。,https://jiapu.library.sh.cn/https://jiapu.library.sh.cn/#/GenealogySummary:http://data.library.sh.cn/jp/resource/work/239i329q8l5qwcms
刘氏德福堂族谱（重庆市/重庆市/九龙坡区）,刘家林,刘,2002,德福堂,"始祖祥，唐僖宗年间避乱从洛阳南下，至福建汀州府宁化县石壁洞定居。先祖广传，南宋末官至江西瑞金县令,生十四子,第三子巨汌由福建宁化老屋到广东嘉应州兴宁县齐昌，创业双溪坪，并世居于此。始迁祖登凤，清乾隆十年奉母吴氏由广东兴宁双溪迁四川重庆府巴县西里白市驿（今属九龙坡区）。 本谱以《刘氏大宗族谱》为基础，共分十二卷，卷一至卷三为文献，卷四至卷九为旧谱世系（上古先秦世系、西汉东汉中山世系、蜀汉至唐末世系、福建宁化世系、广东兴宁世系重庆巴县世系），卷十至卷十二为续谱世系。谱中有祖像及题词。保留艺文卷中收录的族规家训等篇。后三卷续谱为新增谱系，只收录了二十一世德福公之后代，按三房分三卷排列（长房鸿万裔世系、二房鸿裔世系、三房鸿元裔世系）。",https://jiapu.library.sh.cn/https://jiapu.library.sh.cn/#/GenealogySummary:http://data.library.sh.cn/jp/resource/work/uv9u8o4ramdkogi3
刘氏复修族谱六卷首一卷末一卷(湖南邵阳),刘希圣,刘,清道光28年(1848),藜照堂,始迁祖侍孙，原籍江西，元至正间官湖南靖州牧，致仕落籍邵阳。卷首新序、旧序、凡例、奠宅、簪绂、理学、圣谕、家法、家规、家范、四礼、五服图、祠堂图、班次、谱引、首事纪名、宗支论、宗支图，卷一至六世系，卷末坟宅图、列传、行实、赞、捐名、收谱字号、跋。,https://jiapu.library.sh.cn/https://jiapu.library.sh.cn/#/GenealogySummary:http://data.library.sh.cn/jp/resource/work/82cjjrdah3tyf20o
