谱名,责任者,姓氏,撰修时间,堂号,家谱简介,详情链接
钦贤张氏宗谱（江苏省/无锡市/江阴市）,张渭均;张锡彦;等,张,光绪元年（1875）,光裕堂,参见张子初修《[江苏江阴]钦贤张氏宗谱》（馆藏：JP213）。是族先世为山东登州人，后随宋室南渡。始迁祖英（字雄斋），仕宋累官至都督，南宋理宗朝迁居江苏江阴邑城内锁巷（宋代县志所载又名钦贤坊）。 卷首谱序、纪言、名目、凡例、旧序、祀言、旧例、旧跋等，卷一至十三世系，卷十四诰敕、坊祠，卷十五行状，卷十六传、题赞、哀诔，卷十七志铭，卷十八上书、书简，卷十九序、记、祭文，卷二十杂文、遗诗，卷二十一祀产，卷二十二遗像、墓图、祠图、后跋，卷末领谱字号。,https://jiapu.library.sh.cn/https://jiapu.library.sh.cn/#/GenealogySummary:http://data.library.sh.cn/jp/resource/work/2fdgy3kakv3vnkpb
钦贤张氏宗谱（江苏省/无锡市/江阴市）,张兴祥,张,2018,光裕堂,先世山东登州人，后随宋室南渡。始迁祖英（字雄斋），南宋理宗时占籍江阴，定居邑城内锁巷（宋代县志所载又名钦贤坊）。本谱记七世明代人僎（字孟礼，号守愚）支谱。 卷一钦贤张氏戊戌续修支谱序、新唐书张氏原系并跋、旧序旧跋、旧凡例、新凡例、续修委员会合影，卷二至六系图、世谱，卷七祠图、遗像、题赞、诰敕、传、行状，卷八墓图、墓志铭、哀诔、祭文，卷九序、记、杂文、遗诗，卷十题词、旧谱照片、族人现居地、跋、修谱注、纪年对照表、余庆录。,https://jiapu.library.sh.cn/https://jiapu.library.sh.cn/#/GenealogySummary:http://data.library.sh.cn/jp/resource/work/yrrx9x6542d8axbj
钦贤张氏宗谱（江苏省/无锡市/江阴市）,张子初,张,1949,光裕堂,先世山东登州人，后随宋室南渡。始迁祖英（字雄斋），南宋理宗时占籍江阴，定居邑城内锁巷（宋代县志所载又名钦贤坊）。 卷首载谱序等，卷一至十六系图、世谱，余卷载祀产、墓图、像赞、诰敕、传状、志铭、奏疏、杂文、遗诗。内收钱谦益、李兆洛、顾炎武、沈德潜等人文。,https://jiapu.library.sh.cn/https://jiapu.library.sh.cn/#/GenealogySummary:http://data.library.sh.cn/jp/resource/work/txv56utv227ixjgb
钦贤张氏宗谱（江苏省/无锡市/江阴市）,等;张多淦;张𨱈;张之纯;张渭均,张,民国3年（1914）,--,参见张子初修《[江苏江阴]钦贤张氏宗谱》（馆藏：JP213）。是族先世为山东登州人，后随宋室南渡。始迁祖英（字雄斋），仕宋累官至都督，南宋理宗朝迁居江苏江阴邑城内锁巷（宋代县志所载又名钦贤坊）。 卷首谱序、执事名目、新凡例、领谱字号、历修名目、旧序、纪言、旧例、旧跋，卷一至十三世系，卷十四祀产、祠图、墓图，卷十五遗像、题赞、诰敕、坊祠，卷十六传、行状，卷十七志铭，卷十八奏疏、上书、书简，卷十九序、记、哀诔、祭文，卷二十杂文、遗诗。,https://jiapu.library.sh.cn/https://jiapu.library.sh.cn/#/GenealogySummary:http://data.library.sh.cn/jp/resource/work/bf8ip9xbk3a299wb
钦贤张氏宗谱（江苏省/无锡市/江阴市）,张子堃;张子初,张,2009,光裕堂,先世山东登州人，后随宋室南渡。始迁祖英（字雄斋），南宋理宗时占籍江阴，定居邑城内锁巷（宋代县志所载又名钦贤坊）。 卷首序、总目、执事名字录、领谱字号、历届修刻年分世次名字录、纪言、旧例、旧跋、编辑后跋，卷一至十六世系图、世表，卷十七祀产、祠图，卷十八墓图，卷十九遗像、题赞、诰敕、祠坊，卷二十传，卷二十一行状，卷二十二志铭，卷二十三奏疏、上书、书简，卷二十四序、记、哀诔、祭文，卷末杂文、遗诗。,https://jiapu.library.sh.cn/https://jiapu.library.sh.cn/#/GenealogySummary:http://data.library.sh.cn/jp/resource/work/t7zu4qxg4hud4enq
钦贤张氏宗谱四卷（浙江省绍兴市嵊州市）,张发琴,张,1928年,--,始祖昭（韶），字良臣，行五四，唐代人。始遷祖儒二，元末明初自嵊縣范村（今三界鎮范洋村）遷居本邑溪濱村（今崇仁鎮溪邊村）。卷一譜序，卷二遺像，卷三世系圖，卷四行傳。,https://jiapu.library.sh.cn/https://jiapu.library.sh.cn/#/GenealogySummary:http://data.library.sh.cn/jp/resource/work/97w37z99bajs22cn
钦贤张氏宗谱伟公支（江苏省/无锡市/江阴市）,张宗良等,张,2013,光裕堂,先世山东登州人，后随宋室南渡。始祖英（字雄斋），南宋理宗时占籍江阴，定居邑城内锁巷（宋代县志所载又名钦贤坊）。七世孙伟（字孟奇，号守端）。十一世孙义生（名庵，字至正）、毅生（字至刚），因避明季战乱迁居东乡章卿三保和阳舍南门，是为始迁祖。 卷一序、旧序、凡例、张氏祖庭谒祖合影、祭祖仪式、续谱编委会、张义巷、功德榜、人物志，卷二至十二世系图、世系表，卷十三像赞、传记、行状，卷十四诰敕、祠堂宗约、祭文、墓志铭、碑记、墓图、家教铭言，卷十五遗诗杂文、学历录、领谱名录、中华张氏源流考、跋、告成记、余庆录。,https://jiapu.library.sh.cn/https://jiapu.library.sh.cn/#/GenealogySummary:http://data.library.sh.cn/jp/resource/work/gn3fiqst78nb3jrb
钦贤张氏宗谱二十一卷首一卷（江苏省无锡市江阴市）,张炼,张,1914年,光裕堂,江陰始遷祖英，字雄齋，宋代人。,https://jiapu.library.sh.cn/https://jiapu.library.sh.cn/#/GenealogySummary:http://data.library.sh.cn/jp/resource/work/wb733nn2xjc9pmut
钦赐瑚旺济雅尔氏谱系不分卷（辽宁省沈阳市）,不详,瑚旺济雅尔,清,--,始祖松珠克。因系合族欽賜瑚旺濟雅爾氏。據“滿福”事蹟，爲清乾隆時人。 三页中有二页爲滿文。右端題清康熙十三年奉旨歸入鑲藍旗滿州公中佐領下管轄。,https://jiapu.library.sh.cn/https://jiapu.library.sh.cn/#/GenealogySummary:http://data.library.sh.cn/jp/resource/work/e41ayl9z114qf9h9
钦祖祠族谱：东墩乡张氏善钦公裔孙（广东省/汕头市）,<钦祖祠族谱>理事会,张,2006,善庆堂,本谱如实记述了钦祖祠族人的繁衍、创业、发展的光辉历史。东墩乡始祖漳源公，谱载善钦公裔孙四大房分世系。 本谱分[一章]前言；[二]图像；[三]张氏家族（清河世家）简介；[四]张氏家族（曲江世家）简介；[五]张氏家族（鄞江始祖）简介；[六]张氏家族（孝思堂）简介；[七]张氏家族（东墩乡）；[八]张氏家族（钦祖祠）；[九]张氏家族（善钦公）裔孙四大房份世系；[十]中国历代帝号明细介绍；[十一]后语,https://jiapu.library.sh.cn/https://jiapu.library.sh.cn/#/GenealogySummary:http://data.library.sh.cn/jp/resource/work/l3tiee11idieskve
钦氏族谱（江苏省/徐州市）,钦祥昆,钦,2001,三盛堂,谱奉《三国志·魏志》所载乌桓酋长钦志贲为一世始祖，由古碑可知明代万历以前邳州地区已有钦氏，其余已不可考。谱所载各支世系，皆起于第七十七世继字辈。 谱载钦氏发展渊源辑考、族规、人物传略、世系表。世系表有睢宁钦庄、马庄、彭庄等支，亦收有邳州市之新桥乡、赵墩乡二支及铜山县张集乡一支。,https://jiapu.library.sh.cn/https://jiapu.library.sh.cn/#/GenealogySummary:http://data.library.sh.cn/jp/resource/work/nb2ww9u9j4llh8ht
钦氏家乘十卷（浙江省湖州市长兴县）,钦振,钦,1935年,经义堂,始祖同上。始迁祖德載，字均厚，號壽巖，北宋靖康间自京師汴京（今河南開封市）迁居浙江長興縣邑城（今雉城鎮）。卷首譜序，卷一祠记、規訓，卷二列傳，卷三家乘世系源，卷四舊譜源流，卷五至十世系譜。书名據版心题。四修本。,https://jiapu.library.sh.cn/https://jiapu.library.sh.cn/#/GenealogySummary:http://data.library.sh.cn/jp/resource/work/ryw8rdvnmk6vwzrs
钦氏宗谱十卷,钦作舟,钦,清光緒十三年（1887）,敦睦堂,始迁祖高一，原名宜也吉都，宋代人。书名據版心题。,https://jiapu.library.sh.cn/https://jiapu.library.sh.cn/#/GenealogySummary:http://data.library.sh.cn/jp/resource/work/x7kzu8rpp4ln25f2
钦氏世系考一卷（江苏省苏州市）,钦其宝,钦,清宣統元年（1909）,--,始祖高一，原名宜也吉多，西南夷人，宋高宗時南迁，賜名高一。第七世满，字萬一，始占籍呈縣，为始迁祖。存卷为行傳。书名據版心、书衣、书名页、卷端题。,https://jiapu.library.sh.cn/https://jiapu.library.sh.cn/#/GenealogySummary:http://data.library.sh.cn/jp/resource/work/hm9h1rdx8n456dxm
钦州水东郭氏族谱（广西壮族自治区/钦州市）,郭钦华;郭其廷,郭,2017,汾阳堂,始迁祖有声，原籍福建福州市朱粉巷，明末经广东迁居广西钦州水东朝京坊。五世孙派分二房，其中：珖、玺、璜、璠为二房支祖；琏、瑡、瑄为三房支祖。 谱载照片、村庄图、墓图、历代谱序篇、寻根溯源篇、承先启后篇、历代世系篇、古今郭氏名人篇、文化拾遗篇。,https://jiapu.library.sh.cn/https://jiapu.library.sh.cn/#/GenealogySummary:http://data.library.sh.cn/jp/resource/work/jd6r5s2fs9udmr5i
钦州市莫氏族谱（广西壮族自治区/钦州市）,莫夺;莫居汉;莫其欢,莫,2013,--,钦州市莫氏宗支众多，多从合浦县、吴川县（湛江市）、横县（今横州市）、南宁市迁入。莫先保公，于明万历年间（1608）从横县迁浦北县寨圩镇柘木村委会古塘村。莫树秀公，清乾隆二十六年（1761）从邕宁县（今南宁市邕宁区）大塘镇那梨村迁居贵台镇（今属钦州市钦北区）屯良村委会平天村。莫定成（莫愚）公于明万历年间（约1583）从合浦县西场镇葛麻山迁犀牛角镇（今属钦州市钦南区）平山莫冲垌簕岭，后定居平山东头村。 第二集载钦州市浦北县莫氏族谱，钦州市钦北区莫氏族谱，莫氏名人录，钦州市莫氏精英录；第三集载钦南区莫氏族谱，三娘湾管区、钦州港区莫氏族谱，浦北县莫氏族谱（新增）。,https://jiapu.library.sh.cn/https://jiapu.library.sh.cn/#/GenealogySummary:http://data.library.sh.cn/jp/resource/work/mzkt9ka6gwkx8sy7
钦州公鹅田李氏宗谱（广西壮族自治区/钦州市/钦北区）,李文俊,李,2022,--,始祖子华，清初从广西省玉林市博白县迁到广西省钦州市。其子成锦，从广西壮族自治区钦州牛头湾复龙迁到钦州市钦北区公鹅田村，是为始迁祖。 谱载序、族徽、族旗、家训、神龛、世系图表、世系概况、族谱存件、地图、先进人物录、寿星榜、习俗、历史年代简表、干支对照表、芳名榜、编后。,https://jiapu.library.sh.cn/https://jiapu.library.sh.cn/#/GenealogySummary:http://data.library.sh.cn/jp/resource/work/aut1kabvh7wze552
钦天监杨氏回族族谱（山东省/济南市/济阳区）,杨松岳,杨,2019,--,始迁祖光先（字长公），原世居安徽歙县，清康熙朝任钦天监监正，因用人失当，被革职返乡，途中因病于济阳孙家村（今隶属于山东省济南市济阳区仁风镇孙家村）去世，后安葬于此，子孙遂居焉。 谱载目录、谱序、谱牒四十字、碑记、后记、考证说明、墓志铭、字辈集、宗亲联谊会纪实、全国宗亲通讯录、世系图。,https://jiapu.library.sh.cn/https://jiapu.library.sh.cn/#/GenealogySummary:http://data.library.sh.cn/jp/resource/work/xup1lglirxhprwbm
钦亷陈氏名人谱（广西壮族自治区）,陈同泽,陈,2021,--,本谱收录了广西钦州、防城港、北海三市从汉代至今的名人传记。并简要记述了三地三十八支陈氏的迁徙源流：其中如高文（今陈屋）村支系始迁祖瑞、清康熙十五年自广西玉林沙河独石角囤谷村迁居广西北海合浦大亷垌高文村；石康镇支系始迁祖冠带，明景泰四年自广东平远县迁居广西北海合浦县石康万善寺。 谱载序、钦亷陈氏名人、钦亷陈氏名人表、钦亷陈氏始祖、钦亷陈氏百岁寿星、附件。,https://jiapu.library.sh.cn/https://jiapu.library.sh.cn/#/GenealogySummary:http://data.library.sh.cn/jp/resource/work/hmuk78nnkcstfkag
欧阳里诸氏宗谱十六卷（江苏省常州市）,诸暄宝;诸南瞻;诸仲宾,诸,清光緒二十六年（1900）,敦睦堂,始祖南瞻，宋代自汴迁浙江紹兴。元代裔孫又移居江蘇崑山。始迁祖釧，字仲賓，明中葉再徙常州郡东之欧阳里，裔孫散居武進、無錫、丹阳、江陰等县。卷一、二谱序、宗訓、宗約、诰命、传记、墓誌、行略、寿序，卷三世系，卷四至十六世表。书名据版心、书名页题。谱初修於清嘉慶六年，此为六修本。,https://jiapu.library.sh.cn/https://jiapu.library.sh.cn/#/GenealogySummary:http://data.library.sh.cn/jp/resource/work/i3c5v49k7v6qzk8x
欧阳里诸氏宗谱二十八卷（江苏省常州市）,诸福昌,诸,1929年,敦睦堂,始祖南瞻，宋代自汴迁浙江紹兴。元代裔孫又移居江蘇崑山。始迁祖釧，字仲賓，明中葉再徙常州郡东之欧阳里，裔孫散居武進、無錫、丹阳、江陰等县。书名据卷端题。,https://jiapu.library.sh.cn/https://jiapu.library.sh.cn/#/GenealogySummary:http://data.library.sh.cn/jp/resource/work/wu5sjmywf11i6xw7
欧阳贵公支谱八卷首一卷末一卷（湖南省长沙市宁乡县）,欧阳南村;等,欧阳,清嘉慶五年（1800）,渤海堂,始祖万，唐代人。始迁祖贵。存卷首、卷一。书名据书名页题。潙宁老虎山祠梓。,https://jiapu.library.sh.cn/https://jiapu.library.sh.cn/#/GenealogySummary:http://data.library.sh.cn/jp/resource/work/vjlnxlii7rgktjt1
欧阳续修族谱（湖南省娄底市新化县）,欧阳佑甫,欧阳,清光緒二十八年（1902）,六一堂,始祖勛，宋代宦游梅城（新化），遂由江西吉水徙來湖南新化。传三世至万七徙團山，万八徙木山，万九（字升秀）往梅山，分为三大房。存卷首。书名据版心题。,https://jiapu.library.sh.cn/https://jiapu.library.sh.cn/#/GenealogySummary:http://data.library.sh.cn/jp/resource/work/8ajalodfouvbz9tz
欧阳氏通谱十卷首一卷（广东省）,欧阳耀时,欧阳,清嘉慶二十一年（1816）,--,清嘉慶二十一年（1816）補清乾隆八年（1743）刻本。存卷首、卷一至八。书名据版心题。,https://jiapu.library.sh.cn/https://jiapu.library.sh.cn/#/GenealogySummary:http://data.library.sh.cn/jp/resource/work/hhws7udnb6hh9zfe
欧阳氏通谱六卷（湖南省郴州市安仁县）,欧阳伯珍,欧阳,1934年,--,--,https://jiapu.library.sh.cn/https://jiapu.library.sh.cn/#/GenealogySummary:http://data.library.sh.cn/jp/resource/work/5z2aaxqjwtbnd7la
欧阳氏续修族谱十卷（湖南省）,欧阳耘圃;等,欧阳,清同治元年（1862）,六一堂,始祖万，一作安福府君，唐代人。始迁祖華立、嶽立、泰立、衡立，明代人。存卷一。书名据版心题。,https://jiapu.library.sh.cn/https://jiapu.library.sh.cn/#/GenealogySummary:http://data.library.sh.cn/jp/resource/work/p4d91s5o1a5mytgv
欧阳氏续修族谱十卷（湖南省湘潭市湘乡市）,欧阳耘圃;等,欧阳,清同治元年（1862）,六一堂,始祖万，唐代人。始迁祖華立、嶽立、泰立、衡立，明代人。存卷一。书名据版心题。,https://jiapu.library.sh.cn/https://jiapu.library.sh.cn/#/GenealogySummary:http://data.library.sh.cn/jp/resource/work/mdaa5bcohmm6jlla
欧阳氏族谱（湖南省衡阳市衡山县）,欧阳鳯翥,欧阳,清同治九年（1870）,文忠堂,始迁祖如麟，字吐玉，宋代人。存卷首、卷十四、十五、十八。书名据版心题。,https://jiapu.library.sh.cn/https://jiapu.library.sh.cn/#/GenealogySummary:http://data.library.sh.cn/jp/resource/work/t2xi621ypwfx1fbz
欧阳氏族谱四卷（湖南省永州市江永县）,不详,欧阳,明嘉靖十九年（1540）,--,--,https://jiapu.library.sh.cn/https://jiapu.library.sh.cn/#/GenealogySummary:http://data.library.sh.cn/jp/resource/work/jhm1kngyscnv1af2
欧阳氏族谱五卷首二卷（湖南省）,欧阳文昊,欧阳,清光緒20年(1895),渤海堂,始祖万，唐代人。始迁祖芳，字德仁，明洪武二十二年封指揮將軍，由江西吉安迁江蘇南京，再迁湖南零陵下屯崇文乡上里，地名嶺口塘头灣。卷首源流序、纂修序、谱序、派等，卷一至五为各派世系。存卷首、卷一、三至五。书名据版心题。,https://jiapu.library.sh.cn/https://jiapu.library.sh.cn/#/GenealogySummary:http://data.library.sh.cn/jp/resource/work/y5bjj85v6vxaj4k3
欧阳氏族谱九卷,等;欧阳金丹,欧阳,清同治十一年（1872）,渤海堂,始祖琮，世居江西吉州。始迁祖正華，明代迁萍乡；上華、正祥、正財、京承迁瀏阳；任慶迁武宁；上利迁万载。卷一序、诰敕、服制图、祠堂图、屋图、像图、墳图、修谱人名、總歌等，卷二家規、凡例、序、像赞、忠節紀、理学记、祠堂记等，卷三至九世系。存卷一至二、四至九。书名据书名页题。,https://jiapu.library.sh.cn/https://jiapu.library.sh.cn/#/GenealogySummary:http://data.library.sh.cn/jp/resource/work/jw4612xz4y2bctwg
欧阳氏族谱三卷（湖南省）,何惟贤,欧阳,清光緒十八年（1892）,--,--,https://jiapu.library.sh.cn/https://jiapu.library.sh.cn/#/GenealogySummary:http://data.library.sh.cn/jp/resource/work/wkoubqcicweq3pza
欧阳氏族谱,不详,欧阳,清,--,存卷为世录。存卷三。书名据版心题。记事至清光緒间。,https://jiapu.library.sh.cn/https://jiapu.library.sh.cn/#/GenealogySummary:http://data.library.sh.cn/jp/resource/work/zljvt59zvzghtsce
欧阳氏少峰公五修支谱十卷首一卷末一卷（湖南省株洲市醴陵市）,欧阳名暹;等,欧阳,清光緒三十三年（1907）,伦叙堂,始迁祖紹中，明建文间由江西豫章迁居醴南十八都梘上。存卷首、卷一、三至十、卷末。书名据版心题。,https://jiapu.library.sh.cn/https://jiapu.library.sh.cn/#/GenealogySummary:http://data.library.sh.cn/jp/resource/work/mqoteiawh6w6d9jz
欧阳氏宗谱（浙江省金华市兰溪市）,不详,欧阳,1947年,--,--,https://jiapu.library.sh.cn/https://jiapu.library.sh.cn/#/GenealogySummary:http://data.library.sh.cn/jp/resource/work/lkty3bug2exyezye
欧阳氏宗谱十七卷（江西省九江市彭泽县）,欧阳钟坚,欧阳,1948年,--,始祖奕，字文焕，宋天禧间任江州守，诸僚佐保奏赴闕，忽疾作不豫，遂於轄下本州彭澤县境置庄七所。第二子宙居城西庄，十五传而生六子： 貴一徙湖口，久不往來；貴二裔孫上、下兩腦；貴三、貴五迁居十二都；貴六分徙蛾眉洲，式微已極，僅有裔孫一，猶流裔靡定；惟貴四生子有三：仁七、仁九、仁十。卷一谱序、墓碑志、迁徙、凡例、詩、歌引、名目、議約合同、世系等，卷一至十七世系。书名据版心题。,https://jiapu.library.sh.cn/https://jiapu.library.sh.cn/#/GenealogySummary:http://data.library.sh.cn/jp/resource/work/v2ocwxnonik8hcvm
欧阳氏宗谱二十一卷（安徽省安庆市太湖县）,欧阳名忠;欧阳绍楠,欧阳,民國二十三年(1934),--,始迁祖皓，字光舦，原籍江西彭澤塘鄷庄，南宋因官籍太湖。卷首（卷一）上山图、碑记、谱序、凡例、本源图说、訂世代歌等。卷首（卷一）下谱序、歷代迁派、名目、歷代世系等，卷二至二十一世系。书名据书衣、版心题。,https://jiapu.library.sh.cn/https://jiapu.library.sh.cn/#/GenealogySummary:http://data.library.sh.cn/jp/resource/work/4mwoeowrslo3hyq9
欧阳氏宗谱不分卷（湖南省郴州市桂阳县）,欧阳中桂;等,欧阳,清咸豐十一年（1861）,光六堂,始迁祖存瓚，字琢玉，明代人。书名据版心、书签题。,https://jiapu.library.sh.cn/https://jiapu.library.sh.cn/#/GenealogySummary:http://data.library.sh.cn/jp/resource/work/43uokkyvqkoubkgm
欧阳氏四修族谱（湖南省长沙市宁乡县）,欧阳先池,欧阳,清,渤海堂,始祖万，唐代人。始迁祖可大，字霖源，号魯齊，南宋时赴長沙從軍，遂徙居宁乡。存卷为四礼輯略、服制图、祠堂图说等。存卷四。书名据书衣题。记事至清光緒间。,https://jiapu.library.sh.cn/https://jiapu.library.sh.cn/#/GenealogySummary:http://data.library.sh.cn/jp/resource/work/nxa4uohc33wbbt5i
欧阳氏八修谱九卷首一卷（江西省九江市都昌县）,合族,欧阳,1948年,--,始迁祖宥，宋代人。存首卷，卷九。书名据版心题。,https://jiapu.library.sh.cn/https://jiapu.library.sh.cn/#/GenealogySummary:http://data.library.sh.cn/jp/resource/work/mi78sj4lxi5ynmj8
欧阳氏上院支谱不分卷（江西省吉安市安福县）,欧阳干,欧阳,清同治二年（1863）,--,始祖万，唐僖宗时任吉州刺史，因家焉。书名据版心题。,https://jiapu.library.sh.cn/https://jiapu.library.sh.cn/#/GenealogySummary:http://data.library.sh.cn/jp/resource/work/auxvc3c622vwtfv8
欧阳族谱（湖南省益阳市安化县）,欧阳廷霭;等,欧阳,清順治七年（1650）,--,始祖万，字彌高，唐代人。始迁祖聖祥、聖斌、聖隨，明代人。存卷上、卷一。书名据版心题。,https://jiapu.library.sh.cn/https://jiapu.library.sh.cn/#/GenealogySummary:http://data.library.sh.cn/jp/resource/work/5jkwdbvgwsgjrdrq
欧阳族谱（湖南省岳阳市）,欧阳泽绥,欧阳,民國32年(1943),庐陵堂,始祖迁武，明洪武时自江西南昌鐵樹觀筲箕坡徙居巴陵。始迁祖受七，明代人。卷首谱序、家訓、始迁祖履歷源流等，餘卷为世系。存卷首，卷三、十一至十五、十七。书名据版心题。,https://jiapu.library.sh.cn/https://jiapu.library.sh.cn/#/GenealogySummary:http://data.library.sh.cn/jp/resource/work/sq2anfu5dglkltlu
欧阳族谱（湖南省岳阳市）,欧阳祥意,欧阳,民國13年(1924),庐陵堂,始祖迁武，明洪武时自江西南昌鐵樹觀筲箕坡徙居巴陵。始迁祖受七，明代人。卷首像赞、履歷源流等，卷十至十五世系。存卷首，卷十至十二、十五。书名据版心题。,https://jiapu.library.sh.cn/https://jiapu.library.sh.cn/#/GenealogySummary:http://data.library.sh.cn/jp/resource/work/nvcxt94z7y3ga4e4
欧阳族谱八卷首二卷（湖南省长沙市宁乡县）,欧阳彩山;等,欧阳,清咸豐四年（1854）,渤海堂,始祖万，唐代人。始迁祖家銘，明代人。存上部卷首。书名据版心题。,https://jiapu.library.sh.cn/https://jiapu.library.sh.cn/#/GenealogySummary:http://data.library.sh.cn/jp/resource/work/xze64s5frs798js2
欧阳族谱,不详,欧阳,清,渤海堂,始祖德新，南宋人。存卷为瀏南周家庄昌齡公支下文亨公世系、九有公世系、萍乡石灌泉新屋下正華公支下世系、正祥公支下世系、正財公支下世系、万公房世系等。存卷四至五、七。书名据版心题。记事至清同治间。,https://jiapu.library.sh.cn/https://jiapu.library.sh.cn/#/GenealogySummary:http://data.library.sh.cn/jp/resource/work/4dh6wqmv4fcs12o1
欧阳宗谱不分卷（湖北省宜昌市枝江市）,姚星吾,欧阳,1924年,六一堂,始迁祖普誠，明成化间由江西迁湖北。书名据书衣题。,https://jiapu.library.sh.cn/https://jiapu.library.sh.cn/#/GenealogySummary:http://data.library.sh.cn/jp/resource/work/kzqcsn6c7iltz1h5
欧阳宗谱三卷（湖南省郴州市安仁县）,欧阳良昱,欧阳,清道光二十年（1840）,--,--,https://jiapu.library.sh.cn/https://jiapu.library.sh.cn/#/GenealogySummary:http://data.library.sh.cn/jp/resource/work/48hjfwktm1fiyr85
欧阳墨谱不分卷,欧阳厚晓,欧阳,民國26年(1937),庐陵堂,谱存世系。书名据版心题。,https://jiapu.library.sh.cn/https://jiapu.library.sh.cn/#/GenealogySummary:http://data.library.sh.cn/jp/resource/work/6x1tdm5y4v9t4l8g
欧阳四修族谱十四卷（湖南省长沙市浏阳市）,欧阳宏权;等,欧阳,1936年,六一堂,始祖万，一名安福公，唐代人。始迁祖安时，行八。宋宁宗时漕試湖南從江西迁瀏阳馬渡。传至明代勛，字大猷，生子五： 長曰聖文，迁邑西之瀠波港；次曰富文，偕叔重迁邑北之洞阳段。存卷一。书名据书衣题。,https://jiapu.library.sh.cn/https://jiapu.library.sh.cn/#/GenealogySummary:http://data.library.sh.cn/jp/resource/work/tdcbnr228dvhtyns
欧阳四修族谱十七卷首三十卷（湖南省常德市）,欧阳元臣;等,欧阳,1943年,六一堂,始迁祖立德，明代人。存卷首三十卷、卷一至三、五至八、十至十三、十七。,https://jiapu.library.sh.cn/https://jiapu.library.sh.cn/#/GenealogySummary:http://data.library.sh.cn/jp/resource/work/mr1sl9ulug9lrb83
欧阳和璧祖蔴子房谱不分卷（广东省中山市）,欧阳民承,欧阳,1924年,--,始祖鍵，又名榮可公，行二，宋嘉定间任南雄知府。始迁祖和璧，宋末人。书名据鈐印题。,https://jiapu.library.sh.cn/https://jiapu.library.sh.cn/#/GenealogySummary:http://data.library.sh.cn/jp/resource/work/lbtz1z23tqmyms2u
欧阳和璧祖蔴子房谱不分卷（广东省中山市）,欧阳衮臣,欧阳,清咸豐九年（1859）,--,始祖鍵，又名榮可公，行二，宋嘉定间任南雄知府。始迁祖和璧，宋末人。书名据钤印题。二修本。,https://jiapu.library.sh.cn/https://jiapu.library.sh.cn/#/GenealogySummary:http://data.library.sh.cn/jp/resource/work/v2179zf1fcoqrzks
