谱名,责任者,姓氏,撰修时间,堂号,家谱简介,详情链接
正黄旗三保管领下头等庄头蔡德俊家谱（辽宁省）,不详,蔡,清末,--,始遷祖文學、蔡二。書名據卷端題。,https://jiapu.library.sh.cn/https://jiapu.library.sh.cn/#/GenealogySummary:http://data.library.sh.cn/jp/resource/work/jma2zi2r1xcwqikw
正黄旗三保管领下头等庄头蔡德俊家谱（辽宁省）,不详,蔡,清光緒二十九年（1903）,--,始遷祖文學、蔡二。書名據卷端題。,https://jiapu.library.sh.cn/https://jiapu.library.sh.cn/#/GenealogySummary:http://data.library.sh.cn/jp/resource/work/w8p92rj9rpj5zcl4
正黄旗三保管领下四等庄头周岐山家谱（辽宁省）,不详,周,清光緒三十二年（1906）,--,始遷祖富安，清代人。 書名據卷端題。,https://jiapu.library.sh.cn/https://jiapu.library.sh.cn/#/GenealogySummary:http://data.library.sh.cn/jp/resource/work/hw9qemxejvuh54g4
正黄旗三保管领下四等庄头周岐山家谱（辽宁省）,不详,周,清末,--,始遷祖富安，清代人。 書名據卷端題。,https://jiapu.library.sh.cn/https://jiapu.library.sh.cn/#/GenealogySummary:http://data.library.sh.cn/jp/resource/work/ul3xfalrenak75vj
正黄旗三保管领下四等庄头周岐山家谱（辽宁省）,不详,周,清光緒二十九年（1903）,--,始遷祖富安，清代人。 書名據卷端題。,https://jiapu.library.sh.cn/https://jiapu.library.sh.cn/#/GenealogySummary:http://data.library.sh.cn/jp/resource/work/w1s8z2u2if7k5r7x
正阳陈家楼陈氏宗谱四卷（河南省驻马店市正阳县）,陈守谦;陈世猷,陈,1938年,--,始祖自立，明代人。始遷祖進義，明天啟間因貿易自山西洪洞縣移居河南正陽縣。卷一序、凡例、家規、像贊、傳頌、行狀、壽序、碑文、書後，卷二排行字、世系圖、世系表、領譜編號、譜跋，卷三選録格言小引，卷四遺規、家訓。世系載至第十四世“州”字輩。書名據書簽題。譜初修於清雍正五年，此为四修本。,https://jiapu.library.sh.cn/https://jiapu.library.sh.cn/#/GenealogySummary:http://data.library.sh.cn/jp/resource/work/bxvx296a81c2ig9q
正阳.江国.江姓（全国）,王淑和,江,2010,--,始祖元仲（名恩成，字元仲）为伯益之三子，江姓得姓始祖，官至夏朝大理、主观刑事，受封于江邑，并建立了江国，都城位于今河南驻马店市正阳县。江国被楚国所灭，其后子孙以国名为氏，称江姓。 谱载序文、凡例、姓氏研究报告、古今名人、名胜古迹、民间习俗、历史沿革表、姓氏渊源、名人传略、名人录、族规家训、世系图、文化研究、文化交流、资源开发、大事记、后记。,https://jiapu.library.sh.cn/https://jiapu.library.sh.cn/#/GenealogySummary:http://data.library.sh.cn/jp/resource/work/zeumk1wknl2i93rs
正蓝旗满洲博尔济吉特氏支谱不分卷(内蒙古),葆亨,--,清同治10年(1871),教经堂,始祖瑙諾木，清封兀魯特貝勒。後人有居旅大等地。譜載譜序、世系。,https://jiapu.library.sh.cn/https://jiapu.library.sh.cn/#/GenealogySummary:http://data.library.sh.cn/jp/resource/work/87y63mpowicwk333
正蓝旗满洲博尔济吉特氏支谱不分卷（内蒙古自治区）,葆亨,博尔济吉特,清同治十年（1871）,教经堂,始祖瑙諾木，清封兀魯特貝勒。譜載譜序、世系。 书名據版心题。,https://jiapu.library.sh.cn/https://jiapu.library.sh.cn/#/GenealogySummary:http://data.library.sh.cn/jp/resource/work/ce7mbq9jz9vcvoml
正蓝旗博尔济吉特氏支谱不分卷（内蒙古自治区）,子强,博尔济吉特,據1953年,--,始祖瑙諾木，清封兀魯特貝勒。 譜載譜序、世系、慕園记。 书名據书名页题。,https://jiapu.library.sh.cn/https://jiapu.library.sh.cn/#/GenealogySummary:http://data.library.sh.cn/jp/resource/work/owhs39ne9f2g2dxp
正兴马家谱（甘肃省/天水市/秦州区）,马靖宇;马诚,马,2016,--,始迁祖名讳无考，明初自山西洪洞县大槐树下迁居古秦州城（今甘肃省天水市秦州区）西六十里铺马家庄村南山后苦驼眼玉泉里正四甲落户。本谱为天水秦州区回族“正兴马”一世祖（清）马锡之后裔谱系。 谱载前言、思祖寻根苦驼眼、人物介绍、老宅院房屋面积及宅院分布图、家族合影照片、世系图、祖坟照片等。,https://jiapu.library.sh.cn/https://jiapu.library.sh.cn/#/GenealogySummary:http://data.library.sh.cn/jp/resource/work/kf37xraulpapedm7
正繁体版(吴兴)湖州荻(溪)港章氏五修部分家乘（浙江省/湖州市）,--,章,2004,--,此是馆藏XP2938之繁体字本。始迁祖明代后期自会稽（今绍兴市）迁来荻港，至四世祖名字皆已不可考。谱从五世祖良荣记起，一至四世为一线单传。谱录照片、前言、世系图、世系传，学者章开沅《荻溪章氏》文，及《湖州晚报》关于瑞典亲王继子罗伯特·章来荻港寻根的报导等。,https://jiapu.library.sh.cn/https://jiapu.library.sh.cn/#/GenealogySummary:http://data.library.sh.cn/jp/resource/work/ah2klv3rw7uuy84p
正绥晏氏宗谱（贵州省/遵义市/正安县）,晏永超;晏永仲,晏,2016,--,始迁祖武，明崇祯末年随其母从江西省临江府兴意县铜锣井流连到贵州正安县中观镇晏溪，后迁移到流渡堡上定居。 谱载序、前言、谱序、凡例、修谱文件、伟人论谱、姓氏考辨、家庙祠堂、世系名录、启迪族属、传家有道、德泽子孙、后记。,https://jiapu.library.sh.cn/https://jiapu.library.sh.cn/#/GenealogySummary:http://data.library.sh.cn/jp/resource/work/udafhun81s35bkha
正素公黎氏族谱（广东省/肇庆市/封开县）,黎卓洲,黎,1996,--,始祖侍举公，原籍江西赣州府于都县水头里，后迁居广东新会都会里，由都会里而黎村。至八世祖正素公，由新会迁居封川县（今肇庆封开）渔涝镇古榄村。由封川而郁南县连滩镇全安村的黎经是正素第七世孙妣莫氏太婆，繁衍我族。 谱载古榄村宗谱、系统宗支表、仕杰公英俊房宗支、仕杰公英奇房宗支、仕杰房英秀房宗支、仕杰公英瑞房宗支等。,https://jiapu.library.sh.cn/https://jiapu.library.sh.cn/#/GenealogySummary:http://data.library.sh.cn/jp/resource/work/6y5cd6ijdrr73oxf
正红旗满洲哈达瓜尔佳氏家谱不分卷（辽宁省）,恩龄,瓜尔佳,清道光二十九年（1849）,--,始遷祖尼雅濟布，清代人。書名據書簽題,https://jiapu.library.sh.cn/https://jiapu.library.sh.cn/#/GenealogySummary:http://data.library.sh.cn/jp/resource/work/af9yoqyq5ijbnzrz
正白旗那龄阿管领下干河子头等庄头祁恒福家谱（辽宁省）,不详,祁,清道光二十三年（1843）,--,始遷祖岱功，清代人。書名據卷端題。,https://jiapu.library.sh.cn/https://jiapu.library.sh.cn/#/GenealogySummary:http://data.library.sh.cn/jp/resource/work/ilp4e2di7pqsucbv
正白旗义秀管领下四等庄头李海山家谱（辽宁省）,不详,李,清光緒二十九年（1903）,--,始遷祖彦得、彦會，清代人。書名據卷端題。,https://jiapu.library.sh.cn/https://jiapu.library.sh.cn/#/GenealogySummary:http://data.library.sh.cn/jp/resource/work/wylykc52ryk2ixz6
正白旗义秀管领下四等庄头李海山家谱（辽宁省）,不详,李,清光緒三十二年（1906）,--,始遷祖彦得、彦會，清代人。書名據卷端題。,https://jiapu.library.sh.cn/https://jiapu.library.sh.cn/#/GenealogySummary:http://data.library.sh.cn/jp/resource/work/34k5e1lay4d39y5v
正白旗义秀管领下四等庄头李海山家谱（辽宁省）,不详,李,清末,--,始遷祖彦得、彦會，清代人。書名據卷端題。,https://jiapu.library.sh.cn/https://jiapu.library.sh.cn/#/GenealogySummary:http://data.library.sh.cn/jp/resource/work/sezo2ysarmtr5dzb
正白旗福濬管领下头等庄头庄玉昌家谱（辽宁省）,不详,庄,清光绪三十二年（1906）,--,始迁祖登第、登賢、登科，皆清代人。书名据卷端题。,https://jiapu.library.sh.cn/https://jiapu.library.sh.cn/#/GenealogySummary:http://data.library.sh.cn/jp/resource/work/f8r9hep79fnsfgqt
正白旗福濬管领下头等庄头庄玉昌家谱（辽宁省）,不详,庄,清末,--,始迁祖登第、登賢、登科，皆清代人。书名据卷端题。,https://jiapu.library.sh.cn/https://jiapu.library.sh.cn/#/GenealogySummary:http://data.library.sh.cn/jp/resource/work/p9todx4c35e3qibo
正白旗福濬管领下头等庄头庄玉昌家谱（辽宁省）,不详,庄,清光绪二十九年（1903）,--,始迁祖登第、登賢、登科，皆清代人。书名据卷端题。,https://jiapu.library.sh.cn/https://jiapu.library.sh.cn/#/GenealogySummary:http://data.library.sh.cn/jp/resource/work/n9uqt1178gpoe2bx
正白旗满洲叶赫那拉氏宗谱（辽宁省）,崇秀,那拉,清同治九年（1870）,--,始祖星懇達爾漢，明代人。六世祖雅巴蘭下分入正白旗。是譜爲滿漢合璧本。書名據書簽、書名頁題。,https://jiapu.library.sh.cn/https://jiapu.library.sh.cn/#/GenealogySummary:http://data.library.sh.cn/jp/resource/work/zvrfacqkxv5hhm9r
正白旗清太管领下夹河心四等庄头王起发家谱（辽宁省/铁岭市/调兵山市）,王起发,王,2000,--,始迁祖国栋，清代人。,https://jiapu.library.sh.cn/https://jiapu.library.sh.cn/#/GenealogySummary:http://data.library.sh.cn/jp/resource/work/5n5ousil96bc7hbz
正白旗李氏族谱不分卷（北京市）,不详,李,清,--,始遷祖金葉，明代人。書名據譜序題。,https://jiapu.library.sh.cn/https://jiapu.library.sh.cn/#/GenealogySummary:http://data.library.sh.cn/jp/resource/work/def7czyrf5ghrg3u
正白旗文奎管领下头等庄头施复积家谱（辽宁省）,不详,施,清末,--,始迁祖洪仁、洪義、洪兆，清代人。书名据卷端题。,https://jiapu.library.sh.cn/https://jiapu.library.sh.cn/#/GenealogySummary:http://data.library.sh.cn/jp/resource/work/qmbbnl1lez6h1j5w
正白旗文奎管领下头等庄头施复积家谱（辽宁省）,不详,施,清光绪三十二年（1906）,--,始迁祖洪仁、洪義、洪兆，清代人。书名据卷端题。,https://jiapu.library.sh.cn/https://jiapu.library.sh.cn/#/GenealogySummary:http://data.library.sh.cn/jp/resource/work/j7y1n5edrp6abfzk
正白旗文奎管领下头等庄头边振奎家（辽宁省）,不详,边,清末,--,始遷祖仪龍、儀鳳、儀朋，清代人。書名據卷端題。,https://jiapu.library.sh.cn/https://jiapu.library.sh.cn/#/GenealogySummary:http://data.library.sh.cn/jp/resource/work/jg3wc73m7p3vi3oy
正白旗文奎管领下头等庄头边振奎家谱（辽宁省）,不详,边,清光緒二十九年（1903）,--,始遷祖仪龍、儀鳳、儀朋，清代人。書名據卷端題。,https://jiapu.library.sh.cn/https://jiapu.library.sh.cn/#/GenealogySummary:http://data.library.sh.cn/jp/resource/work/2qmxx46nd9yazspq
正白旗文奎管领下头等庄头边振奎家谱（辽宁省）,不详,边,清光緒三十二年（1906）,--,始遷祖仪龍、儀鳳、儀朋，清代人。書名據卷端題。,https://jiapu.library.sh.cn/https://jiapu.library.sh.cn/#/GenealogySummary:http://data.library.sh.cn/jp/resource/work/588rdnqil17twjg3
正白旗文奎管领下四等庄头王恩久家谱不分卷（辽宁省铁岭市调兵山市）,不详,王,清光緒三十二年（1906）,--,始遷祖國棟，清代人。書名據卷端題。,https://jiapu.library.sh.cn/https://jiapu.library.sh.cn/#/GenealogySummary:http://data.library.sh.cn/jp/resource/work/m5pru7fndrevx5qs
正白旗文奎管领下四等庄头王恩久家谱不分卷（辽宁省铁岭市调兵山市）,不详,王,清末,--,始遷祖國棟，清代人。書名據卷端題。,https://jiapu.library.sh.cn/https://jiapu.library.sh.cn/#/GenealogySummary:http://data.library.sh.cn/jp/resource/work/rrbmr65u1eryfv58
正白旗文奎管领下四等庄头王恩久家谱不分卷（辽宁省铁岭市调兵山市）,不详,王,清光緒二十九年（1903）,--,始遷祖國棟，清代人。書名據卷端題。,https://jiapu.library.sh.cn/https://jiapu.library.sh.cn/#/GenealogySummary:http://data.library.sh.cn/jp/resource/work/a5otpn8s8uvi6a8t
正白旗文奎管理下头等庄头施复积家谱（辽宁省）,不详,施,清光绪二十九年（1903）,--,始迁祖洪仁、洪義、洪兆，清代人。书名据卷端题。,https://jiapu.library.sh.cn/https://jiapu.library.sh.cn/#/GenealogySummary:http://data.library.sh.cn/jp/resource/work/79slbwqmh37uucbl
正白旗恒喜管领下三等庄头黄自龄家谱（辽宁省）,不详,黄,清光緒三十二年（1906）,--,始遷祖達子，清代人。書名據卷端題。,https://jiapu.library.sh.cn/https://jiapu.library.sh.cn/#/GenealogySummary:http://data.library.sh.cn/jp/resource/work/eovbee68je6rn5a6
正白旗恒喜管领下三等庄头黄自龄家谱（辽宁省）,不详,黄,清末,--,始遷祖達子，清代人。書名據卷端題。世系記至清光緒三十二年譜之後。,https://jiapu.library.sh.cn/https://jiapu.library.sh.cn/#/GenealogySummary:http://data.library.sh.cn/jp/resource/work/g1jszrpop5to8qxc
正白旗恒喜管领下三等庄头黄叙德家谱（辽宁省）,不详,黄,清光緒二十九年（1903）,--,始遷祖達子，清代人。書名據卷端題。,https://jiapu.library.sh.cn/https://jiapu.library.sh.cn/#/GenealogySummary:http://data.library.sh.cn/jp/resource/work/fe4zh69qtc2ji58k
正白旗常桂管领下头等庄头王兆吉家谱不分卷（辽宁省）,不详,王,清末*清光緒二十九年（1903）,--,始遷祖洪明、洪祝、洪元、洪安、洪保，皆清代人。書名據卷端題。,https://jiapu.library.sh.cn/https://jiapu.library.sh.cn/#/GenealogySummary:http://data.library.sh.cn/jp/resource/work/rqawspned1wbe455
正白旗常桂管领下四等庄头王兆吉家谱不分卷（辽宁省）,不详,王,清光緒二十九年（1903）,--,始遷祖洪明、洪祝、洪元、洪安、洪保，皆清代人。書名據卷端題。,https://jiapu.library.sh.cn/https://jiapu.library.sh.cn/#/GenealogySummary:http://data.library.sh.cn/jp/resource/work/kkjo1ijd3tf5nrg2
正白旗常桂管领下四等庄头王兆吉家谱不分卷（辽宁省）,不详,王,清光緒三十二年（1906）,--,始遷祖洪明、洪祝、洪元、洪安、洪保，皆清代人。書名據卷端題。,https://jiapu.library.sh.cn/https://jiapu.library.sh.cn/#/GenealogySummary:http://data.library.sh.cn/jp/resource/work/evcg6qt5xpq6iwiv
正白旗太管领下八卦头等庄头庄文焕家谱（辽宁省）,不详,庄,清咸豐二年（1852）,--,始迁祖登第、登賢、登科，皆清代人。书名据卷端题。,https://jiapu.library.sh.cn/https://jiapu.library.sh.cn/#/GenealogySummary:http://data.library.sh.cn/jp/resource/work/mh4wkbztn3nkzdbz
正白旗善禄管领下头等庄头祁玉玺家谱（辽宁省）,不详,祁,清光緒二十九年（1903）,--,始遷祖岱功，清代人。書名據卷端題。,https://jiapu.library.sh.cn/https://jiapu.library.sh.cn/#/GenealogySummary:http://data.library.sh.cn/jp/resource/work/kxe5yhmkw6q6cb65
正白旗善禄管领下头等庄头祁玉玺家谱（辽宁省）,不详,祁,清光緒三十二年（1906）,--,始遷祖岱功，清代人。書名據卷端題。,https://jiapu.library.sh.cn/https://jiapu.library.sh.cn/#/GenealogySummary:http://data.library.sh.cn/jp/resource/work/xig2s36tfsycyihq
正白旗善禄管领下头等庄头祁文锦家谱（辽宁省）,不详,祁,清末,--,始遷祖岱功，清代人。書名據卷端題。,https://jiapu.library.sh.cn/https://jiapu.library.sh.cn/#/GenealogySummary:http://data.library.sh.cn/jp/resource/work/vjhkuyzgc4u8jii6
正白旗吉海管领下头等庄头王恩俊家谱不分卷（辽宁省）,不详,王,清末,--,始遷祖洪明、洪祝、洪元、洪安、洪保，皆清代人。書名據卷端題。,https://jiapu.library.sh.cn/https://jiapu.library.sh.cn/#/GenealogySummary:http://data.library.sh.cn/jp/resource/work/gmkdlqk5f62ons23
正白旗吉海管领下头等庄头王恩俊家谱不分卷（辽宁省）,不详,王,清光緒二十九年（1903）,--,始遷祖洪明、洪祝、洪元、洪安、洪保，皆清代人。書名據卷端題。,https://jiapu.library.sh.cn/https://jiapu.library.sh.cn/#/GenealogySummary:http://data.library.sh.cn/jp/resource/work/nb61r8qnovxkmeuu
正白旗吉海管领下四等庄头王恩俊家谱不分卷（辽宁省）,不详,王,清光緒三十二年（1906）,--,始遷祖洪明、洪祝、洪元、洪安、洪保，皆清代人。書名據卷端題。,https://jiapu.library.sh.cn/https://jiapu.library.sh.cn/#/GenealogySummary:http://data.library.sh.cn/jp/resource/work/wc2ka92awzvpfcoh
正白旗世裕管领下头等庄头张国兴家谱（辽宁省）,不详,张,清光緒二十九年（1903）,--,始遷祖仲傑，清代人。書名據卷端題。,https://jiapu.library.sh.cn/https://jiapu.library.sh.cn/#/GenealogySummary:http://data.library.sh.cn/jp/resource/work/jyoipniwjldp1w8q
正白旗世裕管领下头等庄头张国兴家谱（辽宁省）,不详,张,清末,--,始遷祖仲傑，清代人。書名據卷端題。應在清光緒三十二年譜之後。,https://jiapu.library.sh.cn/https://jiapu.library.sh.cn/#/GenealogySummary:http://data.library.sh.cn/jp/resource/work/6j65v57dv7tgl6qa
正白旗世裕管领下四等庄头魏庆恩家谱（辽宁省）,不详,魏,清光緒二十九年（1903）,--,始遷祖自高，清代人。書名據卷端題。,https://jiapu.library.sh.cn/https://jiapu.library.sh.cn/#/GenealogySummary:http://data.library.sh.cn/jp/resource/work/zgl565dq1kcm4i5v
正白旗世裕管领下四等庄头魏庆恩家谱（辽宁省）,不详,魏,清末,--,始遷祖自高，清代人。書名據卷端題。,https://jiapu.library.sh.cn/https://jiapu.library.sh.cn/#/GenealogySummary:http://data.library.sh.cn/jp/resource/work/qzyo7kcc9885pkuo
正白旗世裕管领下四等庄头魏庆恩家谱（辽宁省）,不详,魏,清光緒三十二年（1906）,--,始遷祖自高，清代人。書名據卷端題。,https://jiapu.library.sh.cn/https://jiapu.library.sh.cn/#/GenealogySummary:http://data.library.sh.cn/jp/resource/work/twph2dxr5xxi9u5z
正白旗世裕管领下四等庄头田雨公家谱（辽宁省）,不详,田,清光緒二十九年（1903）,--,始遷祖士英，清代人。書名據卷端題。,https://jiapu.library.sh.cn/https://jiapu.library.sh.cn/#/GenealogySummary:http://data.library.sh.cn/jp/resource/work/91lb48wohjb9ishi
正白旗世裕管领下四等庄头田雨公家谱（辽宁省）,不详,田,光緒三十二年（1906）,--,始遷祖士英，清代人。書名據卷端題。,https://jiapu.library.sh.cn/https://jiapu.library.sh.cn/#/GenealogySummary:http://data.library.sh.cn/jp/resource/work/3xck8hqfa56yk3r5
正白旗世裕管领下四等庄头田雨公家谱（辽宁省）,不详,田,清末,--,始遷祖士英，清代人。書名據卷端題。版本年代應在清光緒三十二年譜之後。,https://jiapu.library.sh.cn/https://jiapu.library.sh.cn/#/GenealogySummary:http://data.library.sh.cn/jp/resource/work/xm7x1p1fvdeokf85
正白旗世裕管领下四等庄头张德绪正黄旗庆裕管领下头等庄头张德恩家谱（辽宁省）,不详,张,清光緒二十九年（1903）,--,始遷祖二、三、五，皆清代人。書名據卷端題。,https://jiapu.library.sh.cn/https://jiapu.library.sh.cn/#/GenealogySummary:http://data.library.sh.cn/jp/resource/work/1ufrysnd6fsauxl4
正白旗世裕管领下四等庄头张得绪正黄旗庆裕管领下头等庄头张得恩家谱（辽宁省）,不详,张,清光緒三十二年（1906）,--,始遷祖二、三、五，皆清代人。書名據卷端題。,https://jiapu.library.sh.cn/https://jiapu.library.sh.cn/#/GenealogySummary:http://data.library.sh.cn/jp/resource/work/3b29sfgu1q2wv9bh
正白旗世裕管领下四等庄头张得绪正黄旗庆裕管领下头等庄头张得恩家谱（辽宁省）,不详,张,清宣統二年（1910）,--,始遷祖二、三、五，皆清代人。書名據卷端題。,https://jiapu.library.sh.cn/https://jiapu.library.sh.cn/#/GenealogySummary:http://data.library.sh.cn/jp/resource/work/9cto2btze2vu2y1r
正白旗世裕管理下头等荘头夏恩铭家谱不分卷（辽宁省）,不详,夏,清光绪二十九年（1903）,--,始迁祖雲滕，清代人。书名据卷端题。,https://jiapu.library.sh.cn/https://jiapu.library.sh.cn/#/GenealogySummary:http://data.library.sh.cn/jp/resource/work/b8kfahw9j8g777r4
正白旗世裕管理下头等荘头夏恩铭家谱不分卷（辽宁省）,不详,夏,清宣统二年（1910）,--,始迁祖雲滕，清代人。书名据卷端题。,https://jiapu.library.sh.cn/https://jiapu.library.sh.cn/#/GenealogySummary:http://data.library.sh.cn/jp/resource/work/f4v6z5opto3whna7
正白旗世裕管理下头等荘头夏恩铭家谱不分卷（辽宁省）,不详,夏,清光绪三十二年（1906）,--,始迁祖雲滕，清代人。书名据卷端题。,https://jiapu.library.sh.cn/https://jiapu.library.sh.cn/#/GenealogySummary:http://data.library.sh.cn/jp/resource/work/ffexw3uxlvx9x34q
正气堂文氏族谱（湖北省/仙桃市）,不详,文,2008,正气堂,迁沔始祖文德及，元末明初人。 不详,https://jiapu.library.sh.cn/https://jiapu.library.sh.cn/#/GenealogySummary:http://data.library.sh.cn/jp/resource/work/2kx0azbscb9quya3
正气堂合谱资讯（湖北省）,文昌银,文,2008,正气堂,文氏一族尊南宋文天祥为一世祖。明朝洪武元年，文天祥七世孙文开大有江西吉安迁鄂（今湖北省），后族人在湖北省繁衍至今，此谱为湖北省文氏合修。 合谱资讯载序页、世系、源流、正气篇、文献、人物、纪实、学识、编后，卷二三至四世系图、世系表。,https://jiapu.library.sh.cn/https://jiapu.library.sh.cn/#/GenealogySummary:http://data.library.sh.cn/jp/resource/work/m5ktwru8moucfzpc
正山叶氏宗谱（浙江省/金华市/东阳市）,叶茂琪,叶,2007,--,始祖乾昱（字宏道），至唐宪宗己丑年，仕处州府尹，就居卯山。始迁祖茂芳（字邦芬，文五），大明弘治年间从永康上宅派分迁至东阳县三十四都游公岭安家落户。 卷一新序见前、文件、题词、续谱理事会关于清理删除栗树园、胡家塘二村叶氏老谱中有关历史资料的决定、续谱凡例、族规、编后记、祭仪定制、旧序十四篇细目、凡例十七则、家规八、刺命、记类、行第字母、命名字母、表字字母、正山八景诗、宅图引、各村叶氏概况、序类、行传类、贞节类、遗像、赞类、重修宗谱题名记、墓志类、奠章类、墓图类、约据类、谱跋，卷二系图，卷三至四行传。,https://jiapu.library.sh.cn/https://jiapu.library.sh.cn/#/GenealogySummary:http://data.library.sh.cn/jp/resource/work/ygt3zqolpwz6p8vv
正定留村吴氏族谱（河北省/石家庄市/裕华区）,吴鸿师,吴,2012,--,"明永乐年间先祖自山西洪洞县迁河北省石家庄市正定县,后裔九昌，明末清初迁裕华区留村。 谱载家训、溯源、说明、修谱纪实、谱序、圣谕、世系。",https://jiapu.library.sh.cn/https://jiapu.library.sh.cn/#/GenealogySummary:http://data.library.sh.cn/jp/resource/work/s7vuusa8zubyee31
正定王氏家传六卷（河北省石家庄市正定县）,王耕心,王,清光緒19年(1893),--,始遷祖大賢，號清源，明代人。書名據版心、書簽、書名頁題。,https://jiapu.library.sh.cn/https://jiapu.library.sh.cn/#/GenealogySummary:http://data.library.sh.cn/jp/resource/work/q666a94otsjx35zo
正定杨氏家谱一卷（广东省广州市）,杨国清,杨,1934年,--,始遷祖日魁，字斗南，原籍河北正定縣，明萬曆間駐防廣州，授千户指揮之職，遂家焉。譜載世系。書名據版心、書衣題。,https://jiapu.library.sh.cn/https://jiapu.library.sh.cn/#/GenealogySummary:http://data.library.sh.cn/jp/resource/work/14wgbmpwdrnkj128
正定梁氏族谱一卷续四卷（河北省石家庄市正定县）,梁允植;梁桥,梁,清康熙十九年（1680）,--,始祖友才，世居河北蔚州（今正定）興和樓。始遷祖聚，號東崗，友才子，明洪武初奉例開荒，置莊於邑之東崗。譜載序、譜原、世系、家傳、大傳、外傳、紀聞、存疑、悼往、訓來、氏考、宗考、跋語。續譜載世系、家傳、大傳、外傳。書名據版心題。,https://jiapu.library.sh.cn/https://jiapu.library.sh.cn/#/GenealogySummary:http://data.library.sh.cn/jp/resource/work/6dlyt28mt1h2d4fw
正安陈氏万古系族谱（贵州省/遵义市/正安县）,陈锡褆,陈,2005,--,始迁祖陈万古于明末万历年间由江西省迁四川省雅安市汉源县富春乡，任知县，后又迁贵州省遵义市正安县。 谱载先祖像、起源、居住地、郡望堂号、历代世系、编后。,https://jiapu.library.sh.cn/https://jiapu.library.sh.cn/#/GenealogySummary:http://data.library.sh.cn/jp/resource/work/8jesdib1moubqm9b
欢留韩氏族谱（河北省/沧州市/河间市）,韩树更,韩,2016,--,始迁祖卞，明永乐间由山西洪洞县迁居河间欢留村。 卷一谱序、重修祠堂记、祠堂图、功名表、祖茔图、目录、世系，卷二至三世系，卷四世系、行述、跋。,https://jiapu.library.sh.cn/https://jiapu.library.sh.cn/#/GenealogySummary:http://data.library.sh.cn/jp/resource/work/aikxu7wanqntu3uu
