谱名,责任者,姓氏,撰修时间,堂号,家谱简介,详情链接
潘氏宗谱（山东省/潍坊市/临朐县）,潘心德;潘可佐,潘,2007,忠武堂,始迁祖济，明朝洪武四年由山西洪洞县迁临朐县，立村潘家埠居焉。 谱载图腾、编纂委员会成员、祖像、圣旨、诰命、墓地、照片、序、辑谱意见、凡例、图例、历史源流、世表、谱序、墓志、碑序、碑文、村概况、世系图、世表、历代仕宦录、长寿老人简介、迁徙一览表、编纂委员会关于今后辈份排列的决定、捐款人名单及简介醵金、支系资料来源登记表、编后说明、附录。,https://jiapu.library.sh.cn/https://jiapu.library.sh.cn/#/GenealogySummary:http://data.library.sh.cn/jp/resource/work/2c1fkvd1hdo39ekt
潘氏宗谱（安徽省）,潘家骏,潘,民國15年(1926),敦伦堂,始祖清一，明洪武二年自江西都昌土塘遷居湖口走馬坂。始遷祖雲二，清一次子，明初遷居太湖。卷一序文、跋、收掌字號、凡例、家規、宗譜說附字派、服制圖、世系圖，卷二至六世系圖，卷七行述，卷八讞語、墳塋記。書名據版心、書簽、書名頁題。,https://jiapu.library.sh.cn/https://jiapu.library.sh.cn/#/GenealogySummary:http://data.library.sh.cn/jp/resource/work/mf7ojxf6nsffqe3f
潘氏宗谱（安徽省/合肥市）,潘守忠,潘,2008,敦礼堂,始迁祖大邦公，自浙省昆山县迁安徽合肥西乡，卜宅烧脉岗西潘家湾（今称潘湾）。 卷首天月题、四修印、上谕诰封、收藏证书、功德篇、人才篇、序言、关于续修家谱感受、亲朋礼赞、谱跋、古谱首事名目、四修执谱细目、字辈引、后记、古卷首，卷一至九为世系。,https://jiapu.library.sh.cn/https://jiapu.library.sh.cn/#/GenealogySummary:http://data.library.sh.cn/jp/resource/work/uggjz6cp9424dvqo
潘氏宗谱（安徽省/合肥市/肥东县）,潘万成,潘,2015,务本堂,谱称先世于明初自江西大洪山迁合肥肥东。谱内世系一世为世高，为清乾隆时人。 谱载谱序、姓源略谈、捐款名单、名贤说谱、族人题词、家训、字辈录、续修理事名录、功臣名录、世系等。,https://jiapu.library.sh.cn/https://jiapu.library.sh.cn/#/GenealogySummary:http://data.library.sh.cn/jp/resource/work/jhrwhd4m5yu9zm8b
潘氏宗谱（安徽省/六安市/舒城县）,潘忠纯;潘孝钦,潘,2011,花县堂,始迁祖秀三，原居徽州婺源，抡元季殿魁，职授浙江湖州府太守，公视其元纲不振，故辞职避隐，渡江而北，路过舒城南邑霍家洼，爱其山水，故携眷属定居于此。 卷一家宝、鱼龙字号、水源本本、五修宗谱理事会成员名单、捐助人员名单、彩照、家谱序、引言、礼义廉耻、宗谱序、字派引、家训格言、自传、执谱须知、执谱名录、本修后记、源流世系，卷二至十五世系表，卷十六老茔图。,https://jiapu.library.sh.cn/https://jiapu.library.sh.cn/#/GenealogySummary:http://data.library.sh.cn/jp/resource/work/eioze3l7g8v4r247
潘氏宗谱（四川省/泸州市/古蔺县）,潘兴福,潘,2016,荥阳堂,潘廷富，湖广麻城县孝感县桃子湾人，受大明政令奉旨填川，率兄弟四人入川于泸州大田角。延富公落业于古蔺州小麻园；延贵公落业于泸州大田角；延长公落业于贵州遵义；延春公落业于天兴桥。 谱载前言、图腾、像赞、人类的起源、中国姓氏概说、中国潘氏起源及分支、秦汉以来潘氏的迁徙分布、夏朝及清明朝历朝世系至清朝历朝世系、潘氏溯源、潘氏历代名人录、四川省古蔺县潘氏源流考、为潘美正名文章二则、潘氏训言、潘氏宗族近代的发展、潘氏族规、承先启后、皇明鹤驾（各分支后裔表）、自愿出资明细表、潘氏杰出人物介绍、古蔺寻亲情况简介、说明。,https://jiapu.library.sh.cn/https://jiapu.library.sh.cn/#/GenealogySummary:http://data.library.sh.cn/jp/resource/work/mpsxxuw96op3exy5
潘氏宗谱（副本乙亥仲秋）（浙江省/宁波市/宁海县）,潘培,潘,1995,--,始迁祖居仁，唐朝自宁邑上隍迁至西溪黄坛坑（宁波宁海） 谱序,https://jiapu.library.sh.cn/https://jiapu.library.sh.cn/#/GenealogySummary:http://data.library.sh.cn/jp/resource/work/svv2tyemrfx2ebry
潘氏宗谱骞公裔鄂东南联修（湖北省/鄂州市）,潘绍屏,潘,2008,忠武堂,宋代，始迁祖潘骞从河南省开封市迁湖北省鄂州市。 卷首上族徽、像、题词、联修宗谱序、凡例、图像篇、谱序篇、源流篇、训诫文契篇，卷首下人物篇、传赞篇、艺文篇、附录、跋，卷四潘氏探源、潘氏起源、潘氏历代宗支系统表、世系图、像、墓志、各庄祖堂照、世系表。,https://jiapu.library.sh.cn/https://jiapu.library.sh.cn/#/GenealogySummary:http://data.library.sh.cn/jp/resource/work/knx5muvf3jvupqxi
潘氏宗谱桥下潘（浙江省/宁波市/宁海县）,建廷,潘,2001,--,始祖一公始迁祖，传五世孟璧公始迁桥下潘（浙江省宁波宁海）。 谱载、序、世系、世略、世福、世秩、世藻。,https://jiapu.library.sh.cn/https://jiapu.library.sh.cn/#/GenealogySummary:http://data.library.sh.cn/jp/resource/work/gtgcficsgnvmxw8n
潘氏宗谱广西都安县永叶世系良公支系（广西壮族自治区/河池市/都安瑶族自治县）,潘毓才,潘,2001,--,始迁祖良，于明朝时期由山东省青州府益都县白马巷(今山东省潍坊市青州市白马乡)迁安定(今广西壮族自治区河池市都安瑶族自治县澄江乡)。 谱载序言、遗像、地图、修编成员、姓源、源流、班辈对照表、传略、世系、碑文、历史沿革、族贤录、功德榜、纪年表。,https://jiapu.library.sh.cn/https://jiapu.library.sh.cn/#/GenealogySummary:http://data.library.sh.cn/jp/resource/work/wkx19zzfj4v7fz7g
潘氏宗谱四卷首二卷(湖北罗田),潘癸溪,潘,民國22年(1943),世德堂,始遷祖紹賢，元初自江西吉水縣太平原遷湖北羅田烏雲寨下。此是第五世代舜一支譜。代舜遷居木樨河潘家下灣。首二卷譜序、編例、宗范、族規、源流記、墓圖、墳山約，卷一至四世系圖、考。,https://jiapu.library.sh.cn/https://jiapu.library.sh.cn/#/GenealogySummary:http://data.library.sh.cn/jp/resource/work/6rzliecqxho6tjk4
潘氏宗谱四修（湖北省/黄冈市/麻城市）,潘隆一,潘,1993,--,始迁祖潘明大，清朝年间，从山西省阳泉市平定县冶西镇，迁到湖北省黄冈市麻城市。,https://jiapu.library.sh.cn/https://jiapu.library.sh.cn/#/GenealogySummary:http://data.library.sh.cn/jp/resource/work/diupew22cdtmegqc
潘氏宗谱二十九卷首四卷（湖北省黄冈市）,潘经心,潘,1948年,荥阳堂,始迁祖隆、盛，明代自江西五柳村迁湖北黄冈，一居感化村，一居火连畈。首四卷谱序、凡例、墓图、寿序、世系总图、家规、记、誌、地契等，卷一至二十九为各支世系表。存卷首一至四，卷一至三，五至九，十一，十三至二十七、二十九。书名据版心、书衣、书名页题。,https://jiapu.library.sh.cn/https://jiapu.library.sh.cn/#/GenealogySummary:http://data.library.sh.cn/jp/resource/work/pgxk8tq3m9bs8h7y
潘氏宗谱世系图（安徽省/合肥市/巢湖市）,潘宗纯,潘,2004,--,明朝，始迁祖潘必从江西省上饶市婺源县迁居安徽省合肥市巢湖市 谱载新谱序、潘氏宗族来历简介、新老字辈、像赞、赞文、照片、委员会名单、寿星录、照片、世系图。,https://jiapu.library.sh.cn/https://jiapu.library.sh.cn/#/GenealogySummary:http://data.library.sh.cn/jp/resource/work/9esjsfpo5bnnxmea
潘氏宗谱不分卷（安徽省黄山市休宁县）,潘盓,潘,清,--,始迁祖夢麟，唐末自歙之黄墩迁居休宁八都。内有文天祥撰文。谱载序、統宗世系表、休宁世系表、祠图。书名据卷端题。,https://jiapu.library.sh.cn/https://jiapu.library.sh.cn/#/GenealogySummary:http://data.library.sh.cn/jp/resource/work/rjg84es7xnfxb6ih
潘氏宗谱不分卷(湖北黄冈),潘泰业;潘传燮,潘,清光绪20年(1894),体元堂,始迁祖隆，原籍江西饶州府武宁县五柳村，明代偕弟盛，移居湖北黄陂，继迁齐安郡（今黄冈）中和乡。隆初居感化畈，迨後二、三、六分徙居三山舗。盛初居火连畈，迨後七分亦徙居感化畈。此乃二至七分後裔合谱。谱存纶音、像、纪略、墓图、家庙图、历代总图、隆祖五世总图、盛祖五世总图、隆盛二祖十分总图、二分至七分世系。（参见：民国37年《潘氏宗谱》，馆藏：993750-78，又1004323-49）,https://jiapu.library.sh.cn/https://jiapu.library.sh.cn/#/GenealogySummary:http://data.library.sh.cn/jp/resource/work/ukm634sk7ed2j5ti
潘氏宗谱三卷首一卷(江苏吴县),潘良敬,潘,清道光間,--,始遷祖秀，明萬歷間由吳興之懷七里遷居洞庭東山唐股村。卷首誥敕，卷上序例、墓圖、祠祀、世系圖，卷中世系表，卷下旌表、詩文、祀產。,https://jiapu.library.sh.cn/https://jiapu.library.sh.cn/#/GenealogySummary:http://data.library.sh.cn/jp/resource/work/rrwi6y0jfcdjjzdz
潘氏宗谱三十卷首四卷(湖北黄冈),潘经心;潘南陔,潘,民国37年(1948),荥阳堂,始迁祖隆、盛兄弟，明初自江西武宁县五柳村迁湖北黄陂，复徙黄冈。盛居阳逻潘家堤，後裔承顶一、七、八、九、十分；隆居潘家井，子孙顶二、三、四、五、六分。此乃一至十分合修谱。卷首一谱序、总目录、义分纪略、历代字派、凡例、规条、祭仪、五服图、分祖墓志，分祖墓图，卷首二各分小传、行状、各分贞节纪略，卷首三纶音、像赞纪略、始祖墓图、里居图、家庙图、历代世系总图、迁徙世系图、纯孝里总系图、湖北各支世系考，卷首四家规、祭田志、建祠始末、捐钱名目、地契、任事名目、隆盛二祖五世总图；卷一至三十世系。,https://jiapu.library.sh.cn/https://jiapu.library.sh.cn/#/GenealogySummary:http://data.library.sh.cn/jp/resource/work/alkkrvn23j0l2p4z
潘氏宗谱□□卷(湖北阳新),合族,潘,民國33年(1944),忠武堂,始遷祖思忠（字淳夫，一字旻夫），元代自江西武寧縣南臯山遷居興國州（今陽新）辛安里朱華村。卷首序、傳、家教、修譜章程、分遷圖、仕宦、修譜名目、誥敕、傳，卷三至七世系。,https://jiapu.library.sh.cn/https://jiapu.library.sh.cn/#/GenealogySummary:http://data.library.sh.cn/jp/resource/work/1bf7l76ydsgs25ct
潘氏宗谱.荥阳鐄铿岭西（河南省/郑州市/荥阳市）,潘景泉,潘,2006,--,始迁祖义绯。于梁开平二年由山东省淮坊市青州市迁河南省郑州市荥阳市。 谱载修谱说明、字辈歌、世系、后记。,https://jiapu.library.sh.cn/https://jiapu.library.sh.cn/#/GenealogySummary:http://data.library.sh.cn/jp/resource/work/wl3mkpylhlhxmp1y
潘氏宗谱.荥阳郡东⼭宗（浙江省/丽水市/青田县）,佚名,潘,2020,--,始迁祖员吉，唐时，由长山县(今浙江省)，迁浙江省丽水市青田县龙湾。 谱载目录、祠堂记、序言、凡例、字辈、公赞像赞、村貌、全家福、图腾、祖训、世系图,https://jiapu.library.sh.cn/https://jiapu.library.sh.cn/#/GenealogySummary:http://data.library.sh.cn/jp/resource/work/bkva37r1xq5ctqut
潘氏基督徒家谱（台湾省/屏东县）,潘恩赐,潘,不详,--,始祖万春。后裔移居台湾屏东县内埔乡中林村等地。,https://jiapu.library.sh.cn/https://jiapu.library.sh.cn/#/GenealogySummary:http://data.library.sh.cn/jp/resource/work/p95wuufp318pnymf
潘氏合修族谱十卷首三卷（湖南省常德市汉寿县）,潘家眉,潘,1915年,紫岩堂,始祖开基，明代人。始迁祖元八，号白眉，明代人。存卷首一。书名据版心题。,https://jiapu.library.sh.cn/https://jiapu.library.sh.cn/#/GenealogySummary:http://data.library.sh.cn/jp/resource/work/s3x3j8q4ajj9cwit
潘氏古谱十卷（江苏省无锡市宜兴市）,潘远达,潘,清光緒四年（1878）,如在堂,始迁祖佸，世居滎阳，宋室南渡，移家宜兴陸平里。书名据版心、目录题。,https://jiapu.library.sh.cn/https://jiapu.library.sh.cn/#/GenealogySummary:http://data.library.sh.cn/jp/resource/work/h89gm69huynf9tn8
潘氏十修宗谱五十卷（湖北省）,潘省昱,余,民國33年(1944),--,始祖美，北宋燕山大名府（今北京）人。始遷祖國寶，美六世孫，南宋紹興間自江西饒州東鄉潘橋遷居湖北蘄春百師河。卷一譜序、目錄、凡例、家規、祭禮圖說、喪服制、家禮故訓、家訓、齒莊引、學田引，卷二誥封、紀年、派行、修譜名氏，卷三墓誌、墓表、山圖、科名仕宦、奇行、節烈傳，卷四詩古存稿，卷五譜序、行述，卷六至十一行述、傳狀、序傳、譜序，卷十二祭產約據、堂斷、判辭，卷十三至十九世系圖，卷二十至五十世傳。書名據書衣、目錄題。,https://jiapu.library.sh.cn/https://jiapu.library.sh.cn/#/GenealogySummary:http://data.library.sh.cn/jp/resource/work/my4abecui4ulihqz
潘氏六修族谱（安徽省/安庆市/怀宁县）,潘孝然;潘永发;等,潘,2019,总英堂,始祖荣一，明洪武初兄弟四人由江西瓦屑坝迁居安徽桐城木头山。长子映富（字行生）居其一，由木头山迁居怀宁总铺坂，是为始迁祖。 卷首毛泽东论家谱、图像、族歌、溯源、传承与迁徙、世系图、谱序、凡例、大宗小宗图、家礼图、家规、族派、乐输名目、董事名目、墓地示意图、祭文、领谱字号，卷一至三十六世系。,https://jiapu.library.sh.cn/https://jiapu.library.sh.cn/#/GenealogySummary:http://data.library.sh.cn/jp/resource/work/rh7fp5rpedfzptgf
潘氏五修族谱二十七卷首一卷（湖南省湘潭市）,潘克正,潘,清宣統2年(1910),荥阳堂,始祖仕榮，元翰林学士，居湘乡十四都滾陂塘。始迁祖繼先（行竣四）、大名（行竣八），仕榮孫，明洪武二年移居潭邑上五都二甲。卷首序、传、墓誌，卷一凡例、家規、祠图、契据、家礼等，卷二至三垂絲图，卷四至二十六齒录，卷二十七墓图。书名据版心、书签题。,https://jiapu.library.sh.cn/https://jiapu.library.sh.cn/#/GenealogySummary:http://data.library.sh.cn/jp/resource/work/i3x3xsa9nqoc2vm1
潘氏五修族谱□□卷(湖南湘潭),佚名,潘,清宣統2年(1910),滎阳堂,始祖仕榮，元翰林學士，居湘鄉十四都滾陂塘；孫繼先、大名，明洪武二年始遷潭邑上五都二甲。存卷為凡例、規約、祠記、祀田等。,https://jiapu.library.sh.cn/https://jiapu.library.sh.cn/#/GenealogySummary:http://data.library.sh.cn/jp/resource/work/xpt0ntnnaoe85n1y
潘氏世系表（台湾省/屏东县）,不详,潘,1983,--,始祖旺生，清代人。后裔移居台湾屏东县枋寮乡枋寮村。,https://jiapu.library.sh.cn/https://jiapu.library.sh.cn/#/GenealogySummary:http://data.library.sh.cn/jp/resource/work/lsj5ej31f85ozmpg
潘氏世系图（台湾省/台东县）,潘明由,潘,不详,--,始祖卯仔。后裔移居台湾台东市。,https://jiapu.library.sh.cn/https://jiapu.library.sh.cn/#/GenealogySummary:http://data.library.sh.cn/jp/resource/work/ihbn4vw2kwidvkrr
潘氏世系图（台湾省/新竹县）,不详,潘,1982,--,始迁祖庶贤，清代移居台湾新竹县新埔镇。,https://jiapu.library.sh.cn/https://jiapu.library.sh.cn/#/GenealogySummary:http://data.library.sh.cn/jp/resource/work/tngedj7q3ge33x7c
潘氏世系图（台湾省/屏东县）,潘州城,潘,不详,--,始祖添丁、吉生，原姓廖，后改姓潘。后裔移居台湾屏东县坊寮乡新开村。,https://jiapu.library.sh.cn/https://jiapu.library.sh.cn/#/GenealogySummary:http://data.library.sh.cn/jp/resource/work/geszqrgvc7cemkf4
潘氏世系图（台湾省/南投县）,潘启明,潘,不详,--,始祖阿敦，清代人。后裔移居台湾南投县埔里镇爱兰里。,https://jiapu.library.sh.cn/https://jiapu.library.sh.cn/#/GenealogySummary:http://data.library.sh.cn/jp/resource/work/ow892qj3aszhfdau
潘氏世系图（台湾省/南投县）,不详,潘,不详,--,始祖阿四老，清代人。后裔移居台湾南投县埔里镇。,https://jiapu.library.sh.cn/https://jiapu.library.sh.cn/#/GenealogySummary:http://data.library.sh.cn/jp/resource/work/8e2kxegrr5vyk4wk
潘氏上五房宗谱（浙江省丽水市松阳县）,不详,潘,清光緒7年(1881),--,始迁祖字八友，行十五，五代时自浙江青田沐鶴溪移居松阳一都濟川里。南宋中葉，九世孫頤、顥昆仲，分为天地兩派。是为地派四房後裔合谱。支祖渭翁，地派祖顥之四世孫，元代人，生士贤、小贤、士成、士貴四子。士贤子椿孫、桂孫，士成子繼善，士貴子榮孫，开忠信礼義四房。是为地派信房支谱。支祖元榆，派祖桂孫之六世孫，生国旌、国舉、国聘、国薦、国召五子，再分五房。卷二世系图，卷三为行传。存卷二、三。书名据版心题。,https://jiapu.library.sh.cn/https://jiapu.library.sh.cn/#/GenealogySummary:http://data.library.sh.cn/jp/resource/work/m98nkrvvxdm7ninx
潘氏三修族谱十卷（江西省宜春市）,潘全忠,潘,民國3年(1914),荥阳堂,始祖揭，字均瑞，唐代自江西临川徙宜黄大富岡。始迁祖琴，行万十郎，三十世祖，宋末自福建宁化徙居广东長樂，繼迁兴宁。明季以後，後裔散居江西万载、分宜、萍乡、宜春及湖南瀏阳等地。是为袁郡（今宜春）後裔合修谱。卷首（即卷一）序、像图、祭田、凡例、家訓、家規、祭産、祠图、墳图、墓誌銘、紀传等，卷二至九世系、跋，卷十祭礼。书名据版心题。三修本。,https://jiapu.library.sh.cn/https://jiapu.library.sh.cn/#/GenealogySummary:http://data.library.sh.cn/jp/resource/work/ohbb3gdikrenkt6f
潘氏三修族谱十一卷首一卷(湖南邵阳),合族,潘,民国22年(1933),敦本堂,始迁祖历本，元末明初由浙江金华迁湖南邵阳县洪仁乡路塘村。卷首谱序、凡例、家训、家规、格言、仪注、祠堂图、五服图、坟山图、合约、契约；卷一班次、系图、垂丝图、世系，卷二至十一世系、遗名。（参见：清光绪25年《潘氏续修族谱》，馆藏：991514-23）,https://jiapu.library.sh.cn/https://jiapu.library.sh.cn/#/GenealogySummary:http://data.library.sh.cn/jp/resource/work/anmjdy1ygkays8w2
潘氏三修族谱不分卷（江西省）,潘祖祯;钟卓群,潘,清,荥阳堂,始祖中牟（又名謀），漢代世居河南開封府中牟縣。清初以後，後裔先後自閩、粵東遷居江西興國，是譜即為居興國者合修。譜存載譜序、執事人名、領譜字號、字派、樂助鴻名、凡例、家約、傳、墳圖墓誌、像圖、敕命、屋圖、仕宦、世系圖等。書名據版心題。,https://jiapu.library.sh.cn/https://jiapu.library.sh.cn/#/GenealogySummary:http://data.library.sh.cn/jp/resource/work/o9ne67dv9rmv5fhr
潘氏三修宗谱（浙江省/温州市/瑞安市）,潘作献,潘,不详,--,始祖建（字遂业），五代时自福建长溪县赤岸村移居浙江瑞安县东观浦村。始迁祖崧，字镇南，号诚斋，行守一，明永乐初年再徙本邑东湖九里村。 谱载序、凡例、行第、修谱任事名单、祀田碑记、养贤条例、遗像、世系图。复印1913年木活字本。书名据版心题。谱初修于清同治六年，是为三修本。,https://jiapu.library.sh.cn/https://jiapu.library.sh.cn/#/GenealogySummary:http://data.library.sh.cn/jp/resource/work/p8iklb4bie7uoovb
潘桑派下全员名册附潘进行派下子孙系统表（台湾省/宜兰县）,不详,潘,不详,--,始祖进行。后裔移居台湾宜兰县市。,https://jiapu.library.sh.cn/https://jiapu.library.sh.cn/#/GenealogySummary:http://data.library.sh.cn/jp/resource/work/yat1ue1ymtu2juc3
潘式典堂族谱六卷（广东省佛山市南海区）,潘桂森;潘继李,潘,清同治六年（1867）,--,始迁祖元章，字秉素，号有光，宋代人。清同治六年（1867）刻1924年續刻本。书名据版心、书名页、卷端、目录题。五修本。,https://jiapu.library.sh.cn/https://jiapu.library.sh.cn/#/GenealogySummary:http://data.library.sh.cn/jp/resource/work/nseotr31rz3dfiep
潘岱清河郡蟠江张氏宗谱（浙江省/温州市/瑞安市）,张佩德,张,1978,--,始迁祖明玖，宋隆兴进士，乾道二年自福建长溪县（今霞浦县）赤岸村迁居瑞安蟠浦村（今属潘岱乡）。 卷首谱序、凡例、家训、传赞，卷一至四世系图。,https://jiapu.library.sh.cn/https://jiapu.library.sh.cn/#/GenealogySummary:http://data.library.sh.cn/jp/resource/work/aihcfsoyvo9l5u2k
潘家荒赵氏族谱（河南省/鹤壁市/淇滨区）,赵际芳,赵,2021,--,始迁祖云从，明朝间由山西省长治市壶关县，迁河南省鹤壁市淇滨区大河涧乡潘荒村。 谱载序、凡例、世系图。,https://jiapu.library.sh.cn/https://jiapu.library.sh.cn/#/GenealogySummary:http://data.library.sh.cn/jp/resource/work/37jsfx58vjr9dj99
潘家埠李氏族谱（山东省/潍坊市/临朐县）,李俊贤;李俊和,李,2015,--,始迁祖二翁，原籍直隶枣强县，明洪武二年迁来长山县（今邹平县西董镇李家峪村，也称东峪村）定居。始迁七世祖昂（字士举），明嘉靖年间再迁至临朐城北粟山脚下胡家庄。十三世支祖可行、可兴、可成，兄弟三人于清康熙二十三年迁来城西南潘家埠定居。 谱载相关文件、伟人论谱、看谱须知、凡例、起源与宗族简述、迁徙路线示意图、源流歌、序文、祖茔碑记、墓志、续谱前言、世系图、世表、人物传略、德才录、遗事与传说、五服图、续谱考证活动纪要、辈序、文物遗存碑文文物载录、十景、诗文选、古今名人、系图、后世续谱备忘录、族训、后记、族谱世系表。,https://jiapu.library.sh.cn/https://jiapu.library.sh.cn/#/GenealogySummary:http://data.library.sh.cn/jp/resource/work/7161wqc3gbnko27y
潘学醇公家谱（浙江省/丽水市/松阳县）,潘肇富,潘,1995,--,始迁祖学醇。 谱载遗像、墓图、扫墓图、合影、世系、通讯地址、亲属简介。,https://jiapu.library.sh.cn/https://jiapu.library.sh.cn/#/GenealogySummary:http://data.library.sh.cn/jp/resource/work/62mglrwfpd86hzzw
潘姓氏族源流一卷（湖南省邵阳市）,潘日升,潘,1948年,--,始遷祖載，明代人。,https://jiapu.library.sh.cn/https://jiapu.library.sh.cn/#/GenealogySummary:http://data.library.sh.cn/jp/resource/work/icpbe55ayapl6vlh
潘姓氏族源流一卷（湖南省株洲市炎陵县）,潘肇高,潘,1948年,--,始遷祖唐壽，元代人。,https://jiapu.library.sh.cn/https://jiapu.library.sh.cn/#/GenealogySummary:http://data.library.sh.cn/jp/resource/work/t7hfukpbbktrvyga
潘姓族谱（台湾省/苗栗县）,潘朝华,潘,1977,--,始祖千正台郎。始迁祖恒创，字敦贻，移居台湾苗栗县苗栗镇。 不详,https://jiapu.library.sh.cn/https://jiapu.library.sh.cn/#/GenealogySummary:http://data.library.sh.cn/jp/resource/work/mc6rf3k8py21tpe4
潘姓族谱（台湾省/台北市）,潘逎本,潘,1974,--,始祖龙图，明清之际人。支祖光永，移居台北县石门乡。书名自拟。,https://jiapu.library.sh.cn/https://jiapu.library.sh.cn/#/GenealogySummary:http://data.library.sh.cn/jp/resource/work/aqmud32be3657oy4
潘姓族谱（不详）,潘朝华,潘,1977,--,不详。 谱载世系详情、通知书。,https://jiapu.library.sh.cn/https://jiapu.library.sh.cn/#/GenealogySummary:http://data.library.sh.cn/jp/resource/work/v7676on19ryukyle
潘姓始祖族谱（台湾省/台北市）,潘以乞,潘,不详,--,始祖开宝，清代人。始迁祖康琴、云英，清代移居台湾台北县石门乡。记事至1982年。,https://jiapu.library.sh.cn/https://jiapu.library.sh.cn/#/GenealogySummary:http://data.library.sh.cn/jp/resource/work/gq4wuo9hui9awwzu
潘寿户宗谱（湖北省/武汉市/黄陂区）,潘从盛,潘,2002,合德堂,始迁祖聪四，字伯兴，明洪武间由江西移居黄陂。支祖宣二，字起载，聪四子，明洪武二年自江西饶州府余干县筷子巷移居湖北黄陂东乡白荆村杨桐皮社下营垒湾。谱初修于清嘉庆十四年，是为二修本。,https://jiapu.library.sh.cn/https://jiapu.library.sh.cn/#/GenealogySummary:http://data.library.sh.cn/jp/resource/work/u29fli3lsr8pl77c
潘寿户宗谱.合德堂（湖北省/武汉市/黄陂区）,潘彝赓,潘,2002,合德堂,季孙系黄帝二十一世孙，故潘氏为黄帝子孙。季孙(讳旬)为西伯侯姬昌第十六子毕（讳高）公之子，故季孙为潘氏始祖，毕为远祖。始迁祖宣二(字起载)，明洪武二年由饶州府馀干县(今江西省上饶市余干县)移居黄陂，居黄陂东乡许家桥、堰湾、漂家咀等地(今湖北省武汉市黄陂区)。 上卷目录前、总目录、第一篇潘姓源流、发祥地方位示意图、第二篇谱牒序言、督修理事、名册文稿、第三篇潘氏联宗合谱字派、第四篇族训族志、宗谱文史、第五篇贤达名志、诗词楹联、第六篇潘氏联宗世系瓜藤图、第七篇潘氏联宗世系谱牒表，下卷第七篇潘氏联宗世系谱牒表(续)、第八篇后记。,https://jiapu.library.sh.cn/https://jiapu.library.sh.cn/#/GenealogySummary:http://data.library.sh.cn/jp/resource/work/ssre8ctuxtzyuxqb
