谱名,责任者,姓氏,撰修时间,堂号,家谱简介,详情链接
刘氏宗谱二十卷（湖北省黄冈市）,刘基金,刘,民國22年(1933),藜照堂,始遷祖元弼（又名道晟）、元魁，明正統二年自江西南昌梓溪遷居湖北黃岡永寧鄉馬鞍山。卷首（即卷一）序傳、凡例、規則、戒文、勸文，卷二墓圖、事禮儀物、五服圖，卷三至二十世系。（是譜與館藏：1041655-1671可拼合成一套足本）缺卷十一、十五、十六。,https://jiapu.library.sh.cn/https://jiapu.library.sh.cn/#/GenealogySummary:http://data.library.sh.cn/jp/resource/work/kyd3nib5kz7kplvf
刘氏宗谱二十卷（湖北省黄冈市）,刘基金,刘,民國22年(1933),藜照堂,始遷祖元弼（又名道晟）、元魁，明正統二年自江西南昌梓溪遷居湖北黃岡永寧鄉馬鞍山。卷首（即卷一）序傳、凡例、規則、戒文、勸文，卷二墓圖、事禮儀物、五服圖，卷三至二十世系。（是譜與館藏：1028693-710可拼合成一套足本）缺卷四、九、二十。,https://jiapu.library.sh.cn/https://jiapu.library.sh.cn/#/GenealogySummary:http://data.library.sh.cn/jp/resource/work/y7ewb4molcvi62yt
刘氏宗谱二十卷首二卷（湖北省）,刘国钦,刘,民國33年(1944),--,是族先世自江西彭澤遷居安徽宿松。始遷祖丙一，明洪武間自安徽宿松（今湖北松滋）遷居黃梅停前鎮。卷首上官誥、詔書、誥封、譜序、修譜名目、凡例、家訓、家禮儀節、領譜字號，卷首下陽墓、墓圖、祀田，卷一傳贊，卷二至二十世系。書名據版心、書簽題。,https://jiapu.library.sh.cn/https://jiapu.library.sh.cn/#/GenealogySummary:http://data.library.sh.cn/jp/resource/work/ftu7g5ggpjw48j7s
刘氏宗谱二十卷首一卷(湖北武昌),刘向云,刘,清光緒19年(1893),濬源堂,鼻祖巨容（字德量），唐代人。五世通，唐末自饒州鄱陽遷居德安，為義門始祖。本譜為二支後裔遷居武昌靈溪鄉者所修。其一始祖千二，通十六世孫，南宋時遷居興國州（今湖北陽新）朝陽果石街。始遷祖紹三，千二孫，宋末遷居武昌靈溪鄉馬橋村石屋山下程家坊；其二始遷祖安山，通九世孫，元順帝時自江西南昌府南昌縣石門街遷居武昌縣靈溪鄉爐（↑此↓朿）中礄兒鄒家林下壪內，復遷港口屋兒墩，再移居官山嶺下。卷首譜序、目錄、首事名目、欵例、家規，卷一統宗世系總論、辨訛總說、接遷總表、誥敕、行狀、八景詩、統派、墓圖、陰陽兩宅圖、紅粉團圖，卷二至二十世系。（館藏：1052476-493為民國五年修本）,https://jiapu.library.sh.cn/https://jiapu.library.sh.cn/#/GenealogySummary:http://data.library.sh.cn/jp/resource/work/tag2vvzilqhhaq82
刘氏宗谱二十卷(湖北麻城),刘家楷,刘,清光绪10年(1884),--,始迁祖君受，明洪武二年携四子，由江西南昌迁湖北麻城县木子店区步将军石沟（土名柯士坳）。长子千一，分居白田畈；次子端一，分居西畈，後徙河南；三子万一，分居锁口河；惟四子正一，留居原处。此乃四子後裔谱。卷一谱序、遗稿、寿序、条规，祭规、捐费名目等，卷二至三世系，卷四至二十世纪。（参见：刘远全等编修《刘氏宗谱》，1920年青藜堂木活字本，馆藏：995314-39）,https://jiapu.library.sh.cn/https://jiapu.library.sh.cn/#/GenealogySummary:http://data.library.sh.cn/jp/resource/work/vd1pr1vqem4ib7mh
刘氏宗谱二十五卷首三卷(湖北麻城),刘紫薰,刘,民國9年(1920),青藜堂,始遷祖君受，明洪武二年由江西南昌府遷湖北麻城木子店區。首三卷譜序、傳、墓圖，卷一至二十五世系。,https://jiapu.library.sh.cn/https://jiapu.library.sh.cn/#/GenealogySummary:http://data.library.sh.cn/jp/resource/work/4rn84e5e6etovrmp
刘氏宗谱二十二卷首四卷(湖北黄冈),刘锡炎;刘锡全,刘,民國37年(1948),敦本堂,始遷祖隆三，明初自江西南昌鶴仙崗遷湖北黃岡上伍鄉。首三卷序、凡例、譜規、墓表、墓誌、行狀、祠堂圖、墓圖，卷一至二十世系。,https://jiapu.library.sh.cn/https://jiapu.library.sh.cn/#/GenealogySummary:http://data.library.sh.cn/jp/resource/work/jpset5ei1e4832iy
刘氏宗谱二十二卷首一卷末一卷（安徽省）,劉宇寧,刘,民國29年,敦叙堂,始祖壽二（字南山），元順帝時自江西遷居太湖縣北鄉司空山白沙劉隆灣九口塘，生七子。始遷祖為其五子福五（原字信五），元末遷居懷寧縣石牌，復遷盤石澗。後裔散處潛山、懷寧、太湖等地。卷首聖諭廣訓、誥封、遺像、像贊、狀行、原序、總論、凡例、先賢語錄、家規、家訓、宗禁、遷居地名、派行、任事名目、領譜字號，卷一至至二十二世系，卷末議約、碑文、契券、墳山議約、行實傳贊、家禮儀節、跋。缺卷十七。,https://jiapu.library.sh.cn/https://jiapu.library.sh.cn/#/GenealogySummary:http://data.library.sh.cn/jp/resource/work/b1pex5nrbx1qjak2
刘氏宗谱二十一卷首二卷(湖北麻城),刘森亭;刘直浦,刘,民国34年（1945）,青藜堂,始迁祖仁寿，字配山，明洪武初由江西吉安府庐陵县迁湖北麻城县东界岭，继徙鼓山梅家湾，终居老钟山。传七世至玄文、玄富、玄贵，分东、中、西三分。此乃三分合谱。另外卷十八至二十为“黄冈刘家窊”谱，另行纂修。卷首一序、祠堂记、目录、修谱名目、传派、凡例、家规、家训、传等，卷首二服制图、墓图、阳宅图；卷一至二十一世系。,https://jiapu.library.sh.cn/https://jiapu.library.sh.cn/#/GenealogySummary:http://data.library.sh.cn/jp/resource/work/z7pfmst3s5c1p88l
刘氏宗谱二十一卷首二卷(湖北麻城),刘玉峰,刘,民國34年(1945),青藜堂,始遷祖仁壽，明洪武初由江西遷麻邑東界嶺，繼居鼓山梅家灣，終居老鐘山。卷首一序、祠堂記、修譜名目、凡例、家規、家訓、傳等，卷首二墓圖、陰宅圖，卷一至二十一世系。,https://jiapu.library.sh.cn/https://jiapu.library.sh.cn/#/GenealogySummary:http://data.library.sh.cn/jp/resource/work/jgvznu7t14izix06
刘氏宗谱二十一卷首一卷(湖北武昌),刘春圃,刘,民國5年(1916),濬源堂,參見清劉向雲修《[湖北武昌]劉氏宗譜》條目（館藏：1049844-860）。鼻祖巨容（字德量），唐代人。五世通，唐末自饒州鄱陽遷居德安，為義門始祖。本譜為二支後裔遷居武昌靈溪鄉者所修。其一始祖千二，通十六世孫，南宋時遷居興國州（今湖北陽新）朝陽果石街。始遷祖紹三，千二孫，宋末遷居武昌靈溪鄉馬橋村石屋山下程家坊；其二始遷祖安山，通九世孫，元順帝時自江西南昌府南昌縣石門街遷居武昌縣靈溪鄉爐（↑此↓朿）中礄兒鄒家林下壪內，復遷港口屋兒墩，再移居官山嶺下。卷首譜序、目錄、首事名目、欵例、家規，卷一統宗世系總論、辨訛總說、接遷總表、誥敕、行狀、八景詩、派行、墓圖、陰陽兩宅圖，卷二至六世系，卷七太平莊賦、八景詩、傳，卷八至九傳、世系，卷十至二十一世系。,https://jiapu.library.sh.cn/https://jiapu.library.sh.cn/#/GenealogySummary:http://data.library.sh.cn/jp/resource/work/2g7xxspdolazr4yt
刘氏宗谱三卷（江西省）,刘嗣仁,刘,清光緒29年(1903),--,始祖汾（字伯臨，行十四），唐中和間遷居江西廣信府弋陽縣歸仁鄉四十六都新陂里，光啟二年再遷饒州府樂平縣歸桂豐樂鄉風門嶺。始遷祖十七世妙聰（號正一），約於明代遷居湖口花尖山石澗舖。後裔散居江西湖口、彭澤、鄱陽等地。卷一譜序、凡例、譜論、誥命、行狀、墓圖、詩歌、家訓、議約、合約、祭規、理學、仕宦、忠義、貞節、遷居、字派、老系，卷二至三世系。書名據版心題,https://jiapu.library.sh.cn/https://jiapu.library.sh.cn/#/GenealogySummary:http://data.library.sh.cn/jp/resource/work/pobrirs5gn35719q
刘氏宗谱三卷首一卷（湖北省）,刘如雁;刘彦祖,刘,清道光3年(1823),--,始遷祖朝一，明初自江西饒州府德興縣遷居黃岡庶安鄉馬馹湖，再遷黃州府黃安縣（今紅安）中和鄉。卷首總序、譜序、名目、敘、凡例、祭儀、山圖、喪禮、家規條例、輩派、世系，卷一至三世系。書名據版心題。,https://jiapu.library.sh.cn/https://jiapu.library.sh.cn/#/GenealogySummary:http://data.library.sh.cn/jp/resource/work/v9h8ermm7a7vrrj7
刘氏宗谱三十卷(江苏无锡),刘裕成,刘,民國10年(1921),惇睦堂,始祖子翚（字彥沖），南宋時居福建崇安縣潭溪。曾孫龐（號菊隱，又號醉叟），南宋紹興三十年遷居雲陽（今江蘇丹陽）。龐子伯輝（字文昭，號松虬），遷居金壇。伯輝子亨孫（字仲達），遷居武進東安。亨孫曾孫毅，元至正二十七年遷居無錫南鄉橫山。始遷祖會，毅次子，明洪武間自無錫橫山遷居邑之北門興寧鄉鄒祁。卷一序、凡例、誥命、崇祀錄、忠堂記、銘，卷二序、記，卷三傳、像贊，卷四像、考、領譜編號、纂譜職事，卷五至三十世系。,https://jiapu.library.sh.cn/https://jiapu.library.sh.cn/#/GenealogySummary:http://data.library.sh.cn/jp/resource/work/h7giu2wiioqyk4ol
刘氏宗谱三十八卷首四卷（湖北省黄冈市）,刘昌庚;刘世康,刘,民國35年(1946),藜照堂,始祖正四，元代人。始遷祖均保，正一孫，明洪武間自江西饒州府樂平縣瓦碎壩遷湖北黃州府黃岡縣庶安鄉長樂村鸕鷀湖社團湖西岸。卷首一譜序、判決、字派、凡例、名目、祀產記、祠堂記、祭田記，卷首二譜序、存據、契據、廟圖、墓圖、墓誌、宅圖、祠堂記，卷首三至首四序傳，卷一至三十八世系。缺卷八。,https://jiapu.library.sh.cn/https://jiapu.library.sh.cn/#/GenealogySummary:http://data.library.sh.cn/jp/resource/work/a3p75ivo82ihpgfr
刘氏宗谱三十二卷（安徽省）,刘灼焰,刘,清光緒20年(1894),敦睦堂,始遷祖壽二（字南山），元順帝時自江西遷居太湖縣北鄉司空山白沙劉隆灣九口塘，生七子。本譜支祖為其五子福五（原字信五），元末遷居懷寧縣石牌，復遷盤石澗。後裔散處潛山、懷寧、太湖等地。此譜為居潛山者所修。卷一新序、唐虞至宋元紀、世系，卷二至三十二世系。（館藏：XP11508-514、XP16039-059為其此譜之續修本）缺卷十四。,https://jiapu.library.sh.cn/https://jiapu.library.sh.cn/#/GenealogySummary:http://data.library.sh.cn/jp/resource/work/vp846vmt2rm9cwfn
刘氏宗谱三十二卷首二卷（湖北省）,刘贻熙,刘,民國37年(1948),中山堂,始遷祖必成，明洪武二年自江西饒州府鄱陽縣遷居黃岡中和鄉陸家畈大港上劉家港，明嘉靖四年中和鄉歸屬黃安（今紅安）。子三，長子千一（字寶山）仍居劉成港，次子千二（名諦，字象山）居邑之卓旺山，三子千三遷居麻城浚沙河。是譜為千一、千二合修。卷首上序傳、凡例、規條、圖、儀節、祝文、喪禮、五服圖，卷首下譜序、世系吟、祀產、世代、跋，卷一至三十二世系。書名據版心、書衣、書名頁、目錄、卷端題。,https://jiapu.library.sh.cn/https://jiapu.library.sh.cn/#/GenealogySummary:http://data.library.sh.cn/jp/resource/work/cdcngdr82ikvgcsz
刘氏宗谱三十二卷首二卷(湖北红安),刘明暄,刘,民國37年(1948),中山堂,始祖必成，於明洪武初年自江西遷湖北黃岡中和鄉劉成港，子三人，千一仍居此地，千二居中和鄉卓旺山之東，中和鄉明嘉靖年間劃建黃安縣（今紅安縣），千三麻城。此是千一、千二房之譜。首二卷序、傳、凡例、條規、圖、總序、祀產、世代、跋，卷一至四千一房世系表，卷五至三十二千二房世系，各支世系之首又有家傳、墓圖等。,https://jiapu.library.sh.cn/https://jiapu.library.sh.cn/#/GenealogySummary:http://data.library.sh.cn/jp/resource/work/h4i1rmtcxdrv3iew
刘氏宗谱七卷首一卷（湖北省黄冈市麻城市）,刘初涌;劉初湧,刘,民國33年,青藜堂,始祖君受，明洪武二年避兵燹攜四子自江西南昌府九龍灣北遷至河南商城金缸臺，旋遷麻城科司坳。傳五世有海、濱、江、清、淙、源，淙於明中期自曹家河遷居高澗河，為始遷祖。至族中第十世，始分多支，本譜為四房大祿支。卷首譜序、家規、凡例、宗派緒言、宗派、理事名目、圖形、契約、傳、服制，卷一至七世系。（館藏：1046535-541為此譜之複本殘卷，另館藏：1029839-848、1030912-919、1044046-055為長房大芳支譜，1044027-045、1044082-100為二房大爵支譜）書名據版心、書衣、書名頁、卷端題。,https://jiapu.library.sh.cn/https://jiapu.library.sh.cn/#/GenealogySummary:http://data.library.sh.cn/jp/resource/work/1aml4p5i73stuk2p
刘氏宗谱□□卷（湖北省）,刘八选;刘恩缙;刘寅纬;刘寅晋,刘,清宣統3年(1911),--,參見劉美成修《[湖北羅田]劉氏宗譜》六修本條目（館藏：1038529-548）。（始遷祖永一，元至正間自江西鄱陽清塘遷居湖北羅田。）。存卷為世傳。存卷六、八、十一。,https://jiapu.library.sh.cn/https://jiapu.library.sh.cn/#/GenealogySummary:http://data.library.sh.cn/jp/resource/work/alpbzehiim9pqihr
刘氏宗谱□□卷（湖北省黄冈市）,--,刘,現代,藜照堂,參見劉基金修《[湖北黃岡]劉氏宗譜》三修本條目（館藏：1028693-710、1041655-1671）。（始遷祖元弼（又名道晟）、元魁，明正統二年自江西南昌梓溪遷居湖北黃岡永寧鄉馬鞍山。）。存卷為世系。存卷四、九、二十。,https://jiapu.library.sh.cn/https://jiapu.library.sh.cn/#/GenealogySummary:http://data.library.sh.cn/jp/resource/work/xjiwiw7kh5whtnhu
刘氏宗谱□□卷（湖北省黄冈市武穴市）,--,刘,清,--,參見民國十七年修《[湖北武穴]彭城劉氏宗譜》條目（館藏號：1031087-1109）。（始遷祖傑（字英彥，號舜卿，行千一），北宋元豐間遷居廣濟武穴。）。存卷為祭業。存卷一。,https://jiapu.library.sh.cn/https://jiapu.library.sh.cn/#/GenealogySummary:http://data.library.sh.cn/jp/resource/work/7wpqixal19btqixk
刘氏宗谱□□卷(浙江上虞),刘篤斋,刘,民國,怀贤堂,參見清劉倬修《[浙江上虞]劉氏宗譜》條目（館藏：927521-32）。 始祖豳（字公逹），唐末大臣劉仁晦季子，仕吳越錢氏爲殿中丞。子度（字安仁，行千四）。後唐清泰初遂家上虞峨眉鄉，是爲始遷祖。度孫儼，三子經、緯、彩，分爲東、西、峨眉派祖。卷首譜序、誥敕、譜例、源流實錄、辨疑考真、分派各州府縣錄、祖矦備考，卷一至十系圖、世表，卷十一傳記、行狀，卷十二至十三墓志、祭文、孝義、忠瞕、理學、鄉賢、文行、宦矦、方伎、科第、封贈、蔭襲、特恩旌獎，卷十四節烈、藝文、碑記，卷末祠規、議單、祀田、祠堂對聯。,https://jiapu.library.sh.cn/https://jiapu.library.sh.cn/#/GenealogySummary:http://data.library.sh.cn/jp/resource/work/e5t7nsuk440hewd6
刘氏宗谱□□卷(安徽宿松),刘从惠,刘,民國31年(1942),禄阁堂,弋陽始祖汾（字伯臨，行一），唐代居廣信府弋陽縣歸仁鄉。徽州始祖義富，汾之孫，宋初自鄱陽義城遷居徽州休寧。始遷祖寬，義富十九世孫，明嘉靖十一年自徽州府休寧縣枚寧坊遷居宿松縣東鄉便民倉。卷首譜序、凡例、家訓、傳、贊、山圖、修譜名目、領譜名目，卷一至三世系。,https://jiapu.library.sh.cn/https://jiapu.library.sh.cn/#/GenealogySummary:http://data.library.sh.cn/jp/resource/work/8z8kaqsp1stbotln
刘氏宗谱.青藜堂合肥东乡（安徽省/合肥市/肥东县）,刘文鑫,刘,2013,青藜堂,始迁祖君弼，明朝由山东省青岛莱西店埠镇迁安徽肥东县梁园镇。 谱载资料、图刻、序、引、传、世系、谱序、散记、礼赞、感言。,https://jiapu.library.sh.cn/https://jiapu.library.sh.cn/#/GenealogySummary:http://data.library.sh.cn/jp/resource/work/g14lldlk62n762pv
刘氏宗谱.肥东县杨店乡小刘庄（安徽省/合肥市/肥东县）,等;刘守敬,刘,2022,彭城堂,始迁祖魁宇，明洪武年间从江西省鄱阳县迁安徽合肥东乡杨店集（今安徽省合肥市肥东县杨店乡小刘庄）。 谱载谱序、凡例、族规、家训、人物传志、字辈编修、族谱编修人员群像、世系表。,https://jiapu.library.sh.cn/https://jiapu.library.sh.cn/#/GenealogySummary:http://data.library.sh.cn/jp/resource/work/lumxn378lblzaq6e
刘氏宗谱.简目（湖北省/荆门市）,刘德明,刘,2006,墨椿堂,始迁祖东，元至正初从江西临江府新淦县（今新干）柏水村移居湖北钟祥县石牌西，晚年同子再兴复迁荆门。 谱载家乘全书、寻根问祖、凡例十则、序、世系、江西源流图、公墓图。,https://jiapu.library.sh.cn/https://jiapu.library.sh.cn/#/GenealogySummary:http://data.library.sh.cn/jp/resource/work/d7opvpy1hfc66hrl
刘氏宗谱.东门支谱（江苏省/盐城市）,刘祥玉,刘,2015,彭城堂,始迁祖鹤松，清朝迁居江苏省盐城。 谱载前言、人像图、世系。,https://jiapu.library.sh.cn/https://jiapu.library.sh.cn/#/GenealogySummary:http://data.library.sh.cn/jp/resource/work/254myz38szrkgym4
刘氏宗谱.书字门名行分纪（江苏省/盐城市/建湖县）,刘万儒;刘广桥,刘,2004,彭城堂,始迁祖銮，明初自姑苏（今江苏省苏州市）阊门迁居淮郡盐城（今江苏省盐城市）。本谱自九世书字门惇、愹等始记世系。 谱载祖像、谱引、族谱序、祭章、家训、古训、谱论、纂辑条章、谱议、凡例、字辈、世系图、世表。;谱载续修谱序、图引、世系图、世系表。,https://jiapu.library.sh.cn/https://jiapu.library.sh.cn/#/GenealogySummary:http://data.library.sh.cn/jp/resource/work/mdf5e9zh9yy8huck
刘氏宗谱.敦睦堂（湖北省/黄石市/阳新县）,刘辉廉,刘,2000,敦睦堂,始迁祖荣二，清同治间由江西迁湖北阳新县。 卷一像、受峰圣旨、墓图、姓氏由来、得姓考、家训八条、遗训、家训、谱论十条、宗谱序文，卷二世系总论、谱序、行状、祠堂碑记、各户图说，卷三续谱人员名单、传记、传赞、名人录、耆寿录、节孝录，卷四世系表、世系到户到庄表、诗、谱事赞颂诗、后记。,https://jiapu.library.sh.cn/https://jiapu.library.sh.cn/#/GenealogySummary:http://data.library.sh.cn/jp/resource/work/epc7io7j9vyua9iq
刘氏宗谱.彭城郡（贵州省/毕节市/赫章县）,刘作明,刘,1996,--,始祖开七（字必高），南宋从福建省三明市宁化县石壁迁到广东省梅州市平远县；本谱主要记载其后裔巨渊（又名巨溶，字英，居潮州大埔县）、巨波（字才，居广东归善县，即今惠州市惠城区）派下居贵州省毕节市赫章县宗支世系。 卷一郡名、堂号、谱序、宗祠、匾额、对联、世系，卷二名人名著及名人轶事、顺序号、世系、赞助人员名章、后记，三世系。,https://jiapu.library.sh.cn/https://jiapu.library.sh.cn/#/GenealogySummary:http://data.library.sh.cn/jp/resource/work/5pbjf9ic8jjc9tj6
刘氏宗谱.彭城堂（江苏省/盐城市）,刘云峰,刘,2009,彭城堂,始迁祖极，元末从江苏沛县迁盐城市。 谱载题词、献联、刘氏宗谱创建委员会名单、功德簿、序言、族规、家训、祭约、祭仪、祭文、班辈字派、世系、姓氏由来、源流、堂号、郡望、遗训。,https://jiapu.library.sh.cn/https://jiapu.library.sh.cn/#/GenealogySummary:http://data.library.sh.cn/jp/resource/work/6j6ef4jnu9ti6vpm
刘氏宗谱.彭城堂（江苏省/盐城市/建湖县）,刘寿阳,刘,1997,彭城堂,是族先世不详，后裔散居于今江苏省建湖县。 谱载序言、世系考实、后记。,https://jiapu.library.sh.cn/https://jiapu.library.sh.cn/#/GenealogySummary:http://data.library.sh.cn/jp/resource/work/zva66k2sh6kkzwct
刘氏宗谱.卷号（第三卷）.堂号（藜阁堂）.永定区（湖南省/张家界市/永定区）,刘长金,刘,2018,藜阁堂,始祖复，生于明洪武三年，原籍凤阳府定远县黄金阁枯树堰（今安徽省滁州市定远县），永乐间镇守澧西南卫所（今湖南省常德市澧县）。始迁祖其九世孙嗣汉（字裔绍），明朝末年迁张家界市永定区。 谱载论谱篇、综合篇、祖像、续谱领导小组名录、捐款人名录、序、族谱源流序、祖训家风、刘氏溯源、世系、英烈篇、毛主席题词、名人录、历史篇、姓氏探源、尾声篇、字派、后记、贺词。,https://jiapu.library.sh.cn/https://jiapu.library.sh.cn/#/GenealogySummary:http://data.library.sh.cn/jp/resource/work/56dzbk0chb5z4evy
刘氏宗谱.三都七甲（江苏省/扬州市）,刘加松,刘,2008,豫立堂,始迁祖名不详，北宋时期从江南徽州（今安徽黄山一带）迁到天长东部（今江苏扬州高邮与仪征交界处一带）。 谱载图腾、叙述、谱牒、昭穆世次联、理事会编委会名单、目录、前言、序、凡例、堂号、家规、遗训、远祖宗氏、近代世系、宗祠、家谱会记、天长县地名由来、历史朝代、赞助榜、编后记。,https://jiapu.library.sh.cn/https://jiapu.library.sh.cn/#/GenealogySummary:http://data.library.sh.cn/jp/resource/work/wfbgaafvh59ywad7
刘氏宗谱.七次续修（安徽省/合肥市/肥西县）,刘良增,刘,2011,--,始迁祖赛，元至正间由江西进贤县紫溪村迁安徽肥西大烟墩北号为刘氏院墙（今属肥西县金牛乡）。 卷一叙、序、创修宗谱名目、议条、碑文、孝义纪、节孝纪、敬老抚幼，卷二诰敕，卷三至卷十六世系，卷十七坟墓纪、祭田纪、墓表、失传纪，卷十八至卷二十赞传，卷二十一跋、碑记、遗像、题词、常务理事合影、捐助榜、十六字命目。,https://jiapu.library.sh.cn/https://jiapu.library.sh.cn/#/GenealogySummary:http://data.library.sh.cn/jp/resource/work/djyl98b9b3tc6682
刘氏宗谱(湖北麻城),刘世茂,刘,民国9年(1920),--,始祖庆三，明初携子明四，由江西南昌迁湖北麻城梓树坂。明四子文贵，再徙大河南岸杨林，为始迁祖。卷一大成谱序、碑记、老系，卷二迁徙源委辨，坟图、续修小序、旧序、凡例、家训、条规，卷三传、祀田记、祀田约、约契、田约等。,https://jiapu.library.sh.cn/https://jiapu.library.sh.cn/#/GenealogySummary:http://data.library.sh.cn/jp/resource/work/ckmjmspilgszzazc
刘氏宗谱 大足区回龙镇 铜梁区小林 双山镇（重庆市）,刘代发,刘,2015,--,始迁祖懋魁公，清康熙间率子孙由贵州遵义迁徙到四川省重庆府铜梁县立灯堡（今铜梁县平滩镇立灯村）插占立业。入川三百多年，至今传至十六代，分布于铜梁县小林乡、双山乡、平滩镇，大足县回龙镇等地居住。 本谱设章节，序列记叙刘氏源流、刘姓在历史长河中的业绩、先祖创业的艰辛历程以及世系发展、迁徙等各时期的演绎。本谱世系从懋魁公入川，携三字，分三房，长子良栋、次子良君、三子良臣，以表格形式分别列世系图，图表含代别、姓名（辈名、字号）、性别、文化程度、出生时间和地址、备注等。 谱前刊印神农炎帝仪像、轩辕黄帝仪像、汉高祖刘邦真像、始祖刘清之墓等图片。,https://jiapu.library.sh.cn/https://jiapu.library.sh.cn/#/GenealogySummary:http://data.library.sh.cn/jp/resource/work/t1e7wjxuui16x7ub
刘氏宗谱,刘雁宾,刘,1989,孝义堂,始祖不详，始迁祖不祥，迁徙源流不详。 存卷二墓图、合约、继修名目。,https://jiapu.library.sh.cn/https://jiapu.library.sh.cn/#/GenealogySummary:http://data.library.sh.cn/jp/resource/work/vsnx81g3zue7af4l
刘氏宗谱,佚名,刘,2000,德馨堂,始迁祖不详，迁徙源流不详。 谱载山墓图说明、世系图。,https://jiapu.library.sh.cn/https://jiapu.library.sh.cn/#/GenealogySummary:http://data.library.sh.cn/jp/resource/work/je8h9v5ojiudtzpq
刘氏宗臣公系清远公族谱一卷（江西省）,--,刘,1991,彭城堂,始祖伟錦（字宗臣，又字正潮，号石波），唐代人。后裔散居江西安远、于都、寻乌、广东龙川。清人刘启泰岀于此族。,https://jiapu.library.sh.cn/https://jiapu.library.sh.cn/#/GenealogySummary:http://data.library.sh.cn/jp/resource/work/dvve59x8ad5itmtw
刘氏宗祠志二卷首一卷（湖南省益阳市安化县）,刘春焕,刘,清光緒30年(1904),--,劉氏子羽、允迪、玉琦三支之裔，光緒十四年戊子之春始建祠於湖南安化南門文曲街，復置祭田若干，凡六周寒暑而告成。自祠成又十年，編宗祠志三卷以志祠宇原委、以告善後事宜。卷首序、凡例、董事名目，卷一派語、吉謀、宗祠圖、主位、祭禮、祭器、祭費、祭田，卷二公費、房費、捐費名目、丁費、主費、經費開支、善後事宜、跋。書名據版心*書衣*書名頁題。,https://jiapu.library.sh.cn/https://jiapu.library.sh.cn/#/GenealogySummary:http://data.library.sh.cn/jp/resource/work/4kt4h5v2hszjmlft
